"","game_id","commentary","match_time","team_one","team_two","team_one_score","team_two_score","half_end","match_end","half_begins","shot_attempt","penalty_shot","shot_result","shot_by_player","shot_by_team","shot_with","shot_where","net_location","assist_by_player","foul","foul_by_player","foul_by_team","follow_set_piece","assist_type","follow_corner","offside","offside_team","offside_player","offside_pass_from","shown_card","card_type","card_player","card_team","video_review","video_review_event","video_review_result","delay_in_match","delay_team","free_kick_won","free_kick_player","free_kick_team","free_kick_where","corner","corner_team","corner_conceded_by","substitution","sub_injury","sub_team","sub_player","replaced_player","penalty","team_drew_penalty","player_drew_penalty","player_conceded_penalty","team_conceded_penalty","half","comment_id","stoppage_time","team_one_penalty_score","team_two_penalty_score","match_time_numeric"
"1",480692,"First Half begins.","-","Stoke City","Newcastle United","0","0",0,0,1,0,0,NA,NA,NA,NA,NA,NA,NA,0,NA,NA,0,NA,0,0,NA,NA,NA,0,NA,NA,NA,0,NA,NA,0,NA,0,NA,NA,NA,0,NA,NA,0,0,NA,NA,NA,0,NA,NA,NA,NA,1,1,0,NA,NA,NA
"2",480692,"Lineups are announced and players are warming up.","-","Stoke City","Newcastle United","0","0",0,0,0,0,0,NA,NA,NA,NA,NA,NA,NA,0,NA,NA,0,NA,0,0,NA,NA,NA,0,NA,NA,NA,0,NA,NA,0,NA,0,NA,NA,NA,0,NA,NA,0,0,NA,NA,NA,0,NA,NA,NA,NA,1,2,0,NA,NA,NA
"3",480692,"Attempt blocked. Christian Atsu (Newcastle United) left footed shot from the left side of the box is blocked. Assisted by Ayoze Pérez.","5'","Stoke City","Newcastle United","0","0",0,0,0,1,0,"blocked","Christian Atsu","Newcastle United","left","the left side of the box",NA,"Ayoze Pérez",0,NA,NA,0,NA,0,0,NA,NA,NA,0,NA,NA,NA,0,NA,NA,0,NA,0,NA,NA,NA,0,NA,NA,0,0,NA,NA,NA,0,NA,NA,NA,NA,1,3,0,NA,NA,5
"4",480692,"Corner,  Newcastle United. Conceded by Kurt Zouma.","5'","Stoke City","Newcastle United","0","0",0,0,0,0,0,NA,NA,NA,NA,NA,NA,NA,0,NA,NA,0,NA,0,0,NA,NA,NA,0,NA,NA,NA,0,NA,NA,0,NA,0,NA,NA,NA,1,"Newcastle United","Kurt Zouma",0,0,NA,NA,NA,0,NA,NA,NA,NA,1,4,0,NA,NA,5
"5",480692,"Attempt blocked. DeAndre Yedlin (Newcastle United) right footed shot from outside the box is blocked. Assisted by Matt Ritchie.","6'","Stoke City","Newcastle United","0","0",0,0,0,1,0,"blocked","DeAndre Yedlin","Newcastle United","right","outside the box",NA,"Matt Ritchie",0,NA,NA,0,NA,0,0,NA,NA,NA,0,NA,NA,NA,0,NA,NA,0,NA,0,NA,NA,NA,0,NA,NA,0,0,NA,NA,NA,0,NA,NA,NA,NA,1,5,0,NA,NA,6
"6",480692,"Delay in match Xherdan Shaqiri (Stoke City) because of an injury.","6'","Stoke City","Newcastle United","0","0",0,0,0,0,0,NA,NA,NA,NA,NA,NA,NA,0,NA,NA,0,NA,0,0,NA,NA,NA,0,NA,NA,NA,0,NA,NA,1,"Stoke City",0,NA,NA,NA,0,NA,NA,0,0,NA,NA,NA,0,NA,NA,NA,NA,1,6,0,NA,NA,6
"7",480692,"Delay over. They are ready to continue.","7'","Stoke City","Newcastle United","0","0",0,0,0,0,0,NA,NA,NA,NA,NA,NA,NA,0,NA,NA,0,NA,0,0,NA,NA,NA,0,NA,NA,NA,0,NA,NA,0,NA,0,NA,NA,NA,0,NA,NA,0,0,NA,NA,NA,0,NA,NA,NA,NA,1,7,0,NA,NA,7
"8",480692,"Attempt missed. Christian Atsu (Newcastle United) left footed shot from the centre of the box misses to the left.","10'","Stoke City","Newcastle United","0","0",0,0,0,1,0,"missed","Christian Atsu","Newcastle United","left","the centre of the box","left",NA,0,NA,NA,0,NA,0,0,NA,NA,NA,0,NA,NA,NA,0,NA,NA,0,NA,0,NA,NA,NA,0,NA,NA,0,0,NA,NA,NA,0,NA,NA,NA,NA,1,8,0,NA,NA,10
"9",480692,"Eric Maxim Choupo-Moting (Stoke City) wins a free kick on the left wing.","12'","Stoke City","Newcastle United","0","0",0,0,0,0,0,NA,NA,NA,NA,NA,NA,NA,0,NA,NA,0,NA,0,0,NA,NA,NA,0,NA,NA,NA,0,NA,NA,0,NA,1,NA,"Stoke City",NA,0,NA,NA,0,0,NA,NA,NA,0,NA,NA,NA,NA,1,9,0,NA,NA,12
"10",480692,"Foul by DeAndre Yedlin (Newcastle United).","12'","Stoke City","Newcastle United","0","0",0,0,0,0,0,NA,NA,NA,NA,NA,NA,NA,1,"DeAndre Yedlin","Newcastle United",0,NA,0,0,NA,NA,NA,0,NA,NA,NA,0,NA,NA,0,NA,0,NA,NA,NA,0,NA,NA,0,0,NA,NA,NA,0,NA,NA,NA,NA,1,10,0,NA,NA,12
"11",480692,"Attempt saved. Christian Atsu (Newcastle United) left footed shot from the centre of the box is saved in the centre of the goal.","14'","Stoke City","Newcastle United","0","0",0,0,0,1,0,"saved","Christian Atsu","Newcastle United","left","the centre of the box","the centre of the goal",NA,0,NA,NA,0,NA,0,0,NA,NA,NA,0,NA,NA,NA,0,NA,NA,0,NA,0,NA,NA,NA,0,NA,NA,0,0,NA,NA,NA,0,NA,NA,NA,NA,1,11,0,NA,NA,14
"12",480692,"Corner,  Newcastle United. Conceded by Jack Butland.","14'","Stoke City","Newcastle United","0","0",0,0,0,0,0,NA,NA,NA,NA,NA,NA,NA,0,NA,NA,0,NA,0,0,NA,NA,NA,0,NA,NA,NA,0,NA,NA,0,NA,0,NA,NA,NA,1,"Newcastle United","Jack Butland",0,0,NA,NA,NA,0,NA,NA,NA,NA,1,12,0,NA,NA,14
"13",480692,"Attempt blocked. Christian Atsu (Newcastle United) left footed shot from the right side of the box is blocked. Assisted by Matt Ritchie.","15'","Stoke City","Newcastle United","0","0",0,0,0,1,0,"blocked","Christian Atsu","Newcastle United","left","the right side of the box",NA,"Matt Ritchie",0,NA,NA,0,NA,0,0,NA,NA,NA,0,NA,NA,NA,0,NA,NA,0,NA,0,NA,NA,NA,0,NA,NA,0,0,NA,NA,NA,0,NA,NA,NA,NA,1,13,0,NA,NA,15
"14",480692,"Offside, Stoke City. Thomas Edwards tries a through ball, but Peter Crouch is caught offside.","17'","Stoke City","Newcastle United","0","0",0,0,0,0,0,NA,NA,NA,NA,NA,NA,NA,0,NA,NA,0,NA,0,1,"Stoke City","Peter Crouch","Thomas Edwards",0,NA,NA,NA,0,NA,NA,0,NA,0,NA,NA,NA,0,NA,NA,0,0,NA,NA,NA,0,NA,NA,NA,NA,1,14,0,NA,NA,17
"15",480692,"Foul by Mohamed Diamé (Newcastle United).","21'","Stoke City","Newcastle United","0","0",0,0,0,0,0,NA,NA,NA,NA,NA,NA,NA,1,"Mohamed Diamé","Newcastle United",0,NA,0,0,NA,NA,NA,0,NA,NA,NA,0,NA,NA,0,NA,0,NA,NA,NA,0,NA,NA,0,0,NA,NA,NA,0,NA,NA,NA,NA,1,15,0,NA,NA,21
"16",480692,"Joe Allen (Stoke City) wins a free kick in the defensive half.","21'","Stoke City","Newcastle United","0","0",0,0,0,0,0,NA,NA,NA,NA,NA,NA,NA,0,NA,NA,0,NA,0,0,NA,NA,NA,0,NA,NA,NA,0,NA,NA,0,NA,1,"Joe Allen","Stoke City","defensive half",0,NA,NA,0,0,NA,NA,NA,0,NA,NA,NA,NA,1,16,0,NA,NA,21
"17",480692,"Corner,  Stoke City. Conceded by Mohamed Diamé.","21'","Stoke City","Newcastle United","0","0",0,0,0,0,0,NA,NA,NA,NA,NA,NA,NA,0,NA,NA,0,NA,0,0,NA,NA,NA,0,NA,NA,NA,0,NA,NA,0,NA,0,NA,NA,NA,1,"Stoke City","Mohamed Diamé",0,0,NA,NA,NA,0,NA,NA,NA,NA,1,17,0,NA,NA,21
"18",480692,"Attempt saved. Jacob Murphy (Newcastle United) right footed shot from outside the box is saved in the top centre of the goal. Assisted by Jonjo Shelvey.","22'","Stoke City","Newcastle United","0","0",0,0,0,1,0,"saved","Jacob Murphy","Newcastle United","right","outside the box","the top centre of the goal","Jonjo Shelvey",0,NA,NA,0,NA,0,0,NA,NA,NA,0,NA,NA,NA,0,NA,NA,0,NA,0,NA,NA,NA,0,NA,NA,0,0,NA,NA,NA,0,NA,NA,NA,NA,1,18,0,NA,NA,22
"19",480692,"Charlie Adam (Stoke City) wins a free kick in the attacking half.","26'","Stoke City","Newcastle United","0","0",0,0,0,0,0,NA,NA,NA,NA,NA,NA,NA,0,NA,NA,0,NA,0,0,NA,NA,NA,0,NA,NA,NA,0,NA,NA,0,NA,1,"Charlie Adam","Stoke City","attacking half",0,NA,NA,0,0,NA,NA,NA,0,NA,NA,NA,NA,1,19,0,NA,NA,26
"20",480692,"Foul by Javier Manquillo (Newcastle United).","26'","Stoke City","Newcastle United","0","0",0,0,0,0,0,NA,NA,NA,NA,NA,NA,NA,1,"Javier Manquillo","Newcastle United",0,NA,0,0,NA,NA,NA,0,NA,NA,NA,0,NA,NA,0,NA,0,NA,NA,NA,0,NA,NA,0,0,NA,NA,NA,0,NA,NA,NA,NA,1,20,0,NA,NA,26
"21",480692,"Javier Manquillo (Newcastle United) is shown the yellow card for a bad foul.","26'","Stoke City","Newcastle United","0","0",0,0,0,0,0,NA,NA,NA,NA,NA,NA,NA,0,NA,NA,0,NA,0,0,NA,NA,NA,1,"yellow","Javier Manquillo","Newcastle United",0,NA,NA,0,NA,0,NA,NA,NA,0,NA,NA,0,0,NA,NA,NA,0,NA,NA,NA,NA,1,21,0,NA,NA,26
"22",480692,"Attempt saved. Charlie Adam (Stoke City) left footed shot from outside the box is saved in the top right corner.","27'","Stoke City","Newcastle United","0","0",0,0,0,1,0,"saved","Charlie Adam","Stoke City","left","outside the box","the top right corner",NA,0,NA,NA,0,NA,0,0,NA,NA,NA,0,NA,NA,NA,0,NA,NA,0,NA,0,NA,NA,NA,0,NA,NA,0,0,NA,NA,NA,0,NA,NA,NA,NA,1,22,0,NA,NA,27
"23",480692,"Corner,  Stoke City. Conceded by Karl Darlow.","27'","Stoke City","Newcastle United","0","0",0,0,0,0,0,NA,NA,NA,NA,NA,NA,NA,0,NA,NA,0,NA,0,0,NA,NA,NA,0,NA,NA,NA,0,NA,NA,0,NA,0,NA,NA,NA,1,"Stoke City","Karl Darlow",0,0,NA,NA,NA,0,NA,NA,NA,NA,1,23,0,NA,NA,27
"24",480692,"Corner,  Newcastle United. Conceded by Kevin Wimmer.","29'","Stoke City","Newcastle United","0","0",0,0,0,0,0,NA,NA,NA,NA,NA,NA,NA,0,NA,NA,0,NA,0,0,NA,NA,NA,0,NA,NA,NA,0,NA,NA,0,NA,0,NA,NA,NA,1,"Newcastle United","Kevin Wimmer",0,0,NA,NA,NA,0,NA,NA,NA,NA,1,24,0,NA,NA,29
"25",480692,"Attempt missed. Ayoze Pérez (Newcastle United) header from the right side of the box misses to the left. Assisted by Matt Ritchie with a cross following a corner.","30'","Stoke City","Newcastle United","0","0",0,0,0,1,0,"missed","Ayoze Pérez","Newcastle United","header","the right side of the box","left","Matt Ritchie",0,NA,NA,0,"cross",1,0,NA,NA,NA,0,NA,NA,NA,0,NA,NA,0,NA,0,NA,NA,NA,0,NA,NA,0,0,NA,NA,NA,0,NA,NA,NA,NA,1,25,0,NA,NA,30
"26",480692,"Attempt missed. Ciaran Clark (Newcastle United) left footed shot from very close range is too high. Assisted by Ayoze Pérez following a corner.","30'","Stoke City","Newcastle United","0","0",0,0,0,1,0,"missed","Ciaran Clark","Newcastle United","left","left shot very close range","too high","Ayoze Pérez following",0,NA,NA,0,NA,1,0,NA,NA,NA,0,NA,NA,NA,0,NA,NA,0,NA,0,NA,NA,NA,0,NA,NA,0,0,NA,NA,NA,0,NA,NA,NA,NA,1,26,0,NA,NA,30
"27",480692,"Foul by Ayoze Pérez (Newcastle United).","31'","Stoke City","Newcastle United","0","0",0,0,0,0,0,NA,NA,NA,NA,NA,NA,NA,1,"Ayoze Pérez","Newcastle United",0,NA,0,0,NA,NA,NA,0,NA,NA,NA,0,NA,NA,0,NA,0,NA,NA,NA,0,NA,NA,0,0,NA,NA,NA,0,NA,NA,NA,NA,1,27,0,NA,NA,31
"28",480692,"Kurt Zouma (Stoke City) wins a free kick in the defensive half.","31'","Stoke City","Newcastle United","0","0",0,0,0,0,0,NA,NA,NA,NA,NA,NA,NA,0,NA,NA,0,NA,0,0,NA,NA,NA,0,NA,NA,NA,0,NA,NA,0,NA,1,"Kurt Zouma","Stoke City","defensive half",0,NA,NA,0,0,NA,NA,NA,0,NA,NA,NA,NA,1,28,0,NA,NA,31
"29",480692,"Foul by Erik Pieters (Stoke City).","32'","Stoke City","Newcastle United","0","0",0,0,0,0,0,NA,NA,NA,NA,NA,NA,NA,1,"Erik Pieters","Stoke City",0,NA,0,0,NA,NA,NA,0,NA,NA,NA,0,NA,NA,0,NA,0,NA,NA,NA,0,NA,NA,0,0,NA,NA,NA,0,NA,NA,NA,NA,1,29,0,NA,NA,32
"30",480692,"Jacob Murphy (Newcastle United) wins a free kick on the right wing.","32'","Stoke City","Newcastle United","0","0",0,0,0,0,0,NA,NA,NA,NA,NA,NA,NA,0,NA,NA,0,NA,0,0,NA,NA,NA,0,NA,NA,NA,0,NA,NA,0,NA,1,"Jacob Murphy","Newcastle United",NA,0,NA,NA,0,0,NA,NA,NA,0,NA,NA,NA,NA,1,30,0,NA,NA,32
"31",480692,"Corner,  Stoke City. Conceded by Ciaran Clark.","33'","Stoke City","Newcastle United","0","0",0,0,0,0,0,NA,NA,NA,NA,NA,NA,NA,0,NA,NA,0,NA,0,0,NA,NA,NA,0,NA,NA,NA,0,NA,NA,0,NA,0,NA,NA,NA,1,"Stoke City","Ciaran Clark",0,0,NA,NA,NA,0,NA,NA,NA,NA,1,31,0,NA,NA,33
"32",480692,"Foul by Xherdan Shaqiri (Stoke City).","34'","Stoke City","Newcastle United","0","0",0,0,0,0,0,NA,NA,NA,NA,NA,NA,NA,1,"Xherdan Shaqiri","Stoke City",0,NA,0,0,NA,NA,NA,0,NA,NA,NA,0,NA,NA,0,NA,0,NA,NA,NA,0,NA,NA,0,0,NA,NA,NA,0,NA,NA,NA,NA,1,32,0,NA,NA,34
"33",480692,"Matt Ritchie (Newcastle United) wins a free kick in the defensive half.","34'","Stoke City","Newcastle United","0","0",0,0,0,0,0,NA,NA,NA,NA,NA,NA,NA,0,NA,NA,0,NA,0,0,NA,NA,NA,0,NA,NA,NA,0,NA,NA,0,NA,1,"Matt Ritchie","Newcastle United","defensive half",0,NA,NA,0,0,NA,NA,NA,0,NA,NA,NA,NA,1,33,0,NA,NA,34
"34",480692,"DeAndre Yedlin (Newcastle United) wins a free kick on the right wing.","36'","Stoke City","Newcastle United","0","0",0,0,0,0,0,NA,NA,NA,NA,NA,NA,NA,0,NA,NA,0,NA,0,0,NA,NA,NA,0,NA,NA,NA,0,NA,NA,0,NA,1,"DeAndre Yedlin","Newcastle United",NA,0,NA,NA,0,0,NA,NA,NA,0,NA,NA,NA,NA,1,34,0,NA,NA,36
"35",480692,"Foul by Eric Maxim Choupo-Moting (Stoke City).","36'","Stoke City","Newcastle United","0","0",0,0,0,0,0,NA,NA,NA,NA,NA,NA,NA,1,"Maxim Choupo-Moting","Stoke City",0,NA,0,0,NA,NA,NA,0,NA,NA,NA,0,NA,NA,0,NA,0,NA,NA,NA,0,NA,NA,0,0,NA,NA,NA,0,NA,NA,NA,NA,1,35,0,NA,NA,36
"36",480692,"Corner,  Newcastle United. Conceded by Kevin Wimmer.","36'","Stoke City","Newcastle United","0","0",0,0,0,0,0,NA,NA,NA,NA,NA,NA,NA,0,NA,NA,0,NA,0,0,NA,NA,NA,0,NA,NA,NA,0,NA,NA,0,NA,0,NA,NA,NA,1,"Newcastle United","Kevin Wimmer",0,0,NA,NA,NA,0,NA,NA,NA,NA,1,36,0,NA,NA,36
"37",480692,"Attempt saved. Matt Ritchie (Newcastle United) header from the centre of the box is saved in the top centre of the goal. Assisted by Jonjo Shelvey with a cross.","37'","Stoke City","Newcastle United","0","0",0,0,0,1,0,"saved","Matt Ritchie","Newcastle United","header","the centre of the box","the top centre of the goal","Jonjo Shelvey",0,NA,NA,0,"cross",0,0,NA,NA,NA,0,NA,NA,NA,0,NA,NA,0,NA,0,NA,NA,NA,0,NA,NA,0,0,NA,NA,NA,0,NA,NA,NA,NA,1,37,0,NA,NA,37
"38",480692,"Attempt blocked. Eric Maxim Choupo-Moting (Stoke City) right footed shot from the left side of the box is blocked. Assisted by Kurt Zouma.","38'","Stoke City","Newcastle United","0","0",0,0,0,1,0,"blocked",NA,"Stoke City","right","the left side of the box",NA,"Kurt Zouma",0,NA,NA,0,NA,0,0,NA,NA,NA,0,NA,NA,NA,0,NA,NA,0,NA,0,NA,NA,NA,0,NA,NA,0,0,NA,NA,NA,0,NA,NA,NA,NA,1,38,0,NA,NA,38
"39",480692,"Corner,  Stoke City. Conceded by Jonjo Shelvey.","38'","Stoke City","Newcastle United","0","0",0,0,0,0,0,NA,NA,NA,NA,NA,NA,NA,0,NA,NA,0,NA,0,0,NA,NA,NA,0,NA,NA,NA,0,NA,NA,0,NA,0,NA,NA,NA,1,"Stoke City","Jonjo Shelvey",0,0,NA,NA,NA,0,NA,NA,NA,NA,1,39,0,NA,NA,38
"40",480692,"Attempt missed. Charlie Adam (Stoke City) left footed shot from more than 35 yards is too high. Assisted by Geoff Cameron.","41'","Stoke City","Newcastle United","0","0",0,0,0,1,0,"missed","Charlie Adam","Stoke City","left",NA,NA,"Geoff Cameron",0,NA,NA,0,NA,0,0,NA,NA,NA,0,NA,NA,NA,0,NA,NA,0,NA,0,NA,NA,NA,0,NA,NA,0,0,NA,NA,NA,0,NA,NA,NA,NA,1,40,0,NA,NA,41
"41",480692,"Foul by Jonjo Shelvey (Newcastle United).","44'","Stoke City","Newcastle United","0","0",0,0,0,0,0,NA,NA,NA,NA,NA,NA,NA,1,"Jonjo Shelvey","Newcastle United",0,NA,0,0,NA,NA,NA,0,NA,NA,NA,0,NA,NA,0,NA,0,NA,NA,NA,0,NA,NA,0,0,NA,NA,NA,0,NA,NA,NA,NA,1,41,0,NA,NA,44
"42",480692,"Geoff Cameron (Stoke City) wins a free kick on the left wing.","44'","Stoke City","Newcastle United","0","0",0,0,0,0,0,NA,NA,NA,NA,NA,NA,NA,0,NA,NA,0,NA,0,0,NA,NA,NA,0,NA,NA,NA,0,NA,NA,0,NA,1,"Geoff Cameron","Stoke City",NA,0,NA,NA,0,0,NA,NA,NA,0,NA,NA,NA,NA,1,42,0,NA,NA,44
"43",480692,"Attempt saved. Matt Ritchie (Newcastle United) right footed shot from outside the box is saved in the centre of the goal. Assisted by Christian Atsu.","45'+1'","Stoke City","Newcastle United","0","0",0,0,0,1,0,"saved","Matt Ritchie","Newcastle United","right","outside the box","the centre of the goal","Christian Atsu",0,NA,NA,0,NA,0,0,NA,NA,NA,0,NA,NA,NA,0,NA,NA,0,NA,0,NA,NA,NA,0,NA,NA,0,0,NA,NA,NA,0,NA,NA,NA,NA,1,43,1,NA,NA,46
"44",480692,"First Half ends, Stoke City 0, Newcastle United 0.","45'+1'","Stoke City","Newcastle United","0","0",1,0,0,0,0,NA,NA,NA,NA,NA,NA,NA,0,NA,NA,0,NA,0,0,NA,NA,NA,0,NA,NA,NA,0,NA,NA,0,NA,0,NA,NA,NA,0,NA,NA,0,0,NA,NA,NA,0,NA,NA,NA,NA,1,44,1,NA,NA,46
"45",480692,"Second Half begins Stoke City 0, Newcastle United 0.","45'","Stoke City","Newcastle United","0","0",0,0,1,0,0,NA,NA,NA,NA,NA,NA,NA,0,NA,NA,0,NA,0,0,NA,NA,NA,0,NA,NA,NA,0,NA,NA,0,NA,0,NA,NA,NA,0,NA,NA,0,0,NA,NA,NA,0,NA,NA,NA,NA,2,45,0,NA,NA,45
"46",480692,"Attempt saved. Eric Maxim Choupo-Moting (Stoke City) right footed shot from outside the box is saved in the top centre of the goal.","53'","Stoke City","Newcastle United","0","0",0,0,0,1,0,"saved",NA,"Stoke City","right","outside the box","the top centre of the goal",NA,0,NA,NA,0,NA,0,0,NA,NA,NA,0,NA,NA,NA,0,NA,NA,0,NA,0,NA,NA,NA,0,NA,NA,0,0,NA,NA,NA,0,NA,NA,NA,NA,2,46,0,NA,NA,53
"47",480692,"Corner,  Stoke City. Conceded by Karl Darlow.","53'","Stoke City","Newcastle United","0","0",0,0,0,0,0,NA,NA,NA,NA,NA,NA,NA,0,NA,NA,0,NA,0,0,NA,NA,NA,0,NA,NA,NA,0,NA,NA,0,NA,0,NA,NA,NA,1,"Stoke City","Karl Darlow",0,0,NA,NA,NA,0,NA,NA,NA,NA,2,47,0,NA,NA,53
"48",480692,"Foul by Joe Allen (Stoke City).","54'","Stoke City","Newcastle United","0","0",0,0,0,0,0,NA,NA,NA,NA,NA,NA,NA,1,"Joe Allen","Stoke City",0,NA,0,0,NA,NA,NA,0,NA,NA,NA,0,NA,NA,0,NA,0,NA,NA,NA,0,NA,NA,0,0,NA,NA,NA,0,NA,NA,NA,NA,2,48,0,NA,NA,54
"49",480692,"Jacob Murphy (Newcastle United) wins a free kick on the right wing.","54'","Stoke City","Newcastle United","0","0",0,0,0,0,0,NA,NA,NA,NA,NA,NA,NA,0,NA,NA,0,NA,0,0,NA,NA,NA,0,NA,NA,NA,0,NA,NA,0,NA,1,"Jacob Murphy","Newcastle United",NA,0,NA,NA,0,0,NA,NA,NA,0,NA,NA,NA,NA,2,49,0,NA,NA,54
"50",480692,"Joe Allen (Stoke City) is shown the yellow card.","54'","Stoke City","Newcastle United","0","0",0,0,0,0,0,NA,NA,NA,NA,NA,NA,NA,0,NA,NA,0,NA,0,0,NA,NA,NA,1,"yellow","Joe Allen","Stoke City",0,NA,NA,0,NA,0,NA,NA,NA,0,NA,NA,0,0,NA,NA,NA,0,NA,NA,NA,NA,2,50,0,NA,NA,54
"51",480692,"Corner,  Newcastle United. Conceded by Kevin Wimmer.","56'","Stoke City","Newcastle United","0","0",0,0,0,0,0,NA,NA,NA,NA,NA,NA,NA,0,NA,NA,0,NA,0,0,NA,NA,NA,0,NA,NA,NA,0,NA,NA,0,NA,0,NA,NA,NA,1,"Newcastle United","Kevin Wimmer",0,0,NA,NA,NA,0,NA,NA,NA,NA,2,51,0,NA,NA,56
"52",480692,"Substitution, Stoke City. Mame Biram Diouf replaces Xherdan Shaqiri.","57'","Stoke City","Newcastle United","0","0",0,0,0,0,0,NA,NA,NA,NA,NA,NA,NA,0,NA,NA,0,NA,0,0,NA,NA,NA,0,NA,NA,NA,0,NA,NA,0,NA,0,NA,NA,NA,0,NA,NA,1,0,"Stoke City","Mame Biram Diouf","Xherdan Shaqiri",0,NA,NA,NA,NA,2,52,0,NA,NA,57
"53",480692,"Foul by Mame Biram Diouf (Stoke City).","58'","Stoke City","Newcastle United","0","0",0,0,0,0,0,NA,NA,NA,NA,NA,NA,NA,1,"Mame Biram Diouf","Stoke City",0,NA,0,0,NA,NA,NA,0,NA,NA,NA,0,NA,NA,0,NA,0,NA,NA,NA,0,NA,NA,0,0,NA,NA,NA,0,NA,NA,NA,NA,2,53,0,NA,NA,58
"54",480692,"Javier Manquillo (Newcastle United) wins a free kick in the defensive half.","58'","Stoke City","Newcastle United","0","0",0,0,0,0,0,NA,NA,NA,NA,NA,NA,NA,0,NA,NA,0,NA,0,0,NA,NA,NA,0,NA,NA,NA,0,NA,NA,0,NA,1,"Javier Manquillo","Newcastle United","defensive half",0,NA,NA,0,0,NA,NA,NA,0,NA,NA,NA,NA,2,54,0,NA,NA,58
"55",480692,"DeAndre Yedlin (Newcastle United) wins a free kick on the right wing.","60'","Stoke City","Newcastle United","0","0",0,0,0,0,0,NA,NA,NA,NA,NA,NA,NA,0,NA,NA,0,NA,0,0,NA,NA,NA,0,NA,NA,NA,0,NA,NA,0,NA,1,"DeAndre Yedlin","Newcastle United",NA,0,NA,NA,0,0,NA,NA,NA,0,NA,NA,NA,NA,2,55,0,NA,NA,60
"56",480692,"Foul by Eric Maxim Choupo-Moting (Stoke City).","60'","Stoke City","Newcastle United","0","0",0,0,0,0,0,NA,NA,NA,NA,NA,NA,NA,1,"Maxim Choupo-Moting","Stoke City",0,NA,0,0,NA,NA,NA,0,NA,NA,NA,0,NA,NA,0,NA,0,NA,NA,NA,0,NA,NA,0,0,NA,NA,NA,0,NA,NA,NA,NA,2,56,0,NA,NA,60
"57",480692,"Delay in match DeAndre Yedlin (Newcastle United) because of an injury.","60'","Stoke City","Newcastle United","0","0",0,0,0,0,0,NA,NA,NA,NA,NA,NA,NA,0,NA,NA,0,NA,0,0,NA,NA,NA,0,NA,NA,NA,0,NA,NA,1,"Newcastle United",0,NA,NA,NA,0,NA,NA,0,0,NA,NA,NA,0,NA,NA,NA,NA,2,57,0,NA,NA,60
"58",480692,"Eric Maxim Choupo-Moting (Stoke City) is shown the yellow card for a bad foul.","60'","Stoke City","Newcastle United","0","0",0,0,0,0,0,NA,NA,NA,NA,NA,NA,NA,0,NA,NA,0,NA,0,0,NA,NA,NA,1,"yellow",NA,"Stoke City",0,NA,NA,0,NA,0,NA,NA,NA,0,NA,NA,0,0,NA,NA,NA,0,NA,NA,NA,NA,2,58,0,NA,NA,60
"59",480692,"Delay over. They are ready to continue.","61'","Stoke City","Newcastle United","0","0",0,0,0,0,0,NA,NA,NA,NA,NA,NA,NA,0,NA,NA,0,NA,0,0,NA,NA,NA,0,NA,NA,NA,0,NA,NA,0,NA,0,NA,NA,NA,0,NA,NA,0,0,NA,NA,NA,0,NA,NA,NA,NA,2,59,0,NA,NA,61
"60",480692,"Corner,  Stoke City. Conceded by DeAndre Yedlin.","62'","Stoke City","Newcastle United","0","0",0,0,0,0,0,NA,NA,NA,NA,NA,NA,NA,0,NA,NA,0,NA,0,0,NA,NA,NA,0,NA,NA,NA,0,NA,NA,0,NA,0,NA,NA,NA,1,"Stoke City","DeAndre Yedlin",0,0,NA,NA,NA,0,NA,NA,NA,NA,2,60,0,NA,NA,62
"61",480692,"Substitution, Newcastle United. Dwight Gayle replaces Christian Atsu.","64'","Stoke City","Newcastle United","0","0",0,0,0,0,0,NA,NA,NA,NA,NA,NA,NA,0,NA,NA,0,NA,0,0,NA,NA,NA,0,NA,NA,NA,0,NA,NA,0,NA,0,NA,NA,NA,0,NA,NA,1,0,"Newcastle United","Dwight Gayle","Christian Atsu",0,NA,NA,NA,NA,2,61,0,NA,NA,64
"62",480692,"Ayoze Pérez (Newcastle United) wins a free kick on the right wing.","65'","Stoke City","Newcastle United","0","0",0,0,0,0,0,NA,NA,NA,NA,NA,NA,NA,0,NA,NA,0,NA,0,0,NA,NA,NA,0,NA,NA,NA,0,NA,NA,0,NA,1,"Ayoze Pérez","Newcastle United",NA,0,NA,NA,0,0,NA,NA,NA,0,NA,NA,NA,NA,2,62,0,NA,NA,65
"63",480692,"Foul by Erik Pieters (Stoke City).","65'","Stoke City","Newcastle United","0","0",0,0,0,0,0,NA,NA,NA,NA,NA,NA,NA,1,"Erik Pieters","Stoke City",0,NA,0,0,NA,NA,NA,0,NA,NA,NA,0,NA,NA,0,NA,0,NA,NA,NA,0,NA,NA,0,0,NA,NA,NA,0,NA,NA,NA,NA,2,63,0,NA,NA,65
"64",480692,"Ayoze Pérez (Newcastle United) wins a free kick in the attacking half.","66'","Stoke City","Newcastle United","0","0",0,0,0,0,0,NA,NA,NA,NA,NA,NA,NA,0,NA,NA,0,NA,0,0,NA,NA,NA,0,NA,NA,NA,0,NA,NA,0,NA,1,"Ayoze Pérez","Newcastle United","attacking half",0,NA,NA,0,0,NA,NA,NA,0,NA,NA,NA,NA,2,64,0,NA,NA,66
"65",480692,"Foul by Kevin Wimmer (Stoke City).","66'","Stoke City","Newcastle United","0","0",0,0,0,0,0,NA,NA,NA,NA,NA,NA,NA,1,"Kevin Wimmer","Stoke City",0,NA,0,0,NA,NA,NA,0,NA,NA,NA,0,NA,NA,0,NA,0,NA,NA,NA,0,NA,NA,0,0,NA,NA,NA,0,NA,NA,NA,NA,2,65,0,NA,NA,66
"66",480692,"Kevin Wimmer (Stoke City) is shown the yellow card for a bad foul.","66'","Stoke City","Newcastle United","0","0",0,0,0,0,0,NA,NA,NA,NA,NA,NA,NA,0,NA,NA,0,NA,0,0,NA,NA,NA,1,"yellow","Kevin Wimmer","Stoke City",0,NA,NA,0,NA,0,NA,NA,NA,0,NA,NA,0,0,NA,NA,NA,0,NA,NA,NA,NA,2,66,0,NA,NA,66
"67",480692,"Attempt missed. Jonjo Shelvey (Newcastle United) right footed shot from outside the box is close, but misses the top right corner from a direct free kick.","67'","Stoke City","Newcastle United","0","0",0,0,0,1,0,"missed","Jonjo Shelvey","Newcastle United","right","outside the box","close, but misses the top right corner",NA,0,NA,NA,0,NA,0,0,NA,NA,NA,0,NA,NA,NA,0,NA,NA,0,NA,0,NA,NA,NA,0,NA,NA,0,0,NA,NA,NA,0,NA,NA,NA,NA,2,67,0,NA,NA,67
"68",480692,"Foul by Javier Manquillo (Newcastle United).","68'","Stoke City","Newcastle United","0","0",0,0,0,0,0,NA,NA,NA,NA,NA,NA,NA,1,"Javier Manquillo","Newcastle United",0,NA,0,0,NA,NA,NA,0,NA,NA,NA,0,NA,NA,0,NA,0,NA,NA,NA,0,NA,NA,0,0,NA,NA,NA,0,NA,NA,NA,NA,2,68,0,NA,NA,68
"69",480692,"Mame Biram Diouf (Stoke City) wins a free kick on the right wing.","68'","Stoke City","Newcastle United","0","0",0,0,0,0,0,NA,NA,NA,NA,NA,NA,NA,0,NA,NA,0,NA,0,0,NA,NA,NA,0,NA,NA,NA,0,NA,NA,0,NA,1,"Mame Biram Diouf","Stoke City",NA,0,NA,NA,0,0,NA,NA,NA,0,NA,NA,NA,NA,2,69,0,NA,NA,68
"70",480692,"Delay in match Erik Pieters (Stoke City) because of an injury.","70'","Stoke City","Newcastle United","0","0",0,0,0,0,0,NA,NA,NA,NA,NA,NA,NA,0,NA,NA,0,NA,0,0,NA,NA,NA,0,NA,NA,NA,0,NA,NA,1,"Stoke City",0,NA,NA,NA,0,NA,NA,0,0,NA,NA,NA,0,NA,NA,NA,NA,2,70,0,NA,NA,70
"71",480692,"Substitution, Stoke City. Saido Berahino replaces Erik Pieters because of an injury.","71'","Stoke City","Newcastle United","0","0",0,0,0,0,0,NA,NA,NA,NA,NA,NA,NA,0,NA,NA,0,NA,0,0,NA,NA,NA,0,NA,NA,NA,0,NA,NA,0,NA,0,NA,NA,NA,0,NA,NA,1,1,"Stoke City","Saido Berahino","Erik Pieters",0,NA,NA,NA,NA,2,71,0,NA,NA,71
"72",480692,"Delay over. They are ready to continue.","71'","Stoke City","Newcastle United","0","0",0,0,0,0,0,NA,NA,NA,NA,NA,NA,NA,0,NA,NA,0,NA,0,0,NA,NA,NA,0,NA,NA,NA,0,NA,NA,0,NA,0,NA,NA,NA,0,NA,NA,0,0,NA,NA,NA,0,NA,NA,NA,NA,2,72,0,NA,NA,71
"73",480692,"Goal!  Stoke City 0, Newcastle United 1. Ayoze Pérez (Newcastle United) right footed shot from the centre of the box to the centre of the goal. Assisted by Jacob Murphy.","73'","Stoke City","Newcastle United","0","1",0,0,0,1,0,"goal","Ayoze Pérez","Newcastle United","right","the centre of the box","centre of the goal","Jacob Murphy",0,NA,NA,0,NA,0,0,NA,NA,NA,0,NA,NA,NA,0,NA,NA,0,NA,0,NA,NA,NA,0,NA,NA,0,0,NA,NA,NA,0,NA,NA,NA,NA,2,73,0,NA,NA,73
"74",480692,"Charlie Adam (Stoke City) wins a free kick on the left wing.","75'","Stoke City","Newcastle United","0","1",0,0,0,0,0,NA,NA,NA,NA,NA,NA,NA,0,NA,NA,0,NA,0,0,NA,NA,NA,0,NA,NA,NA,0,NA,NA,0,NA,1,"Charlie Adam","Stoke City",NA,0,NA,NA,0,0,NA,NA,NA,0,NA,NA,NA,NA,2,74,0,NA,NA,75
"75",480692,"Foul by Ayoze Pérez (Newcastle United).","75'","Stoke City","Newcastle United","0","1",0,0,0,0,0,NA,NA,NA,NA,NA,NA,NA,1,"Ayoze Pérez","Newcastle United",0,NA,0,0,NA,NA,NA,0,NA,NA,NA,0,NA,NA,0,NA,0,NA,NA,NA,0,NA,NA,0,0,NA,NA,NA,0,NA,NA,NA,NA,2,75,0,NA,NA,75
"76",480692,"Attempt blocked. Kevin Wimmer (Stoke City) right footed shot from the centre of the box is blocked. Assisted by Kurt Zouma.","75'","Stoke City","Newcastle United","0","1",0,0,0,1,0,"blocked","Kevin Wimmer","Stoke City","right","the centre of the box",NA,"Kurt Zouma",0,NA,NA,0,NA,0,0,NA,NA,NA,0,NA,NA,NA,0,NA,NA,0,NA,0,NA,NA,NA,0,NA,NA,0,0,NA,NA,NA,0,NA,NA,NA,NA,2,76,0,NA,NA,75
"77",480692,"Dwight Gayle (Newcastle United) wins a free kick in the defensive half.","75'","Stoke City","Newcastle United","0","1",0,0,0,0,0,NA,NA,NA,NA,NA,NA,NA,0,NA,NA,0,NA,0,0,NA,NA,NA,0,NA,NA,NA,0,NA,NA,0,NA,1,"Dwight Gayle","Newcastle United","defensive half",0,NA,NA,0,0,NA,NA,NA,0,NA,NA,NA,NA,2,77,0,NA,NA,75
"78",480692,"Foul by Joe Allen (Stoke City).","75'","Stoke City","Newcastle United","0","1",0,0,0,0,0,NA,NA,NA,NA,NA,NA,NA,1,"Joe Allen","Stoke City",0,NA,0,0,NA,NA,NA,0,NA,NA,NA,0,NA,NA,0,NA,0,NA,NA,NA,0,NA,NA,0,0,NA,NA,NA,0,NA,NA,NA,NA,2,78,0,NA,NA,75
"79",480692,"Dwight Gayle (Newcastle United) wins a free kick on the right wing.","78'","Stoke City","Newcastle United","0","1",0,0,0,0,0,NA,NA,NA,NA,NA,NA,NA,0,NA,NA,0,NA,0,0,NA,NA,NA,0,NA,NA,NA,0,NA,NA,0,NA,1,"Dwight Gayle","Newcastle United",NA,0,NA,NA,0,0,NA,NA,NA,0,NA,NA,NA,NA,2,79,0,NA,NA,78
"80",480692,"Foul by Geoff Cameron (Stoke City).","78'","Stoke City","Newcastle United","0","1",0,0,0,0,0,NA,NA,NA,NA,NA,NA,NA,1,"Geoff Cameron","Stoke City",0,NA,0,0,NA,NA,NA,0,NA,NA,NA,0,NA,NA,0,NA,0,NA,NA,NA,0,NA,NA,0,0,NA,NA,NA,0,NA,NA,NA,NA,2,80,0,NA,NA,78
