"","game_id","commentary","match_time","team_one","team_two","team_one_score","team_two_score","half_end","match_end","half_begins","shot_attempt","penalty_shot","shot_result","shot_by_player","shot_by_team","shot_with","shot_where","net_location","assist_by_player","foul","foul_by_player","foul_by_team","follow_set_piece","assist_type","follow_corner","offside","offside_team","offside_player","offside_pass_from","shown_card","card_type","card_player","card_team","video_review","video_review_event","video_review_result","delay_in_match","delay_team","free_kick_won","free_kick_player","free_kick_team","free_kick_where","corner","corner_team","corner_conceded_by","substitution","sub_injury","sub_team","sub_player","replaced_player","penalty","team_drew_penalty","player_drew_penalty","player_conceded_penalty","team_conceded_penalty","half","comment_id","stoppage_time","team_one_penalty_score","team_two_penalty_score","match_time_numeric"
"1",480761,"First Half begins.","-","Chelsea","Newcastle United","0","0",0,0,1,0,0,NA,NA,NA,NA,NA,NA,NA,0,NA,NA,0,NA,0,0,NA,NA,NA,0,NA,NA,NA,0,NA,NA,0,NA,0,NA,NA,NA,0,NA,NA,0,0,NA,NA,NA,0,NA,NA,NA,NA,1,1,0,NA,NA,NA
"2",480761,"Lineups are announced and players are warming up.","-","Chelsea","Newcastle United","0","0",0,0,0,0,0,NA,NA,NA,NA,NA,NA,NA,0,NA,NA,0,NA,0,0,NA,NA,NA,0,NA,NA,NA,0,NA,NA,0,NA,0,NA,NA,NA,0,NA,NA,0,0,NA,NA,NA,0,NA,NA,NA,NA,1,2,0,NA,NA,NA
"3",480761,"Daniel Drinkwater (Chelsea) wins a free kick in the attacking half.","2'","Chelsea","Newcastle United","0","0",0,0,0,0,0,NA,NA,NA,NA,NA,NA,NA,0,NA,NA,0,NA,0,0,NA,NA,NA,0,NA,NA,NA,0,NA,NA,0,NA,1,"Daniel Drinkwater","Chelsea","attacking half",0,NA,NA,0,0,NA,NA,NA,0,NA,NA,NA,NA,1,3,0,NA,NA,2
"4",480761,"Foul by Chancel Mbemba (Newcastle United).","2'","Chelsea","Newcastle United","0","0",0,0,0,0,0,NA,NA,NA,NA,NA,NA,NA,1,"Chancel Mbemba","Newcastle United",0,NA,0,0,NA,NA,NA,0,NA,NA,NA,0,NA,NA,0,NA,0,NA,NA,NA,0,NA,NA,0,0,NA,NA,NA,0,NA,NA,NA,NA,1,4,0,NA,NA,2
"5",480761,"Foul by Daniel Drinkwater (Chelsea).","3'","Chelsea","Newcastle United","0","0",0,0,0,0,0,NA,NA,NA,NA,NA,NA,NA,1,"Daniel Drinkwater","Chelsea",0,NA,0,0,NA,NA,NA,0,NA,NA,NA,0,NA,NA,0,NA,0,NA,NA,NA,0,NA,NA,0,0,NA,NA,NA,0,NA,NA,NA,NA,1,5,0,NA,NA,3
"6",480761,"Javier Manquillo (Newcastle United) wins a free kick in the defensive half.","3'","Chelsea","Newcastle United","0","0",0,0,0,0,0,NA,NA,NA,NA,NA,NA,NA,0,NA,NA,0,NA,0,0,NA,NA,NA,0,NA,NA,NA,0,NA,NA,0,NA,1,"Javier Manquillo","Newcastle United","defensive half",0,NA,NA,0,0,NA,NA,NA,0,NA,NA,NA,NA,1,6,0,NA,NA,3
"7",480761,"Offside, Chelsea. Cesc Fàbregas tries a through ball, but Victor Moses is caught offside.","6'","Chelsea","Newcastle United","0","0",0,0,0,0,0,NA,NA,NA,NA,NA,NA,NA,0,NA,NA,0,NA,0,1,"Chelsea","Victor Moses","Cesc Fàbregas",0,NA,NA,NA,0,NA,NA,0,NA,0,NA,NA,NA,0,NA,NA,0,0,NA,NA,NA,0,NA,NA,NA,NA,1,7,0,NA,NA,6
"8",480761,"Eden Hazard (Chelsea) wins a free kick in the defensive half.","7'","Chelsea","Newcastle United","0","0",0,0,0,0,0,NA,NA,NA,NA,NA,NA,NA,0,NA,NA,0,NA,0,0,NA,NA,NA,0,NA,NA,NA,0,NA,NA,0,NA,1,"Eden Hazard","Chelsea","defensive half",0,NA,NA,0,0,NA,NA,NA,0,NA,NA,NA,NA,1,8,0,NA,NA,7
"9",480761,"Foul by Mohamed Diamé (Newcastle United).","7'","Chelsea","Newcastle United","0","0",0,0,0,0,0,NA,NA,NA,NA,NA,NA,NA,1,"Mohamed Diamé","Newcastle United",0,NA,0,0,NA,NA,NA,0,NA,NA,NA,0,NA,NA,0,NA,0,NA,NA,NA,0,NA,NA,0,0,NA,NA,NA,0,NA,NA,NA,NA,1,9,0,NA,NA,7
"10",480761,"Attempt saved. Mikel Merino (Newcastle United) left footed shot from outside the box is saved in the bottom left corner. Assisted by Ayoze Pérez.","9'","Chelsea","Newcastle United","0","0",0,0,0,1,0,"saved","Mikel Merino","Newcastle United","left","outside the box","the bottom left corner","Ayoze Pérez",0,NA,NA,0,NA,0,0,NA,NA,NA,0,NA,NA,NA,0,NA,NA,0,NA,0,NA,NA,NA,0,NA,NA,0,0,NA,NA,NA,0,NA,NA,NA,NA,1,10,0,NA,NA,9
"11",480761,"Attempt missed. Álvaro Morata (Chelsea) right footed shot from the right side of the box is high and wide to the right. Assisted by Eden Hazard.","10'","Chelsea","Newcastle United","0","0",0,0,0,1,0,"missed","Álvaro Morata","Chelsea","right","the right side of the box","high and wide to the right","Eden Hazard",0,NA,NA,0,NA,0,0,NA,NA,NA,0,NA,NA,NA,0,NA,NA,0,NA,0,NA,NA,NA,0,NA,NA,0,0,NA,NA,NA,0,NA,NA,NA,NA,1,11,0,NA,NA,10
"12",480761,"Attempt blocked. Jacob Murphy (Newcastle United) left footed shot from outside the box is blocked. Assisted by Matt Ritchie.","11'","Chelsea","Newcastle United","0","0",0,0,0,1,0,"blocked","Jacob Murphy","Newcastle United","left","outside the box",NA,"Matt Ritchie",0,NA,NA,0,NA,0,0,NA,NA,NA,0,NA,NA,NA,0,NA,NA,0,NA,0,NA,NA,NA,0,NA,NA,0,0,NA,NA,NA,0,NA,NA,NA,NA,1,12,0,NA,NA,11
"13",480761,"Foul by Antonio Rüdiger (Chelsea).","11'","Chelsea","Newcastle United","0","0",0,0,0,0,0,NA,NA,NA,NA,NA,NA,NA,1,"Antonio Rüdiger","Chelsea",0,NA,0,0,NA,NA,NA,0,NA,NA,NA,0,NA,NA,0,NA,0,NA,NA,NA,0,NA,NA,0,0,NA,NA,NA,0,NA,NA,NA,NA,1,13,0,NA,NA,11
"14",480761,"Jacob Murphy (Newcastle United) wins a free kick in the attacking half.","11'","Chelsea","Newcastle United","0","0",0,0,0,0,0,NA,NA,NA,NA,NA,NA,NA,0,NA,NA,0,NA,0,0,NA,NA,NA,0,NA,NA,NA,0,NA,NA,0,NA,1,"Jacob Murphy","Newcastle United","attacking half",0,NA,NA,0,0,NA,NA,NA,0,NA,NA,NA,NA,1,14,0,NA,NA,11
"15",480761,"Goal!  Chelsea 0, Newcastle United 1. Dwight Gayle (Newcastle United) right footed shot from the right side of the box to the centre of the goal.","12'","Chelsea","Newcastle United","0","1",0,0,0,1,0,"goal","Dwight Gayle","Newcastle United","right","the right side of the box","centre of the goal",NA,0,NA,NA,0,NA,0,0,NA,NA,NA,0,NA,NA,NA,0,NA,NA,0,NA,0,NA,NA,NA,0,NA,NA,0,0,NA,NA,NA,0,NA,NA,NA,NA,1,15,0,NA,NA,12
"16",480761,"Corner,  Chelsea. Conceded by Matt Ritchie.","14'","Chelsea","Newcastle United","0","1",0,0,0,0,0,NA,NA,NA,NA,NA,NA,NA,0,NA,NA,0,NA,0,0,NA,NA,NA,0,NA,NA,NA,0,NA,NA,0,NA,0,NA,NA,NA,1,"Chelsea","Matt Ritchie",0,0,NA,NA,NA,0,NA,NA,NA,NA,1,16,0,NA,NA,14
"17",480761,"Corner,  Chelsea. Conceded by Ciaran Clark.","16'","Chelsea","Newcastle United","0","1",0,0,0,0,0,NA,NA,NA,NA,NA,NA,NA,0,NA,NA,0,NA,0,0,NA,NA,NA,0,NA,NA,NA,0,NA,NA,0,NA,0,NA,NA,NA,1,"Chelsea","Ciaran Clark",0,0,NA,NA,NA,0,NA,NA,NA,NA,1,17,0,NA,NA,16
"18",480761,"Corner,  Chelsea. Conceded by Javier Manquillo.","16'","Chelsea","Newcastle United","0","1",0,0,0,0,0,NA,NA,NA,NA,NA,NA,NA,0,NA,NA,0,NA,0,0,NA,NA,NA,0,NA,NA,NA,0,NA,NA,0,NA,0,NA,NA,NA,1,"Chelsea","Javier Manquillo",0,0,NA,NA,NA,0,NA,NA,NA,NA,1,18,0,NA,NA,16
"19",480761,"Attempt missed. Andreas Christensen (Chelsea) header from the centre of the box is too high. Assisted by Cesc Fàbregas with a cross following a corner.","16'","Chelsea","Newcastle United","0","1",0,0,0,1,0,"missed","Andreas Christensen","Chelsea","header","the centre of the box","too high","Cesc Fàbregas",0,NA,NA,0,"cross",1,0,NA,NA,NA,0,NA,NA,NA,0,NA,NA,0,NA,0,NA,NA,NA,0,NA,NA,0,0,NA,NA,NA,0,NA,NA,NA,NA,1,19,0,NA,NA,16
"20",480761,"Attempt saved. Eden Hazard (Chelsea) right footed shot from the centre of the box is saved in the centre of the goal. Assisted by Cesc Fàbregas with a through ball.","17'","Chelsea","Newcastle United","0","1",0,0,0,1,0,"saved","Eden Hazard","Chelsea","right","the centre of the box","the centre of the goal","Cesc Fàbregas",0,NA,NA,0,"through",0,0,NA,NA,NA,0,NA,NA,NA,0,NA,NA,0,NA,0,NA,NA,NA,0,NA,NA,0,0,NA,NA,NA,0,NA,NA,NA,NA,1,20,0,NA,NA,17
"21",480761,"Foul by N'Golo Kanté (Chelsea).","17'","Chelsea","Newcastle United","0","1",0,0,0,0,0,NA,NA,NA,NA,NA,NA,NA,1,"N'Golo Kanté","Chelsea",0,NA,0,0,NA,NA,NA,0,NA,NA,NA,0,NA,NA,0,NA,0,NA,NA,NA,0,NA,NA,0,0,NA,NA,NA,0,NA,NA,NA,NA,1,21,0,NA,NA,17
"22",480761,"Mikel Merino (Newcastle United) wins a free kick in the defensive half.","17'","Chelsea","Newcastle United","0","1",0,0,0,0,0,NA,NA,NA,NA,NA,NA,NA,0,NA,NA,0,NA,0,0,NA,NA,NA,0,NA,NA,NA,0,NA,NA,0,NA,1,"Mikel Merino","Newcastle United","defensive half",0,NA,NA,0,0,NA,NA,NA,0,NA,NA,NA,NA,1,22,0,NA,NA,17
"23",480761,"Foul by Mohamed Diamé (Newcastle United).","18'","Chelsea","Newcastle United","0","1",0,0,0,0,0,NA,NA,NA,NA,NA,NA,NA,1,"Mohamed Diamé","Newcastle United",0,NA,0,0,NA,NA,NA,0,NA,NA,NA,0,NA,NA,0,NA,0,NA,NA,NA,0,NA,NA,0,0,NA,NA,NA,0,NA,NA,NA,NA,1,23,0,NA,NA,18
"24",480761,"Álvaro Morata (Chelsea) wins a free kick on the right wing.","18'","Chelsea","Newcastle United","0","1",0,0,0,0,0,NA,NA,NA,NA,NA,NA,NA,0,NA,NA,0,NA,0,0,NA,NA,NA,0,NA,NA,NA,0,NA,NA,0,NA,1,"Álvaro Morata","Chelsea",NA,0,NA,NA,0,0,NA,NA,NA,0,NA,NA,NA,NA,1,24,0,NA,NA,18
"25",480761,"Corner,  Chelsea. Conceded by Ciaran Clark.","20'","Chelsea","Newcastle United","0","1",0,0,0,0,0,NA,NA,NA,NA,NA,NA,NA,0,NA,NA,0,NA,0,0,NA,NA,NA,0,NA,NA,NA,0,NA,NA,0,NA,0,NA,NA,NA,1,"Chelsea","Ciaran Clark",0,0,NA,NA,NA,0,NA,NA,NA,NA,1,25,0,NA,NA,20
"26",480761,"Andreas Christensen (Chelsea) hits the right post with a header from the centre of the box. Assisted by N'Golo Kanté following a corner.","20'","Chelsea","Newcastle United","0","1",0,0,0,0,0,NA,NA,NA,NA,NA,NA,"N'Golo Kanté",0,NA,NA,0,NA,1,0,NA,NA,NA,0,NA,NA,NA,0,NA,NA,0,NA,0,NA,NA,NA,0,NA,NA,0,0,NA,NA,NA,0,NA,NA,NA,NA,1,26,0,NA,NA,20
"27",480761,"Goal!  Chelsea 1, Newcastle United 1. Eden Hazard (Chelsea) right footed shot from the right side of the box to the bottom left corner.","21'","Chelsea","Newcastle United","1","1",0,0,0,1,0,"goal","Eden Hazard","Chelsea","right","the right side of the box","bottom left corner",NA,0,NA,NA,0,NA,0,0,NA,NA,NA,0,NA,NA,NA,0,NA,NA,0,NA,0,NA,NA,NA,0,NA,NA,0,0,NA,NA,NA,0,NA,NA,NA,NA,1,27,0,NA,NA,21
"28",480761,"Cesc Fàbregas (Chelsea) wins a free kick in the defensive half.","24'","Chelsea","Newcastle United","1","1",0,0,0,0,0,NA,NA,NA,NA,NA,NA,NA,0,NA,NA,0,NA,0,0,NA,NA,NA,0,NA,NA,NA,0,NA,NA,0,NA,1,"Cesc Fàbregas","Chelsea","defensive half",0,NA,NA,0,0,NA,NA,NA,0,NA,NA,NA,NA,1,28,0,NA,NA,24
"29",480761,"Foul by Matt Ritchie (Newcastle United).","24'","Chelsea","Newcastle United","1","1",0,0,0,0,0,NA,NA,NA,NA,NA,NA,NA,1,"Matt Ritchie","Newcastle United",0,NA,0,0,NA,NA,NA,0,NA,NA,NA,0,NA,NA,0,NA,0,NA,NA,NA,0,NA,NA,0,0,NA,NA,NA,0,NA,NA,NA,NA,1,29,0,NA,NA,24
"30",480761,"Corner,  Chelsea. Conceded by Matt Ritchie.","31'","Chelsea","Newcastle United","1","1",0,0,0,0,0,NA,NA,NA,NA,NA,NA,NA,0,NA,NA,0,NA,0,0,NA,NA,NA,0,NA,NA,NA,0,NA,NA,0,NA,0,NA,NA,NA,1,"Chelsea","Matt Ritchie",0,0,NA,NA,NA,0,NA,NA,NA,NA,1,30,0,NA,NA,31
"31",480761,"Attempt missed. Álvaro Morata (Chelsea) header from the centre of the box misses to the left. Assisted by Eden Hazard with a cross.","32'","Chelsea","Newcastle United","1","1",0,0,0,1,0,"missed","Álvaro Morata","Chelsea","header","the centre of the box","left","Eden Hazard",0,NA,NA,0,"cross",0,0,NA,NA,NA,0,NA,NA,NA,0,NA,NA,0,NA,0,NA,NA,NA,0,NA,NA,0,0,NA,NA,NA,0,NA,NA,NA,NA,1,31,0,NA,NA,32
"32",480761,"Goal!  Chelsea 2, Newcastle United 1. Álvaro Morata (Chelsea) header from very close range to the centre of the goal. Assisted by Victor Moses with a cross.","33'","Chelsea","Newcastle United","2","1",0,0,0,1,0,"goal","Álvaro Morata","Chelsea","header","very close range","centre of the goal","Victor Moses",0,NA,NA,0,"cross",0,0,NA,NA,NA,0,NA,NA,NA,0,NA,NA,0,NA,0,NA,NA,NA,0,NA,NA,0,0,NA,NA,NA,0,NA,NA,NA,NA,1,32,0,NA,NA,33
"33",480761,"Ayoze Pérez (Newcastle United) wins a free kick in the defensive half.","36'","Chelsea","Newcastle United","2","1",0,0,0,0,0,NA,NA,NA,NA,NA,NA,NA,0,NA,NA,0,NA,0,0,NA,NA,NA,0,NA,NA,NA,0,NA,NA,0,NA,1,"Ayoze Pérez","Newcastle United","defensive half",0,NA,NA,0,0,NA,NA,NA,0,NA,NA,NA,NA,1,33,0,NA,NA,36
"34",480761,"Foul by Daniel Drinkwater (Chelsea).","36'","Chelsea","Newcastle United","2","1",0,0,0,0,0,NA,NA,NA,NA,NA,NA,NA,1,"Daniel Drinkwater","Chelsea",0,NA,0,0,NA,NA,NA,0,NA,NA,NA,0,NA,NA,0,NA,0,NA,NA,NA,0,NA,NA,0,0,NA,NA,NA,0,NA,NA,NA,NA,1,34,0,NA,NA,36
"35",480761,"Attempt blocked. Victor Moses (Chelsea) left footed shot from the right side of the box is blocked. Assisted by Cesc Fàbregas.","37'","Chelsea","Newcastle United","2","1",0,0,0,1,0,"blocked","Victor Moses","Chelsea","left","the right side of the box",NA,"Cesc Fàbregas",0,NA,NA,0,NA,0,0,NA,NA,NA,0,NA,NA,NA,0,NA,NA,0,NA,0,NA,NA,NA,0,NA,NA,0,0,NA,NA,NA,0,NA,NA,NA,NA,1,35,0,NA,NA,37
"36",480761,"Attempt missed. Daniel Drinkwater (Chelsea) right footed shot from outside the box misses to the right.","37'","Chelsea","Newcastle United","2","1",0,0,0,1,0,"missed","Daniel Drinkwater","Chelsea","right","outside the box","right",NA,0,NA,NA,0,NA,0,0,NA,NA,NA,0,NA,NA,NA,0,NA,NA,0,NA,0,NA,NA,NA,0,NA,NA,0,0,NA,NA,NA,0,NA,NA,NA,NA,1,36,0,NA,NA,37
"37",480761,"Hand ball by Ayoze Pérez (Newcastle United).","38'","Chelsea","Newcastle United","2","1",0,0,0,0,0,NA,NA,NA,NA,NA,NA,NA,0,NA,NA,0,NA,0,0,NA,NA,NA,0,NA,NA,NA,0,NA,NA,0,NA,0,NA,NA,NA,0,NA,NA,0,0,NA,NA,NA,0,NA,NA,NA,NA,1,37,0,NA,NA,38
"38",480761,"Cesc Fàbregas (Chelsea) wins a free kick in the attacking half.","40'","Chelsea","Newcastle United","2","1",0,0,0,0,0,NA,NA,NA,NA,NA,NA,NA,0,NA,NA,0,NA,0,0,NA,NA,NA,0,NA,NA,NA,0,NA,NA,0,NA,1,"Cesc Fàbregas","Chelsea","attacking half",0,NA,NA,0,0,NA,NA,NA,0,NA,NA,NA,NA,1,38,0,NA,NA,40
"39",480761,"Foul by Florian Lejeune (Newcastle United).","40'","Chelsea","Newcastle United","2","1",0,0,0,0,0,NA,NA,NA,NA,NA,NA,NA,1,"Florian Lejeune","Newcastle United",0,NA,0,0,NA,NA,NA,0,NA,NA,NA,0,NA,NA,0,NA,0,NA,NA,NA,0,NA,NA,0,0,NA,NA,NA,0,NA,NA,NA,NA,1,39,0,NA,NA,40
"40",480761,"Foul by Daniel Drinkwater (Chelsea).","40'","Chelsea","Newcastle United","2","1",0,0,0,0,0,NA,NA,NA,NA,NA,NA,NA,1,"Daniel Drinkwater","Chelsea",0,NA,0,0,NA,NA,NA,0,NA,NA,NA,0,NA,NA,0,NA,0,NA,NA,NA,0,NA,NA,0,0,NA,NA,NA,0,NA,NA,NA,NA,1,40,0,NA,NA,40
"41",480761,"Jacob Murphy (Newcastle United) wins a free kick in the defensive half.","40'","Chelsea","Newcastle United","2","1",0,0,0,0,0,NA,NA,NA,NA,NA,NA,NA,0,NA,NA,0,NA,0,0,NA,NA,NA,0,NA,NA,NA,0,NA,NA,0,NA,1,"Jacob Murphy","Newcastle United","defensive half",0,NA,NA,0,0,NA,NA,NA,0,NA,NA,NA,NA,1,41,0,NA,NA,40
"42",480761,"Ayoze Pérez (Newcastle United) wins a free kick in the attacking half.","44'","Chelsea","Newcastle United","2","1",0,0,0,0,0,NA,NA,NA,NA,NA,NA,NA,0,NA,NA,0,NA,0,0,NA,NA,NA,0,NA,NA,NA,0,NA,NA,0,NA,1,"Ayoze Pérez","Newcastle United","attacking half",0,NA,NA,0,0,NA,NA,NA,0,NA,NA,NA,NA,1,42,0,NA,NA,44
"43",480761,"Foul by N'Golo Kanté (Chelsea).","44'","Chelsea","Newcastle United","2","1",0,0,0,0,0,NA,NA,NA,NA,NA,NA,NA,1,"N'Golo Kanté","Chelsea",0,NA,0,0,NA,NA,NA,0,NA,NA,NA,0,NA,NA,0,NA,0,NA,NA,NA,0,NA,NA,0,0,NA,NA,NA,0,NA,NA,NA,NA,1,43,0,NA,NA,44
"44",480761,"Attempt blocked. Florian Lejeune (Newcastle United) right footed shot from the left side of the box is blocked.","44'","Chelsea","Newcastle United","2","1",0,0,0,1,0,"blocked","Florian Lejeune","Newcastle United","right","the left side of the box",NA,NA,0,NA,NA,0,NA,0,0,NA,NA,NA,0,NA,NA,NA,0,NA,NA,0,NA,0,NA,NA,NA,0,NA,NA,0,0,NA,NA,NA,0,NA,NA,NA,NA,1,44,0,NA,NA,44
"45",480761,"Corner,  Newcastle United. Conceded by Marcos Alonso.","44'","Chelsea","Newcastle United","2","1",0,0,0,0,0,NA,NA,NA,NA,NA,NA,NA,0,NA,NA,0,NA,0,0,NA,NA,NA,0,NA,NA,NA,0,NA,NA,0,NA,0,NA,NA,NA,1,"Newcastle United","Marcos Alonso",0,0,NA,NA,NA,0,NA,NA,NA,NA,1,45,0,NA,NA,44
"46",480761,"Eden Hazard (Chelsea) wins a free kick on the right wing.","45'+1'","Chelsea","Newcastle United","2","1",0,0,0,0,0,NA,NA,NA,NA,NA,NA,NA,0,NA,NA,0,NA,0,0,NA,NA,NA,0,NA,NA,NA,0,NA,NA,0,NA,1,"Eden Hazard","Chelsea",NA,0,NA,NA,0,0,NA,NA,NA,0,NA,NA,NA,NA,1,46,1,NA,NA,46
"47",480761,"Foul by Ciaran Clark (Newcastle United).","45'+1'","Chelsea","Newcastle United","2","1",0,0,0,0,0,NA,NA,NA,NA,NA,NA,NA,1,"Ciaran Clark","Newcastle United",0,NA,0,0,NA,NA,NA,0,NA,NA,NA,0,NA,NA,0,NA,0,NA,NA,NA,0,NA,NA,0,0,NA,NA,NA,0,NA,NA,NA,NA,1,47,1,NA,NA,46
"48",480761,"Ciaran Clark (Newcastle United) is shown the yellow card for a bad foul.","45'+1'","Chelsea","Newcastle United","2","1",0,0,0,0,0,NA,NA,NA,NA,NA,NA,NA,0,NA,NA,0,NA,0,0,NA,NA,NA,1,"yellow","Ciaran Clark","Newcastle United",0,NA,NA,0,NA,0,NA,NA,NA,0,NA,NA,0,0,NA,NA,NA,0,NA,NA,NA,NA,1,48,1,NA,NA,46
"49",480761,"Attempt missed. Antonio Rüdiger (Chelsea) header from the centre of the box misses to the right. Assisted by Álvaro Morata following a set piece situation.","45'+2'","Chelsea","Newcastle United","2","1",0,0,0,1,0,"missed","Antonio Rüdiger","Chelsea","header","the centre of the box","right","Álvaro Morata following",0,NA,NA,1,NA,0,0,NA,NA,NA,0,NA,NA,NA,0,NA,NA,0,NA,0,NA,NA,NA,0,NA,NA,0,0,NA,NA,NA,0,NA,NA,NA,NA,1,49,1,NA,NA,47
"50",480761,"First Half ends, Chelsea 2, Newcastle United 1.","45'+3'","Chelsea","Newcastle United","2","1",1,0,0,0,0,NA,NA,NA,NA,NA,NA,NA,0,NA,NA,0,NA,0,0,NA,NA,NA,0,NA,NA,NA,0,NA,NA,0,NA,0,NA,NA,NA,0,NA,NA,0,0,NA,NA,NA,0,NA,NA,NA,NA,1,50,1,NA,NA,48
"51",480761,"Second Half begins Chelsea 2, Newcastle United 1.","45'","Chelsea","Newcastle United","2","1",0,0,1,0,0,NA,NA,NA,NA,NA,NA,NA,0,NA,NA,0,NA,0,0,NA,NA,NA,0,NA,NA,NA,0,NA,NA,0,NA,0,NA,NA,NA,0,NA,NA,0,0,NA,NA,NA,0,NA,NA,NA,NA,2,51,0,NA,NA,45
"52",480761,"Corner,  Chelsea. Conceded by Chancel Mbemba.","47'","Chelsea","Newcastle United","2","1",0,0,0,0,0,NA,NA,NA,NA,NA,NA,NA,0,NA,NA,0,NA,0,0,NA,NA,NA,0,NA,NA,NA,0,NA,NA,0,NA,0,NA,NA,NA,1,"Chelsea","Chancel Mbemba",0,0,NA,NA,NA,0,NA,NA,NA,NA,2,52,0,NA,NA,47
"53",480761,"Offside, Chelsea. Cesc Fàbregas tries a through ball, but Eden Hazard is caught offside.","49'","Chelsea","Newcastle United","2","1",0,0,0,0,0,NA,NA,NA,NA,NA,NA,NA,0,NA,NA,0,NA,0,1,"Chelsea","Eden Hazard","Cesc Fàbregas",0,NA,NA,NA,0,NA,NA,0,NA,0,NA,NA,NA,0,NA,NA,0,0,NA,NA,NA,0,NA,NA,NA,NA,2,53,0,NA,NA,49
"54",480761,"Foul by Ayoze Pérez (Newcastle United).","51'","Chelsea","Newcastle United","2","1",0,0,0,0,0,NA,NA,NA,NA,NA,NA,NA,1,"Ayoze Pérez","Newcastle United",0,NA,0,0,NA,NA,NA,0,NA,NA,NA,0,NA,NA,0,NA,0,NA,NA,NA,0,NA,NA,0,0,NA,NA,NA,0,NA,NA,NA,NA,2,54,0,NA,NA,51
"55",480761,"Victor Moses (Chelsea) wins a free kick in the defensive half.","51'","Chelsea","Newcastle United","2","1",0,0,0,0,0,NA,NA,NA,NA,NA,NA,NA,0,NA,NA,0,NA,0,0,NA,NA,NA,0,NA,NA,NA,0,NA,NA,0,NA,1,"Victor Moses","Chelsea","defensive half",0,NA,NA,0,0,NA,NA,NA,0,NA,NA,NA,NA,2,55,0,NA,NA,51
"56",480761,"Foul by Mohamed Diamé (Newcastle United).","52'","Chelsea","Newcastle United","2","1",0,0,0,0,0,NA,NA,NA,NA,NA,NA,NA,1,"Mohamed Diamé","Newcastle United",0,NA,0,0,NA,NA,NA,0,NA,NA,NA,0,NA,NA,0,NA,0,NA,NA,NA,0,NA,NA,0,0,NA,NA,NA,0,NA,NA,NA,NA,2,56,0,NA,NA,52
"57",480761,"Victor Moses (Chelsea) wins a free kick in the attacking half.","52'","Chelsea","Newcastle United","2","1",0,0,0,0,0,NA,NA,NA,NA,NA,NA,NA,0,NA,NA,0,NA,0,0,NA,NA,NA,0,NA,NA,NA,0,NA,NA,0,NA,1,"Victor Moses","Chelsea","attacking half",0,NA,NA,0,0,NA,NA,NA,0,NA,NA,NA,NA,2,57,0,NA,NA,52
"58",480761,"Corner,  Chelsea. Conceded by Ayoze Pérez.","54'","Chelsea","Newcastle United","2","1",0,0,0,0,0,NA,NA,NA,NA,NA,NA,NA,0,NA,NA,0,NA,0,0,NA,NA,NA,0,NA,NA,NA,0,NA,NA,0,NA,0,NA,NA,NA,1,"Chelsea","Ayoze Pérez",0,0,NA,NA,NA,0,NA,NA,NA,NA,2,58,0,NA,NA,54
"59",480761,"Attempt blocked. Eden Hazard (Chelsea) right footed shot from outside the box is blocked. Assisted by Marcos Alonso.","56'","Chelsea","Newcastle United","2","1",0,0,0,1,0,"blocked","Eden Hazard","Chelsea","right","outside the box",NA,"Marcos Alonso",0,NA,NA,0,NA,0,0,NA,NA,NA,0,NA,NA,NA,0,NA,NA,0,NA,0,NA,NA,NA,0,NA,NA,0,0,NA,NA,NA,0,NA,NA,NA,NA,2,59,0,NA,NA,56
"60",480761,"Corner,  Chelsea. Conceded by Ciaran Clark.","56'","Chelsea","Newcastle United","2","1",0,0,0,0,0,NA,NA,NA,NA,NA,NA,NA,0,NA,NA,0,NA,0,0,NA,NA,NA,0,NA,NA,NA,0,NA,NA,0,NA,0,NA,NA,NA,1,"Chelsea","Ciaran Clark",0,0,NA,NA,NA,0,NA,NA,NA,NA,2,60,0,NA,NA,56
"61",480761,"Attempt blocked. Victor Moses (Chelsea) right footed shot from outside the box is blocked.","56'","Chelsea","Newcastle United","2","1",0,0,0,1,0,"blocked","Victor Moses","Chelsea","right","outside the box",NA,NA,0,NA,NA,0,NA,0,0,NA,NA,NA,0,NA,NA,NA,0,NA,NA,0,NA,0,NA,NA,NA,0,NA,NA,0,0,NA,NA,NA,0,NA,NA,NA,NA,2,61,0,NA,NA,56
"62",480761,"Attempt saved. Eden Hazard (Chelsea) right footed shot from the centre of the box is saved in the bottom right corner.","57'","Chelsea","Newcastle United","2","1",0,0,0,1,0,"saved","Eden Hazard","Chelsea","right","the centre of the box","the bottom right corner",NA,0,NA,NA,0,NA,0,0,NA,NA,NA,0,NA,NA,NA,0,NA,NA,0,NA,0,NA,NA,NA,0,NA,NA,0,0,NA,NA,NA,0,NA,NA,NA,NA,2,62,0,NA,NA,57
"63",480761,"Foul by Victor Moses (Chelsea).","58'","Chelsea","Newcastle United","2","1",0,0,0,0,0,NA,NA,NA,NA,NA,NA,NA,1,"Victor Moses","Chelsea",0,NA,0,0,NA,NA,NA,0,NA,NA,NA,0,NA,NA,0,NA,0,NA,NA,NA,0,NA,NA,0,0,NA,NA,NA,0,NA,NA,NA,NA,2,63,0,NA,NA,58
"64",480761,"Mikel Merino (Newcastle United) wins a free kick in the defensive half.","58'","Chelsea","Newcastle United","2","1",0,0,0,0,0,NA,NA,NA,NA,NA,NA,NA,0,NA,NA,0,NA,0,0,NA,NA,NA,0,NA,NA,NA,0,NA,NA,0,NA,1,"Mikel Merino","Newcastle United","defensive half",0,NA,NA,0,0,NA,NA,NA,0,NA,NA,NA,NA,2,64,0,NA,NA,58
"65",480761,"Eden Hazard (Chelsea) wins a free kick in the defensive half.","60'","Chelsea","Newcastle United","2","1",0,0,0,0,0,NA,NA,NA,NA,NA,NA,NA,0,NA,NA,0,NA,0,0,NA,NA,NA,0,NA,NA,NA,0,NA,NA,0,NA,1,"Eden Hazard","Chelsea","defensive half",0,NA,NA,0,0,NA,NA,NA,0,NA,NA,NA,NA,2,65,0,NA,NA,60
"66",480761,"Foul by Mikel Merino (Newcastle United).","60'","Chelsea","Newcastle United","2","1",0,0,0,0,0,NA,NA,NA,NA,NA,NA,NA,1,"Mikel Merino","Newcastle United",0,NA,0,0,NA,NA,NA,0,NA,NA,NA,0,NA,NA,0,NA,0,NA,NA,NA,0,NA,NA,0,0,NA,NA,NA,0,NA,NA,NA,NA,2,66,0,NA,NA,60
"67",480761,"Attempt missed. Ayoze Pérez (Newcastle United) right footed shot from outside the box misses to the left. Assisted by Mikel Merino.","61'","Chelsea","Newcastle United","2","1",0,0,0,1,0,"missed","Ayoze Pérez","Newcastle United","right","outside the box","left","Mikel Merino",0,NA,NA,0,NA,0,0,NA,NA,NA,0,NA,NA,NA,0,NA,NA,0,NA,0,NA,NA,NA,0,NA,NA,0,0,NA,NA,NA,0,NA,NA,NA,NA,2,67,0,NA,NA,61
"68",480761,"Substitution, Newcastle United. Isaac Hayden replaces Ayoze Pérez.","62'","Chelsea","Newcastle United","2","1",0,0,0,0,0,NA,NA,NA,NA,NA,NA,NA,0,NA,NA,0,NA,0,0,NA,NA,NA,0,NA,NA,NA,0,NA,NA,0,NA,0,NA,NA,NA,0,NA,NA,1,0,"Newcastle United","Isaac Hayden","Ayoze Pérez",0,NA,NA,NA,NA,2,68,0,NA,NA,62
"69",480761,"Attempt blocked. Cesc Fàbregas (Chelsea) right footed shot from outside the box is blocked. Assisted by N'Golo Kanté.","62'","Chelsea","Newcastle United","2","1",0,0,0,1,0,"blocked","Cesc Fàbregas","Chelsea","right","outside the box",NA,"N'Golo Kanté",0,NA,NA,0,NA,0,0,NA,NA,NA,0,NA,NA,NA,0,NA,NA,0,NA,0,NA,NA,NA,0,NA,NA,0,0,NA,NA,NA,0,NA,NA,NA,NA,2,69,0,NA,NA,62
"70",480761,"Offside, Newcastle United. Chancel Mbemba tries a through ball, but Dwight Gayle is caught offside.","64'","Chelsea","Newcastle United","2","1",0,0,0,0,0,NA,NA,NA,NA,NA,NA,NA,0,NA,NA,0,NA,0,1,"Newcastle United","Dwight Gayle","Chancel Mbemba",0,NA,NA,NA,0,NA,NA,0,NA,0,NA,NA,NA,0,NA,NA,0,0,NA,NA,NA,0,NA,NA,NA,NA,2,70,0,NA,NA,64
"71",480761,"Attempt saved. Victor Moses (Chelsea) header from the centre of the box is saved in the centre of the goal. Assisted by César Azpilicueta.","67'","Chelsea","Newcastle United","2","1",0,0,0,1,0,"saved","Victor Moses","Chelsea","header","the centre of the box","the centre of the goal","César Azpilicueta",0,NA,NA,0,NA,0,0,NA,NA,NA,0,NA,NA,NA,0,NA,NA,0,NA,0,NA,NA,NA,0,NA,NA,0,0,NA,NA,NA,0,NA,NA,NA,NA,2,71,0,NA,NA,67
"72",480761,"Corner,  Chelsea. Conceded by Florian Lejeune.","68'","Chelsea","Newcastle United","2","1",0,0,0,0,0,NA,NA,NA,NA,NA,NA,NA,0,NA,NA,0,NA,0,0,NA,NA,NA,0,NA,NA,NA,0,NA,NA,0,NA,0,NA,NA,NA,1,"Chelsea","Florian Lejeune",0,0,NA,NA,NA,0,NA,NA,NA,NA,2,72,0,NA,NA,68
"73",480761,"Corner,  Chelsea. Conceded by Mohamed Diamé.","68'","Chelsea","Newcastle United","2","1",0,0,0,0,0,NA,NA,NA,NA,NA,NA,NA,0,NA,NA,0,NA,0,0,NA,NA,NA,0,NA,NA,NA,0,NA,NA,0,NA,0,NA,NA,NA,1,"Chelsea","Mohamed Diamé",0,0,NA,NA,NA,0,NA,NA,NA,NA,2,73,0,NA,NA,68
"74",480761,"Attempt missed. Andreas Christensen (Chelsea) header from the centre of the box misses to the left. Assisted by Cesc Fàbregas with a cross following a corner.","69'","Chelsea","Newcastle United","2","1",0,0,0,1,0,"missed","Andreas Christensen","Chelsea","header","the centre of the box","left","Cesc Fàbregas",0,NA,NA,0,"cross",1,0,NA,NA,NA,0,NA,NA,NA,0,NA,NA,0,NA,0,NA,NA,NA,0,NA,NA,0,0,NA,NA,NA,0,NA,NA,NA,NA,2,74,0,NA,NA,69
"75",480761,"Attempt saved. Eden Hazard (Chelsea) right footed shot from the left side of the box is saved in the centre of the goal. Assisted by Daniel Drinkwater.","69'","Chelsea","Newcastle United","2","1",0,0,0,1,0,"saved","Eden Hazard","Chelsea","right","the left side of the box","the centre of the goal","Daniel Drinkwater",0,NA,NA,0,NA,0,0,NA,NA,NA,0,NA,NA,NA,0,NA,NA,0,NA,0,NA,NA,NA,0,NA,NA,0,0,NA,NA,NA,0,NA,NA,NA,NA,2,75,0,NA,NA,69
"76",480761,"Attempt missed. Eden Hazard (Chelsea) left footed shot from the centre of the box is close, but misses to the left. Assisted by Daniel Drinkwater with a through ball.","70'","Chelsea","Newcastle United","2","1",0,0,0,1,0,"missed","Eden Hazard","Chelsea","left","the centre of the box","close, but left","Daniel Drinkwater",0,NA,NA,0,"through",0,0,NA,NA,NA,0,NA,NA,NA,0,NA,NA,0,NA,0,NA,NA,NA,0,NA,NA,0,0,NA,NA,NA,0,NA,NA,NA,NA,2,76,0,NA,NA,70
"77",480761,"Penalty Chelsea. Victor Moses draws a foul in the penalty area.","73'","Chelsea","Newcastle United","2","1",0,0,0,0,0,NA,NA,NA,NA,NA,NA,NA,0,NA,NA,0,NA,0,0,NA,NA,NA,0,NA,NA,NA,0,NA,NA,0,NA,0,NA,NA,NA,0,NA,NA,0,0,NA,NA,NA,1,"Chelsea","Victor Moses",NA,NA,2,77,0,NA,NA,73
"78",480761,"Penalty conceded by Matt Ritchie (Newcastle United) after a foul in the penalty area.","73'","Chelsea","Newcastle United","2","1",0,0,0,0,0,NA,NA,NA,NA,NA,NA,NA,0,NA,NA,0,NA,0,0,NA,NA,NA,0,NA,NA,NA,0,NA,NA,0,NA,0,NA,NA,NA,0,NA,NA,0,0,NA,NA,NA,1,"Newcastle United",NA,"Matt Ritchie","Newcastle United",2,78,0,NA,NA,73
