"","game_id","commentary","match_time","team_one","team_two","team_one_score","team_two_score","half_end","match_end","half_begins","shot_attempt","penalty_shot","shot_result","shot_by_player","shot_by_team","shot_with","shot_where","net_location","assist_by_player","foul","foul_by_player","foul_by_team","follow_set_piece","assist_type","follow_corner","offside","offside_team","offside_player","offside_pass_from","shown_card","card_type","card_player","card_team","video_review","video_review_event","video_review_result","delay_in_match","delay_team","free_kick_won","free_kick_player","free_kick_team","free_kick_where","corner","corner_team","corner_conceded_by","substitution","sub_injury","sub_team","sub_player","replaced_player","penalty","team_drew_penalty","player_drew_penalty","player_conceded_penalty","team_conceded_penalty","half","comment_id","stoppage_time","team_one_penalty_score","team_two_penalty_score","match_time_numeric"
"1",480897,"First Half begins.","-","Chelsea","Burnley","0","0",0,0,1,0,0,NA,NA,NA,NA,NA,NA,NA,0,NA,NA,0,NA,0,0,NA,NA,NA,0,NA,NA,NA,0,NA,NA,0,NA,0,NA,NA,NA,0,NA,NA,0,0,NA,NA,NA,0,NA,NA,NA,NA,1,1,0,NA,NA,NA
"2",480897,"Lineups are announced and players are warming up.","-","Chelsea","Burnley","0","0",0,0,0,0,0,NA,NA,NA,NA,NA,NA,NA,0,NA,NA,0,NA,0,0,NA,NA,NA,0,NA,NA,NA,0,NA,NA,0,NA,0,NA,NA,NA,0,NA,NA,0,0,NA,NA,NA,0,NA,NA,NA,NA,1,2,0,NA,NA,NA
"3",480897,"Foul by Marcos Alonso (Chelsea).","3'","Chelsea","Burnley","0","0",0,0,0,0,0,NA,NA,NA,NA,NA,NA,NA,1,"Marcos Alonso","Chelsea",0,NA,0,0,NA,NA,NA,0,NA,NA,NA,0,NA,NA,0,NA,0,NA,NA,NA,0,NA,NA,0,0,NA,NA,NA,0,NA,NA,NA,NA,1,3,0,NA,NA,3
"4",480897,"Matthew Lowton (Burnley) wins a free kick on the right wing.","3'","Chelsea","Burnley","0","0",0,0,0,0,0,NA,NA,NA,NA,NA,NA,NA,0,NA,NA,0,NA,0,0,NA,NA,NA,0,NA,NA,NA,0,NA,NA,0,NA,1,"Matthew Lowton","Burnley",NA,0,NA,NA,0,0,NA,NA,NA,0,NA,NA,NA,NA,1,4,0,NA,NA,3
"5",480897,"Marcos Alonso (Chelsea) is shown the yellow card for a bad foul.","3'","Chelsea","Burnley","0","0",0,0,0,0,0,NA,NA,NA,NA,NA,NA,NA,0,NA,NA,0,NA,0,0,NA,NA,NA,1,"yellow","Marcos Alonso","Chelsea",0,NA,NA,0,NA,0,NA,NA,NA,0,NA,NA,0,0,NA,NA,NA,0,NA,NA,NA,NA,1,5,0,NA,NA,3
"6",480897,"Attempt saved. Ben Mee (Burnley) header from the left side of the box is saved in the centre of the goal. Assisted by Robbie Brady with a cross.","3'","Chelsea","Burnley","0","0",0,0,0,1,0,"saved","Ben Mee","Burnley","header","the left side of the box","the centre of the goal","Robbie Brady",0,NA,NA,0,"cross",0,0,NA,NA,NA,0,NA,NA,NA,0,NA,NA,0,NA,0,NA,NA,NA,0,NA,NA,0,0,NA,NA,NA,0,NA,NA,NA,NA,1,6,0,NA,NA,3
"7",480897,"Foul by Jeremie Boga (Chelsea).","10'","Chelsea","Burnley","0","0",0,0,0,0,0,NA,NA,NA,NA,NA,NA,NA,1,"Jeremie Boga","Chelsea",0,NA,0,0,NA,NA,NA,0,NA,NA,NA,0,NA,NA,0,NA,0,NA,NA,NA,0,NA,NA,0,0,NA,NA,NA,0,NA,NA,NA,NA,1,7,0,NA,NA,10
"8",480897,"James Tarkowski (Burnley) wins a free kick in the defensive half.","10'","Chelsea","Burnley","0","0",0,0,0,0,0,NA,NA,NA,NA,NA,NA,NA,0,NA,NA,0,NA,0,0,NA,NA,NA,0,NA,NA,NA,0,NA,NA,0,NA,1,"James Tarkowski","Burnley","defensive half",0,NA,NA,0,0,NA,NA,NA,0,NA,NA,NA,NA,1,8,0,NA,NA,10
"9",480897,"Attempt blocked. Antonio Rüdiger (Chelsea) right footed shot from outside the box is blocked. Assisted by Cesc Fàbregas.","11'","Chelsea","Burnley","0","0",0,0,0,1,0,"blocked","Antonio Rüdiger","Chelsea","right","outside the box",NA,"Cesc Fàbregas",0,NA,NA,0,NA,0,0,NA,NA,NA,0,NA,NA,NA,0,NA,NA,0,NA,0,NA,NA,NA,0,NA,NA,0,0,NA,NA,NA,0,NA,NA,NA,NA,1,9,0,NA,NA,11
"10",480897,"Foul by Gary Cahill (Chelsea).","13'","Chelsea","Burnley","0","0",0,0,0,0,0,NA,NA,NA,NA,NA,NA,NA,1,"Gary Cahill","Chelsea",0,NA,0,0,NA,NA,NA,0,NA,NA,NA,0,NA,NA,0,NA,0,NA,NA,NA,0,NA,NA,0,0,NA,NA,NA,0,NA,NA,NA,NA,1,10,0,NA,NA,13
"11",480897,"Steven Defour (Burnley) wins a free kick in the defensive half.","13'","Chelsea","Burnley","0","0",0,0,0,0,0,NA,NA,NA,NA,NA,NA,NA,0,NA,NA,0,NA,0,0,NA,NA,NA,0,NA,NA,NA,0,NA,NA,0,NA,1,"Steven Defour","Burnley","defensive half",0,NA,NA,0,0,NA,NA,NA,0,NA,NA,NA,NA,1,11,0,NA,NA,13
"12",480897,"Gary Cahill (Chelsea) is shown the red card.","14'","Chelsea","Burnley","0","0",0,0,0,0,0,NA,NA,NA,NA,NA,NA,NA,0,NA,NA,0,NA,0,0,NA,NA,NA,1,"red","Gary Cahill","Chelsea",0,NA,NA,0,NA,0,NA,NA,NA,0,NA,NA,0,0,NA,NA,NA,0,NA,NA,NA,NA,1,12,0,NA,NA,14
"13",480897,"Delay in match  (Burnley).","14'","Chelsea","Burnley","0","0",0,0,0,0,0,NA,NA,NA,NA,NA,NA,NA,0,NA,NA,0,NA,0,0,NA,NA,NA,0,NA,NA,NA,0,NA,NA,1,"Burnley",0,NA,NA,NA,0,NA,NA,0,0,NA,NA,NA,0,NA,NA,NA,NA,1,13,0,NA,NA,14
"14",480897,"Delay over. They are ready to continue.","15'","Chelsea","Burnley","0","0",0,0,0,0,0,NA,NA,NA,NA,NA,NA,NA,0,NA,NA,0,NA,0,0,NA,NA,NA,0,NA,NA,NA,0,NA,NA,0,NA,0,NA,NA,NA,0,NA,NA,0,0,NA,NA,NA,0,NA,NA,NA,NA,1,14,0,NA,NA,15
"15",480897,"Foul by Stephen Ward (Burnley).","16'","Chelsea","Burnley","0","0",0,0,0,0,0,NA,NA,NA,NA,NA,NA,NA,1,"Stephen Ward","Burnley",0,NA,0,0,NA,NA,NA,0,NA,NA,NA,0,NA,NA,0,NA,0,NA,NA,NA,0,NA,NA,0,0,NA,NA,NA,0,NA,NA,NA,NA,1,15,0,NA,NA,16
"16",480897,"Willian (Chelsea) wins a free kick in the defensive half.","16'","Chelsea","Burnley","0","0",0,0,0,0,0,NA,NA,NA,NA,NA,NA,NA,0,NA,NA,0,NA,0,0,NA,NA,NA,0,NA,NA,NA,0,NA,NA,0,NA,1,"Willian","Chelsea","defensive half",0,NA,NA,0,0,NA,NA,NA,0,NA,NA,NA,NA,1,16,0,NA,NA,16
"17",480897,"Foul by Cesc Fàbregas (Chelsea).","16'","Chelsea","Burnley","0","0",0,0,0,0,0,NA,NA,NA,NA,NA,NA,NA,1,"Cesc Fàbregas","Chelsea",0,NA,0,0,NA,NA,NA,0,NA,NA,NA,0,NA,NA,0,NA,0,NA,NA,NA,0,NA,NA,0,0,NA,NA,NA,0,NA,NA,NA,NA,1,17,0,NA,NA,16
"18",480897,"Jeff Hendrick (Burnley) wins a free kick in the defensive half.","16'","Chelsea","Burnley","0","0",0,0,0,0,0,NA,NA,NA,NA,NA,NA,NA,0,NA,NA,0,NA,0,0,NA,NA,NA,0,NA,NA,NA,0,NA,NA,0,NA,1,"Jeff Hendrick","Burnley","defensive half",0,NA,NA,0,0,NA,NA,NA,0,NA,NA,NA,NA,1,18,0,NA,NA,16
"19",480897,"Cesc Fàbregas (Chelsea) is shown the yellow card.","16'","Chelsea","Burnley","0","0",0,0,0,0,0,NA,NA,NA,NA,NA,NA,NA,0,NA,NA,0,NA,0,0,NA,NA,NA,1,"yellow","Cesc Fàbregas","Chelsea",0,NA,NA,0,NA,0,NA,NA,NA,0,NA,NA,0,0,NA,NA,NA,0,NA,NA,NA,NA,1,19,0,NA,NA,16
"20",480897,"Substitution, Chelsea. Andreas Christensen replaces Jeremie Boga.","18'","Chelsea","Burnley","0","0",0,0,0,0,0,NA,NA,NA,NA,NA,NA,NA,0,NA,NA,0,NA,0,0,NA,NA,NA,0,NA,NA,NA,0,NA,NA,0,NA,0,NA,NA,NA,0,NA,NA,1,0,"Chelsea","Andreas Christensen","Jeremie Boga",0,NA,NA,NA,NA,1,20,0,NA,NA,18
"21",480897,"Corner,  Burnley. Conceded by Marcos Alonso.","18'","Chelsea","Burnley","0","0",0,0,0,0,0,NA,NA,NA,NA,NA,NA,NA,0,NA,NA,0,NA,0,0,NA,NA,NA,0,NA,NA,NA,0,NA,NA,0,NA,0,NA,NA,NA,1,"Burnley","Marcos Alonso",0,0,NA,NA,NA,0,NA,NA,NA,NA,1,21,0,NA,NA,18
"22",480897,"Andreas Christensen (Chelsea) wins a free kick in the defensive half.","19'","Chelsea","Burnley","0","0",0,0,0,0,0,NA,NA,NA,NA,NA,NA,NA,0,NA,NA,0,NA,0,0,NA,NA,NA,0,NA,NA,NA,0,NA,NA,0,NA,1,"Andreas Christensen","Chelsea","defensive half",0,NA,NA,0,0,NA,NA,NA,0,NA,NA,NA,NA,1,22,0,NA,NA,19
"23",480897,"Foul by James Tarkowski (Burnley).","19'","Chelsea","Burnley","0","0",0,0,0,0,0,NA,NA,NA,NA,NA,NA,NA,1,"James Tarkowski","Burnley",0,NA,0,0,NA,NA,NA,0,NA,NA,NA,0,NA,NA,0,NA,0,NA,NA,NA,0,NA,NA,0,0,NA,NA,NA,0,NA,NA,NA,NA,1,23,0,NA,NA,19
"24",480897,"Goal!  Chelsea 0, Burnley 1. Sam Vokes (Burnley) right footed shot from the centre of the box to the bottom left corner. Assisted by Matthew Lowton with a cross.","24'","Chelsea","Burnley","0","1",0,0,0,1,0,"goal","Sam Vokes","Burnley","right","the centre of the box","bottom left corner","Matthew Lowton",0,NA,NA,0,"cross",0,0,NA,NA,NA,0,NA,NA,NA,0,NA,NA,0,NA,0,NA,NA,NA,0,NA,NA,0,0,NA,NA,NA,0,NA,NA,NA,NA,1,24,0,NA,NA,24
"25",480897,"Corner,  Burnley. Conceded by Marcos Alonso.","28'","Chelsea","Burnley","0","1",0,0,0,0,0,NA,NA,NA,NA,NA,NA,NA,0,NA,NA,0,NA,0,0,NA,NA,NA,0,NA,NA,NA,0,NA,NA,0,NA,0,NA,NA,NA,1,"Burnley","Marcos Alonso",0,0,NA,NA,NA,0,NA,NA,NA,NA,1,25,0,NA,NA,28
"26",480897,"Cesc Fàbregas (Chelsea) wins a free kick in the defensive half.","29'","Chelsea","Burnley","0","1",0,0,0,0,0,NA,NA,NA,NA,NA,NA,NA,0,NA,NA,0,NA,0,0,NA,NA,NA,0,NA,NA,NA,0,NA,NA,0,NA,1,"Cesc Fàbregas","Chelsea","defensive half",0,NA,NA,0,0,NA,NA,NA,0,NA,NA,NA,NA,1,26,0,NA,NA,29
"27",480897,"Foul by Sam Vokes (Burnley).","29'","Chelsea","Burnley","0","1",0,0,0,0,0,NA,NA,NA,NA,NA,NA,NA,1,"Sam Vokes","Burnley",0,NA,0,0,NA,NA,NA,0,NA,NA,NA,0,NA,NA,0,NA,0,NA,NA,NA,0,NA,NA,0,0,NA,NA,NA,0,NA,NA,NA,NA,1,27,0,NA,NA,29
"28",480897,"Attempt blocked. Marcos Alonso (Chelsea) right footed shot from outside the box is blocked. Assisted by Willian.","33'","Chelsea","Burnley","0","1",0,0,0,1,0,"blocked","Marcos Alonso","Chelsea","right","outside the box",NA,"Willian",0,NA,NA,0,NA,0,0,NA,NA,NA,0,NA,NA,NA,0,NA,NA,0,NA,0,NA,NA,NA,0,NA,NA,0,0,NA,NA,NA,0,NA,NA,NA,NA,1,28,0,NA,NA,33
"29",480897,"Foul by César Azpilicueta (Chelsea).","38'","Chelsea","Burnley","0","1",0,0,0,0,0,NA,NA,NA,NA,NA,NA,NA,1,"César Azpilicueta","Chelsea",0,NA,0,0,NA,NA,NA,0,NA,NA,NA,0,NA,NA,0,NA,0,NA,NA,NA,0,NA,NA,0,0,NA,NA,NA,0,NA,NA,NA,NA,1,29,0,NA,NA,38
"30",480897,"Stephen Ward (Burnley) wins a free kick on the left wing.","38'","Chelsea","Burnley","0","1",0,0,0,0,0,NA,NA,NA,NA,NA,NA,NA,0,NA,NA,0,NA,0,0,NA,NA,NA,0,NA,NA,NA,0,NA,NA,0,NA,1,"Stephen Ward","Burnley",NA,0,NA,NA,0,0,NA,NA,NA,0,NA,NA,NA,NA,1,30,0,NA,NA,38
"31",480897,"Goal!  Chelsea 0, Burnley 2. Stephen Ward (Burnley) left footed shot from the left side of the box to the top right corner. Assisted by Jack Cork.","39'","Chelsea","Burnley","0","2",0,0,0,1,0,"goal","Stephen Ward","Burnley","left","the left side of the box","top right corner","Jack Cork",0,NA,NA,0,NA,0,0,NA,NA,NA,0,NA,NA,NA,0,NA,NA,0,NA,0,NA,NA,NA,0,NA,NA,0,0,NA,NA,NA,0,NA,NA,NA,NA,1,31,0,NA,NA,39
"32",480897,"Attempt missed. David Luiz (Chelsea) left footed shot from outside the box is high and wide to the left.","41'","Chelsea","Burnley","0","2",0,0,0,1,0,"missed","David Luiz","Chelsea","left","outside the box","high and wide to the left",NA,0,NA,NA,0,NA,0,0,NA,NA,NA,0,NA,NA,NA,0,NA,NA,0,NA,0,NA,NA,NA,0,NA,NA,0,0,NA,NA,NA,0,NA,NA,NA,NA,1,32,0,NA,NA,41
"33",480897,"Foul by Antonio Rüdiger (Chelsea).","42'","Chelsea","Burnley","0","2",0,0,0,0,0,NA,NA,NA,NA,NA,NA,NA,1,"Antonio Rüdiger","Chelsea",0,NA,0,0,NA,NA,NA,0,NA,NA,NA,0,NA,NA,0,NA,0,NA,NA,NA,0,NA,NA,0,0,NA,NA,NA,0,NA,NA,NA,NA,1,33,0,NA,NA,42
"34",480897,"Jeff Hendrick (Burnley) wins a free kick on the right wing.","42'","Chelsea","Burnley","0","2",0,0,0,0,0,NA,NA,NA,NA,NA,NA,NA,0,NA,NA,0,NA,0,0,NA,NA,NA,0,NA,NA,NA,0,NA,NA,0,NA,1,"Jeff Hendrick","Burnley",NA,0,NA,NA,0,0,NA,NA,NA,0,NA,NA,NA,NA,1,34,0,NA,NA,42
"35",480897,"Goal!  Chelsea 0, Burnley 3. Sam Vokes (Burnley) header from the centre of the box to the top left corner. Assisted by Steven Defour with a cross following a set piece situation.","43'","Chelsea","Burnley","0","3",0,0,0,1,0,"goal","Sam Vokes","Burnley","header","the centre of the box","top left corner","Steven Defour",0,NA,NA,1,"cross",0,0,NA,NA,NA,0,NA,NA,NA,0,NA,NA,0,NA,0,NA,NA,NA,0,NA,NA,0,0,NA,NA,NA,0,NA,NA,NA,NA,1,35,0,NA,NA,43
"36",480897,"Attempt blocked. N'Golo Kanté (Chelsea) right footed shot from outside the box is blocked. Assisted by Marcos Alonso.","45'","Chelsea","Burnley","0","3",0,0,0,1,0,"blocked","N'Golo Kanté","Chelsea","right","outside the box",NA,"Marcos Alonso",0,NA,NA,0,NA,0,0,NA,NA,NA,0,NA,NA,NA,0,NA,NA,0,NA,0,NA,NA,NA,0,NA,NA,0,0,NA,NA,NA,0,NA,NA,NA,NA,1,36,0,NA,NA,45
"37",480897,"Corner,  Chelsea. Conceded by Steven Defour.","45'","Chelsea","Burnley","0","3",0,0,0,0,0,NA,NA,NA,NA,NA,NA,NA,0,NA,NA,0,NA,0,0,NA,NA,NA,0,NA,NA,NA,0,NA,NA,0,NA,0,NA,NA,NA,1,"Chelsea","Steven Defour",0,0,NA,NA,NA,0,NA,NA,NA,NA,1,37,0,NA,NA,45
"38",480897,"Attempt blocked. N'Golo Kanté (Chelsea) right footed shot from outside the box is blocked.","45'","Chelsea","Burnley","0","3",0,0,0,1,0,"blocked","N'Golo Kanté","Chelsea","right","outside the box",NA,NA,0,NA,NA,0,NA,0,0,NA,NA,NA,0,NA,NA,NA,0,NA,NA,0,NA,0,NA,NA,NA,0,NA,NA,0,0,NA,NA,NA,0,NA,NA,NA,NA,1,38,0,NA,NA,45
"39",480897,"Foul by Antonio Rüdiger (Chelsea).","45'","Chelsea","Burnley","0","3",0,0,0,0,0,NA,NA,NA,NA,NA,NA,NA,1,"Antonio Rüdiger","Chelsea",0,NA,0,0,NA,NA,NA,0,NA,NA,NA,0,NA,NA,0,NA,0,NA,NA,NA,0,NA,NA,0,0,NA,NA,NA,0,NA,NA,NA,NA,1,39,0,NA,NA,45
"40",480897,"Jack Cork (Burnley) wins a free kick in the defensive half.","45'","Chelsea","Burnley","0","3",0,0,0,0,0,NA,NA,NA,NA,NA,NA,NA,0,NA,NA,0,NA,0,0,NA,NA,NA,0,NA,NA,NA,0,NA,NA,0,NA,1,"Jack Cork","Burnley","defensive half",0,NA,NA,0,0,NA,NA,NA,0,NA,NA,NA,NA,1,40,0,NA,NA,45
"41",480897,"Foul by David Luiz (Chelsea).","45'+2'","Chelsea","Burnley","0","3",0,0,0,0,0,NA,NA,NA,NA,NA,NA,NA,1,"David Luiz","Chelsea",0,NA,0,0,NA,NA,NA,0,NA,NA,NA,0,NA,NA,0,NA,0,NA,NA,NA,0,NA,NA,0,0,NA,NA,NA,0,NA,NA,NA,NA,1,41,1,NA,NA,47
"42",480897,"Sam Vokes (Burnley) wins a free kick in the attacking half.","45'+2'","Chelsea","Burnley","0","3",0,0,0,0,0,NA,NA,NA,NA,NA,NA,NA,0,NA,NA,0,NA,0,0,NA,NA,NA,0,NA,NA,NA,0,NA,NA,0,NA,1,"Sam Vokes","Burnley","attacking half",0,NA,NA,0,0,NA,NA,NA,0,NA,NA,NA,NA,1,42,1,NA,NA,47
"43",480897,"Attempt missed. Robbie Brady (Burnley) left footed shot from the left side of the box misses to the right. Assisted by Jeff Hendrick.","45'+3'","Chelsea","Burnley","0","3",0,0,0,1,0,"missed","Robbie Brady","Burnley","left","the left side of the box","right","Jeff Hendrick",0,NA,NA,0,NA,0,0,NA,NA,NA,0,NA,NA,NA,0,NA,NA,0,NA,0,NA,NA,NA,0,NA,NA,0,0,NA,NA,NA,0,NA,NA,NA,NA,1,43,1,NA,NA,48
"44",480897,"First Half ends, Chelsea 0, Burnley 3.","45'+4'","Chelsea","Burnley","0","3",1,0,0,0,0,NA,NA,NA,NA,NA,NA,NA,0,NA,NA,0,NA,0,0,NA,NA,NA,0,NA,NA,NA,0,NA,NA,0,NA,0,NA,NA,NA,0,NA,NA,0,0,NA,NA,NA,0,NA,NA,NA,NA,1,44,1,NA,NA,49
"45",480897,"Second Half begins Chelsea 0, Burnley 3.","45'","Chelsea","Burnley","0","3",0,0,1,0,0,NA,NA,NA,NA,NA,NA,NA,0,NA,NA,0,NA,0,0,NA,NA,NA,0,NA,NA,NA,0,NA,NA,0,NA,0,NA,NA,NA,0,NA,NA,0,0,NA,NA,NA,0,NA,NA,NA,NA,2,45,0,NA,NA,45
"46",480897,"Foul by Steven Defour (Burnley).","47'","Chelsea","Burnley","0","3",0,0,0,0,0,NA,NA,NA,NA,NA,NA,NA,1,"Steven Defour","Burnley",0,NA,0,0,NA,NA,NA,0,NA,NA,NA,0,NA,NA,0,NA,0,NA,NA,NA,0,NA,NA,0,0,NA,NA,NA,0,NA,NA,NA,NA,2,46,0,NA,NA,47
"47",480897,"N'Golo Kanté (Chelsea) wins a free kick in the defensive half.","47'","Chelsea","Burnley","0","3",0,0,0,0,0,NA,NA,NA,NA,NA,NA,NA,0,NA,NA,0,NA,0,0,NA,NA,NA,0,NA,NA,NA,0,NA,NA,0,NA,1,"N'Golo Kanté","Chelsea","defensive half",0,NA,NA,0,0,NA,NA,NA,0,NA,NA,NA,NA,2,47,0,NA,NA,47
"48",480897,"Attempt missed. Antonio Rüdiger (Chelsea) right footed shot from outside the box misses to the left. Assisted by Cesc Fàbregas.","48'","Chelsea","Burnley","0","3",0,0,0,1,0,"missed","Antonio Rüdiger","Chelsea","right","outside the box","left","Cesc Fàbregas",0,NA,NA,0,NA,0,0,NA,NA,NA,0,NA,NA,NA,0,NA,NA,0,NA,0,NA,NA,NA,0,NA,NA,0,0,NA,NA,NA,0,NA,NA,NA,NA,2,48,0,NA,NA,48
"49",480897,"Attempt saved. Marcos Alonso (Chelsea) left footed shot from outside the box is saved in the top left corner. Assisted by Cesc Fàbregas.","49'","Chelsea","Burnley","0","3",0,0,0,1,0,"saved","Marcos Alonso","Chelsea","left","outside the box","the top left corner","Cesc Fàbregas",0,NA,NA,0,NA,0,0,NA,NA,NA,0,NA,NA,NA,0,NA,NA,0,NA,0,NA,NA,NA,0,NA,NA,0,0,NA,NA,NA,0,NA,NA,NA,NA,2,49,0,NA,NA,49
"50",480897,"Corner,  Chelsea. Conceded by James Tarkowski.","49'","Chelsea","Burnley","0","3",0,0,0,0,0,NA,NA,NA,NA,NA,NA,NA,0,NA,NA,0,NA,0,0,NA,NA,NA,0,NA,NA,NA,0,NA,NA,0,NA,0,NA,NA,NA,1,"Chelsea","James Tarkowski",0,0,NA,NA,NA,0,NA,NA,NA,NA,2,50,0,NA,NA,49
"51",480897,"Corner,  Chelsea. Conceded by Steven Defour.","52'","Chelsea","Burnley","0","3",0,0,0,0,0,NA,NA,NA,NA,NA,NA,NA,0,NA,NA,0,NA,0,0,NA,NA,NA,0,NA,NA,NA,0,NA,NA,0,NA,0,NA,NA,NA,1,"Chelsea","Steven Defour",0,0,NA,NA,NA,0,NA,NA,NA,NA,2,51,0,NA,NA,52
"52",480897,"Attempt saved. Michy Batshuayi (Chelsea) right footed shot from outside the box is saved in the centre of the goal. Assisted by N'Golo Kanté.","53'","Chelsea","Burnley","0","3",0,0,0,1,0,"saved","Michy Batshuayi","Chelsea","right","outside the box","the centre of the goal","N'Golo Kanté",0,NA,NA,0,NA,0,0,NA,NA,NA,0,NA,NA,NA,0,NA,NA,0,NA,0,NA,NA,NA,0,NA,NA,0,0,NA,NA,NA,0,NA,NA,NA,NA,2,52,0,NA,NA,53
"53",480897,"Andreas Christensen (Chelsea) wins a free kick in the defensive half.","54'","Chelsea","Burnley","0","3",0,0,0,0,0,NA,NA,NA,NA,NA,NA,NA,0,NA,NA,0,NA,0,0,NA,NA,NA,0,NA,NA,NA,0,NA,NA,0,NA,1,"Andreas Christensen","Chelsea","defensive half",0,NA,NA,0,0,NA,NA,NA,0,NA,NA,NA,NA,2,53,0,NA,NA,54
"54",480897,"Foul by Sam Vokes (Burnley).","54'","Chelsea","Burnley","0","3",0,0,0,0,0,NA,NA,NA,NA,NA,NA,NA,1,"Sam Vokes","Burnley",0,NA,0,0,NA,NA,NA,0,NA,NA,NA,0,NA,NA,0,NA,0,NA,NA,NA,0,NA,NA,0,0,NA,NA,NA,0,NA,NA,NA,NA,2,54,0,NA,NA,54
"55",480897,"Foul by Cesc Fàbregas (Chelsea).","55'","Chelsea","Burnley","0","3",0,0,0,0,0,NA,NA,NA,NA,NA,NA,NA,1,"Cesc Fàbregas","Chelsea",0,NA,0,0,NA,NA,NA,0,NA,NA,NA,0,NA,NA,0,NA,0,NA,NA,NA,0,NA,NA,0,0,NA,NA,NA,0,NA,NA,NA,NA,2,55,0,NA,NA,55
"56",480897,"Jeff Hendrick (Burnley) wins a free kick in the attacking half.","55'","Chelsea","Burnley","0","3",0,0,0,0,0,NA,NA,NA,NA,NA,NA,NA,0,NA,NA,0,NA,0,0,NA,NA,NA,0,NA,NA,NA,0,NA,NA,0,NA,1,"Jeff Hendrick","Burnley","attacking half",0,NA,NA,0,0,NA,NA,NA,0,NA,NA,NA,NA,2,56,0,NA,NA,55
"57",480897,"Corner,  Burnley. Conceded by Marcos Alonso.","56'","Chelsea","Burnley","0","3",0,0,0,0,0,NA,NA,NA,NA,NA,NA,NA,0,NA,NA,0,NA,0,0,NA,NA,NA,0,NA,NA,NA,0,NA,NA,0,NA,0,NA,NA,NA,1,"Burnley","Marcos Alonso",0,0,NA,NA,NA,0,NA,NA,NA,NA,2,57,0,NA,NA,56
"58",480897,"Attempt missed. Sam Vokes (Burnley) header from the centre of the box misses to the left. Assisted by Robbie Brady with a cross following a corner.","57'","Chelsea","Burnley","0","3",0,0,0,1,0,"missed","Sam Vokes","Burnley","header","the centre of the box","left","Robbie Brady",0,NA,NA,0,"cross",1,0,NA,NA,NA,0,NA,NA,NA,0,NA,NA,0,NA,0,NA,NA,NA,0,NA,NA,0,0,NA,NA,NA,0,NA,NA,NA,NA,2,58,0,NA,NA,57
"59",480897,"Substitution, Chelsea. Álvaro Morata replaces Michy Batshuayi.","59'","Chelsea","Burnley","0","3",0,0,0,0,0,NA,NA,NA,NA,NA,NA,NA,0,NA,NA,0,NA,0,0,NA,NA,NA,0,NA,NA,NA,0,NA,NA,0,NA,0,NA,NA,NA,0,NA,NA,1,0,"Chelsea","Álvaro Morata","Michy Batshuayi",0,NA,NA,NA,NA,2,59,0,NA,NA,59
"60",480897,"Attempt missed. Álvaro Morata (Chelsea) right footed shot from outside the box is high and wide to the right. Assisted by Marcos Alonso.","59'","Chelsea","Burnley","0","3",0,0,0,1,0,"missed","Álvaro Morata","Chelsea","right","outside the box","high and wide to the right","Marcos Alonso",0,NA,NA,0,NA,0,0,NA,NA,NA,0,NA,NA,NA,0,NA,NA,0,NA,0,NA,NA,NA,0,NA,NA,0,0,NA,NA,NA,0,NA,NA,NA,NA,2,60,0,NA,NA,59
"61",480897,"Foul by Robbie Brady (Burnley).","60'","Chelsea","Burnley","0","3",0,0,0,0,0,NA,NA,NA,NA,NA,NA,NA,1,"Robbie Brady","Burnley",0,NA,0,0,NA,NA,NA,0,NA,NA,NA,0,NA,NA,0,NA,0,NA,NA,NA,0,NA,NA,0,0,NA,NA,NA,0,NA,NA,NA,NA,2,61,0,NA,NA,60
"62",480897,"Willian (Chelsea) wins a free kick in the attacking half.","60'","Chelsea","Burnley","0","3",0,0,0,0,0,NA,NA,NA,NA,NA,NA,NA,0,NA,NA,0,NA,0,0,NA,NA,NA,0,NA,NA,NA,0,NA,NA,0,NA,1,"Willian","Chelsea","attacking half",0,NA,NA,0,0,NA,NA,NA,0,NA,NA,NA,NA,2,62,0,NA,NA,60
"63",480897,"Robbie Brady (Burnley) is shown the yellow card for a bad foul.","60'","Chelsea","Burnley","0","3",0,0,0,0,0,NA,NA,NA,NA,NA,NA,NA,0,NA,NA,0,NA,0,0,NA,NA,NA,1,"yellow","Robbie Brady","Burnley",0,NA,NA,0,NA,0,NA,NA,NA,0,NA,NA,0,0,NA,NA,NA,0,NA,NA,NA,NA,2,63,0,NA,NA,60
"64",480897,"Attempt saved. Marcos Alonso (Chelsea) left footed shot from outside the box is saved in the top right corner.","61'","Chelsea","Burnley","0","3",0,0,0,1,0,"saved","Marcos Alonso","Chelsea","left","outside the box","the top right corner",NA,0,NA,NA,0,NA,0,0,NA,NA,NA,0,NA,NA,NA,0,NA,NA,0,NA,0,NA,NA,NA,0,NA,NA,0,0,NA,NA,NA,0,NA,NA,NA,NA,2,64,0,NA,NA,61
"65",480897,"Corner,  Chelsea. Conceded by Tom Heaton.","61'","Chelsea","Burnley","0","3",0,0,0,0,0,NA,NA,NA,NA,NA,NA,NA,0,NA,NA,0,NA,0,0,NA,NA,NA,0,NA,NA,NA,0,NA,NA,0,NA,0,NA,NA,NA,1,"Chelsea","Tom Heaton",0,0,NA,NA,NA,0,NA,NA,NA,NA,2,65,0,NA,NA,61
"66",480897,"Attempt blocked. Marcos Alonso (Chelsea) left footed shot from the centre of the box is blocked.","62'","Chelsea","Burnley","0","3",0,0,0,1,0,"blocked","Marcos Alonso","Chelsea","left","the centre of the box",NA,NA,0,NA,NA,0,NA,0,0,NA,NA,NA,0,NA,NA,NA,0,NA,NA,0,NA,0,NA,NA,NA,0,NA,NA,0,0,NA,NA,NA,0,NA,NA,NA,NA,2,66,0,NA,NA,62
"67",480897,"Foul by Ben Mee (Burnley).","63'","Chelsea","Burnley","0","3",0,0,0,0,0,NA,NA,NA,NA,NA,NA,NA,1,"Ben Mee","Burnley",0,NA,0,0,NA,NA,NA,0,NA,NA,NA,0,NA,NA,0,NA,0,NA,NA,NA,0,NA,NA,0,0,NA,NA,NA,0,NA,NA,NA,NA,2,67,0,NA,NA,63
"68",480897,"Álvaro Morata (Chelsea) wins a free kick on the right wing.","63'","Chelsea","Burnley","0","3",0,0,0,0,0,NA,NA,NA,NA,NA,NA,NA,0,NA,NA,0,NA,0,0,NA,NA,NA,0,NA,NA,NA,0,NA,NA,0,NA,1,"Álvaro Morata","Chelsea",NA,0,NA,NA,0,0,NA,NA,NA,0,NA,NA,NA,NA,2,68,0,NA,NA,63
"69",480897,"Ben Mee (Burnley) is shown the yellow card for a bad foul.","63'","Chelsea","Burnley","0","3",0,0,0,0,0,NA,NA,NA,NA,NA,NA,NA,0,NA,NA,0,NA,0,0,NA,NA,NA,1,"yellow","Ben Mee","Burnley",0,NA,NA,0,NA,0,NA,NA,NA,0,NA,NA,0,0,NA,NA,NA,0,NA,NA,NA,NA,2,69,0,NA,NA,63
"70",480897,"Attempt missed. David Luiz (Chelsea) right footed shot from the centre of the box is high and wide to the right. Assisted by Cesc Fàbregas with a cross following a set piece situation.","64'","Chelsea","Burnley","0","3",0,0,0,1,0,"missed","David Luiz","Chelsea","right","the centre of the box","high and wide to the right","Cesc Fàbregas",0,NA,NA,1,"cross",0,0,NA,NA,NA,0,NA,NA,NA,0,NA,NA,0,NA,0,NA,NA,NA,0,NA,NA,0,0,NA,NA,NA,0,NA,NA,NA,NA,2,70,0,NA,NA,64
"71",480897,"Foul by David Luiz (Chelsea).","65'","Chelsea","Burnley","0","3",0,0,0,0,0,NA,NA,NA,NA,NA,NA,NA,1,"David Luiz","Chelsea",0,NA,0,0,NA,NA,NA,0,NA,NA,NA,0,NA,NA,0,NA,0,NA,NA,NA,0,NA,NA,0,0,NA,NA,NA,0,NA,NA,NA,NA,2,71,0,NA,NA,65
"72",480897,"Sam Vokes (Burnley) wins a free kick in the attacking half.","65'","Chelsea","Burnley","0","3",0,0,0,0,0,NA,NA,NA,NA,NA,NA,NA,0,NA,NA,0,NA,0,0,NA,NA,NA,0,NA,NA,NA,0,NA,NA,0,NA,1,"Sam Vokes","Burnley","attacking half",0,NA,NA,0,0,NA,NA,NA,0,NA,NA,NA,NA,2,72,0,NA,NA,65
"73",480897,"Corner,  Burnley. Conceded by Andreas Christensen.","66'","Chelsea","Burnley","0","3",0,0,0,0,0,NA,NA,NA,NA,NA,NA,NA,0,NA,NA,0,NA,0,0,NA,NA,NA,0,NA,NA,NA,0,NA,NA,0,NA,0,NA,NA,NA,1,"Burnley","Andreas Christensen",0,0,NA,NA,NA,0,NA,NA,NA,NA,2,73,0,NA,NA,66
"74",480897,"Attempt missed. Robbie Brady (Burnley) header from a difficult angle on the left is close, but misses to the left. Assisted by Johann Berg Gudmundsson with a cross following a corner.","66'","Chelsea","Burnley","0","3",0,0,0,1,0,"missed","Robbie Brady","Burnley","header",NA,NA,"Johann Berg Gudmundsson",0,NA,NA,0,"cross",1,0,NA,NA,NA,0,NA,NA,NA,0,NA,NA,0,NA,0,NA,NA,NA,0,NA,NA,0,0,NA,NA,NA,0,NA,NA,NA,NA,2,74,0,NA,NA,66
"75",480897,"Cesc Fàbregas (Chelsea) wins a free kick on the right wing.","67'","Chelsea","Burnley","0","3",0,0,0,0,0,NA,NA,NA,NA,NA,NA,NA,0,NA,NA,0,NA,0,0,NA,NA,NA,0,NA,NA,NA,0,NA,NA,0,NA,1,"Cesc Fàbregas","Chelsea",NA,0,NA,NA,0,0,NA,NA,NA,0,NA,NA,NA,NA,2,75,0,NA,NA,67
"76",480897,"Foul by Jack Cork (Burnley).","67'","Chelsea","Burnley","0","3",0,0,0,0,0,NA,NA,NA,NA,NA,NA,NA,1,"Jack Cork","Burnley",0,NA,0,0,NA,NA,NA,0,NA,NA,NA,0,NA,NA,0,NA,0,NA,NA,NA,0,NA,NA,0,0,NA,NA,NA,0,NA,NA,NA,NA,2,76,0,NA,NA,67
"77",480897,"Corner,  Chelsea. Conceded by Steven Defour.","68'","Chelsea","Burnley","0","3",0,0,0,0,0,NA,NA,NA,NA,NA,NA,NA,0,NA,NA,0,NA,0,0,NA,NA,NA,0,NA,NA,NA,0,NA,NA,0,NA,0,NA,NA,NA,1,"Chelsea","Steven Defour",0,0,NA,NA,NA,0,NA,NA,NA,NA,2,77,0,NA,NA,68
"78",480897,"Attempt blocked. N'Golo Kanté (Chelsea) right footed shot from the right side of the box is blocked. Assisted by Cesc Fàbregas.","68'","Chelsea","Burnley","0","3",0,0,0,1,0,"blocked","N'Golo Kanté","Chelsea","right","the right side of the box",NA,"Cesc Fàbregas",0,NA,NA,0,NA,0,0,NA,NA,NA,0,NA,NA,NA,0,NA,NA,0,NA,0,NA,NA,NA,0,NA,NA,0,0,NA,NA,NA,0,NA,NA,NA,NA,2,78,0,NA,NA,68
"79",480897,"Goal!  Chelsea 1, Burnley 3. Álvaro Morata (Chelsea) header from very close range to the bottom left corner. Assisted by Willian with a cross.","69'","Chelsea","Burnley","1","3",0,0,0,1,0,"goal","Álvaro Morata","Chelsea","header","very close range","bottom left corner","Willian a",0,NA,NA,0,"cross",0,0,NA,NA,NA,0,NA,NA,NA,0,NA,NA,0,NA,0,NA,NA,NA,0,NA,NA,0,0,NA,NA,NA,0,NA,NA,NA,NA,2,79,0,NA,NA,69
"80",480897,"Hand ball by Willian (Chelsea).","69'","Chelsea","Burnley","1","3",0,0,0,0,0,NA,NA,NA,NA,NA,NA,NA,0,NA,NA,0,NA,0,0,NA,NA,NA,0,NA,NA,NA,0,NA,NA,0,NA,0,NA,NA,NA,0,NA,NA,0,0,NA,NA,NA,0,NA,NA,NA,NA,2,80,0,NA,NA,69
"81",480897,"Foul by Marcos Alonso (Chelsea).","70'","Chelsea","Burnley","1","3",0,0,0,0,0,NA,NA,NA,NA,NA,NA,NA,1,"Marcos Alonso","Chelsea",0,NA,0,0,NA,NA,NA,0,NA,NA,NA,0,NA,NA,0,NA,0,NA,NA,NA,0,NA,NA,0,0,NA,NA,NA,0,NA,NA,NA,NA,2,81,0,NA,NA,70
"82",480897,"Johann Berg Gudmundsson (Burnley) wins a free kick in the defensive half.","70'","Chelsea","Burnley","1","3",0,0,0,0,0,NA,NA,NA,NA,NA,NA,NA,0,NA,NA,0,NA,0,0,NA,NA,NA,0,NA,NA,NA,0,NA,NA,0,NA,1,"Johann Berg Gudmundsson","Burnley","defensive half",0,NA,NA,0,0,NA,NA,NA,0,NA,NA,NA,NA,2,82,0,NA,NA,70
"83",480897,"Antonio Rüdiger (Chelsea) wins a free kick in the defensive half.","71'","Chelsea","Burnley","1","3",0,0,0,0,0,NA,NA,NA,NA,NA,NA,NA,0,NA,NA,0,NA,0,0,NA,NA,NA,0,NA,NA,NA,0,NA,NA,0,NA,1,"Antonio Rüdiger","Chelsea","defensive half",0,NA,NA,0,0,NA,NA,NA,0,NA,NA,NA,NA,2,83,0,NA,NA,71
"84",480897,"Foul by Sam Vokes (Burnley).","71'","Chelsea","Burnley","1","3",0,0,0,0,0,NA,NA,NA,NA,NA,NA,NA,1,"Sam Vokes","Burnley",0,NA,0,0,NA,NA,NA,0,NA,NA,NA,0,NA,NA,0,NA,0,NA,NA,NA,0,NA,NA,0,0,NA,NA,NA,0,NA,NA,NA,NA,2,84,0,NA,NA,71
