"","game_id","commentary","match_time","team_one","team_two","team_one_score","team_two_score","half_end","match_end","half_begins","shot_attempt","penalty_shot","shot_result","shot_by_player","shot_by_team","shot_with","shot_where","net_location","assist_by_player","foul","foul_by_player","foul_by_team","follow_set_piece","assist_type","follow_corner","offside","offside_team","offside_player","offside_pass_from","shown_card","card_type","card_player","card_team","video_review","video_review_event","video_review_result","delay_in_match","delay_team","free_kick_won","free_kick_player","free_kick_team","free_kick_where","corner","corner_team","corner_conceded_by","substitution","sub_injury","sub_team","sub_player","replaced_player","penalty","team_drew_penalty","player_drew_penalty","player_conceded_penalty","team_conceded_penalty","half","comment_id","stoppage_time","team_one_penalty_score","team_two_penalty_score","match_time_numeric"
"82",480867,"Foul by Wilfred Ndidi (Leicester City).","84'","Leicester City","Chelsea","1","2",0,0,0,0,0,NA,NA,NA,NA,NA,NA,NA,1,"Wilfred Ndidi","Leicester City",0,NA,0,0,NA,NA,NA,0,NA,NA,NA,0,NA,NA,0,NA,0,NA,NA,NA,0,NA,NA,0,0,NA,NA,NA,0,NA,NA,NA,NA,2,82,0,NA,NA,84
"83",480867,"Willian (Chelsea) wins a free kick in the attacking half.","84'","Leicester City","Chelsea","1","2",0,0,0,0,0,NA,NA,NA,NA,NA,NA,NA,0,NA,NA,0,NA,0,0,NA,NA,NA,0,NA,NA,NA,0,NA,NA,0,NA,1,"Willian","Chelsea","attacking half",0,NA,NA,0,0,NA,NA,NA,0,NA,NA,NA,NA,2,83,0,NA,NA,84
"84",480867,"Wilfred Ndidi (Leicester City) is shown the yellow card for a bad foul.","84'","Leicester City","Chelsea","1","2",0,0,0,0,0,NA,NA,NA,NA,NA,NA,NA,0,NA,NA,0,NA,0,0,NA,NA,NA,1,"yellow","Wilfred Ndidi","Leicester City",0,NA,NA,0,NA,0,NA,NA,NA,0,NA,NA,0,0,NA,NA,NA,0,NA,NA,NA,NA,2,84,0,NA,NA,84
"85",480867,"Corner,  Chelsea. Conceded by Wilfred Ndidi.","86'","Leicester City","Chelsea","1","2",0,0,0,0,0,NA,NA,NA,NA,NA,NA,NA,0,NA,NA,0,NA,0,0,NA,NA,NA,0,NA,NA,NA,0,NA,NA,0,NA,0,NA,NA,NA,1,"Chelsea","Wilfred Ndidi",0,0,NA,NA,NA,0,NA,NA,NA,NA,2,85,0,NA,NA,86
"86",480867,"Attempt missed. Willian (Chelsea) right footed shot from the left side of the box is close, but misses to the right. Assisted by Álvaro Morata.","87'","Leicester City","Chelsea","1","2",0,0,0,1,0,"missed","Willian","Chelsea","right","the left side of the box","close, but right","Álvaro Morata",0,NA,NA,0,NA,0,0,NA,NA,NA,0,NA,NA,NA,0,NA,NA,0,NA,0,NA,NA,NA,0,NA,NA,0,0,NA,NA,NA,0,NA,NA,NA,NA,2,86,0,NA,NA,87
"87",480867,"Hand ball by Riyad Mahrez (Leicester City).","89'","Leicester City","Chelsea","1","2",0,0,0,0,0,NA,NA,NA,NA,NA,NA,NA,0,NA,NA,0,NA,0,0,NA,NA,NA,0,NA,NA,NA,0,NA,NA,0,NA,0,NA,NA,NA,0,NA,NA,0,0,NA,NA,NA,0,NA,NA,NA,NA,2,87,0,NA,NA,89
"88",480867,"Eden Hazard (Chelsea) wins a free kick in the attacking half.","90'","Leicester City","Chelsea","1","2",0,0,0,0,0,NA,NA,NA,NA,NA,NA,NA,0,NA,NA,0,NA,0,0,NA,NA,NA,0,NA,NA,NA,0,NA,NA,0,NA,1,"Eden Hazard","Chelsea","attacking half",0,NA,NA,0,0,NA,NA,NA,0,NA,NA,NA,NA,2,88,0,NA,NA,90
"89",480867,"Foul by Andy King (Leicester City).","90'","Leicester City","Chelsea","1","2",0,0,0,0,0,NA,NA,NA,NA,NA,NA,NA,1,"Andy King","Leicester City",0,NA,0,0,NA,NA,NA,0,NA,NA,NA,0,NA,NA,0,NA,0,NA,NA,NA,0,NA,NA,0,0,NA,NA,NA,0,NA,NA,NA,NA,2,89,0,NA,NA,90
"90",480867,"Offside, Chelsea. Tiemoué Bakayoko tries a through ball, but Marcos Alonso is caught offside.","90'+1'","Leicester City","Chelsea","1","2",0,0,0,0,0,NA,NA,NA,NA,NA,NA,NA,0,NA,NA,0,NA,0,1,"Chelsea","Marcos Alonso","Tiemoué Bakayoko",0,NA,NA,NA,0,NA,NA,0,NA,0,NA,NA,NA,0,NA,NA,0,0,NA,NA,NA,0,NA,NA,NA,NA,2,90,1,NA,NA,91
"91",480867,"Attempt saved. Willian (Chelsea) right footed shot from the centre of the box is saved in the centre of the goal. Assisted by Eden Hazard.","90'+2'","Leicester City","Chelsea","1","2",0,0,0,1,0,"saved","Willian","Chelsea","right","the centre of the box","the centre of the goal","Eden Hazard",0,NA,NA,0,NA,0,0,NA,NA,NA,0,NA,NA,NA,0,NA,NA,0,NA,0,NA,NA,NA,0,NA,NA,0,0,NA,NA,NA,0,NA,NA,NA,NA,2,91,1,NA,NA,92
"92",480867,"Offside, Leicester City. Christian Fuchs tries a through ball, but Andy King is caught offside.","90'+3'","Leicester City","Chelsea","1","2",0,0,0,0,0,NA,NA,NA,NA,NA,NA,NA,0,NA,NA,0,NA,0,1,"Leicester City","Andy King","Christian Fuchs",0,NA,NA,NA,0,NA,NA,0,NA,0,NA,NA,NA,0,NA,NA,0,0,NA,NA,NA,0,NA,NA,NA,NA,2,92,1,NA,NA,93
"93",480867,"Second Half ends, Leicester City 1, Chelsea 2.","90'+5'","Leicester City","Chelsea","1","2",1,0,0,0,0,NA,NA,NA,NA,NA,NA,NA,0,NA,NA,0,NA,0,0,NA,NA,NA,0,NA,NA,NA,0,NA,NA,0,NA,0,NA,NA,NA,0,NA,NA,0,0,NA,NA,NA,0,NA,NA,NA,NA,2,93,1,NA,NA,95
"94",480867,"Match ends, Leicester City 1, Chelsea 2.","90'+5'","Leicester City","Chelsea","1","2",0,1,0,0,0,NA,NA,NA,NA,NA,NA,NA,0,NA,NA,0,NA,0,0,NA,NA,NA,0,NA,NA,NA,0,NA,NA,0,NA,0,NA,NA,NA,0,NA,NA,0,0,NA,NA,NA,0,NA,NA,NA,NA,2,94,1,NA,NA,95
