"","game_id","commentary","match_time","team_one","team_two","team_one_score","team_two_score","half_end","match_end","half_begins","shot_attempt","penalty_shot","shot_result","shot_by_player","shot_by_team","shot_with","shot_where","net_location","assist_by_player","foul","foul_by_player","foul_by_team","follow_set_piece","assist_type","follow_corner","offside","offside_team","offside_player","offside_pass_from","shown_card","card_type","card_player","card_team","video_review","video_review_event","video_review_result","delay_in_match","delay_team","free_kick_won","free_kick_player","free_kick_team","free_kick_where","corner","corner_team","corner_conceded_by","substitution","sub_injury","sub_team","sub_player","replaced_player","penalty","team_drew_penalty","player_drew_penalty","player_conceded_penalty","team_conceded_penalty","half","comment_id","stoppage_time","team_one_penalty_score","team_two_penalty_score","match_time_numeric"
"1",480645,"First Half begins.","-","Chelsea","West Bromwich Albion","0","0",0,0,1,0,0,NA,NA,NA,NA,NA,NA,NA,0,NA,NA,0,NA,0,0,NA,NA,NA,0,NA,NA,NA,0,NA,NA,0,NA,0,NA,NA,NA,0,NA,NA,0,0,NA,NA,NA,0,NA,NA,NA,NA,1,1,0,NA,NA,NA
"2",480645,"Lineups are announced and players are warming up.","-","Chelsea","West Bromwich Albion","0","0",0,0,0,0,0,NA,NA,NA,NA,NA,NA,NA,0,NA,NA,0,NA,0,0,NA,NA,NA,0,NA,NA,NA,0,NA,NA,0,NA,0,NA,NA,NA,0,NA,NA,0,0,NA,NA,NA,0,NA,NA,NA,NA,1,2,0,NA,NA,NA
"3",480645,"Corner,  West Bromwich Albion. Conceded by Victor Moses.","2'","Chelsea","West Bromwich Albion","0","0",0,0,0,0,0,NA,NA,NA,NA,NA,NA,NA,0,NA,NA,0,NA,0,0,NA,NA,NA,0,NA,NA,NA,0,NA,NA,0,NA,0,NA,NA,NA,1,"West Bromwich Albion","Victor Moses",0,0,NA,NA,NA,0,NA,NA,NA,NA,1,3,0,NA,NA,2
"4",480645,"Foul by Davide Zappacosta (Chelsea).","3'","Chelsea","West Bromwich Albion","0","0",0,0,0,0,0,NA,NA,NA,NA,NA,NA,NA,1,"Davide Zappacosta","Chelsea",0,NA,0,0,NA,NA,NA,0,NA,NA,NA,0,NA,NA,0,NA,0,NA,NA,NA,0,NA,NA,0,0,NA,NA,NA,0,NA,NA,NA,NA,1,4,0,NA,NA,3
"5",480645,"Jonny Evans (West Bromwich Albion) wins a free kick on the right wing.","3'","Chelsea","West Bromwich Albion","0","0",0,0,0,0,0,NA,NA,NA,NA,NA,NA,NA,0,NA,NA,0,NA,0,0,NA,NA,NA,0,NA,NA,NA,0,NA,NA,0,NA,1,"Jonny Evans","West Bromwich Albion",NA,0,NA,NA,0,0,NA,NA,NA,0,NA,NA,NA,NA,1,5,0,NA,NA,3
"6",480645,"Delay in match Daniel Sturridge (West Bromwich Albion) because of an injury.","3'","Chelsea","West Bromwich Albion","0","0",0,0,0,0,0,NA,NA,NA,NA,NA,NA,NA,0,NA,NA,0,NA,0,0,NA,NA,NA,0,NA,NA,NA,0,NA,NA,1,"West Bromwich Albion",0,NA,NA,NA,0,NA,NA,0,0,NA,NA,NA,0,NA,NA,NA,NA,1,6,0,NA,NA,3
"7",480645,"Delay over. They are ready to continue.","4'","Chelsea","West Bromwich Albion","0","0",0,0,0,0,0,NA,NA,NA,NA,NA,NA,NA,0,NA,NA,0,NA,0,0,NA,NA,NA,0,NA,NA,NA,0,NA,NA,0,NA,0,NA,NA,NA,0,NA,NA,0,0,NA,NA,NA,0,NA,NA,NA,NA,1,7,0,NA,NA,4
"8",480645,"Substitution, West Bromwich Albion. Jay Rodriguez replaces Daniel Sturridge because of an injury.","4'","Chelsea","West Bromwich Albion","0","0",0,0,0,0,0,NA,NA,NA,NA,NA,NA,NA,0,NA,NA,0,NA,0,0,NA,NA,NA,0,NA,NA,NA,0,NA,NA,0,NA,0,NA,NA,NA,0,NA,NA,1,1,"West Bromwich Albion","Jay Rodriguez","Daniel Sturridge",0,NA,NA,NA,NA,1,8,0,NA,NA,4
"9",480645,"Attempt missed. Jay Rodriguez (West Bromwich Albion) right footed shot from the centre of the box misses to the left. Assisted by Salomón Rondón.","4'","Chelsea","West Bromwich Albion","0","0",0,0,0,1,0,"missed","Jay Rodriguez","West Bromwich Albion","right","the centre of the box","left","Salomón Rondón",0,NA,NA,0,NA,0,0,NA,NA,NA,0,NA,NA,NA,0,NA,NA,0,NA,0,NA,NA,NA,0,NA,NA,0,0,NA,NA,NA,0,NA,NA,NA,NA,1,9,0,NA,NA,4
"10",480645,"Foul by Cesc Fàbregas (Chelsea).","6'","Chelsea","West Bromwich Albion","0","0",0,0,0,0,0,NA,NA,NA,NA,NA,NA,NA,1,"Cesc Fàbregas","Chelsea",0,NA,0,0,NA,NA,NA,0,NA,NA,NA,0,NA,NA,0,NA,0,NA,NA,NA,0,NA,NA,0,0,NA,NA,NA,0,NA,NA,NA,NA,1,10,0,NA,NA,6
"11",480645,"Jay Rodriguez (West Bromwich Albion) wins a free kick in the attacking half.","6'","Chelsea","West Bromwich Albion","0","0",0,0,0,0,0,NA,NA,NA,NA,NA,NA,NA,0,NA,NA,0,NA,0,0,NA,NA,NA,0,NA,NA,NA,0,NA,NA,0,NA,1,"Jay Rodriguez","West Bromwich Albion","attacking half",0,NA,NA,0,0,NA,NA,NA,0,NA,NA,NA,NA,1,11,0,NA,NA,6
"12",480645,"Attempt missed. Salomón Rondón (West Bromwich Albion) header from the centre of the box misses to the right. Assisted by Matt Phillips with a cross following a set piece situation.","6'","Chelsea","West Bromwich Albion","0","0",0,0,0,1,0,"missed","Salomón Rondón","West Bromwich Albion","header","the centre of the box","right","Matt Phillips",0,NA,NA,1,"cross",0,0,NA,NA,NA,0,NA,NA,NA,0,NA,NA,0,NA,0,NA,NA,NA,0,NA,NA,0,0,NA,NA,NA,0,NA,NA,NA,NA,1,12,0,NA,NA,6
"13",480645,"Corner,  West Bromwich Albion. Conceded by Antonio Rüdiger.","7'","Chelsea","West Bromwich Albion","0","0",0,0,0,0,0,NA,NA,NA,NA,NA,NA,NA,0,NA,NA,0,NA,0,0,NA,NA,NA,0,NA,NA,NA,0,NA,NA,0,NA,0,NA,NA,NA,1,"West Bromwich Albion","Antonio Rüdiger",0,0,NA,NA,NA,0,NA,NA,NA,NA,1,13,0,NA,NA,7
"14",480645,"Attempt blocked. Olivier Giroud (Chelsea) left footed shot from the left side of the box is blocked. Assisted by Pedro.","8'","Chelsea","West Bromwich Albion","0","0",0,0,0,1,0,"blocked","Olivier Giroud","Chelsea","left","the left side of the box",NA,"Pedro",0,NA,NA,0,NA,0,0,NA,NA,NA,0,NA,NA,NA,0,NA,NA,0,NA,0,NA,NA,NA,0,NA,NA,0,0,NA,NA,NA,0,NA,NA,NA,NA,1,14,0,NA,NA,8
"15",480645,"Foul by Jay Rodriguez (West Bromwich Albion).","10'","Chelsea","West Bromwich Albion","0","0",0,0,0,0,0,NA,NA,NA,NA,NA,NA,NA,1,"Jay Rodriguez","West Bromwich Albion",0,NA,0,0,NA,NA,NA,0,NA,NA,NA,0,NA,NA,0,NA,0,NA,NA,NA,0,NA,NA,0,0,NA,NA,NA,0,NA,NA,NA,NA,1,15,0,NA,NA,10
"16",480645,"Pedro (Chelsea) wins a free kick in the defensive half.","10'","Chelsea","West Bromwich Albion","0","0",0,0,0,0,0,NA,NA,NA,NA,NA,NA,NA,0,NA,NA,0,NA,0,0,NA,NA,NA,0,NA,NA,NA,0,NA,NA,0,NA,1,"Pedro","Chelsea","defensive half",0,NA,NA,0,0,NA,NA,NA,0,NA,NA,NA,NA,1,16,0,NA,NA,10
"17",480645,"Attempt blocked. Olivier Giroud (Chelsea) header from the centre of the box is blocked. Assisted by César Azpilicueta with a cross.","11'","Chelsea","West Bromwich Albion","0","0",0,0,0,1,0,"blocked","Olivier Giroud","Chelsea","header","the centre of the box",NA,"César Azpilicueta",0,NA,NA,0,"cross",0,0,NA,NA,NA,0,NA,NA,NA,0,NA,NA,0,NA,0,NA,NA,NA,0,NA,NA,0,0,NA,NA,NA,0,NA,NA,NA,NA,1,17,0,NA,NA,11
"18",480645,"Corner,  Chelsea. Conceded by Ahmed Hegazi.","11'","Chelsea","West Bromwich Albion","0","0",0,0,0,0,0,NA,NA,NA,NA,NA,NA,NA,0,NA,NA,0,NA,0,0,NA,NA,NA,0,NA,NA,NA,0,NA,NA,0,NA,0,NA,NA,NA,1,"Chelsea","Ahmed Hegazi",0,0,NA,NA,NA,0,NA,NA,NA,NA,1,18,0,NA,NA,11
"19",480645,"Attempt missed. Jay Rodriguez (West Bromwich Albion) right footed shot from outside the box misses to the left.","11'","Chelsea","West Bromwich Albion","0","0",0,0,0,1,0,"missed","Jay Rodriguez","West Bromwich Albion","right","outside the box","left",NA,0,NA,NA,0,NA,0,0,NA,NA,NA,0,NA,NA,NA,0,NA,NA,0,NA,0,NA,NA,NA,0,NA,NA,0,0,NA,NA,NA,0,NA,NA,NA,NA,1,19,0,NA,NA,11
"20",480645,"Foul by Ahmed Hegazi (West Bromwich Albion).","14'","Chelsea","West Bromwich Albion","0","0",0,0,0,0,0,NA,NA,NA,NA,NA,NA,NA,1,"Ahmed Hegazi","West Bromwich Albion",0,NA,0,0,NA,NA,NA,0,NA,NA,NA,0,NA,NA,0,NA,0,NA,NA,NA,0,NA,NA,0,0,NA,NA,NA,0,NA,NA,NA,NA,1,20,0,NA,NA,14
"21",480645,"Olivier Giroud (Chelsea) wins a free kick in the defensive half.","14'","Chelsea","West Bromwich Albion","0","0",0,0,0,0,0,NA,NA,NA,NA,NA,NA,NA,0,NA,NA,0,NA,0,0,NA,NA,NA,0,NA,NA,NA,0,NA,NA,0,NA,1,"Olivier Giroud","Chelsea","defensive half",0,NA,NA,0,0,NA,NA,NA,0,NA,NA,NA,NA,1,21,0,NA,NA,14
"22",480645,"Cesc Fàbregas (Chelsea) wins a free kick in the defensive half.","16'","Chelsea","West Bromwich Albion","0","0",0,0,0,0,0,NA,NA,NA,NA,NA,NA,NA,0,NA,NA,0,NA,0,0,NA,NA,NA,0,NA,NA,NA,0,NA,NA,0,NA,1,"Cesc Fàbregas","Chelsea","defensive half",0,NA,NA,0,0,NA,NA,NA,0,NA,NA,NA,NA,1,22,0,NA,NA,16
"23",480645,"Foul by Chris Brunt (West Bromwich Albion).","16'","Chelsea","West Bromwich Albion","0","0",0,0,0,0,0,NA,NA,NA,NA,NA,NA,NA,1,"Chris Brunt","West Bromwich Albion",0,NA,0,0,NA,NA,NA,0,NA,NA,NA,0,NA,NA,0,NA,0,NA,NA,NA,0,NA,NA,0,0,NA,NA,NA,0,NA,NA,NA,NA,1,23,0,NA,NA,16
"24",480645,"Attempt saved. Davide Zappacosta (Chelsea) right footed shot from the left side of the six yard box is saved in the centre of the goal. Assisted by César Azpilicueta with a cross.","17'","Chelsea","West Bromwich Albion","0","0",0,0,0,1,0,"saved","Davide Zappacosta","Chelsea","right","the left side of the six yard box","the centre of the goal","César Azpilicueta",0,NA,NA,0,"cross",0,0,NA,NA,NA,0,NA,NA,NA,0,NA,NA,0,NA,0,NA,NA,NA,0,NA,NA,0,0,NA,NA,NA,0,NA,NA,NA,NA,1,24,0,NA,NA,17
"25",480645,"Corner,  West Bromwich Albion. Conceded by Antonio Rüdiger.","18'","Chelsea","West Bromwich Albion","0","0",0,0,0,0,0,NA,NA,NA,NA,NA,NA,NA,0,NA,NA,0,NA,0,0,NA,NA,NA,0,NA,NA,NA,0,NA,NA,0,NA,0,NA,NA,NA,1,"West Bromwich Albion","Antonio Rüdiger",0,0,NA,NA,NA,0,NA,NA,NA,NA,1,25,0,NA,NA,18
"26",480645,"Foul by Salomón Rondón (West Bromwich Albion).","19'","Chelsea","West Bromwich Albion","0","0",0,0,0,0,0,NA,NA,NA,NA,NA,NA,NA,1,"Salomón Rondón","West Bromwich Albion",0,NA,0,0,NA,NA,NA,0,NA,NA,NA,0,NA,NA,0,NA,0,NA,NA,NA,0,NA,NA,0,0,NA,NA,NA,0,NA,NA,NA,NA,1,26,0,NA,NA,19
"27",480645,"Victor Moses (Chelsea) wins a free kick in the defensive half.","19'","Chelsea","West Bromwich Albion","0","0",0,0,0,0,0,NA,NA,NA,NA,NA,NA,NA,0,NA,NA,0,NA,0,0,NA,NA,NA,0,NA,NA,NA,0,NA,NA,0,NA,1,"Victor Moses","Chelsea","defensive half",0,NA,NA,0,0,NA,NA,NA,0,NA,NA,NA,NA,1,27,0,NA,NA,19
"28",480645,"Corner,  Chelsea. Conceded by Kieran Gibbs.","20'","Chelsea","West Bromwich Albion","0","0",0,0,0,0,0,NA,NA,NA,NA,NA,NA,NA,0,NA,NA,0,NA,0,0,NA,NA,NA,0,NA,NA,NA,0,NA,NA,0,NA,0,NA,NA,NA,1,"Chelsea","Kieran Gibbs",0,0,NA,NA,NA,0,NA,NA,NA,NA,1,28,0,NA,NA,20
"29",480645,"Attempt saved. Olivier Giroud (Chelsea) right footed shot from the centre of the box is saved in the centre of the goal. Assisted by Eden Hazard.","20'","Chelsea","West Bromwich Albion","0","0",0,0,0,1,0,"saved","Olivier Giroud","Chelsea","right","the centre of the box","the centre of the goal","Eden Hazard",0,NA,NA,0,NA,0,0,NA,NA,NA,0,NA,NA,NA,0,NA,NA,0,NA,0,NA,NA,NA,0,NA,NA,0,0,NA,NA,NA,0,NA,NA,NA,NA,1,29,0,NA,NA,20
"30",480645,"Corner,  Chelsea. Conceded by Jonny Evans.","20'","Chelsea","West Bromwich Albion","0","0",0,0,0,0,0,NA,NA,NA,NA,NA,NA,NA,0,NA,NA,0,NA,0,0,NA,NA,NA,0,NA,NA,NA,0,NA,NA,0,NA,0,NA,NA,NA,1,"Chelsea","Jonny Evans",0,0,NA,NA,NA,0,NA,NA,NA,NA,1,30,0,NA,NA,20
"31",480645,"Attempt missed. Olivier Giroud (Chelsea) header from the centre of the box misses to the right. Assisted by Davide Zappacosta with a cross.","21'","Chelsea","West Bromwich Albion","0","0",0,0,0,1,0,"missed","Olivier Giroud","Chelsea","header","the centre of the box","right","Davide Zappacosta",0,NA,NA,0,"cross",0,0,NA,NA,NA,0,NA,NA,NA,0,NA,NA,0,NA,0,NA,NA,NA,0,NA,NA,0,0,NA,NA,NA,0,NA,NA,NA,NA,1,31,0,NA,NA,21
"32",480645,"Foul by Ahmed Hegazi (West Bromwich Albion).","23'","Chelsea","West Bromwich Albion","0","0",0,0,0,0,0,NA,NA,NA,NA,NA,NA,NA,1,"Ahmed Hegazi","West Bromwich Albion",0,NA,0,0,NA,NA,NA,0,NA,NA,NA,0,NA,NA,0,NA,0,NA,NA,NA,0,NA,NA,0,0,NA,NA,NA,0,NA,NA,NA,NA,1,32,0,NA,NA,23
"33",480645,"Pedro (Chelsea) wins a free kick in the attacking half.","23'","Chelsea","West Bromwich Albion","0","0",0,0,0,0,0,NA,NA,NA,NA,NA,NA,NA,0,NA,NA,0,NA,0,0,NA,NA,NA,0,NA,NA,NA,0,NA,NA,0,NA,1,"Pedro","Chelsea","attacking half",0,NA,NA,0,0,NA,NA,NA,0,NA,NA,NA,NA,1,33,0,NA,NA,23
"34",480645,"Attempt blocked. Eden Hazard (Chelsea) right footed shot from outside the box is blocked.","23'","Chelsea","West Bromwich Albion","0","0",0,0,0,1,0,"blocked","Eden Hazard","Chelsea","right","outside the box",NA,NA,0,NA,NA,0,NA,0,0,NA,NA,NA,0,NA,NA,NA,0,NA,NA,0,NA,0,NA,NA,NA,0,NA,NA,0,0,NA,NA,NA,0,NA,NA,NA,NA,1,34,0,NA,NA,23
"35",480645,"Attempt blocked. Pedro (Chelsea) left footed shot from outside the box is blocked. Assisted by Eden Hazard.","24'","Chelsea","West Bromwich Albion","0","0",0,0,0,1,0,"blocked","Pedro","Chelsea","left","outside the box",NA,"Eden Hazard",0,NA,NA,0,NA,0,0,NA,NA,NA,0,NA,NA,NA,0,NA,NA,0,NA,0,NA,NA,NA,0,NA,NA,0,0,NA,NA,NA,0,NA,NA,NA,NA,1,35,0,NA,NA,24
"36",480645,"Goal!  Chelsea 1, West Bromwich Albion 0. Eden Hazard (Chelsea) right footed shot from the centre of the box to the bottom left corner. Assisted by Olivier Giroud.","25'","Chelsea","West Bromwich Albion","1","0",0,0,0,1,0,"goal","Eden Hazard","Chelsea","right","the centre of the box","bottom left corner","Olivier Giroud",0,NA,NA,0,NA,0,0,NA,NA,NA,0,NA,NA,NA,0,NA,NA,0,NA,0,NA,NA,NA,0,NA,NA,0,0,NA,NA,NA,0,NA,NA,NA,NA,1,36,0,NA,NA,25
"37",480645,"Foul by N'Golo Kanté (Chelsea).","28'","Chelsea","West Bromwich Albion","1","0",0,0,0,0,0,NA,NA,NA,NA,NA,NA,NA,1,"N'Golo Kanté","Chelsea",0,NA,0,0,NA,NA,NA,0,NA,NA,NA,0,NA,NA,0,NA,0,NA,NA,NA,0,NA,NA,0,0,NA,NA,NA,0,NA,NA,NA,NA,1,37,0,NA,NA,28
"38",480645,"Grzegorz Krychowiak (West Bromwich Albion) wins a free kick on the right wing.","28'","Chelsea","West Bromwich Albion","1","0",0,0,0,0,0,NA,NA,NA,NA,NA,NA,NA,0,NA,NA,0,NA,0,0,NA,NA,NA,0,NA,NA,NA,0,NA,NA,0,NA,1,"Grzegorz Krychowiak","West Bromwich Albion",NA,0,NA,NA,0,0,NA,NA,NA,0,NA,NA,NA,NA,1,38,0,NA,NA,28
"39",480645,"Offside, West Bromwich Albion. Chris Brunt tries a through ball, but Craig Dawson is caught offside.","28'","Chelsea","West Bromwich Albion","1","0",0,0,0,0,0,NA,NA,NA,NA,NA,NA,NA,0,NA,NA,0,NA,0,1,"West Bromwich Albion","Craig Dawson","Chris Brunt",0,NA,NA,NA,0,NA,NA,0,NA,0,NA,NA,NA,0,NA,NA,0,0,NA,NA,NA,0,NA,NA,NA,NA,1,39,0,NA,NA,28
"40",480645,"Corner,  West Bromwich Albion. Conceded by Davide Zappacosta.","30'","Chelsea","West Bromwich Albion","1","0",0,0,0,0,0,NA,NA,NA,NA,NA,NA,NA,0,NA,NA,0,NA,0,0,NA,NA,NA,0,NA,NA,NA,0,NA,NA,0,NA,0,NA,NA,NA,1,"West Bromwich Albion","Davide Zappacosta",0,0,NA,NA,NA,0,NA,NA,NA,NA,1,40,0,NA,NA,30
"41",480645,"Attempt missed. Grzegorz Krychowiak (West Bromwich Albion) left footed shot from outside the box misses to the left.","31'","Chelsea","West Bromwich Albion","1","0",0,0,0,1,0,"missed","Grzegorz Krychowiak","West Bromwich Albion","left","outside the box","left",NA,0,NA,NA,0,NA,0,0,NA,NA,NA,0,NA,NA,NA,0,NA,NA,0,NA,0,NA,NA,NA,0,NA,NA,0,0,NA,NA,NA,0,NA,NA,NA,NA,1,41,0,NA,NA,31
"42",480645,"Foul by Cesc Fàbregas (Chelsea).","32'","Chelsea","West Bromwich Albion","1","0",0,0,0,0,0,NA,NA,NA,NA,NA,NA,NA,1,"Cesc Fàbregas","Chelsea",0,NA,0,0,NA,NA,NA,0,NA,NA,NA,0,NA,NA,0,NA,0,NA,NA,NA,0,NA,NA,0,0,NA,NA,NA,0,NA,NA,NA,NA,1,42,0,NA,NA,32
"43",480645,"Gareth Barry (West Bromwich Albion) wins a free kick in the defensive half.","32'","Chelsea","West Bromwich Albion","1","0",0,0,0,0,0,NA,NA,NA,NA,NA,NA,NA,0,NA,NA,0,NA,0,0,NA,NA,NA,0,NA,NA,NA,0,NA,NA,0,NA,1,"Gareth Barry","West Bromwich Albion","defensive half",0,NA,NA,0,0,NA,NA,NA,0,NA,NA,NA,NA,1,43,0,NA,NA,32
"44",480645,"Cesc Fàbregas (Chelsea) wins a free kick in the defensive half.","34'","Chelsea","West Bromwich Albion","1","0",0,0,0,0,0,NA,NA,NA,NA,NA,NA,NA,0,NA,NA,0,NA,0,0,NA,NA,NA,0,NA,NA,NA,0,NA,NA,0,NA,1,"Cesc Fàbregas","Chelsea","defensive half",0,NA,NA,0,0,NA,NA,NA,0,NA,NA,NA,NA,1,44,0,NA,NA,34
"45",480645,"Foul by Salomón Rondón (West Bromwich Albion).","34'","Chelsea","West Bromwich Albion","1","0",0,0,0,0,0,NA,NA,NA,NA,NA,NA,NA,1,"Salomón Rondón","West Bromwich Albion",0,NA,0,0,NA,NA,NA,0,NA,NA,NA,0,NA,NA,0,NA,0,NA,NA,NA,0,NA,NA,0,0,NA,NA,NA,0,NA,NA,NA,NA,1,45,0,NA,NA,34
"46",480645,"Corner,  Chelsea. Conceded by Matt Phillips.","34'","Chelsea","West Bromwich Albion","1","0",0,0,0,0,0,NA,NA,NA,NA,NA,NA,NA,0,NA,NA,0,NA,0,0,NA,NA,NA,0,NA,NA,NA,0,NA,NA,0,NA,0,NA,NA,NA,1,"Chelsea","Matt Phillips",0,0,NA,NA,NA,0,NA,NA,NA,NA,1,46,0,NA,NA,34
"47",480645,"Attempt blocked. Andreas Christensen (Chelsea) header from the centre of the box is blocked. Assisted by Cesc Fàbregas with a cross.","35'","Chelsea","West Bromwich Albion","1","0",0,0,0,1,0,"blocked","Andreas Christensen","Chelsea","header","the centre of the box",NA,"Cesc Fàbregas",0,NA,NA,0,"cross",0,0,NA,NA,NA,0,NA,NA,NA,0,NA,NA,0,NA,0,NA,NA,NA,0,NA,NA,0,0,NA,NA,NA,0,NA,NA,NA,NA,1,47,0,NA,NA,35
"48",480645,"Attempt missed. Olivier Giroud (Chelsea) left footed shot from the left side of the six yard box is close, but misses to the left following a corner.","35'","Chelsea","West Bromwich Albion","1","0",0,0,0,1,0,"missed","Olivier Giroud","Chelsea","left","the left side of the six yard box","close, but left",NA,0,NA,NA,0,NA,1,0,NA,NA,NA,0,NA,NA,NA,0,NA,NA,0,NA,0,NA,NA,NA,0,NA,NA,0,0,NA,NA,NA,0,NA,NA,NA,NA,1,48,0,NA,NA,35
"49",480645,"Delay in match Olivier Giroud (Chelsea) because of an injury.","37'","Chelsea","West Bromwich Albion","1","0",0,0,0,0,0,NA,NA,NA,NA,NA,NA,NA,0,NA,NA,0,NA,0,0,NA,NA,NA,0,NA,NA,NA,0,NA,NA,1,"Chelsea",0,NA,NA,NA,0,NA,NA,0,0,NA,NA,NA,0,NA,NA,NA,NA,1,49,0,NA,NA,37
"50",480645,"Delay over. They are ready to continue.","39'","Chelsea","West Bromwich Albion","1","0",0,0,0,0,0,NA,NA,NA,NA,NA,NA,NA,0,NA,NA,0,NA,0,0,NA,NA,NA,0,NA,NA,NA,0,NA,NA,0,NA,0,NA,NA,NA,0,NA,NA,0,0,NA,NA,NA,0,NA,NA,NA,NA,1,50,0,NA,NA,39
"51",480645,"Attempt saved. Davide Zappacosta (Chelsea) right footed shot from outside the box is saved in the centre of the goal. Assisted by Pedro.","42'","Chelsea","West Bromwich Albion","1","0",0,0,0,1,0,"saved","Davide Zappacosta","Chelsea","right","outside the box","the centre of the goal","Pedro",0,NA,NA,0,NA,0,0,NA,NA,NA,0,NA,NA,NA,0,NA,NA,0,NA,0,NA,NA,NA,0,NA,NA,0,0,NA,NA,NA,0,NA,NA,NA,NA,1,51,0,NA,NA,42
"52",480645,"Offside, West Bromwich Albion. Chris Brunt tries a through ball, but Jay Rodriguez is caught offside.","42'","Chelsea","West Bromwich Albion","1","0",0,0,0,0,0,NA,NA,NA,NA,NA,NA,NA,0,NA,NA,0,NA,0,1,"West Bromwich Albion","Jay Rodriguez","Chris Brunt",0,NA,NA,NA,0,NA,NA,0,NA,0,NA,NA,NA,0,NA,NA,0,0,NA,NA,NA,0,NA,NA,NA,NA,1,52,0,NA,NA,42
"53",480645,"Cesc Fàbregas (Chelsea) wins a free kick in the attacking half.","44'","Chelsea","West Bromwich Albion","1","0",0,0,0,0,0,NA,NA,NA,NA,NA,NA,NA,0,NA,NA,0,NA,0,0,NA,NA,NA,0,NA,NA,NA,0,NA,NA,0,NA,1,"Cesc Fàbregas","Chelsea","attacking half",0,NA,NA,0,0,NA,NA,NA,0,NA,NA,NA,NA,1,53,0,NA,NA,44
"54",480645,"Foul by Grzegorz Krychowiak (West Bromwich Albion).","44'","Chelsea","West Bromwich Albion","1","0",0,0,0,0,0,NA,NA,NA,NA,NA,NA,NA,1,"Grzegorz Krychowiak","West Bromwich Albion",0,NA,0,0,NA,NA,NA,0,NA,NA,NA,0,NA,NA,0,NA,0,NA,NA,NA,0,NA,NA,0,0,NA,NA,NA,0,NA,NA,NA,NA,1,54,0,NA,NA,44
"55",480645,"Attempt missed. Olivier Giroud (Chelsea) header from the centre of the box misses to the right. Assisted by Victor Moses.","45'","Chelsea","West Bromwich Albion","1","0",0,0,0,1,0,"missed","Olivier Giroud","Chelsea","header","the centre of the box","right","Victor Moses",0,NA,NA,0,NA,0,0,NA,NA,NA,0,NA,NA,NA,0,NA,NA,0,NA,0,NA,NA,NA,0,NA,NA,0,0,NA,NA,NA,0,NA,NA,NA,NA,1,55,0,NA,NA,45
"56",480645,"Attempt missed. Salomón Rondón (West Bromwich Albion) left footed shot from outside the box misses to the left. Assisted by Grzegorz Krychowiak.","45'+2'","Chelsea","West Bromwich Albion","1","0",0,0,0,1,0,"missed","Salomón Rondón","West Bromwich Albion","left","outside the box","left","Grzegorz Krychowiak",0,NA,NA,0,NA,0,0,NA,NA,NA,0,NA,NA,NA,0,NA,NA,0,NA,0,NA,NA,NA,0,NA,NA,0,0,NA,NA,NA,0,NA,NA,NA,NA,1,56,1,NA,NA,47
"57",480645,"Foul by Jonny Evans (West Bromwich Albion).","45'+3'","Chelsea","West Bromwich Albion","1","0",0,0,0,0,0,NA,NA,NA,NA,NA,NA,NA,1,"Jonny Evans","West Bromwich Albion",0,NA,0,0,NA,NA,NA,0,NA,NA,NA,0,NA,NA,0,NA,0,NA,NA,NA,0,NA,NA,0,0,NA,NA,NA,0,NA,NA,NA,NA,1,57,1,NA,NA,48
"58",480645,"Olivier Giroud (Chelsea) wins a free kick in the defensive half.","45'+3'","Chelsea","West Bromwich Albion","1","0",0,0,0,0,0,NA,NA,NA,NA,NA,NA,NA,0,NA,NA,0,NA,0,0,NA,NA,NA,0,NA,NA,NA,0,NA,NA,0,NA,1,"Olivier Giroud","Chelsea","defensive half",0,NA,NA,0,0,NA,NA,NA,0,NA,NA,NA,NA,1,58,1,NA,NA,48
"59",480645,"Jonny Evans (West Bromwich Albion) is shown the yellow card for a bad foul.","45'+3'","Chelsea","West Bromwich Albion","1","0",0,0,0,0,0,NA,NA,NA,NA,NA,NA,NA,0,NA,NA,0,NA,0,0,NA,NA,NA,1,"yellow","Jonny Evans","West Bromwich Albion",0,NA,NA,0,NA,0,NA,NA,NA,0,NA,NA,0,0,NA,NA,NA,0,NA,NA,NA,NA,1,59,1,NA,NA,48
"60",480645,"Delay in match Olivier Giroud (Chelsea) because of an injury.","45'+4'","Chelsea","West Bromwich Albion","1","0",0,0,0,0,0,NA,NA,NA,NA,NA,NA,NA,0,NA,NA,0,NA,0,0,NA,NA,NA,0,NA,NA,NA,0,NA,NA,1,"Chelsea",0,NA,NA,NA,0,NA,NA,0,0,NA,NA,NA,0,NA,NA,NA,NA,1,60,1,NA,NA,49
"61",480645,"Delay over. They are ready to continue.","45'+5'","Chelsea","West Bromwich Albion","1","0",0,0,0,0,0,NA,NA,NA,NA,NA,NA,NA,0,NA,NA,0,NA,0,0,NA,NA,NA,0,NA,NA,NA,0,NA,NA,0,NA,0,NA,NA,NA,0,NA,NA,0,0,NA,NA,NA,0,NA,NA,NA,NA,1,61,1,NA,NA,50
"62",480645,"First Half ends, Chelsea 1, West Bromwich Albion 0.","45'+5'","Chelsea","West Bromwich Albion","1","0",1,0,0,0,0,NA,NA,NA,NA,NA,NA,NA,0,NA,NA,0,NA,0,0,NA,NA,NA,0,NA,NA,NA,0,NA,NA,0,NA,0,NA,NA,NA,0,NA,NA,0,0,NA,NA,NA,0,NA,NA,NA,NA,1,62,1,NA,NA,50
"63",480645,"Second Half begins Chelsea 1, West Bromwich Albion 0.","45'","Chelsea","West Bromwich Albion","1","0",0,0,1,0,0,NA,NA,NA,NA,NA,NA,NA,0,NA,NA,0,NA,0,0,NA,NA,NA,0,NA,NA,NA,0,NA,NA,0,NA,0,NA,NA,NA,0,NA,NA,0,0,NA,NA,NA,0,NA,NA,NA,NA,2,63,0,NA,NA,45
"64",480645,"Substitution, West Bromwich Albion. Oliver Burke replaces Chris Brunt.","45'","Chelsea","West Bromwich Albion","1","0",0,0,0,0,0,NA,NA,NA,NA,NA,NA,NA,0,NA,NA,0,NA,0,0,NA,NA,NA,0,NA,NA,NA,0,NA,NA,0,NA,0,NA,NA,NA,0,NA,NA,1,0,"West Bromwich Albion","Oliver Burke","Chris Brunt",0,NA,NA,NA,NA,2,64,0,NA,NA,45
"65",480645,"Offside, West Bromwich Albion. Ben Foster tries a through ball, but Matt Phillips is caught offside.","47'","Chelsea","West Bromwich Albion","1","0",0,0,0,0,0,NA,NA,NA,NA,NA,NA,NA,0,NA,NA,0,NA,0,1,"West Bromwich Albion","Matt Phillips","Ben Foster",0,NA,NA,NA,0,NA,NA,0,NA,0,NA,NA,NA,0,NA,NA,0,0,NA,NA,NA,0,NA,NA,NA,NA,2,65,0,NA,NA,47
"66",480645,"Foul by Kieran Gibbs (West Bromwich Albion).","49'","Chelsea","West Bromwich Albion","1","0",0,0,0,0,0,NA,NA,NA,NA,NA,NA,NA,1,"Kieran Gibbs","West Bromwich Albion",0,NA,0,0,NA,NA,NA,0,NA,NA,NA,0,NA,NA,0,NA,0,NA,NA,NA,0,NA,NA,0,0,NA,NA,NA,0,NA,NA,NA,NA,2,66,0,NA,NA,49
"67",480645,"Victor Moses (Chelsea) wins a free kick on the right wing.","49'","Chelsea","West Bromwich Albion","1","0",0,0,0,0,0,NA,NA,NA,NA,NA,NA,NA,0,NA,NA,0,NA,0,0,NA,NA,NA,0,NA,NA,NA,0,NA,NA,0,NA,1,"Victor Moses","Chelsea",NA,0,NA,NA,0,0,NA,NA,NA,0,NA,NA,NA,NA,2,67,0,NA,NA,49
"68",480645,"Kieran Gibbs (West Bromwich Albion) is shown the yellow card for a bad foul.","49'","Chelsea","West Bromwich Albion","1","0",0,0,0,0,0,NA,NA,NA,NA,NA,NA,NA,0,NA,NA,0,NA,0,0,NA,NA,NA,1,"yellow","Kieran Gibbs","West Bromwich Albion",0,NA,NA,0,NA,0,NA,NA,NA,0,NA,NA,0,0,NA,NA,NA,0,NA,NA,NA,NA,2,68,0,NA,NA,49
"69",480645,"Attempt missed. Andreas Christensen (Chelsea) header from the centre of the box misses to the left. Assisted by Cesc Fàbregas following a set piece situation.","49'","Chelsea","West Bromwich Albion","1","0",0,0,0,1,0,"missed","Andreas Christensen","Chelsea","header","the centre of the box","left","Cesc Fàbregas following",0,NA,NA,1,NA,0,0,NA,NA,NA,0,NA,NA,NA,0,NA,NA,0,NA,0,NA,NA,NA,0,NA,NA,0,0,NA,NA,NA,0,NA,NA,NA,NA,2,69,0,NA,NA,49
"70",480645,"Foul by Antonio Rüdiger (Chelsea).","50'","Chelsea","West Bromwich Albion","1","0",0,0,0,0,0,NA,NA,NA,NA,NA,NA,NA,1,"Antonio Rüdiger","Chelsea",0,NA,0,0,NA,NA,NA,0,NA,NA,NA,0,NA,NA,0,NA,0,NA,NA,NA,0,NA,NA,0,0,NA,NA,NA,0,NA,NA,NA,NA,2,70,0,NA,NA,50
"71",480645,"Oliver Burke (West Bromwich Albion) wins a free kick on the right wing.","50'","Chelsea","West Bromwich Albion","1","0",0,0,0,0,0,NA,NA,NA,NA,NA,NA,NA,0,NA,NA,0,NA,0,0,NA,NA,NA,0,NA,NA,NA,0,NA,NA,0,NA,1,"Oliver Burke","West Bromwich Albion",NA,0,NA,NA,0,0,NA,NA,NA,0,NA,NA,NA,NA,2,71,0,NA,NA,50
"72",480645,"Foul by César Azpilicueta (Chelsea).","51'","Chelsea","West Bromwich Albion","1","0",0,0,0,0,0,NA,NA,NA,NA,NA,NA,NA,1,"César Azpilicueta","Chelsea",0,NA,0,0,NA,NA,NA,0,NA,NA,NA,0,NA,NA,0,NA,0,NA,NA,NA,0,NA,NA,0,0,NA,NA,NA,0,NA,NA,NA,NA,2,72,0,NA,NA,51
"73",480645,"Salomón Rondón (West Bromwich Albion) wins a free kick in the defensive half.","51'","Chelsea","West Bromwich Albion","1","0",0,0,0,0,0,NA,NA,NA,NA,NA,NA,NA,0,NA,NA,0,NA,0,0,NA,NA,NA,0,NA,NA,NA,0,NA,NA,0,NA,1,"Salomón Rondón","West Bromwich Albion","defensive half",0,NA,NA,0,0,NA,NA,NA,0,NA,NA,NA,NA,2,73,0,NA,NA,51
"74",480645,"Eden Hazard (Chelsea) wins a free kick in the defensive half.","51'","Chelsea","West Bromwich Albion","1","0",0,0,0,0,0,NA,NA,NA,NA,NA,NA,NA,0,NA,NA,0,NA,0,0,NA,NA,NA,0,NA,NA,NA,0,NA,NA,0,NA,1,"Eden Hazard","Chelsea","defensive half",0,NA,NA,0,0,NA,NA,NA,0,NA,NA,NA,NA,2,74,0,NA,NA,51
"75",480645,"Foul by Gareth Barry (West Bromwich Albion).","51'","Chelsea","West Bromwich Albion","1","0",0,0,0,0,0,NA,NA,NA,NA,NA,NA,NA,1,"Gareth Barry","West Bromwich Albion",0,NA,0,0,NA,NA,NA,0,NA,NA,NA,0,NA,NA,0,NA,0,NA,NA,NA,0,NA,NA,0,0,NA,NA,NA,0,NA,NA,NA,NA,2,75,0,NA,NA,51
"76",480645,"Offside, Chelsea. Davide Zappacosta tries a through ball, but Olivier Giroud is caught offside.","53'","Chelsea","West Bromwich Albion","1","0",0,0,0,0,0,NA,NA,NA,NA,NA,NA,NA,0,NA,NA,0,NA,0,1,"Chelsea","Olivier Giroud","Davide Zappacosta",0,NA,NA,NA,0,NA,NA,0,NA,0,NA,NA,NA,0,NA,NA,0,0,NA,NA,NA,0,NA,NA,NA,NA,2,76,0,NA,NA,53
"77",480645,"Attempt missed. Victor Moses (Chelsea) right footed shot from the right side of the box is high and wide to the right. Assisted by Eden Hazard.","54'","Chelsea","West Bromwich Albion","1","0",0,0,0,1,0,"missed","Victor Moses","Chelsea","right","the right side of the box","high and wide to the right","Eden Hazard",0,NA,NA,0,NA,0,0,NA,NA,NA,0,NA,NA,NA,0,NA,NA,0,NA,0,NA,NA,NA,0,NA,NA,0,0,NA,NA,NA,0,NA,NA,NA,NA,2,77,0,NA,NA,54
