"","game_id","commentary","match_time","team_one","team_two","team_one_score","team_two_score","half_end","match_end","half_begins","shot_attempt","penalty_shot","shot_result","shot_by_player","shot_by_team","shot_with","shot_where","net_location","assist_by_player","foul","foul_by_player","foul_by_team","follow_set_piece","assist_type","follow_corner","offside","offside_team","offside_player","offside_pass_from","shown_card","card_type","card_player","card_team","video_review","video_review_event","video_review_result","delay_in_match","delay_team","free_kick_won","free_kick_player","free_kick_team","free_kick_where","corner","corner_team","corner_conceded_by","substitution","sub_injury","sub_team","sub_player","replaced_player","penalty","team_drew_penalty","player_drew_penalty","player_conceded_penalty","team_conceded_penalty","half","comment_id","stoppage_time","team_one_penalty_score","team_two_penalty_score","match_time_numeric"
"78",480626,"Victor Lindelöf (Manchester United) wins a free kick in the defensive half.","79'","Manchester United","Chelsea","2","1",0,0,0,0,0,NA,NA,NA,NA,NA,NA,NA,0,NA,NA,0,NA,0,0,NA,NA,NA,0,NA,NA,NA,0,NA,NA,0,NA,1,"Victor Lindelöf","Manchester United","defensive half",0,NA,NA,0,0,NA,NA,NA,0,NA,NA,NA,NA,2,78,0,NA,NA,79
"79",480626,"Offside, Chelsea. Marcos Alonso tries a through ball, but Olivier Giroud is caught offside.","80'","Manchester United","Chelsea","2","1",0,0,0,0,0,NA,NA,NA,NA,NA,NA,NA,0,NA,NA,0,NA,0,1,"Chelsea","Olivier Giroud","Marcos Alonso",0,NA,NA,NA,0,NA,NA,0,NA,0,NA,NA,NA,0,NA,NA,0,0,NA,NA,NA,0,NA,NA,NA,NA,2,79,0,NA,NA,80
"80",480626,"Substitution, Manchester United. Eric Bailly replaces Alexis Sánchez.","81'","Manchester United","Chelsea","2","1",0,0,0,0,0,NA,NA,NA,NA,NA,NA,NA,0,NA,NA,0,NA,0,0,NA,NA,NA,0,NA,NA,NA,0,NA,NA,0,NA,0,NA,NA,NA,0,NA,NA,1,0,"Manchester United","Eric Bailly","Alexis Sánchez",0,NA,NA,NA,NA,2,80,0,NA,NA,81
"81",480626,"Substitution, Chelsea. Cesc Fàbregas replaces Daniel Drinkwater.","81'","Manchester United","Chelsea","2","1",0,0,0,0,0,NA,NA,NA,NA,NA,NA,NA,0,NA,NA,0,NA,0,0,NA,NA,NA,0,NA,NA,NA,0,NA,NA,0,NA,0,NA,NA,NA,0,NA,NA,1,0,"Chelsea","Cesc Fàbregas","Daniel Drinkwater",0,NA,NA,NA,NA,2,81,0,NA,NA,81
"82",480626,"Foul by Antonio Rüdiger (Chelsea).","82'","Manchester United","Chelsea","2","1",0,0,0,0,0,NA,NA,NA,NA,NA,NA,NA,1,"Antonio Rüdiger","Chelsea",0,NA,0,0,NA,NA,NA,0,NA,NA,NA,0,NA,NA,0,NA,0,NA,NA,NA,0,NA,NA,0,0,NA,NA,NA,0,NA,NA,NA,NA,2,82,0,NA,NA,82
"83",480626,"Jesse Lingard (Manchester United) wins a free kick in the defensive half.","82'","Manchester United","Chelsea","2","1",0,0,0,0,0,NA,NA,NA,NA,NA,NA,NA,0,NA,NA,0,NA,0,0,NA,NA,NA,0,NA,NA,NA,0,NA,NA,0,NA,1,"Jesse Lingard","Manchester United","defensive half",0,NA,NA,0,0,NA,NA,NA,0,NA,NA,NA,NA,2,83,0,NA,NA,82
"84",480626,"Antonio Valencia (Manchester United) wins a free kick on the right wing.","83'","Manchester United","Chelsea","2","1",0,0,0,0,0,NA,NA,NA,NA,NA,NA,NA,0,NA,NA,0,NA,0,0,NA,NA,NA,0,NA,NA,NA,0,NA,NA,0,NA,1,"Antonio Valencia","Manchester United",NA,0,NA,NA,0,0,NA,NA,NA,0,NA,NA,NA,NA,2,84,0,NA,NA,83
"85",480626,"Foul by Marcos Alonso (Chelsea).","83'","Manchester United","Chelsea","2","1",0,0,0,0,0,NA,NA,NA,NA,NA,NA,NA,1,"Marcos Alonso","Chelsea",0,NA,0,0,NA,NA,NA,0,NA,NA,NA,0,NA,NA,0,NA,0,NA,NA,NA,0,NA,NA,0,0,NA,NA,NA,0,NA,NA,NA,NA,2,85,0,NA,NA,83
"86",480626,"Foul by Nemanja Matic (Manchester United).","85'","Manchester United","Chelsea","2","1",0,0,0,0,0,NA,NA,NA,NA,NA,NA,NA,1,"Nemanja Matic","Manchester United",0,NA,0,0,NA,NA,NA,0,NA,NA,NA,0,NA,NA,0,NA,0,NA,NA,NA,0,NA,NA,0,0,NA,NA,NA,0,NA,NA,NA,NA,2,86,0,NA,NA,85
"87",480626,"Willian (Chelsea) wins a free kick in the attacking half.","85'","Manchester United","Chelsea","2","1",0,0,0,0,0,NA,NA,NA,NA,NA,NA,NA,0,NA,NA,0,NA,0,0,NA,NA,NA,0,NA,NA,NA,0,NA,NA,0,NA,1,"Willian","Chelsea","attacking half",0,NA,NA,0,0,NA,NA,NA,0,NA,NA,NA,NA,2,87,0,NA,NA,85
"88",480626,"Nemanja Matic (Manchester United) is shown the yellow card for a bad foul.","85'","Manchester United","Chelsea","2","1",0,0,0,0,0,NA,NA,NA,NA,NA,NA,NA,0,NA,NA,0,NA,0,0,NA,NA,NA,1,"yellow","Nemanja Matic","Manchester United",0,NA,NA,0,NA,0,NA,NA,NA,0,NA,NA,0,0,NA,NA,NA,0,NA,NA,NA,NA,2,88,0,NA,NA,85
"89",480626,"Offside, Chelsea. Cesc Fàbregas tries a through ball, but Álvaro Morata is caught offside.","86'","Manchester United","Chelsea","2","1",0,0,0,0,0,NA,NA,NA,NA,NA,NA,NA,0,NA,NA,0,NA,0,1,"Chelsea","Álvaro Morata","Cesc Fàbregas",0,NA,NA,NA,0,NA,NA,0,NA,0,NA,NA,NA,0,NA,NA,0,0,NA,NA,NA,0,NA,NA,NA,NA,2,89,0,NA,NA,86
"90",480626,"Chris Smalling (Manchester United) wins a free kick in the defensive half.","88'","Manchester United","Chelsea","2","1",0,0,0,0,0,NA,NA,NA,NA,NA,NA,NA,0,NA,NA,0,NA,0,0,NA,NA,NA,0,NA,NA,NA,0,NA,NA,0,NA,1,"Chris Smalling","Manchester United","defensive half",0,NA,NA,0,0,NA,NA,NA,0,NA,NA,NA,NA,2,90,0,NA,NA,88
"91",480626,"Foul by Álvaro Morata (Chelsea).","88'","Manchester United","Chelsea","2","1",0,0,0,0,0,NA,NA,NA,NA,NA,NA,NA,1,"Álvaro Morata","Chelsea",0,NA,0,0,NA,NA,NA,0,NA,NA,NA,0,NA,NA,0,NA,0,NA,NA,NA,0,NA,NA,0,0,NA,NA,NA,0,NA,NA,NA,NA,2,91,0,NA,NA,88
"92",480626,"Álvaro Morata (Chelsea) is shown the yellow card for a bad foul.","88'","Manchester United","Chelsea","2","1",0,0,0,0,0,NA,NA,NA,NA,NA,NA,NA,0,NA,NA,0,NA,0,0,NA,NA,NA,1,"yellow","Álvaro Morata","Chelsea",0,NA,NA,0,NA,0,NA,NA,NA,0,NA,NA,0,0,NA,NA,NA,0,NA,NA,NA,NA,2,92,0,NA,NA,88
"93",480626,"Foul by Ashley Young (Manchester United).","89'","Manchester United","Chelsea","2","1",0,0,0,0,0,NA,NA,NA,NA,NA,NA,NA,1,"Ashley Young","Manchester United",0,NA,0,0,NA,NA,NA,0,NA,NA,NA,0,NA,NA,0,NA,0,NA,NA,NA,0,NA,NA,0,0,NA,NA,NA,0,NA,NA,NA,NA,2,93,0,NA,NA,89
"94",480626,"Willian (Chelsea) wins a free kick in the defensive half.","89'","Manchester United","Chelsea","2","1",0,0,0,0,0,NA,NA,NA,NA,NA,NA,NA,0,NA,NA,0,NA,0,0,NA,NA,NA,0,NA,NA,NA,0,NA,NA,0,NA,1,"Willian","Chelsea","defensive half",0,NA,NA,0,0,NA,NA,NA,0,NA,NA,NA,NA,2,94,0,NA,NA,89
"95",480626,"Delay in match Nemanja Matic (Manchester United) because of an injury.","90'+1'","Manchester United","Chelsea","2","1",0,0,0,0,0,NA,NA,NA,NA,NA,NA,NA,0,NA,NA,0,NA,0,0,NA,NA,NA,0,NA,NA,NA,0,NA,NA,1,"Manchester United",0,NA,NA,NA,0,NA,NA,0,0,NA,NA,NA,0,NA,NA,NA,NA,2,95,1,NA,NA,91
"96",480626,"Delay over. They are ready to continue.","90'+1'","Manchester United","Chelsea","2","1",0,0,0,0,0,NA,NA,NA,NA,NA,NA,NA,0,NA,NA,0,NA,0,0,NA,NA,NA,0,NA,NA,NA,0,NA,NA,0,NA,0,NA,NA,NA,0,NA,NA,0,0,NA,NA,NA,0,NA,NA,NA,NA,2,96,1,NA,NA,91
"97",480626,"Attempt blocked. Olivier Giroud (Chelsea) left footed shot from outside the box is blocked. Assisted by Álvaro Morata.","90'+2'","Manchester United","Chelsea","2","1",0,0,0,1,0,"blocked","Olivier Giroud","Chelsea","left","outside the box",NA,"Álvaro Morata",0,NA,NA,0,NA,0,0,NA,NA,NA,0,NA,NA,NA,0,NA,NA,0,NA,0,NA,NA,NA,0,NA,NA,0,0,NA,NA,NA,0,NA,NA,NA,NA,2,97,1,NA,NA,92
"98",480626,"Attempt blocked. Romelu Lukaku (Manchester United) left footed shot from the left side of the box is blocked. Assisted by Jesse Lingard.","90'+3'","Manchester United","Chelsea","2","1",0,0,0,1,0,"blocked","Romelu Lukaku","Manchester United","left","the left side of the box",NA,"Jesse Lingard",0,NA,NA,0,NA,0,0,NA,NA,NA,0,NA,NA,NA,0,NA,NA,0,NA,0,NA,NA,NA,0,NA,NA,0,0,NA,NA,NA,0,NA,NA,NA,NA,2,98,1,NA,NA,93
"99",480626,"Foul by Paul Pogba (Manchester United).","90'+4'","Manchester United","Chelsea","2","1",0,0,0,0,0,NA,NA,NA,NA,NA,NA,NA,1,"Paul Pogba","Manchester United",0,NA,0,0,NA,NA,NA,0,NA,NA,NA,0,NA,NA,0,NA,0,NA,NA,NA,0,NA,NA,0,0,NA,NA,NA,0,NA,NA,NA,NA,2,99,1,NA,NA,94
"100",480626,"Willian (Chelsea) wins a free kick on the right wing.","90'+4'","Manchester United","Chelsea","2","1",0,0,0,0,0,NA,NA,NA,NA,NA,NA,NA,0,NA,NA,0,NA,0,0,NA,NA,NA,0,NA,NA,NA,0,NA,NA,0,NA,1,"Willian","Chelsea",NA,0,NA,NA,0,0,NA,NA,NA,0,NA,NA,NA,NA,2,100,1,NA,NA,94
"101",480626,"Foul by César Azpilicueta (Chelsea).","90'+5'","Manchester United","Chelsea","2","1",0,0,0,0,0,NA,NA,NA,NA,NA,NA,NA,1,"César Azpilicueta","Chelsea",0,NA,0,0,NA,NA,NA,0,NA,NA,NA,0,NA,NA,0,NA,0,NA,NA,NA,0,NA,NA,0,0,NA,NA,NA,0,NA,NA,NA,NA,2,101,1,NA,NA,95
"102",480626,"Paul Pogba (Manchester United) wins a free kick on the left wing.","90'+5'","Manchester United","Chelsea","2","1",0,0,0,0,0,NA,NA,NA,NA,NA,NA,NA,0,NA,NA,0,NA,0,0,NA,NA,NA,0,NA,NA,NA,0,NA,NA,0,NA,1,"Paul Pogba","Manchester United",NA,0,NA,NA,0,0,NA,NA,NA,0,NA,NA,NA,NA,2,102,1,NA,NA,95
"103",480626,"Corner,  Chelsea. Conceded by Antonio Valencia.","90'+6'","Manchester United","Chelsea","2","1",0,0,0,0,0,NA,NA,NA,NA,NA,NA,NA,0,NA,NA,0,NA,0,0,NA,NA,NA,0,NA,NA,NA,0,NA,NA,0,NA,0,NA,NA,NA,1,"Chelsea","Antonio Valencia",0,0,NA,NA,NA,0,NA,NA,NA,NA,2,103,1,NA,NA,96
"104",480626,"Second Half ends, Manchester United 2, Chelsea 1.","90'+6'","Manchester United","Chelsea","2","1",1,0,0,0,0,NA,NA,NA,NA,NA,NA,NA,0,NA,NA,0,NA,0,0,NA,NA,NA,0,NA,NA,NA,0,NA,NA,0,NA,0,NA,NA,NA,0,NA,NA,0,0,NA,NA,NA,0,NA,NA,NA,NA,2,104,1,NA,NA,96
"105",480626,"Match ends, Manchester United 2, Chelsea 1.","90'+6'","Manchester United","Chelsea","2","1",0,1,0,0,0,NA,NA,NA,NA,NA,NA,NA,0,NA,NA,0,NA,0,0,NA,NA,NA,0,NA,NA,NA,0,NA,NA,0,NA,0,NA,NA,NA,0,NA,NA,0,0,NA,NA,NA,0,NA,NA,NA,NA,2,105,1,NA,NA,96
