480568;14-04-2018;First Half begins.;-;Crystal Palace;Brighton & Hove Albion;0;0;0;0;1;0;0;NA;NA;NA;NA;NA;NA;NA;0;NA;NA;0;NA;0;0;NA;NA;NA;0;NA;NA;NA;0;NA;NA;0;NA;0;NA;NA;NA;0;NA;NA;0;0;NA;NA;NA;0;NA;NA;NA;NA;1;1;0;NA;NA;NA
480568;14-04-2018;Lineups are announced and players are warming up.;-;Crystal Palace;Brighton & Hove Albion;0;0;0;0;0;0;0;NA;NA;NA;NA;NA;NA;NA;0;NA;NA;0;NA;0;0;NA;NA;NA;0;NA;NA;NA;0;NA;NA;0;NA;0;NA;NA;NA;0;NA;NA;0;0;NA;NA;NA;0;NA;NA;NA;NA;1;2;0;NA;NA;NA
480568;14-04-2018;Foul by Ruben Loftus-Cheek (Crystal Palace).;1';Crystal Palace;Brighton & Hove Albion;0;0;0;0;0;0;0;NA;NA;NA;NA;NA;NA;NA;1;Ruben Loftus-Cheek;Crystal Palace;0;NA;0;0;NA;NA;NA;0;NA;NA;NA;0;NA;NA;0;NA;0;NA;NA;NA;0;NA;NA;0;0;NA;NA;NA;0;NA;NA;NA;NA;1;3;0;NA;NA;1
480568;14-04-2018;Pascal Groß (Brighton and Hove Albion) wins a free kick in the defensive half.;1';Crystal Palace;Brighton & Hove Albion;0;0;0;0;0;0;0;NA;NA;NA;NA;NA;NA;NA;0;NA;NA;0;NA;0;0;NA;NA;NA;0;NA;NA;NA;0;NA;NA;0;NA;1;Pascal Groß;Brighton and Hove Albion;defensive half;0;NA;NA;0;0;NA;NA;NA;0;NA;NA;NA;NA;1;4;0;NA;NA;1
480568;14-04-2018;Foul by Glenn Murray (Brighton and Hove Albion).;2';Crystal Palace;Brighton & Hove Albion;0;0;0;0;0;0;0;NA;NA;NA;NA;NA;NA;NA;1;Glenn Murray;Brighton and Hove Albion;0;NA;0;0;NA;NA;NA;0;NA;NA;NA;0;NA;NA;0;NA;0;NA;NA;NA;0;NA;NA;0;0;NA;NA;NA;0;NA;NA;NA;NA;1;5;0;NA;NA;2
480568;14-04-2018;Mamadou Sakho (Crystal Palace) wins a free kick in the defensive half.;2';Crystal Palace;Brighton & Hove Albion;0;0;0;0;0;0;0;NA;NA;NA;NA;NA;NA;NA;0;NA;NA;0;NA;0;0;NA;NA;NA;0;NA;NA;NA;0;NA;NA;0;NA;1;Mamadou Sakho;Crystal Palace;defensive half;0;NA;NA;0;0;NA;NA;NA;0;NA;NA;NA;NA;1;6;0;NA;NA;2
480568;14-04-2018;Attempt blocked. Andros Townsend (Crystal Palace) left footed shot from outside the box is blocked. Assisted by James McArthur.;4';Crystal Palace;Brighton & Hove Albion;0;0;0;0;0;1;0;blocked;Andros Townsend;Crystal Palace;left;outside the box;NA;James McArthur;0;NA;NA;0;NA;0;0;NA;NA;NA;0;NA;NA;NA;0;NA;NA;0;NA;0;NA;NA;NA;0;NA;NA;0;0;NA;NA;NA;0;NA;NA;NA;NA;1;7;0;NA;NA;4
480568;14-04-2018;Corner,  Crystal Palace. Conceded by Gaëtan Bong.;4';Crystal Palace;Brighton & Hove Albion;0;0;0;0;0;0;0;NA;NA;NA;NA;NA;NA;NA;0;NA;NA;0;NA;0;0;NA;NA;NA;0;NA;NA;NA;0;NA;NA;0;NA;0;NA;NA;NA;1;Crystal Palace;Gaëtan Bong;0;0;NA;NA;NA;0;NA;NA;NA;NA;1;8;0;NA;NA;4
480568;14-04-2018;Attempt saved. Luka Milivojevic (Crystal Palace) right footed shot from a difficult angle on the right is saved in the bottom left corner. Assisted by Ruben Loftus-Cheek.;5';Crystal Palace;Brighton & Hove Albion;0;0;0;0;0;1;0;saved;Luka Milivojevic;Crystal Palace;right;NA;the bottom left corner;Ruben Loftus-Cheek;0;NA;NA;0;NA;0;0;NA;NA;NA;0;NA;NA;NA;0;NA;NA;0;NA;0;NA;NA;NA;0;NA;NA;0;0;NA;NA;NA;0;NA;NA;NA;NA;1;9;0;NA;NA;5
480568;14-04-2018;Goal!  Crystal Palace 1, Brighton and Hove Albion 0. Wilfried Zaha (Crystal Palace) right footed shot from very close range to the centre of the goal following a corner.;5';Crystal Palace;Brighton & Hove Albion;1;0;0;0;0;1;0;goal;Wilfried Zaha;Crystal Palace;right;right shot very close range;centre of the goal following a corner;NA;0;NA;NA;0;NA;1;0;NA;NA;NA;0;NA;NA;NA;0;NA;NA;0;NA;0;NA;NA;NA;0;NA;NA;0;0;NA;NA;NA;0;NA;NA;NA;NA;1;10;0;NA;NA;5
480568;14-04-2018;Attempt blocked. Patrick van Aanholt (Crystal Palace) right footed shot from the left side of the box is blocked. Assisted by Wilfried Zaha.;7';Crystal Palace;Brighton & Hove Albion;1;0;0;0;0;1;0;blocked;Patrick van Aanholt;Crystal Palace;right;the left side of the box;NA;Wilfried Zaha;0;NA;NA;0;NA;0;0;NA;NA;NA;0;NA;NA;NA;0;NA;NA;0;NA;0;NA;NA;NA;0;NA;NA;0;0;NA;NA;NA;0;NA;NA;NA;NA;1;11;0;NA;NA;7
480568;14-04-2018;Corner,  Crystal Palace. Conceded by Shane Duffy.;7';Crystal Palace;Brighton & Hove Albion;1;0;0;0;0;0;0;NA;NA;NA;NA;NA;NA;NA;0;NA;NA;0;NA;0;0;NA;NA;NA;0;NA;NA;NA;0;NA;NA;0;NA;0;NA;NA;NA;1;Crystal Palace;Shane Duffy;0;0;NA;NA;NA;0;NA;NA;NA;NA;1;12;0;NA;NA;7
480568;14-04-2018;Foul by Ezequiel Schelotto (Brighton and Hove Albion).;9';Crystal Palace;Brighton & Hove Albion;1;0;0;0;0;0;0;NA;NA;NA;NA;NA;NA;NA;1;Ezequiel Schelotto;Brighton and Hove Albion;0;NA;0;0;NA;NA;NA;0;NA;NA;NA;0;NA;NA;0;NA;0;NA;NA;NA;0;NA;NA;0;0;NA;NA;NA;0;NA;NA;NA;NA;1;13;0;NA;NA;9
480568;14-04-2018;Ruben Loftus-Cheek (Crystal Palace) wins a free kick in the defensive half.;9';Crystal Palace;Brighton & Hove Albion;1;0;0;0;0;0;0;NA;NA;NA;NA;NA;NA;NA;0;NA;NA;0;NA;0;0;NA;NA;NA;0;NA;NA;NA;0;NA;NA;0;NA;1;Ruben Loftus-Cheek;Crystal Palace;defensive half;0;NA;NA;0;0;NA;NA;NA;0;NA;NA;NA;NA;1;14;0;NA;NA;9
480568;14-04-2018;Offside, Crystal Palace. Luka Milivojevic tries a through ball, but Joel Ward is caught offside.;9';Crystal Palace;Brighton & Hove Albion;1;0;0;0;0;0;0;NA;NA;NA;NA;NA;NA;NA;0;NA;NA;0;NA;0;1;Crystal Palace;Joel Ward;Luka Milivojevic;0;NA;NA;NA;0;NA;NA;0;NA;0;NA;NA;NA;0;NA;NA;0;0;NA;NA;NA;0;NA;NA;NA;NA;1;15;0;NA;NA;9
480568;14-04-2018;Foul by Dale Stephens (Brighton and Hove Albion).;11';Crystal Palace;Brighton & Hove Albion;1;0;0;0;0;0;0;NA;NA;NA;NA;NA;NA;NA;1;Dale Stephens;Brighton and Hove Albion;0;NA;0;0;NA;NA;NA;0;NA;NA;NA;0;NA;NA;0;NA;0;NA;NA;NA;0;NA;NA;0;0;NA;NA;NA;0;NA;NA;NA;NA;1;16;0;NA;NA;11
480568;14-04-2018;Wilfried Zaha (Crystal Palace) wins a free kick in the defensive half.;11';Crystal Palace;Brighton & Hove Albion;1;0;0;0;0;0;0;NA;NA;NA;NA;NA;NA;NA;0;NA;NA;0;NA;0;0;NA;NA;NA;0;NA;NA;NA;0;NA;NA;0;NA;1;Wilfried Zaha;Crystal Palace;defensive half;0;NA;NA;0;0;NA;NA;NA;0;NA;NA;NA;NA;1;17;0;NA;NA;11
480568;14-04-2018;Dale Stephens (Brighton and Hove Albion) is shown the yellow card for a bad foul.;11';Crystal Palace;Brighton & Hove Albion;1;0;0;0;0;0;0;NA;NA;NA;NA;NA;NA;NA;0;NA;NA;0;NA;0;0;NA;NA;NA;1;yellow;Dale Stephens;Brighton and Hove Albion;0;NA;NA;0;NA;0;NA;NA;NA;0;NA;NA;0;0;NA;NA;NA;0;NA;NA;NA;NA;1;18;0;NA;NA;11
480568;14-04-2018;Attempt blocked. Yohan Cabaye (Crystal Palace) right footed shot from outside the box is blocked. Assisted by Wilfried Zaha.;12';Crystal Palace;Brighton & Hove Albion;1;0;0;0;0;1;0;blocked;Yohan Cabaye;Crystal Palace;right;outside the box;NA;Wilfried Zaha;0;NA;NA;0;NA;0;0;NA;NA;NA;0;NA;NA;NA;0;NA;NA;0;NA;0;NA;NA;NA;0;NA;NA;0;0;NA;NA;NA;0;NA;NA;NA;NA;1;19;0;NA;NA;12
480568;14-04-2018;Corner,  Crystal Palace. Conceded by Beram Kayal.;12';Crystal Palace;Brighton & Hove Albion;1;0;0;0;0;0;0;NA;NA;NA;NA;NA;NA;NA;0;NA;NA;0;NA;0;0;NA;NA;NA;0;NA;NA;NA;0;NA;NA;0;NA;0;NA;NA;NA;1;Crystal Palace;Beram Kayal;0;0;NA;NA;NA;0;NA;NA;NA;NA;1;20;0;NA;NA;12
480568;14-04-2018;Attempt saved. Andros Townsend (Crystal Palace) left footed shot from outside the box is saved in the bottom left corner.;13';Crystal Palace;Brighton & Hove Albion;1;0;0;0;0;1;0;saved;Andros Townsend;Crystal Palace;left;outside the box;the bottom left corner;NA;0;NA;NA;0;NA;0;0;NA;NA;NA;0;NA;NA;NA;0;NA;NA;0;NA;0;NA;NA;NA;0;NA;NA;0;0;NA;NA;NA;0;NA;NA;NA;NA;1;21;0;NA;NA;13
480568;14-04-2018;Corner,  Crystal Palace. Conceded by Shane Duffy.;13';Crystal Palace;Brighton & Hove Albion;1;0;0;0;0;0;0;NA;NA;NA;NA;NA;NA;NA;0;NA;NA;0;NA;0;0;NA;NA;NA;0;NA;NA;NA;0;NA;NA;0;NA;0;NA;NA;NA;1;Crystal Palace;Shane Duffy;0;0;NA;NA;NA;0;NA;NA;NA;NA;1;22;0;NA;NA;13
480568;14-04-2018;Attempt blocked. James McArthur (Crystal Palace) left footed shot from very close range is blocked.;14';Crystal Palace;Brighton & Hove Albion;1;0;0;0;0;1;0;blocked;James McArthur;Crystal Palace;left;left shot very close range;NA;NA;0;NA;NA;0;NA;0;0;NA;NA;NA;0;NA;NA;NA;0;NA;NA;0;NA;0;NA;NA;NA;0;NA;NA;0;0;NA;NA;NA;0;NA;NA;NA;NA;1;23;0;NA;NA;14
480568;14-04-2018;Goal!  Crystal Palace 2, Brighton and Hove Albion 0. James Tomkins (Crystal Palace) left footed shot from the centre of the box to the bottom right corner following a corner.;14';Crystal Palace;Brighton & Hove Albion;2;0;0;0;0;1;0;goal;James Tomkins;Crystal Palace;left;the centre of the box;bottom right corner following a corner;NA;0;NA;NA;0;NA;1;0;NA;NA;NA;0;NA;NA;NA;0;NA;NA;0;NA;0;NA;NA;NA;0;NA;NA;0;0;NA;NA;NA;0;NA;NA;NA;NA;1;24;0;NA;NA;14
480568;14-04-2018;Dangerous play by Gaëtan Bong (Brighton and Hove Albion).;15';Crystal Palace;Brighton & Hove Albion;2;0;0;0;0;0;0;NA;NA;NA;NA;NA;NA;NA;0;NA;NA;0;NA;0;0;NA;NA;NA;0;NA;NA;NA;0;NA;NA;0;NA;0;NA;NA;NA;0;NA;NA;0;0;NA;NA;NA;0;NA;NA;NA;NA;1;25;0;NA;NA;15
480568;14-04-2018;Joel Ward (Crystal Palace) wins a free kick in the defensive half.;15';Crystal Palace;Brighton & Hove Albion;2;0;0;0;0;0;0;NA;NA;NA;NA;NA;NA;NA;0;NA;NA;0;NA;0;0;NA;NA;NA;0;NA;NA;NA;0;NA;NA;0;NA;1;Joel Ward;Crystal Palace;defensive half;0;NA;NA;0;0;NA;NA;NA;0;NA;NA;NA;NA;1;26;0;NA;NA;15
480568;14-04-2018;Hand ball by Luka Milivojevic (Crystal Palace).;16';Crystal Palace;Brighton & Hove Albion;2;0;0;0;0;0;0;NA;NA;NA;NA;NA;NA;NA;0;NA;NA;0;NA;0;0;NA;NA;NA;0;NA;NA;NA;0;NA;NA;0;NA;0;NA;NA;NA;0;NA;NA;0;0;NA;NA;NA;0;NA;NA;NA;NA;1;27;0;NA;NA;16
480568;14-04-2018;Luka Milivojevic (Crystal Palace) is shown the yellow card.;16';Crystal Palace;Brighton & Hove Albion;2;0;0;0;0;0;0;NA;NA;NA;NA;NA;NA;NA;0;NA;NA;0;NA;0;0;NA;NA;NA;1;yellow;Luka Milivojevic;Crystal Palace;0;NA;NA;0;NA;0;NA;NA;NA;0;NA;NA;0;0;NA;NA;NA;0;NA;NA;NA;NA;1;28;0;NA;NA;16
480568;14-04-2018;Corner,  Brighton and Hove Albion. Conceded by Patrick van Aanholt.;17';Crystal Palace;Brighton & Hove Albion;2;0;0;0;0;0;0;NA;NA;NA;NA;NA;NA;NA;0;NA;NA;0;NA;0;0;NA;NA;NA;0;NA;NA;NA;0;NA;NA;0;NA;0;NA;NA;NA;1;Brighton and Hove Albion;Patrick van Aanholt;0;0;NA;NA;NA;0;NA;NA;NA;NA;1;29;0;NA;NA;17
480568;14-04-2018;Attempt blocked. Lewis Dunk (Brighton and Hove Albion) header from the centre of the box is blocked. Assisted by Pascal Groß with a cross.;18';Crystal Palace;Brighton & Hove Albion;2;0;0;0;0;1;0;blocked;Lewis Dunk;Brighton and Hove Albion;header;the centre of the box;NA;Pascal Groß;0;NA;NA;0;cross;0;0;NA;NA;NA;0;NA;NA;NA;0;NA;NA;0;NA;0;NA;NA;NA;0;NA;NA;0;0;NA;NA;NA;0;NA;NA;NA;NA;1;30;0;NA;NA;18
480568;14-04-2018;Goal!  Crystal Palace 2, Brighton and Hove Albion 1. Glenn Murray (Brighton and Hove Albion) right footed shot from very close range to the top left corner. Assisted by Lewis Dunk following a corner.;18';Crystal Palace;Brighton & Hove Albion;2;1;0;0;0;1;0;goal;Glenn Murray;Brighton and Hove Albion;right;right shot very close range;top left corner;Lewis Dunk;0;NA;NA;0;NA;1;0;NA;NA;NA;0;NA;NA;NA;0;NA;NA;0;NA;0;NA;NA;NA;0;NA;NA;0;0;NA;NA;NA;0;NA;NA;NA;NA;1;31;0;NA;NA;18
480568;14-04-2018;Attempt missed. Pascal Groß (Brighton and Hove Albion) right footed shot from outside the box is just a bit too high. Assisted by Glenn Murray.;20';Crystal Palace;Brighton & Hove Albion;2;1;0;0;0;1;0;missed;Pascal Groß;Brighton and Hove Albion;right;outside the box;just a bit too high;Glenn Murray;0;NA;NA;0;NA;0;0;NA;NA;NA;0;NA;NA;NA;0;NA;NA;0;NA;0;NA;NA;NA;0;NA;NA;0;0;NA;NA;NA;0;NA;NA;NA;NA;1;32;0;NA;NA;20
480568;14-04-2018;Andros Townsend (Crystal Palace) wins a free kick on the left wing.;21';Crystal Palace;Brighton & Hove Albion;2;1;0;0;0;0;0;NA;NA;NA;NA;NA;NA;NA;0;NA;NA;0;NA;0;0;NA;NA;NA;0;NA;NA;NA;0;NA;NA;0;NA;1;Andros Townsend;Crystal Palace;NA;0;NA;NA;0;0;NA;NA;NA;0;NA;NA;NA;NA;1;33;0;NA;NA;21
480568;14-04-2018;Foul by Ezequiel Schelotto (Brighton and Hove Albion).;21';Crystal Palace;Brighton & Hove Albion;2;1;0;0;0;0;0;NA;NA;NA;NA;NA;NA;NA;1;Ezequiel Schelotto;Brighton and Hove Albion;0;NA;0;0;NA;NA;NA;0;NA;NA;NA;0;NA;NA;0;NA;0;NA;NA;NA;0;NA;NA;0;0;NA;NA;NA;0;NA;NA;NA;NA;1;34;0;NA;NA;21
480568;14-04-2018;Beram Kayal (Brighton and Hove Albion) wins a free kick in the defensive half.;21';Crystal Palace;Brighton & Hove Albion;2;1;0;0;0;0;0;NA;NA;NA;NA;NA;NA;NA;0;NA;NA;0;NA;0;0;NA;NA;NA;0;NA;NA;NA;0;NA;NA;0;NA;1;Beram Kayal;Brighton and Hove Albion;defensive half;0;NA;NA;0;0;NA;NA;NA;0;NA;NA;NA;NA;1;35;0;NA;NA;21
480568;14-04-2018;Foul by Luka Milivojevic (Crystal Palace).;21';Crystal Palace;Brighton & Hove Albion;2;1;0;0;0;0;0;NA;NA;NA;NA;NA;NA;NA;1;Luka Milivojevic;Crystal Palace;0;NA;0;0;NA;NA;NA;0;NA;NA;NA;0;NA;NA;0;NA;0;NA;NA;NA;0;NA;NA;0;0;NA;NA;NA;0;NA;NA;NA;NA;1;36;0;NA;NA;21
480568;14-04-2018;Attempt blocked. José Izquierdo (Brighton and Hove Albion) right footed shot from the centre of the box is blocked. Assisted by Beram Kayal.;23';Crystal Palace;Brighton & Hove Albion;2;1;0;0;0;1;0;blocked;José Izquierdo;Brighton and Hove Albion;right;the centre of the box;NA;Beram Kayal;0;NA;NA;0;NA;0;0;NA;NA;NA;0;NA;NA;NA;0;NA;NA;0;NA;0;NA;NA;NA;0;NA;NA;0;0;NA;NA;NA;0;NA;NA;NA;NA;1;37;0;NA;NA;23
480568;14-04-2018;Goal!  Crystal Palace 3, Brighton and Hove Albion 1. Wilfried Zaha (Crystal Palace) header from the centre of the box to the bottom left corner. Assisted by Luka Milivojevic.;24';Crystal Palace;Brighton & Hove Albion;3;1;0;0;0;1;0;goal;Wilfried Zaha;Crystal Palace;header;the centre of the box;bottom left corner;Luka Milivojevic;0;NA;NA;0;NA;0;0;NA;NA;NA;0;NA;NA;NA;0;NA;NA;0;NA;0;NA;NA;NA;0;NA;NA;0;0;NA;NA;NA;0;NA;NA;NA;NA;1;38;0;NA;NA;24
480568;14-04-2018;Dale Stephens (Brighton and Hove Albion) wins a free kick in the defensive half.;26';Crystal Palace;Brighton & Hove Albion;3;1;0;0;0;0;0;NA;NA;NA;NA;NA;NA;NA;0;NA;NA;0;NA;0;0;NA;NA;NA;0;NA;NA;NA;0;NA;NA;0;NA;1;Dale Stephens;Brighton and Hove Albion;defensive half;0;NA;NA;0;0;NA;NA;NA;0;NA;NA;NA;NA;1;39;0;NA;NA;26
480568;14-04-2018;Foul by Ruben Loftus-Cheek (Crystal Palace).;26';Crystal Palace;Brighton & Hove Albion;3;1;0;0;0;0;0;NA;NA;NA;NA;NA;NA;NA;1;Ruben Loftus-Cheek;Crystal Palace;0;NA;0;0;NA;NA;NA;0;NA;NA;NA;0;NA;NA;0;NA;0;NA;NA;NA;0;NA;NA;0;0;NA;NA;NA;0;NA;NA;NA;NA;1;40;0;NA;NA;26
480568;14-04-2018;Foul by Dale Stephens (Brighton and Hove Albion).;31';Crystal Palace;Brighton & Hove Albion;3;1;0;0;0;0;0;NA;NA;NA;NA;NA;NA;NA;1;Dale Stephens;Brighton and Hove Albion;0;NA;0;0;NA;NA;NA;0;NA;NA;NA;0;NA;NA;0;NA;0;NA;NA;NA;0;NA;NA;0;0;NA;NA;NA;0;NA;NA;NA;NA;1;41;0;NA;NA;31
480568;14-04-2018;Wilfried Zaha (Crystal Palace) wins a free kick on the left wing.;31';Crystal Palace;Brighton & Hove Albion;3;1;0;0;0;0;0;NA;NA;NA;NA;NA;NA;NA;0;NA;NA;0;NA;0;0;NA;NA;NA;0;NA;NA;NA;0;NA;NA;0;NA;1;Wilfried Zaha;Crystal Palace;NA;0;NA;NA;0;0;NA;NA;NA;0;NA;NA;NA;NA;1;42;0;NA;NA;31
480568;14-04-2018;Attempt missed. Glenn Murray (Brighton and Hove Albion) right footed shot from the centre of the box misses to the left. Assisted by Gaëtan Bong with a cross.;32';Crystal Palace;Brighton & Hove Albion;3;1;0;0;0;1;0;missed;Glenn Murray;Brighton and Hove Albion;right;the centre of the box;left;Gaëtan Bong;0;NA;NA;0;cross;0;0;NA;NA;NA;0;NA;NA;NA;0;NA;NA;0;NA;0;NA;NA;NA;0;NA;NA;0;0;NA;NA;NA;0;NA;NA;NA;NA;1;43;0;NA;NA;32
480568;14-04-2018;Attempt saved. Wilfried Zaha (Crystal Palace) right footed shot from outside the box is saved in the centre of the goal. Assisted by Luka Milivojevic.;33';Crystal Palace;Brighton & Hove Albion;3;1;0;0;0;1;0;saved;Wilfried Zaha;Crystal Palace;right;outside the box;the centre of the goal;Luka Milivojevic;0;NA;NA;0;NA;0;0;NA;NA;NA;0;NA;NA;NA;0;NA;NA;0;NA;0;NA;NA;NA;0;NA;NA;0;0;NA;NA;NA;0;NA;NA;NA;NA;1;44;0;NA;NA;33
480568;14-04-2018;Goal!  Crystal Palace 3, Brighton and Hove Albion 2. José Izquierdo (Brighton and Hove Albion) right footed shot from the left side of the box to the bottom right corner. Assisted by Jürgen Locadia.;34';Crystal Palace;Brighton & Hove Albion;3;2;0;0;0;1;0;goal;José Izquierdo;Brighton and Hove Albion;right;the left side of the box;bottom right corner;Jürgen Locadia;0;NA;NA;0;NA;0;0;NA;NA;NA;0;NA;NA;NA;0;NA;NA;0;NA;0;NA;NA;NA;0;NA;NA;0;0;NA;NA;NA;0;NA;NA;NA;NA;1;45;0;NA;NA;34
480568;14-04-2018;Dale Stephens (Brighton and Hove Albion) wins a free kick in the attacking half.;35';Crystal Palace;Brighton & Hove Albion;3;2;0;0;0;0;0;NA;NA;NA;NA;NA;NA;NA;0;NA;NA;0;NA;0;0;NA;NA;NA;0;NA;NA;NA;0;NA;NA;0;NA;1;Dale Stephens;Brighton and Hove Albion;attacking half;0;NA;NA;0;0;NA;NA;NA;0;NA;NA;NA;NA;1;46;0;NA;NA;35
480568;14-04-2018;Foul by Wilfried Zaha (Crystal Palace).;35';Crystal Palace;Brighton & Hove Albion;3;2;0;0;0;0;0;NA;NA;NA;NA;NA;NA;NA;1;Wilfried Zaha;Crystal Palace;0;NA;0;0;NA;NA;NA;0;NA;NA;NA;0;NA;NA;0;NA;0;NA;NA;NA;0;NA;NA;0;0;NA;NA;NA;0;NA;NA;NA;NA;1;47;0;NA;NA;35
480568;14-04-2018;Offside, Brighton and Hove Albion. Shane Duffy tries a through ball, but Glenn Murray is caught offside.;36';Crystal Palace;Brighton & Hove Albion;3;2;0;0;0;0;0;NA;NA;NA;NA;NA;NA;NA;0;NA;NA;0;NA;0;1;Brighton and Hove Albion;Glenn Murray;Shane Duffy;0;NA;NA;NA;0;NA;NA;0;NA;0;NA;NA;NA;0;NA;NA;0;0;NA;NA;NA;0;NA;NA;NA;NA;1;48;0;NA;NA;36
480568;14-04-2018;Offside, Crystal Palace. James McArthur tries a through ball, but Wilfried Zaha is caught offside.;38';Crystal Palace;Brighton & Hove Albion;3;2;0;0;0;0;0;NA;NA;NA;NA;NA;NA;NA;0;NA;NA;0;NA;0;1;Crystal Palace;Wilfried Zaha;James McArthur;0;NA;NA;NA;0;NA;NA;0;NA;0;NA;NA;NA;0;NA;NA;0;0;NA;NA;NA;0;NA;NA;NA;NA;1;49;0;NA;NA;38
480568;14-04-2018;Foul by Joel Ward (Crystal Palace).;38';Crystal Palace;Brighton & Hove Albion;3;2;0;0;0;0;0;NA;NA;NA;NA;NA;NA;NA;1;Joel Ward;Crystal Palace;0;NA;0;0;NA;NA;NA;0;NA;NA;NA;0;NA;NA;0;NA;0;NA;NA;NA;0;NA;NA;0;0;NA;NA;NA;0;NA;NA;NA;NA;1;50;0;NA;NA;38
480568;14-04-2018;José Izquierdo (Brighton and Hove Albion) wins a free kick on the left wing.;38';Crystal Palace;Brighton & Hove Albion;3;2;0;0;0;0;0;NA;NA;NA;NA;NA;NA;NA;0;NA;NA;0;NA;0;0;NA;NA;NA;0;NA;NA;NA;0;NA;NA;0;NA;1;José Izquierdo;Brighton and Hove Albion;NA;0;NA;NA;0;0;NA;NA;NA;0;NA;NA;NA;NA;1;51;0;NA;NA;38
480568;14-04-2018;Foul by Lewis Dunk (Brighton and Hove Albion).;39';Crystal Palace;Brighton & Hove Albion;3;2;0;0;0;0;0;NA;NA;NA;NA;NA;NA;NA;1;Lewis Dunk;Brighton and Hove Albion;0;NA;0;0;NA;NA;NA;0;NA;NA;NA;0;NA;NA;0;NA;0;NA;NA;NA;0;NA;NA;0;0;NA;NA;NA;0;NA;NA;NA;NA;1;52;0;NA;NA;39
480568;14-04-2018;Ruben Loftus-Cheek (Crystal Palace) wins a free kick in the defensive half.;39';Crystal Palace;Brighton & Hove Albion;3;2;0;0;0;0;0;NA;NA;NA;NA;NA;NA;NA;0;NA;NA;0;NA;0;0;NA;NA;NA;0;NA;NA;NA;0;NA;NA;0;NA;1;Ruben Loftus-Cheek;Crystal Palace;defensive half;0;NA;NA;0;0;NA;NA;NA;0;NA;NA;NA;NA;1;53;0;NA;NA;39
480568;14-04-2018;Offside, Crystal Palace. Yohan Cabaye tries a through ball, but Wilfried Zaha is caught offside.;41';Crystal Palace;Brighton & Hove Albion;3;2;0;0;0;0;0;NA;NA;NA;NA;NA;NA;NA;0;NA;NA;0;NA;0;1;Crystal Palace;Wilfried Zaha;Yohan Cabaye;0;NA;NA;NA;0;NA;NA;0;NA;0;NA;NA;NA;0;NA;NA;0;0;NA;NA;NA;0;NA;NA;NA;NA;1;54;0;NA;NA;41
480568;14-04-2018;Foul by Beram Kayal (Brighton and Hove Albion).;44';Crystal Palace;Brighton & Hove Albion;3;2;0;0;0;0;0;NA;NA;NA;NA;NA;NA;NA;1;Beram Kayal;Brighton and Hove Albion;0;NA;0;0;NA;NA;NA;0;NA;NA;NA;0;NA;NA;0;NA;0;NA;NA;NA;0;NA;NA;0;0;NA;NA;NA;0;NA;NA;NA;NA;1;55;0;NA;NA;44
480568;14-04-2018;Ruben Loftus-Cheek (Crystal Palace) wins a free kick in the attacking half.;44';Crystal Palace;Brighton & Hove Albion;3;2;0;0;0;0;0;NA;NA;NA;NA;NA;NA;NA;0;NA;NA;0;NA;0;0;NA;NA;NA;0;NA;NA;NA;0;NA;NA;0;NA;1;Ruben Loftus-Cheek;Crystal Palace;attacking half;0;NA;NA;0;0;NA;NA;NA;0;NA;NA;NA;NA;1;56;0;NA;NA;44
480568;14-04-2018;Foul by Dale Stephens (Brighton and Hove Albion).;45';Crystal Palace;Brighton & Hove Albion;3;2;0;0;0;0;0;NA;NA;NA;NA;NA;NA;NA;1;Dale Stephens;Brighton and Hove Albion;0;NA;0;0;NA;NA;NA;0;NA;NA;NA;0;NA;NA;0;NA;0;NA;NA;NA;0;NA;NA;0;0;NA;NA;NA;0;NA;NA;NA;NA;1;57;0;NA;NA;45
480568;14-04-2018;Joel Ward (Crystal Palace) wins a free kick in the attacking half.;45';Crystal Palace;Brighton & Hove Albion;3;2;0;0;0;0;0;NA;NA;NA;NA;NA;NA;NA;0;NA;NA;0;NA;0;0;NA;NA;NA;0;NA;NA;NA;0;NA;NA;0;NA;1;Joel Ward;Crystal Palace;attacking half;0;NA;NA;0;0;NA;NA;NA;0;NA;NA;NA;NA;1;58;0;NA;NA;45
480568;14-04-2018;Attempt saved. Luka Milivojevic (Crystal Palace) right footed shot from outside the box is saved in the bottom right corner. Assisted by Andros Townsend.;45'+2';Crystal Palace;Brighton & Hove Albion;3;2;0;0;0;1;0;saved;Luka Milivojevic;Crystal Palace;right;outside the box;the bottom right corner;Andros Townsend;0;NA;NA;0;NA;0;0;NA;NA;NA;0;NA;NA;NA;0;NA;NA;0;NA;0;NA;NA;NA;0;NA;NA;0;0;NA;NA;NA;0;NA;NA;NA;NA;1;59;1;NA;NA;47
480568;14-04-2018;Foul by Yohan Cabaye (Crystal Palace).;45'+2';Crystal Palace;Brighton & Hove Albion;3;2;0;0;0;0;0;NA;NA;NA;NA;NA;NA;NA;1;Yohan Cabaye;Crystal Palace;0;NA;0;0;NA;NA;NA;0;NA;NA;NA;0;NA;NA;0;NA;0;NA;NA;NA;0;NA;NA;0;0;NA;NA;NA;0;NA;NA;NA;NA;1;60;1;NA;NA;47
480568;14-04-2018;Lewis Dunk (Brighton and Hove Albion) wins a free kick in the defensive half.;45'+2';Crystal Palace;Brighton & Hove Albion;3;2;0;0;0;0;0;NA;NA;NA;NA;NA;NA;NA;0;NA;NA;0;NA;0;0;NA;NA;NA;0;NA;NA;NA;0;NA;NA;0;NA;1;Lewis Dunk;Brighton and Hove Albion;defensive half;0;NA;NA;0;0;NA;NA;NA;0;NA;NA;NA;NA;1;61;1;NA;NA;47
480568;14-04-2018;First Half ends, Crystal Palace 3, Brighton and Hove Albion 2.;45'+4';Crystal Palace;Brighton & Hove Albion;3;2;1;0;0;0;0;NA;NA;NA;NA;NA;NA;NA;0;NA;NA;0;NA;0;0;NA;NA;NA;0;NA;NA;NA;0;NA;NA;0;NA;0;NA;NA;NA;0;NA;NA;0;0;NA;NA;NA;0;NA;NA;NA;NA;1;62;1;NA;NA;49
480568;14-04-2018;Second Half begins Crystal Palace 3, Brighton and Hove Albion 2.;45';Crystal Palace;Brighton & Hove Albion;3;2;0;0;1;0;0;NA;NA;NA;NA;NA;NA;NA;0;NA;NA;0;NA;0;0;NA;NA;NA;0;NA;NA;NA;0;NA;NA;0;NA;0;NA;NA;NA;0;NA;NA;0;0;NA;NA;NA;0;NA;NA;NA;NA;2;63;0;NA;NA;45
480568;14-04-2018;Substitution, Brighton and Hove Albion. Anthony Knockaert replaces Jürgen Locadia.;45';Crystal Palace;Brighton & Hove Albion;3;2;0;0;0;0;0;NA;NA;NA;NA;NA;NA;NA;0;NA;NA;0;NA;0;0;NA;NA;NA;0;NA;NA;NA;0;NA;NA;0;NA;0;NA;NA;NA;0;NA;NA;1;0;Brighton and Hove Albion;Anthony Knockaert;Jürgen Locadia;0;NA;NA;NA;NA;2;64;0;NA;NA;45
480568;14-04-2018;Attempt blocked. Wilfried Zaha (Crystal Palace) right footed shot from outside the box is blocked. Assisted by Luka Milivojevic.;49';Crystal Palace;Brighton & Hove Albion;3;2;0;0;0;1;0;blocked;Wilfried Zaha;Crystal Palace;right;outside the box;NA;Luka Milivojevic;0;NA;NA;0;NA;0;0;NA;NA;NA;0;NA;NA;NA;0;NA;NA;0;NA;0;NA;NA;NA;0;NA;NA;0;0;NA;NA;NA;0;NA;NA;NA;NA;2;65;0;NA;NA;49
480568;14-04-2018;Attempt blocked. Andros Townsend (Crystal Palace) right footed shot from outside the box is blocked. Assisted by Luka Milivojevic.;52';Crystal Palace;Brighton & Hove Albion;3;2;0;0;0;1;0;blocked;Andros Townsend;Crystal Palace;right;outside the box;NA;Luka Milivojevic;0;NA;NA;0;NA;0;0;NA;NA;NA;0;NA;NA;NA;0;NA;NA;0;NA;0;NA;NA;NA;0;NA;NA;0;0;NA;NA;NA;0;NA;NA;NA;NA;2;66;0;NA;NA;52
480568;14-04-2018;Corner,  Crystal Palace. Conceded by Dale Stephens.;52';Crystal Palace;Brighton & Hove Albion;3;2;0;0;0;0;0;NA;NA;NA;NA;NA;NA;NA;0;NA;NA;0;NA;0;0;NA;NA;NA;0;NA;NA;NA;0;NA;NA;0;NA;0;NA;NA;NA;1;Crystal Palace;Dale Stephens;0;0;NA;NA;NA;0;NA;NA;NA;NA;2;67;0;NA;NA;52
480568;14-04-2018;Foul by Yohan Cabaye (Crystal Palace).;53';Crystal Palace;Brighton & Hove Albion;3;2;0;0;0;0;0;NA;NA;NA;NA;NA;NA;NA;1;Yohan Cabaye;Crystal Palace;0;NA;0;0;NA;NA;NA;0;NA;NA;NA;0;NA;NA;0;NA;0;NA;NA;NA;0;NA;NA;0;0;NA;NA;NA;0;NA;NA;NA;NA;2;68;0;NA;NA;53
480568;14-04-2018;José Izquierdo (Brighton and Hove Albion) wins a free kick on the left wing.;53';Crystal Palace;Brighton & Hove Albion;3;2;0;0;0;0;0;NA;NA;NA;NA;NA;NA;NA;0;NA;NA;0;NA;0;0;NA;NA;NA;0;NA;NA;NA;0;NA;NA;0;NA;1;José Izquierdo;Brighton and Hove Albion;NA;0;NA;NA;0;0;NA;NA;NA;0;NA;NA;NA;NA;2;69;0;NA;NA;53
480568;14-04-2018;Foul by Yohan Cabaye (Crystal Palace).;57';Crystal Palace;Brighton & Hove Albion;3;2;0;0;0;0;0;NA;NA;NA;NA;NA;NA;NA;1;Yohan Cabaye;Crystal Palace;0;NA;0;0;NA;NA;NA;0;NA;NA;NA;0;NA;NA;0;NA;0;NA;NA;NA;0;NA;NA;0;0;NA;NA;NA;0;NA;NA;NA;NA;2;70;0;NA;NA;57
480568;14-04-2018;Glenn Murray (Brighton and Hove Albion) wins a free kick on the left wing.;57';Crystal Palace;Brighton & Hove Albion;3;2;0;0;0;0;0;NA;NA;NA;NA;NA;NA;NA;0;NA;NA;0;NA;0;0;NA;NA;NA;0;NA;NA;NA;0;NA;NA;0;NA;1;Glenn Murray;Brighton and Hove Albion;NA;0;NA;NA;0;0;NA;NA;NA;0;NA;NA;NA;NA;2;71;0;NA;NA;57
480568;14-04-2018;Corner,  Brighton and Hove Albion. Conceded by Luka Milivojevic.;58';Crystal Palace;Brighton & Hove Albion;3;2;0;0;0;0;0;NA;NA;NA;NA;NA;NA;NA;0;NA;NA;0;NA;0;0;NA;NA;NA;0;NA;NA;NA;0;NA;NA;0;NA;0;NA;NA;NA;1;Brighton and Hove Albion;Luka Milivojevic;0;0;NA;NA;NA;0;NA;NA;NA;NA;2;72;0;NA;NA;58
480568;14-04-2018;Dale Stephens (Brighton and Hove Albion) wins a free kick in the attacking half.;60';Crystal Palace;Brighton & Hove Albion;3;2;0;0;0;0;0;NA;NA;NA;NA;NA;NA;NA;0;NA;NA;0;NA;0;0;NA;NA;NA;0;NA;NA;NA;0;NA;NA;0;NA;1;Dale Stephens;Brighton and Hove Albion;attacking half;0;NA;NA;0;0;NA;NA;NA;0;NA;NA;NA;NA;2;73;0;NA;NA;60
480568;14-04-2018;Foul by Wilfried Zaha (Crystal Palace).;60';Crystal Palace;Brighton & Hove Albion;3;2;0;0;0;0;0;NA;NA;NA;NA;NA;NA;NA;1;Wilfried Zaha;Crystal Palace;0;NA;0;0;NA;NA;NA;0;NA;NA;NA;0;NA;NA;0;NA;0;NA;NA;NA;0;NA;NA;0;0;NA;NA;NA;0;NA;NA;NA;NA;2;74;0;NA;NA;60
480568;14-04-2018;Attempt missed. Glenn Murray (Brighton and Hove Albion) right footed shot from the right side of the six yard box is close, but misses to the left. Assisted by Beram Kayal.;61';Crystal Palace;Brighton & Hove Albion;3;2;0;0;0;1;0;missed;Glenn Murray;Brighton and Hove Albion;right;the right side of the six yard box;close, but left;Beram Kayal;0;NA;NA;0;NA;0;0;NA;NA;NA;0;NA;NA;NA;0;NA;NA;0;NA;0;NA;NA;NA;0;NA;NA;0;0;NA;NA;NA;0;NA;NA;NA;NA;2;75;0;NA;NA;61
480568;14-04-2018;Foul by Pascal Groß (Brighton and Hove Albion).;62';Crystal Palace;Brighton & Hove Albion;3;2;0;0;0;0;0;NA;NA;NA;NA;NA;NA;NA;1;Pascal Groß;Brighton and Hove Albion;0;NA;0;0;NA;NA;NA;0;NA;NA;NA;0;NA;NA;0;NA;0;NA;NA;NA;0;NA;NA;0;0;NA;NA;NA;0;NA;NA;NA;NA;2;76;0;NA;NA;62
480568;14-04-2018;Wilfried Zaha (Crystal Palace) wins a free kick on the left wing.;62';Crystal Palace;Brighton & Hove Albion;3;2;0;0;0;0;0;NA;NA;NA;NA;NA;NA;NA;0;NA;NA;0;NA;0;0;NA;NA;NA;0;NA;NA;NA;0;NA;NA;0;NA;1;Wilfried Zaha;Crystal Palace;NA;0;NA;NA;0;0;NA;NA;NA;0;NA;NA;NA;NA;2;77;0;NA;NA;62
