480624;03-03-2018;First Half begins.;-;Watford;West Bromwich Albion;0;0;0;0;1;0;0;NA;NA;NA;NA;NA;NA;NA;0;NA;NA;0;NA;0;0;NA;NA;NA;0;NA;NA;NA;0;NA;NA;0;NA;0;NA;NA;NA;0;NA;NA;0;0;NA;NA;NA;0;NA;NA;NA;NA;1;1;0;NA;NA;NA
480624;03-03-2018;Lineups are announced and players are warming up.;-;Watford;West Bromwich Albion;0;0;0;0;0;0;0;NA;NA;NA;NA;NA;NA;NA;0;NA;NA;0;NA;0;0;NA;NA;NA;0;NA;NA;NA;0;NA;NA;0;NA;0;NA;NA;NA;0;NA;NA;0;0;NA;NA;NA;0;NA;NA;NA;NA;1;2;0;NA;NA;NA
480624;03-03-2018;Delay in match Etienne Capoue (Watford) because of an injury.;1';Watford;West Bromwich Albion;0;0;0;0;0;0;0;NA;NA;NA;NA;NA;NA;NA;0;NA;NA;0;NA;0;0;NA;NA;NA;0;NA;NA;NA;0;NA;NA;1;Watford;0;NA;NA;NA;0;NA;NA;0;0;NA;NA;NA;0;NA;NA;NA;NA;1;3;0;NA;NA;1
480624;03-03-2018;Delay over. They are ready to continue.;2';Watford;West Bromwich Albion;0;0;0;0;0;0;0;NA;NA;NA;NA;NA;NA;NA;0;NA;NA;0;NA;0;0;NA;NA;NA;0;NA;NA;NA;0;NA;NA;0;NA;0;NA;NA;NA;0;NA;NA;0;0;NA;NA;NA;0;NA;NA;NA;NA;1;4;0;NA;NA;2
480624;03-03-2018;Offside, Watford. Adrian Mariappa tries a through ball, but André Carrillo is caught offside.;4';Watford;West Bromwich Albion;0;0;0;0;0;0;0;NA;NA;NA;NA;NA;NA;NA;0;NA;NA;0;NA;0;1;Watford;André Carrillo;Adrian Mariappa;0;NA;NA;NA;0;NA;NA;0;NA;0;NA;NA;NA;0;NA;NA;0;0;NA;NA;NA;0;NA;NA;NA;NA;1;5;0;NA;NA;4
480624;03-03-2018;Attempt blocked. Grzegorz Krychowiak (West Bromwich Albion) left footed shot from the centre of the box is blocked.;4';Watford;West Bromwich Albion;0;0;0;0;0;1;0;blocked;Grzegorz Krychowiak;West Bromwich Albion;left;the centre of the box;NA;NA;0;NA;NA;0;NA;0;0;NA;NA;NA;0;NA;NA;NA;0;NA;NA;0;NA;0;NA;NA;NA;0;NA;NA;0;0;NA;NA;NA;0;NA;NA;NA;NA;1;6;0;NA;NA;4
480624;03-03-2018;Corner,  West Bromwich Albion. Conceded by Adrian Mariappa.;4';Watford;West Bromwich Albion;0;0;0;0;0;0;0;NA;NA;NA;NA;NA;NA;NA;0;NA;NA;0;NA;0;0;NA;NA;NA;0;NA;NA;NA;0;NA;NA;0;NA;0;NA;NA;NA;1;West Bromwich Albion;Adrian Mariappa;0;0;NA;NA;NA;0;NA;NA;NA;NA;1;7;0;NA;NA;4
480624;03-03-2018;Foul by Ahmed Hegazi (West Bromwich Albion).;5';Watford;West Bromwich Albion;0;0;0;0;0;0;0;NA;NA;NA;NA;NA;NA;NA;1;Ahmed Hegazi;West Bromwich Albion;0;NA;0;0;NA;NA;NA;0;NA;NA;NA;0;NA;NA;0;NA;0;NA;NA;NA;0;NA;NA;0;0;NA;NA;NA;0;NA;NA;NA;NA;1;8;0;NA;NA;5
480624;03-03-2018;Richarlison (Watford) wins a free kick in the defensive half.;5';Watford;West Bromwich Albion;0;0;0;0;0;0;0;NA;NA;NA;NA;NA;NA;NA;0;NA;NA;0;NA;0;0;NA;NA;NA;0;NA;NA;NA;0;NA;NA;0;NA;1;Richarlison;Watford;defensive half;0;NA;NA;0;0;NA;NA;NA;0;NA;NA;NA;NA;1;9;0;NA;NA;5
480624;03-03-2018;Attempt blocked. José Holebas (Watford) left footed shot from the left side of the box is blocked. Assisted by Troy Deeney.;7';Watford;West Bromwich Albion;0;0;0;0;0;1;0;blocked;José Holebas;Watford;left;the left side of the box;NA;Troy Deeney;0;NA;NA;0;NA;0;0;NA;NA;NA;0;NA;NA;NA;0;NA;NA;0;NA;0;NA;NA;NA;0;NA;NA;0;0;NA;NA;NA;0;NA;NA;NA;NA;1;10;0;NA;NA;7
480624;03-03-2018;Attempt blocked. Roberto Pereyra (Watford) left footed shot from the centre of the box is blocked. Assisted by André Carrillo.;7';Watford;West Bromwich Albion;0;0;0;0;0;1;0;blocked;Roberto Pereyra;Watford;left;the centre of the box;NA;André Carrillo;0;NA;NA;0;NA;0;0;NA;NA;NA;0;NA;NA;NA;0;NA;NA;0;NA;0;NA;NA;NA;0;NA;NA;0;0;NA;NA;NA;0;NA;NA;NA;NA;1;11;0;NA;NA;7
480624;03-03-2018;Corner,  Watford. Conceded by Kieran Gibbs.;7';Watford;West Bromwich Albion;0;0;0;0;0;0;0;NA;NA;NA;NA;NA;NA;NA;0;NA;NA;0;NA;0;0;NA;NA;NA;0;NA;NA;NA;0;NA;NA;0;NA;0;NA;NA;NA;1;Watford;Kieran Gibbs;0;0;NA;NA;NA;0;NA;NA;NA;NA;1;12;0;NA;NA;7
480624;03-03-2018;Attempt missed. André Carrillo (Watford) left footed shot from outside the box misses to the left following a corner.;8';Watford;West Bromwich Albion;0;0;0;0;0;1;0;missed;André Carrillo;Watford;left;outside the box;left;NA;0;NA;NA;0;NA;1;0;NA;NA;NA;0;NA;NA;NA;0;NA;NA;0;NA;0;NA;NA;NA;0;NA;NA;0;0;NA;NA;NA;0;NA;NA;NA;NA;1;13;0;NA;NA;8
480624;03-03-2018;Etienne Capoue (Watford) wins a free kick in the defensive half.;9';Watford;West Bromwich Albion;0;0;0;0;0;0;0;NA;NA;NA;NA;NA;NA;NA;0;NA;NA;0;NA;0;0;NA;NA;NA;0;NA;NA;NA;0;NA;NA;0;NA;1;Etienne Capoue;Watford;defensive half;0;NA;NA;0;0;NA;NA;NA;0;NA;NA;NA;NA;1;14;0;NA;NA;9
480624;03-03-2018;Foul by Chris Brunt (West Bromwich Albion).;9';Watford;West Bromwich Albion;0;0;0;0;0;0;0;NA;NA;NA;NA;NA;NA;NA;1;Chris Brunt;West Bromwich Albion;0;NA;0;0;NA;NA;NA;0;NA;NA;NA;0;NA;NA;0;NA;0;NA;NA;NA;0;NA;NA;0;0;NA;NA;NA;0;NA;NA;NA;NA;1;15;0;NA;NA;9
480624;03-03-2018;Hand ball by Jake Livermore (West Bromwich Albion).;11';Watford;West Bromwich Albion;0;0;0;0;0;0;0;NA;NA;NA;NA;NA;NA;NA;0;NA;NA;0;NA;0;0;NA;NA;NA;0;NA;NA;NA;0;NA;NA;0;NA;0;NA;NA;NA;0;NA;NA;0;0;NA;NA;NA;0;NA;NA;NA;NA;1;16;0;NA;NA;11
480624;03-03-2018;Corner,  Watford. Conceded by Craig Dawson.;16';Watford;West Bromwich Albion;0;0;0;0;0;0;0;NA;NA;NA;NA;NA;NA;NA;0;NA;NA;0;NA;0;0;NA;NA;NA;0;NA;NA;NA;0;NA;NA;0;NA;0;NA;NA;NA;1;Watford;Craig Dawson;0;0;NA;NA;NA;0;NA;NA;NA;NA;1;17;0;NA;NA;16
480624;03-03-2018;Attempt missed. Adrian Mariappa (Watford) header from the centre of the box misses to the right. Assisted by José Holebas with a cross following a corner.;17';Watford;West Bromwich Albion;0;0;0;0;0;1;0;missed;Adrian Mariappa;Watford;header;the centre of the box;right;José Holebas;0;NA;NA;0;cross;1;0;NA;NA;NA;0;NA;NA;NA;0;NA;NA;0;NA;0;NA;NA;NA;0;NA;NA;0;0;NA;NA;NA;0;NA;NA;NA;NA;1;18;0;NA;NA;17
480624;03-03-2018;Craig Dawson (West Bromwich Albion) wins a free kick in the attacking half.;19';Watford;West Bromwich Albion;0;0;0;0;0;0;0;NA;NA;NA;NA;NA;NA;NA;0;NA;NA;0;NA;0;0;NA;NA;NA;0;NA;NA;NA;0;NA;NA;0;NA;1;Craig Dawson;West Bromwich Albion;attacking half;0;NA;NA;0;0;NA;NA;NA;0;NA;NA;NA;NA;1;19;0;NA;NA;19
480624;03-03-2018;Foul by Troy Deeney (Watford).;19';Watford;West Bromwich Albion;0;0;0;0;0;0;0;NA;NA;NA;NA;NA;NA;NA;1;Troy Deeney;Watford;0;NA;0;0;NA;NA;NA;0;NA;NA;NA;0;NA;NA;0;NA;0;NA;NA;NA;0;NA;NA;0;0;NA;NA;NA;0;NA;NA;NA;NA;1;20;0;NA;NA;19
480624;03-03-2018;Attempt missed. Jay Rodriguez (West Bromwich Albion) right footed shot from outside the box is high and wide to the right. Assisted by Grzegorz Krychowiak.;20';Watford;West Bromwich Albion;0;0;0;0;0;1;0;missed;Jay Rodriguez;West Bromwich Albion;right;outside the box;high and wide to the right;Grzegorz Krychowiak;0;NA;NA;0;NA;0;0;NA;NA;NA;0;NA;NA;NA;0;NA;NA;0;NA;0;NA;NA;NA;0;NA;NA;0;0;NA;NA;NA;0;NA;NA;NA;NA;1;21;0;NA;NA;20
480624;03-03-2018;Foul by Etienne Capoue (Watford).;25';Watford;West Bromwich Albion;0;0;0;0;0;0;0;NA;NA;NA;NA;NA;NA;NA;1;Etienne Capoue;Watford;0;NA;0;0;NA;NA;NA;0;NA;NA;NA;0;NA;NA;0;NA;0;NA;NA;NA;0;NA;NA;0;0;NA;NA;NA;0;NA;NA;NA;NA;1;22;0;NA;NA;25
480624;03-03-2018;Grzegorz Krychowiak (West Bromwich Albion) wins a free kick in the defensive half.;25';Watford;West Bromwich Albion;0;0;0;0;0;0;0;NA;NA;NA;NA;NA;NA;NA;0;NA;NA;0;NA;0;0;NA;NA;NA;0;NA;NA;NA;0;NA;NA;0;NA;1;Grzegorz Krychowiak;West Bromwich Albion;defensive half;0;NA;NA;0;0;NA;NA;NA;0;NA;NA;NA;NA;1;23;0;NA;NA;25
480624;03-03-2018;Etienne Capoue (Watford) is shown the yellow card for a bad foul.;25';Watford;West Bromwich Albion;0;0;0;0;0;0;0;NA;NA;NA;NA;NA;NA;NA;0;NA;NA;0;NA;0;0;NA;NA;NA;1;yellow;Etienne Capoue;Watford;0;NA;NA;0;NA;0;NA;NA;NA;0;NA;NA;0;0;NA;NA;NA;0;NA;NA;NA;NA;1;24;0;NA;NA;25
480624;03-03-2018;Attempt missed. Salomón Rondón (West Bromwich Albion) header from the centre of the box misses to the right. Assisted by Matt Phillips with a cross.;26';Watford;West Bromwich Albion;0;0;0;0;0;1;0;missed;Salomón Rondón;West Bromwich Albion;header;the centre of the box;right;Matt Phillips;0;NA;NA;0;cross;0;0;NA;NA;NA;0;NA;NA;NA;0;NA;NA;0;NA;0;NA;NA;NA;0;NA;NA;0;0;NA;NA;NA;0;NA;NA;NA;NA;1;25;0;NA;NA;26
480624;03-03-2018;Attempt blocked. Daryl Janmaat (Watford) right footed shot from the right side of the box is blocked. Assisted by André Carrillo.;31';Watford;West Bromwich Albion;0;0;0;0;0;1;0;blocked;Daryl Janmaat;Watford;right;the right side of the box;NA;André Carrillo;0;NA;NA;0;NA;0;0;NA;NA;NA;0;NA;NA;NA;0;NA;NA;0;NA;0;NA;NA;NA;0;NA;NA;0;0;NA;NA;NA;0;NA;NA;NA;NA;1;26;0;NA;NA;31
480624;03-03-2018;Attempt blocked. Abdoulaye Doucouré (Watford) right footed shot from outside the box is blocked.;31';Watford;West Bromwich Albion;0;0;0;0;0;1;0;blocked;Abdoulaye Doucouré;Watford;right;outside the box;NA;NA;0;NA;NA;0;NA;0;0;NA;NA;NA;0;NA;NA;NA;0;NA;NA;0;NA;0;NA;NA;NA;0;NA;NA;0;0;NA;NA;NA;0;NA;NA;NA;NA;1;27;0;NA;NA;31
480624;03-03-2018;Daryl Janmaat (Watford) wins a free kick in the defensive half.;35';Watford;West Bromwich Albion;0;0;0;0;0;0;0;NA;NA;NA;NA;NA;NA;NA;0;NA;NA;0;NA;0;0;NA;NA;NA;0;NA;NA;NA;0;NA;NA;0;NA;1;Daryl Janmaat;Watford;defensive half;0;NA;NA;0;0;NA;NA;NA;0;NA;NA;NA;NA;1;28;0;NA;NA;35
480624;03-03-2018;Foul by Jay Rodriguez (West Bromwich Albion).;35';Watford;West Bromwich Albion;0;0;0;0;0;0;0;NA;NA;NA;NA;NA;NA;NA;1;Jay Rodriguez;West Bromwich Albion;0;NA;0;0;NA;NA;NA;0;NA;NA;NA;0;NA;NA;0;NA;0;NA;NA;NA;0;NA;NA;0;0;NA;NA;NA;0;NA;NA;NA;NA;1;29;0;NA;NA;35
480624;03-03-2018;Corner,  West Bromwich Albion. Conceded by Adrian Mariappa.;36';Watford;West Bromwich Albion;0;0;0;0;0;0;0;NA;NA;NA;NA;NA;NA;NA;0;NA;NA;0;NA;0;0;NA;NA;NA;0;NA;NA;NA;0;NA;NA;0;NA;0;NA;NA;NA;1;West Bromwich Albion;Adrian Mariappa;0;0;NA;NA;NA;0;NA;NA;NA;NA;1;30;0;NA;NA;36
480624;03-03-2018;Attempt saved. Daryl Janmaat (Watford) right footed shot from the centre of the box is saved in the bottom left corner. Assisted by Roberto Pereyra.;38';Watford;West Bromwich Albion;0;0;0;0;0;1;0;saved;Daryl Janmaat;Watford;right;the centre of the box;the bottom left corner;Roberto Pereyra;0;NA;NA;0;NA;0;0;NA;NA;NA;0;NA;NA;NA;0;NA;NA;0;NA;0;NA;NA;NA;0;NA;NA;0;0;NA;NA;NA;0;NA;NA;NA;NA;1;31;0;NA;NA;38
480624;03-03-2018;Corner,  Watford. Conceded by Ben Foster.;38';Watford;West Bromwich Albion;0;0;0;0;0;0;0;NA;NA;NA;NA;NA;NA;NA;0;NA;NA;0;NA;0;0;NA;NA;NA;0;NA;NA;NA;0;NA;NA;0;NA;0;NA;NA;NA;1;Watford;Ben Foster;0;0;NA;NA;NA;0;NA;NA;NA;NA;1;32;0;NA;NA;38
480624;03-03-2018;Attempt missed. Sebastian Prödl (Watford) header from the centre of the box is just a bit too high. Assisted by José Holebas with a cross following a corner.;39';Watford;West Bromwich Albion;0;0;0;0;0;1;0;missed;Sebastian Prödl;Watford;header;the centre of the box;just a bit too high;José Holebas;0;NA;NA;0;cross;1;0;NA;NA;NA;0;NA;NA;NA;0;NA;NA;0;NA;0;NA;NA;NA;0;NA;NA;0;0;NA;NA;NA;0;NA;NA;NA;NA;1;33;0;NA;NA;39
480624;03-03-2018;Ahmed Hegazi (West Bromwich Albion) wins a free kick in the defensive half.;41';Watford;West Bromwich Albion;0;0;0;0;0;0;0;NA;NA;NA;NA;NA;NA;NA;0;NA;NA;0;NA;0;0;NA;NA;NA;0;NA;NA;NA;0;NA;NA;0;NA;1;Ahmed Hegazi;West Bromwich Albion;defensive half;0;NA;NA;0;0;NA;NA;NA;0;NA;NA;NA;NA;1;34;0;NA;NA;41
480624;03-03-2018;Foul by Roberto Pereyra (Watford).;41';Watford;West Bromwich Albion;0;0;0;0;0;0;0;NA;NA;NA;NA;NA;NA;NA;1;Roberto Pereyra;Watford;0;NA;0;0;NA;NA;NA;0;NA;NA;NA;0;NA;NA;0;NA;0;NA;NA;NA;0;NA;NA;0;0;NA;NA;NA;0;NA;NA;NA;NA;1;35;0;NA;NA;41
480624;03-03-2018;Craig Dawson (West Bromwich Albion) wins a free kick in the defensive half.;42';Watford;West Bromwich Albion;0;0;0;0;0;0;0;NA;NA;NA;NA;NA;NA;NA;0;NA;NA;0;NA;0;0;NA;NA;NA;0;NA;NA;NA;0;NA;NA;0;NA;1;Craig Dawson;West Bromwich Albion;defensive half;0;NA;NA;0;0;NA;NA;NA;0;NA;NA;NA;NA;1;36;0;NA;NA;42
480624;03-03-2018;Foul by Roberto Pereyra (Watford).;42';Watford;West Bromwich Albion;0;0;0;0;0;0;0;NA;NA;NA;NA;NA;NA;NA;1;Roberto Pereyra;Watford;0;NA;0;0;NA;NA;NA;0;NA;NA;NA;0;NA;NA;0;NA;0;NA;NA;NA;0;NA;NA;0;0;NA;NA;NA;0;NA;NA;NA;NA;1;37;0;NA;NA;42
480624;03-03-2018;Foul by José Holebas (Watford).;43';Watford;West Bromwich Albion;0;0;0;0;0;0;0;NA;NA;NA;NA;NA;NA;NA;1;José Holebas;Watford;0;NA;0;0;NA;NA;NA;0;NA;NA;NA;0;NA;NA;0;NA;0;NA;NA;NA;0;NA;NA;0;0;NA;NA;NA;0;NA;NA;NA;NA;1;38;0;NA;NA;43
480624;03-03-2018;Salomón Rondón (West Bromwich Albion) wins a free kick on the right wing.;43';Watford;West Bromwich Albion;0;0;0;0;0;0;0;NA;NA;NA;NA;NA;NA;NA;0;NA;NA;0;NA;0;0;NA;NA;NA;0;NA;NA;NA;0;NA;NA;0;NA;1;Salomón Rondón;West Bromwich Albion;NA;0;NA;NA;0;0;NA;NA;NA;0;NA;NA;NA;NA;1;39;0;NA;NA;43
480624;03-03-2018;Attempt missed. Chris Brunt (West Bromwich Albion) left footed shot from a difficult angle and long range on the right is just a bit too high from a direct free kick.;45';Watford;West Bromwich Albion;0;0;0;0;0;1;0;missed;Chris Brunt;West Bromwich Albion;left;left shot a difficult angle and long range;NA;NA;0;NA;NA;0;NA;0;0;NA;NA;NA;0;NA;NA;NA;0;NA;NA;0;NA;0;NA;NA;NA;0;NA;NA;0;0;NA;NA;NA;0;NA;NA;NA;NA;1;40;0;NA;NA;45
480624;03-03-2018;First Half ends, Watford 0, West Bromwich Albion 0.;45'+3';Watford;West Bromwich Albion;0;0;1;0;0;0;0;NA;NA;NA;NA;NA;NA;NA;0;NA;NA;0;NA;0;0;NA;NA;NA;0;NA;NA;NA;0;NA;NA;0;NA;0;NA;NA;NA;0;NA;NA;0;0;NA;NA;NA;0;NA;NA;NA;NA;1;41;1;NA;NA;48
480624;03-03-2018;Second Half begins Watford 0, West Bromwich Albion 0.;45';Watford;West Bromwich Albion;0;0;0;0;1;0;0;NA;NA;NA;NA;NA;NA;NA;0;NA;NA;0;NA;0;0;NA;NA;NA;0;NA;NA;NA;0;NA;NA;0;NA;0;NA;NA;NA;0;NA;NA;0;0;NA;NA;NA;0;NA;NA;NA;NA;2;42;0;NA;NA;45
480624;03-03-2018;Foul by Jake Livermore (West Bromwich Albion).;46';Watford;West Bromwich Albion;0;0;0;0;0;0;0;NA;NA;NA;NA;NA;NA;NA;1;Jake Livermore;West Bromwich Albion;0;NA;0;0;NA;NA;NA;0;NA;NA;NA;0;NA;NA;0;NA;0;NA;NA;NA;0;NA;NA;0;0;NA;NA;NA;0;NA;NA;NA;NA;2;43;0;NA;NA;46
480624;03-03-2018;Richarlison (Watford) wins a free kick on the left wing.;46';Watford;West Bromwich Albion;0;0;0;0;0;0;0;NA;NA;NA;NA;NA;NA;NA;0;NA;NA;0;NA;0;0;NA;NA;NA;0;NA;NA;NA;0;NA;NA;0;NA;1;Richarlison;Watford;NA;0;NA;NA;0;0;NA;NA;NA;0;NA;NA;NA;NA;2;44;0;NA;NA;46
480624;03-03-2018;Attempt missed. Richarlison (Watford) header from the centre of the box is high and wide to the right. Assisted by José Holebas with a cross following a set piece situation.;47';Watford;West Bromwich Albion;0;0;0;0;0;1;0;missed;Richarlison;Watford;header;the centre of the box;high and wide to the right;José Holebas;0;NA;NA;1;cross;0;0;NA;NA;NA;0;NA;NA;NA;0;NA;NA;0;NA;0;NA;NA;NA;0;NA;NA;0;0;NA;NA;NA;0;NA;NA;NA;NA;2;45;0;NA;NA;47
480624;03-03-2018;Attempt missed. Salomón Rondón (West Bromwich Albion) right footed shot from the centre of the box misses to the left. Assisted by Matt Phillips.;48';Watford;West Bromwich Albion;0;0;0;0;0;1;0;missed;Salomón Rondón;West Bromwich Albion;right;the centre of the box;left;Matt Phillips;0;NA;NA;0;NA;0;0;NA;NA;NA;0;NA;NA;NA;0;NA;NA;0;NA;0;NA;NA;NA;0;NA;NA;0;0;NA;NA;NA;0;NA;NA;NA;NA;2;46;0;NA;NA;48
480624;03-03-2018;Delay in match Richarlison (Watford) because of an injury.;48';Watford;West Bromwich Albion;0;0;0;0;0;0;0;NA;NA;NA;NA;NA;NA;NA;0;NA;NA;0;NA;0;0;NA;NA;NA;0;NA;NA;NA;0;NA;NA;1;Watford;0;NA;NA;NA;0;NA;NA;0;0;NA;NA;NA;0;NA;NA;NA;NA;2;47;0;NA;NA;48
480624;03-03-2018;Delay over. They are ready to continue.;48';Watford;West Bromwich Albion;0;0;0;0;0;0;0;NA;NA;NA;NA;NA;NA;NA;0;NA;NA;0;NA;0;0;NA;NA;NA;0;NA;NA;NA;0;NA;NA;0;NA;0;NA;NA;NA;0;NA;NA;0;0;NA;NA;NA;0;NA;NA;NA;NA;2;48;0;NA;NA;48
480624;03-03-2018;Attempt saved. Salomón Rondón (West Bromwich Albion) right footed shot from outside the box is saved in the bottom left corner.;50';Watford;West Bromwich Albion;0;0;0;0;0;1;0;saved;Salomón Rondón;West Bromwich Albion;right;outside the box;the bottom left corner;NA;0;NA;NA;0;NA;0;0;NA;NA;NA;0;NA;NA;NA;0;NA;NA;0;NA;0;NA;NA;NA;0;NA;NA;0;0;NA;NA;NA;0;NA;NA;NA;NA;2;49;0;NA;NA;50
480624;03-03-2018;Attempt saved. Salomón Rondón (West Bromwich Albion) left footed shot from the left side of the box is saved in the centre of the goal. Assisted by Jay Rodriguez with a through ball.;51';Watford;West Bromwich Albion;0;0;0;0;0;1;0;saved;Salomón Rondón;West Bromwich Albion;left;the left side of the box;the centre of the goal;Jay Rodriguez;0;NA;NA;0;through;0;0;NA;NA;NA;0;NA;NA;NA;0;NA;NA;0;NA;0;NA;NA;NA;0;NA;NA;0;0;NA;NA;NA;0;NA;NA;NA;NA;2;50;0;NA;NA;51
480624;03-03-2018;Corner,  West Bromwich Albion. Conceded by André Carrillo.;51';Watford;West Bromwich Albion;0;0;0;0;0;0;0;NA;NA;NA;NA;NA;NA;NA;0;NA;NA;0;NA;0;0;NA;NA;NA;0;NA;NA;NA;0;NA;NA;0;NA;0;NA;NA;NA;1;West Bromwich Albion;André Carrillo;0;0;NA;NA;NA;0;NA;NA;NA;NA;2;51;0;NA;NA;51
480624;03-03-2018;Attempt missed. Richarlison (Watford) left footed shot from the centre of the box is close, but misses to the right. Assisted by Abdoulaye Doucouré with a headed pass.;52';Watford;West Bromwich Albion;0;0;0;0;0;1;0;missed;Richarlison;Watford;left;the centre of the box;close, but right;Abdoulaye Doucouré;0;NA;NA;0;NA;0;0;NA;NA;NA;0;NA;NA;NA;0;NA;NA;0;NA;0;NA;NA;NA;0;NA;NA;0;0;NA;NA;NA;0;NA;NA;NA;NA;2;52;0;NA;NA;52
480624;03-03-2018;Attempt missed. Salomón Rondón (West Bromwich Albion) header from the centre of the box misses to the right. Assisted by Kieran Gibbs with a cross.;54';Watford;West Bromwich Albion;0;0;0;0;0;1;0;missed;Salomón Rondón;West Bromwich Albion;header;the centre of the box;right;Kieran Gibbs;0;NA;NA;0;cross;0;0;NA;NA;NA;0;NA;NA;NA;0;NA;NA;0;NA;0;NA;NA;NA;0;NA;NA;0;0;NA;NA;NA;0;NA;NA;NA;NA;2;53;0;NA;NA;54
480624;03-03-2018;Substitution, Watford. Stefano Okaka replaces Richarlison.;54';Watford;West Bromwich Albion;0;0;0;0;0;0;0;NA;NA;NA;NA;NA;NA;NA;0;NA;NA;0;NA;0;0;NA;NA;NA;0;NA;NA;NA;0;NA;NA;0;NA;0;NA;NA;NA;0;NA;NA;1;0;Watford;Stefano Okaka;Richarlison;0;NA;NA;NA;NA;2;54;0;NA;NA;54
480624;03-03-2018;Offside, West Bromwich Albion. Craig Dawson tries a through ball, but Salomón Rondón is caught offside.;55';Watford;West Bromwich Albion;0;0;0;0;0;0;0;NA;NA;NA;NA;NA;NA;NA;0;NA;NA;0;NA;0;1;West Bromwich Albion;Salomón Rondón;Craig Dawson;0;NA;NA;NA;0;NA;NA;0;NA;0;NA;NA;NA;0;NA;NA;0;0;NA;NA;NA;0;NA;NA;NA;NA;2;55;0;NA;NA;55
480624;03-03-2018;Foul by Etienne Capoue (Watford).;58';Watford;West Bromwich Albion;0;0;0;0;0;0;0;NA;NA;NA;NA;NA;NA;NA;1;Etienne Capoue;Watford;0;NA;0;0;NA;NA;NA;0;NA;NA;NA;0;NA;NA;0;NA;0;NA;NA;NA;0;NA;NA;0;0;NA;NA;NA;0;NA;NA;NA;NA;2;56;0;NA;NA;58
480624;03-03-2018;Salomón Rondón (West Bromwich Albion) wins a free kick in the defensive half.;58';Watford;West Bromwich Albion;0;0;0;0;0;0;0;NA;NA;NA;NA;NA;NA;NA;0;NA;NA;0;NA;0;0;NA;NA;NA;0;NA;NA;NA;0;NA;NA;0;NA;1;Salomón Rondón;West Bromwich Albion;defensive half;0;NA;NA;0;0;NA;NA;NA;0;NA;NA;NA;NA;2;57;0;NA;NA;58
480624;03-03-2018;Foul by Abdoulaye Doucouré (Watford).;59';Watford;West Bromwich Albion;0;0;0;0;0;0;0;NA;NA;NA;NA;NA;NA;NA;1;Abdoulaye Doucouré;Watford;0;NA;0;0;NA;NA;NA;0;NA;NA;NA;0;NA;NA;0;NA;0;NA;NA;NA;0;NA;NA;0;0;NA;NA;NA;0;NA;NA;NA;NA;2;58;0;NA;NA;59
480624;03-03-2018;Grzegorz Krychowiak (West Bromwich Albion) wins a free kick in the defensive half.;59';Watford;West Bromwich Albion;0;0;0;0;0;0;0;NA;NA;NA;NA;NA;NA;NA;0;NA;NA;0;NA;0;0;NA;NA;NA;0;NA;NA;NA;0;NA;NA;0;NA;1;Grzegorz Krychowiak;West Bromwich Albion;defensive half;0;NA;NA;0;0;NA;NA;NA;0;NA;NA;NA;NA;2;59;0;NA;NA;59
480624;03-03-2018;Foul by Craig Dawson (West Bromwich Albion).;60';Watford;West Bromwich Albion;0;0;0;0;0;0;0;NA;NA;NA;NA;NA;NA;NA;1;Craig Dawson;West Bromwich Albion;0;NA;0;0;NA;NA;NA;0;NA;NA;NA;0;NA;NA;0;NA;0;NA;NA;NA;0;NA;NA;0;0;NA;NA;NA;0;NA;NA;NA;NA;2;60;0;NA;NA;60
480624;03-03-2018;Troy Deeney (Watford) wins a free kick on the left wing.;60';Watford;West Bromwich Albion;0;0;0;0;0;0;0;NA;NA;NA;NA;NA;NA;NA;0;NA;NA;0;NA;0;0;NA;NA;NA;0;NA;NA;NA;0;NA;NA;0;NA;1;Troy Deeney;Watford;NA;0;NA;NA;0;0;NA;NA;NA;0;NA;NA;NA;NA;2;61;0;NA;NA;60
480624;03-03-2018;Offside, Watford. Sebastian Prödl tries a through ball, but Stefano Okaka is caught offside.;62';Watford;West Bromwich Albion;0;0;0;0;0;0;0;NA;NA;NA;NA;NA;NA;NA;0;NA;NA;0;NA;0;1;Watford;Stefano Okaka;Sebastian Prödl;0;NA;NA;NA;0;NA;NA;0;NA;0;NA;NA;NA;0;NA;NA;0;0;NA;NA;NA;0;NA;NA;NA;NA;2;62;0;NA;NA;62
480624;03-03-2018;Offside, Watford. Daryl Janmaat tries a through ball, but Stefano Okaka is caught offside.;63';Watford;West Bromwich Albion;0;0;0;0;0;0;0;NA;NA;NA;NA;NA;NA;NA;0;NA;NA;0;NA;0;1;Watford;Stefano Okaka;Daryl Janmaat;0;NA;NA;NA;0;NA;NA;0;NA;0;NA;NA;NA;0;NA;NA;0;0;NA;NA;NA;0;NA;NA;NA;NA;2;63;0;NA;NA;63
480624;03-03-2018;Attempt missed. André Carrillo (Watford) right footed shot from outside the box is just a bit too high. Assisted by Roberto Pereyra.;65';Watford;West Bromwich Albion;0;0;0;0;0;1;0;missed;André Carrillo;Watford;right;outside the box;just a bit too high;Roberto Pereyra;0;NA;NA;0;NA;0;0;NA;NA;NA;0;NA;NA;NA;0;NA;NA;0;NA;0;NA;NA;NA;0;NA;NA;0;0;NA;NA;NA;0;NA;NA;NA;NA;2;64;0;NA;NA;65
480624;03-03-2018;Substitution, Watford. Will Hughes replaces André Carrillo.;66';Watford;West Bromwich Albion;0;0;0;0;0;0;0;NA;NA;NA;NA;NA;NA;NA;0;NA;NA;0;NA;0;0;NA;NA;NA;0;NA;NA;NA;0;NA;NA;0;NA;0;NA;NA;NA;0;NA;NA;1;0;Watford;Will Hughes;André Carrillo;0;NA;NA;NA;NA;2;65;0;NA;NA;66
480624;03-03-2018;Foul by Sebastian Prödl (Watford).;67';Watford;West Bromwich Albion;0;0;0;0;0;0;0;NA;NA;NA;NA;NA;NA;NA;1;Sebastian Prödl;Watford;0;NA;0;0;NA;NA;NA;0;NA;NA;NA;0;NA;NA;0;NA;0;NA;NA;NA;0;NA;NA;0;0;NA;NA;NA;0;NA;NA;NA;NA;2;66;0;NA;NA;67
480624;03-03-2018;Salomón Rondón (West Bromwich Albion) wins a free kick in the defensive half.;67';Watford;West Bromwich Albion;0;0;0;0;0;0;0;NA;NA;NA;NA;NA;NA;NA;0;NA;NA;0;NA;0;0;NA;NA;NA;0;NA;NA;NA;0;NA;NA;0;NA;1;Salomón Rondón;West Bromwich Albion;defensive half;0;NA;NA;0;0;NA;NA;NA;0;NA;NA;NA;NA;2;67;0;NA;NA;67
480624;03-03-2018;Hand ball by Matt Phillips (West Bromwich Albion).;68';Watford;West Bromwich Albion;0;0;0;0;0;0;0;NA;NA;NA;NA;NA;NA;NA;0;NA;NA;0;NA;0;0;NA;NA;NA;0;NA;NA;NA;0;NA;NA;0;NA;0;NA;NA;NA;0;NA;NA;0;0;NA;NA;NA;0;NA;NA;NA;NA;2;68;0;NA;NA;68
480624;03-03-2018;Attempt blocked. Jay Rodriguez (West Bromwich Albion) header from very close range is blocked. Assisted by Matt Phillips with a cross.;70';Watford;West Bromwich Albion;0;0;0;0;0;1;0;blocked;Jay Rodriguez;West Bromwich Albion;header;very close range;NA;Matt Phillips;0;NA;NA;0;cross;0;0;NA;NA;NA;0;NA;NA;NA;0;NA;NA;0;NA;0;NA;NA;NA;0;NA;NA;0;0;NA;NA;NA;0;NA;NA;NA;NA;2;69;0;NA;NA;70
480624;03-03-2018;Corner,  West Bromwich Albion. Conceded by Daryl Janmaat.;70';Watford;West Bromwich Albion;0;0;0;0;0;0;0;NA;NA;NA;NA;NA;NA;NA;0;NA;NA;0;NA;0;0;NA;NA;NA;0;NA;NA;NA;0;NA;NA;0;NA;0;NA;NA;NA;1;West Bromwich Albion;Daryl Janmaat;0;0;NA;NA;NA;0;NA;NA;NA;NA;2;70;0;NA;NA;70
480624;03-03-2018;Foul by Adrian Mariappa (Watford).;72';Watford;West Bromwich Albion;0;0;0;0;0;0;0;NA;NA;NA;NA;NA;NA;NA;1;Adrian Mariappa;Watford;0;NA;0;0;NA;NA;NA;0;NA;NA;NA;0;NA;NA;0;NA;0;NA;NA;NA;0;NA;NA;0;0;NA;NA;NA;0;NA;NA;NA;NA;2;71;0;NA;NA;72
480624;03-03-2018;Salomón Rondón (West Bromwich Albion) wins a free kick on the right wing.;72';Watford;West Bromwich Albion;0;0;0;0;0;0;0;NA;NA;NA;NA;NA;NA;NA;0;NA;NA;0;NA;0;0;NA;NA;NA;0;NA;NA;NA;0;NA;NA;0;NA;1;Salomón Rondón;West Bromwich Albion;NA;0;NA;NA;0;0;NA;NA;NA;0;NA;NA;NA;NA;2;72;0;NA;NA;72
480624;03-03-2018;Adrian Mariappa (Watford) is shown the yellow card for a bad foul.;72';Watford;West Bromwich Albion;0;0;0;0;0;0;0;NA;NA;NA;NA;NA;NA;NA;0;NA;NA;0;NA;0;0;NA;NA;NA;1;yellow;Adrian Mariappa;Watford;0;NA;NA;0;NA;0;NA;NA;NA;0;NA;NA;0;0;NA;NA;NA;0;NA;NA;NA;NA;2;73;0;NA;NA;72
480624;03-03-2018;Foul by Matt Phillips (West Bromwich Albion).;73';Watford;West Bromwich Albion;0;0;0;0;0;0;0;NA;NA;NA;NA;NA;NA;NA;1;Matt Phillips;West Bromwich Albion;0;NA;0;0;NA;NA;NA;0;NA;NA;NA;0;NA;NA;0;NA;0;NA;NA;NA;0;NA;NA;0;0;NA;NA;NA;0;NA;NA;NA;NA;2;74;0;NA;NA;73
480624;03-03-2018;Will Hughes (Watford) wins a free kick in the defensive half.;73';Watford;West Bromwich Albion;0;0;0;0;0;0;0;NA;NA;NA;NA;NA;NA;NA;0;NA;NA;0;NA;0;0;NA;NA;NA;0;NA;NA;NA;0;NA;NA;0;NA;1;Will Hughes;Watford;defensive half;0;NA;NA;0;0;NA;NA;NA;0;NA;NA;NA;NA;2;75;0;NA;NA;73
480624;03-03-2018;Corner,  Watford. Conceded by Craig Dawson.;75';Watford;West Bromwich Albion;0;0;0;0;0;0;0;NA;NA;NA;NA;NA;NA;NA;0;NA;NA;0;NA;0;0;NA;NA;NA;0;NA;NA;NA;0;NA;NA;0;NA;0;NA;NA;NA;1;Watford;Craig Dawson;0;0;NA;NA;NA;0;NA;NA;NA;NA;2;76;0;NA;NA;75
480624;03-03-2018;Attempt blocked. Stefano Okaka (Watford) right footed shot from the centre of the box is blocked. Assisted by José Holebas with a cross.;76';Watford;West Bromwich Albion;0;0;0;0;0;1;0;blocked;Stefano Okaka;Watford;right;the centre of the box;NA;José Holebas;0;NA;NA;0;cross;0;0;NA;NA;NA;0;NA;NA;NA;0;NA;NA;0;NA;0;NA;NA;NA;0;NA;NA;0;0;NA;NA;NA;0;NA;NA;NA;NA;2;77;0;NA;NA;76
480624;03-03-2018;Attempt blocked. Roberto Pereyra (Watford) right footed shot from outside the box is blocked.;76';Watford;West Bromwich Albion;0;0;0;0;0;1;0;blocked;Roberto Pereyra;Watford;right;outside the box;NA;NA;0;NA;NA;0;NA;0;0;NA;NA;NA;0;NA;NA;NA;0;NA;NA;0;NA;0;NA;NA;NA;0;NA;NA;0;0;NA;NA;NA;0;NA;NA;NA;NA;2;78;0;NA;NA;76
480624;03-03-2018;Goal!  Watford 1, West Bromwich Albion 0. Troy Deeney (Watford) right footed shot from outside the box to the high centre of the goal. Assisted by Will Hughes with a through ball.;77';Watford;West Bromwich Albion;1;0;0;0;0;1;0;goal;Troy Deeney;Watford;right;outside the box;high centre of the goal;Will Hughes;0;NA;NA;0;through;0;0;NA;NA;NA;0;NA;NA;NA;0;NA;NA;0;NA;0;NA;NA;NA;0;NA;NA;0;0;NA;NA;NA;0;NA;NA;NA;NA;2;79;0;NA;NA;77
480624;03-03-2018;Substitution, West Bromwich Albion. James McClean replaces Grzegorz Krychowiak.;81';Watford;West Bromwich Albion;1;0;0;0;0;0;0;NA;NA;NA;NA;NA;NA;NA;0;NA;NA;0;NA;0;0;NA;NA;NA;0;NA;NA;NA;0;NA;NA;0;NA;0;NA;NA;NA;0;NA;NA;1;0;West Bromwich Albion;James McClean;Grzegorz Krychowiak;0;NA;NA;NA;NA;2;80;0;NA;NA;81
480624;03-03-2018;Foul by Troy Deeney (Watford).;82';Watford;West Bromwich Albion;1;0;0;0;0;0;0;NA;NA;NA;NA;NA;NA;NA;1;Troy Deeney;Watford;0;NA;0;0;NA;NA;NA;0;NA;NA;NA;0;NA;NA;0;NA;0;NA;NA;NA;0;NA;NA;0;0;NA;NA;NA;0;NA;NA;NA;NA;2;81;0;NA;NA;82
480624;03-03-2018;Jonny Evans (West Bromwich Albion) wins a free kick in the defensive half.;82';Watford;West Bromwich Albion;1;0;0;0;0;0;0;NA;NA;NA;NA;NA;NA;NA;0;NA;NA;0;NA;0;0;NA;NA;NA;0;NA;NA;NA;0;NA;NA;0;NA;1;Jonny Evans;West Bromwich Albion;defensive half;0;NA;NA;0;0;NA;NA;NA;0;NA;NA;NA;NA;2;82;0;NA;NA;82
