480656;31-01-2018;Attempt missed. Christian Eriksen (Tottenham Hotspur) right footed shot from outside the box is close, but misses to the left. Assisted by Son Heung-Min.;65';Tottenham Hotspur;Manchester United;2;0;0;0;0;1;0;missed;Christian Eriksen;Tottenham Hotspur;right;outside the box;close, but left;Son Heung-Min;0;NA;NA;0;NA;0;0;NA;NA;NA;0;NA;NA;NA;0;NA;NA;0;NA;0;NA;NA;NA;0;NA;NA;0;0;NA;NA;NA;0;NA;NA;NA;NA;2;77;0;NA;NA;65
480656;31-01-2018;Attempt saved. Ben Davies (Tottenham Hotspur) left footed shot from outside the box is saved in the bottom left corner. Assisted by Mousa Dembélé.;66';Tottenham Hotspur;Manchester United;2;0;0;0;0;1;0;saved;Ben Davies;Tottenham Hotspur;left;outside the box;the bottom left corner;Mousa Dembélé;0;NA;NA;0;NA;0;0;NA;NA;NA;0;NA;NA;NA;0;NA;NA;0;NA;0;NA;NA;NA;0;NA;NA;0;0;NA;NA;NA;0;NA;NA;NA;NA;2;78;0;NA;NA;66
480656;31-01-2018;Attempt saved. Harry Kane (Tottenham Hotspur) right footed shot from the centre of the box is saved in the bottom right corner. Assisted by Son Heung-Min.;67';Tottenham Hotspur;Manchester United;2;0;0;0;0;1;0;saved;Harry Kane;Tottenham Hotspur;right;the centre of the box;the bottom right corner;Son Heung-Min;0;NA;NA;0;NA;0;0;NA;NA;NA;0;NA;NA;NA;0;NA;NA;0;NA;0;NA;NA;NA;0;NA;NA;0;0;NA;NA;NA;0;NA;NA;NA;NA;2;79;0;NA;NA;67
480656;31-01-2018;Foul by Juan Mata (Manchester United).;68';Tottenham Hotspur;Manchester United;2;0;0;0;0;0;0;NA;NA;NA;NA;NA;NA;NA;1;Juan Mata;Manchester United;0;NA;0;0;NA;NA;NA;0;NA;NA;NA;0;NA;NA;0;NA;0;NA;NA;NA;0;NA;NA;0;0;NA;NA;NA;0;NA;NA;NA;NA;2;80;0;NA;NA;68
480656;31-01-2018;Kieran Trippier (Tottenham Hotspur) wins a free kick on the right wing.;68';Tottenham Hotspur;Manchester United;2;0;0;0;0;0;0;NA;NA;NA;NA;NA;NA;NA;0;NA;NA;0;NA;0;0;NA;NA;NA;0;NA;NA;NA;0;NA;NA;0;NA;1;Kieran Trippier;Tottenham Hotspur;NA;0;NA;NA;0;0;NA;NA;NA;0;NA;NA;NA;NA;2;81;0;NA;NA;68
480656;31-01-2018;Attempt saved. Son Heung-Min (Tottenham Hotspur) right footed shot from the right side of the box is saved in the centre of the goal. Assisted by Christian Eriksen with a through ball.;69';Tottenham Hotspur;Manchester United;2;0;0;0;0;1;0;saved;Son Heung-Min;Tottenham Hotspur;right;the right side of the box;the centre of the goal;Christian Eriksen;0;NA;NA;0;through;0;0;NA;NA;NA;0;NA;NA;NA;0;NA;NA;0;NA;0;NA;NA;NA;0;NA;NA;0;0;NA;NA;NA;0;NA;NA;NA;NA;2;82;0;NA;NA;69
480656;31-01-2018;Corner,  Tottenham Hotspur. Conceded by David de Gea.;69';Tottenham Hotspur;Manchester United;2;0;0;0;0;0;0;NA;NA;NA;NA;NA;NA;NA;0;NA;NA;0;NA;0;0;NA;NA;NA;0;NA;NA;NA;0;NA;NA;0;NA;0;NA;NA;NA;1;Tottenham Hotspur;David de Gea;0;0;NA;NA;NA;0;NA;NA;NA;NA;2;83;0;NA;NA;69
480656;31-01-2018;Substitution, Manchester United. Ander Herrera replaces Marouane Fellaini because of an injury.;70';Tottenham Hotspur;Manchester United;2;0;0;0;0;0;0;NA;NA;NA;NA;NA;NA;NA;0;NA;NA;0;NA;0;0;NA;NA;NA;0;NA;NA;NA;0;NA;NA;0;NA;0;NA;NA;NA;0;NA;NA;1;1;Manchester United;Ander Herrera;Marouane Fellaini;0;NA;NA;NA;NA;2;84;0;NA;NA;70
480656;31-01-2018;Foul by Ashley Young (Manchester United).;73';Tottenham Hotspur;Manchester United;2;0;0;0;0;0;0;NA;NA;NA;NA;NA;NA;NA;1;Ashley Young;Manchester United;0;NA;0;0;NA;NA;NA;0;NA;NA;NA;0;NA;NA;0;NA;0;NA;NA;NA;0;NA;NA;0;0;NA;NA;NA;0;NA;NA;NA;NA;2;85;0;NA;NA;73
480656;31-01-2018;Son Heung-Min (Tottenham Hotspur) wins a free kick on the right wing.;73';Tottenham Hotspur;Manchester United;2;0;0;0;0;0;0;NA;NA;NA;NA;NA;NA;NA;0;NA;NA;0;NA;0;0;NA;NA;NA;0;NA;NA;NA;0;NA;NA;0;NA;1;Son Heung-Min;Tottenham Hotspur;NA;0;NA;NA;0;0;NA;NA;NA;0;NA;NA;NA;NA;2;86;0;NA;NA;73
480656;31-01-2018;Ashley Young (Manchester United) is shown the yellow card.;73';Tottenham Hotspur;Manchester United;2;0;0;0;0;0;0;NA;NA;NA;NA;NA;NA;NA;0;NA;NA;0;NA;0;0;NA;NA;NA;1;yellow;Ashley Young;Manchester United;0;NA;NA;0;NA;0;NA;NA;NA;0;NA;NA;0;0;NA;NA;NA;0;NA;NA;NA;NA;2;87;0;NA;NA;73
480656;31-01-2018;Corner,  Tottenham Hotspur. Conceded by Chris Smalling.;74';Tottenham Hotspur;Manchester United;2;0;0;0;0;0;0;NA;NA;NA;NA;NA;NA;NA;0;NA;NA;0;NA;0;0;NA;NA;NA;0;NA;NA;NA;0;NA;NA;0;NA;0;NA;NA;NA;1;Tottenham Hotspur;Chris Smalling;0;0;NA;NA;NA;0;NA;NA;NA;NA;2;88;0;NA;NA;74
480656;31-01-2018;Attempt missed. Harry Kane (Tottenham Hotspur) right footed shot from outside the box is too high. Assisted by Christian Eriksen.;75';Tottenham Hotspur;Manchester United;2;0;0;0;0;1;0;missed;Harry Kane;Tottenham Hotspur;right;outside the box;too high;Christian Eriksen;0;NA;NA;0;NA;0;0;NA;NA;NA;0;NA;NA;NA;0;NA;NA;0;NA;0;NA;NA;NA;0;NA;NA;0;0;NA;NA;NA;0;NA;NA;NA;NA;2;89;0;NA;NA;75
480656;31-01-2018;Attempt blocked. Harry Kane (Tottenham Hotspur) right footed shot from the right side of the box is blocked. Assisted by Christian Eriksen.;76';Tottenham Hotspur;Manchester United;2;0;0;0;0;1;0;blocked;Harry Kane;Tottenham Hotspur;right;the right side of the box;NA;Christian Eriksen;0;NA;NA;0;NA;0;0;NA;NA;NA;0;NA;NA;NA;0;NA;NA;0;NA;0;NA;NA;NA;0;NA;NA;0;0;NA;NA;NA;0;NA;NA;NA;NA;2;90;0;NA;NA;76
480656;31-01-2018;Corner,  Tottenham Hotspur. Conceded by Chris Smalling.;76';Tottenham Hotspur;Manchester United;2;0;0;0;0;0;0;NA;NA;NA;NA;NA;NA;NA;0;NA;NA;0;NA;0;0;NA;NA;NA;0;NA;NA;NA;0;NA;NA;0;NA;0;NA;NA;NA;1;Tottenham Hotspur;Chris Smalling;0;0;NA;NA;NA;0;NA;NA;NA;NA;2;91;0;NA;NA;76
480656;31-01-2018;Attempt blocked. Dele Alli (Tottenham Hotspur) right footed shot from outside the box is blocked. Assisted by Son Heung-Min.;77';Tottenham Hotspur;Manchester United;2;0;0;0;0;1;0;blocked;Dele Alli;Tottenham Hotspur;right;outside the box;NA;Son Heung-Min;0;NA;NA;0;NA;0;0;NA;NA;NA;0;NA;NA;NA;0;NA;NA;0;NA;0;NA;NA;NA;0;NA;NA;0;0;NA;NA;NA;0;NA;NA;NA;NA;2;92;0;NA;NA;77
480656;31-01-2018;Attempt blocked. Eric Dier (Tottenham Hotspur) right footed shot from outside the box is blocked.;77';Tottenham Hotspur;Manchester United;2;0;0;0;0;1;0;blocked;Eric Dier;Tottenham Hotspur;right;outside the box;NA;NA;0;NA;NA;0;NA;0;0;NA;NA;NA;0;NA;NA;NA;0;NA;NA;0;NA;0;NA;NA;NA;0;NA;NA;0;0;NA;NA;NA;0;NA;NA;NA;NA;2;93;0;NA;NA;77
480656;31-01-2018;Corner,  Tottenham Hotspur. Conceded by Phil Jones.;77';Tottenham Hotspur;Manchester United;2;0;0;0;0;0;0;NA;NA;NA;NA;NA;NA;NA;0;NA;NA;0;NA;0;0;NA;NA;NA;0;NA;NA;NA;0;NA;NA;0;NA;0;NA;NA;NA;1;Tottenham Hotspur;Phil Jones;0;0;NA;NA;NA;0;NA;NA;NA;NA;2;94;0;NA;NA;77
480656;31-01-2018;Substitution, Tottenham Hotspur. Erik Lamela replaces Son Heung-Min.;80';Tottenham Hotspur;Manchester United;2;0;0;0;0;0;0;NA;NA;NA;NA;NA;NA;NA;0;NA;NA;0;NA;0;0;NA;NA;NA;0;NA;NA;NA;0;NA;NA;0;NA;0;NA;NA;NA;0;NA;NA;1;0;Tottenham Hotspur;Erik Lamela;Son Heung-Min;0;NA;NA;NA;NA;2;95;0;NA;NA;80
480656;31-01-2018;Ben Davies (Tottenham Hotspur) wins a free kick in the attacking half.;84';Tottenham Hotspur;Manchester United;2;0;0;0;0;0;0;NA;NA;NA;NA;NA;NA;NA;0;NA;NA;0;NA;0;0;NA;NA;NA;0;NA;NA;NA;0;NA;NA;0;NA;1;Ben Davies;Tottenham Hotspur;attacking half;0;NA;NA;0;0;NA;NA;NA;0;NA;NA;NA;NA;2;96;0;NA;NA;84
480656;31-01-2018;Foul by Ander Herrera (Manchester United).;84';Tottenham Hotspur;Manchester United;2;0;0;0;0;0;0;NA;NA;NA;NA;NA;NA;NA;1;Ander Herrera;Manchester United;0;NA;0;0;NA;NA;NA;0;NA;NA;NA;0;NA;NA;0;NA;0;NA;NA;NA;0;NA;NA;0;0;NA;NA;NA;0;NA;NA;NA;NA;2;97;0;NA;NA;84
480656;31-01-2018;Alexis Sánchez (Manchester United) wins a free kick in the defensive half.;85';Tottenham Hotspur;Manchester United;2;0;0;0;0;0;0;NA;NA;NA;NA;NA;NA;NA;0;NA;NA;0;NA;0;0;NA;NA;NA;0;NA;NA;NA;0;NA;NA;0;NA;1;Alexis Sánchez;Manchester United;defensive half;0;NA;NA;0;0;NA;NA;NA;0;NA;NA;NA;NA;2;98;0;NA;NA;85
480656;31-01-2018;Foul by Dele Alli (Tottenham Hotspur).;85';Tottenham Hotspur;Manchester United;2;0;0;0;0;0;0;NA;NA;NA;NA;NA;NA;NA;1;Dele Alli;Tottenham Hotspur;0;NA;0;0;NA;NA;NA;0;NA;NA;NA;0;NA;NA;0;NA;0;NA;NA;NA;0;NA;NA;0;0;NA;NA;NA;0;NA;NA;NA;NA;2;99;0;NA;NA;85
480656;31-01-2018;Dele Alli (Tottenham Hotspur) is shown the yellow card for a bad foul.;85';Tottenham Hotspur;Manchester United;2;0;0;0;0;0;0;NA;NA;NA;NA;NA;NA;NA;0;NA;NA;0;NA;0;0;NA;NA;NA;1;yellow;Dele Alli;Tottenham Hotspur;0;NA;NA;0;NA;0;NA;NA;NA;0;NA;NA;0;0;NA;NA;NA;0;NA;NA;NA;NA;2;100;0;NA;NA;85
480656;31-01-2018;Foul by Antonio Valencia (Manchester United).;86';Tottenham Hotspur;Manchester United;2;0;0;0;0;0;0;NA;NA;NA;NA;NA;NA;NA;1;Antonio Valencia;Manchester United;0;NA;0;0;NA;NA;NA;0;NA;NA;NA;0;NA;NA;0;NA;0;NA;NA;NA;0;NA;NA;0;0;NA;NA;NA;0;NA;NA;NA;NA;2;101;0;NA;NA;86
480656;31-01-2018;Harry Kane (Tottenham Hotspur) wins a free kick in the attacking half.;86';Tottenham Hotspur;Manchester United;2;0;0;0;0;0;0;NA;NA;NA;NA;NA;NA;NA;0;NA;NA;0;NA;0;0;NA;NA;NA;0;NA;NA;NA;0;NA;NA;0;NA;1;Harry Kane;Tottenham Hotspur;attacking half;0;NA;NA;0;0;NA;NA;NA;0;NA;NA;NA;NA;2;102;0;NA;NA;86
480656;31-01-2018;Substitution, Tottenham Hotspur. Moussa Sissoko replaces Dele Alli.;88';Tottenham Hotspur;Manchester United;2;0;0;0;0;0;0;NA;NA;NA;NA;NA;NA;NA;0;NA;NA;0;NA;0;0;NA;NA;NA;0;NA;NA;NA;0;NA;NA;0;NA;0;NA;NA;NA;0;NA;NA;1;0;Tottenham Hotspur;Moussa Sissoko;Dele Alli;0;NA;NA;NA;NA;2;103;0;NA;NA;88
480656;31-01-2018;Attempt missed. Harry Kane (Tottenham Hotspur) right footed shot from outside the box is too high from a direct free kick.;88';Tottenham Hotspur;Manchester United;2;0;0;0;0;1;0;missed;Harry Kane;Tottenham Hotspur;right;outside the box;too high;NA;0;NA;NA;0;NA;0;0;NA;NA;NA;0;NA;NA;NA;0;NA;NA;0;NA;0;NA;NA;NA;0;NA;NA;0;0;NA;NA;NA;0;NA;NA;NA;NA;2;104;0;NA;NA;88
480656;31-01-2018;Offside, Manchester United. Alexis Sánchez tries a through ball, but Juan Mata is caught offside.;88';Tottenham Hotspur;Manchester United;2;0;0;0;0;0;0;NA;NA;NA;NA;NA;NA;NA;0;NA;NA;0;NA;0;1;Manchester United;Juan Mata;Alexis Sánchez;0;NA;NA;NA;0;NA;NA;0;NA;0;NA;NA;NA;0;NA;NA;0;0;NA;NA;NA;0;NA;NA;NA;NA;2;105;0;NA;NA;88
480656;31-01-2018;Substitution, Tottenham Hotspur. Victor Wanyama replaces Mousa Dembélé.;90'+1';Tottenham Hotspur;Manchester United;2;0;0;0;0;0;0;NA;NA;NA;NA;NA;NA;NA;0;NA;NA;0;NA;0;0;NA;NA;NA;0;NA;NA;NA;0;NA;NA;0;NA;0;NA;NA;NA;0;NA;NA;1;0;Tottenham Hotspur;Victor Wanyama;Mousa Dembélé;0;NA;NA;NA;NA;2;106;1;NA;NA;91
480656;31-01-2018;Ben Davies (Tottenham Hotspur) wins a free kick in the defensive half.;90'+2';Tottenham Hotspur;Manchester United;2;0;0;0;0;0;0;NA;NA;NA;NA;NA;NA;NA;0;NA;NA;0;NA;0;0;NA;NA;NA;0;NA;NA;NA;0;NA;NA;0;NA;1;Ben Davies;Tottenham Hotspur;defensive half;0;NA;NA;0;0;NA;NA;NA;0;NA;NA;NA;NA;2;107;1;NA;NA;92
480656;31-01-2018;Foul by Romelu Lukaku (Manchester United).;90'+2';Tottenham Hotspur;Manchester United;2;0;0;0;0;0;0;NA;NA;NA;NA;NA;NA;NA;1;Romelu Lukaku;Manchester United;0;NA;0;0;NA;NA;NA;0;NA;NA;NA;0;NA;NA;0;NA;0;NA;NA;NA;0;NA;NA;0;0;NA;NA;NA;0;NA;NA;NA;NA;2;108;1;NA;NA;92
480656;31-01-2018;Offside, Manchester United. Ashley Young tries a through ball, but Juan Mata is caught offside.;90'+3';Tottenham Hotspur;Manchester United;2;0;0;0;0;0;0;NA;NA;NA;NA;NA;NA;NA;0;NA;NA;0;NA;0;1;Manchester United;Juan Mata;Ashley Young;0;NA;NA;NA;0;NA;NA;0;NA;0;NA;NA;NA;0;NA;NA;0;0;NA;NA;NA;0;NA;NA;NA;NA;2;109;1;NA;NA;93
480656;31-01-2018;Attempt missed. Erik Lamela (Tottenham Hotspur) right footed shot from the right side of the box is too high. Assisted by Christian Eriksen.;90'+4';Tottenham Hotspur;Manchester United;2;0;0;0;0;1;0;missed;Erik Lamela;Tottenham Hotspur;right;the right side of the box;too high;Christian Eriksen;0;NA;NA;0;NA;0;0;NA;NA;NA;0;NA;NA;NA;0;NA;NA;0;NA;0;NA;NA;NA;0;NA;NA;0;0;NA;NA;NA;0;NA;NA;NA;NA;2;110;1;NA;NA;94
480656;31-01-2018;Second Half ends, Tottenham Hotspur 2, Manchester United 0.;90'+4';Tottenham Hotspur;Manchester United;2;0;1;0;0;0;0;NA;NA;NA;NA;NA;NA;NA;0;NA;NA;0;NA;0;0;NA;NA;NA;0;NA;NA;NA;0;NA;NA;0;NA;0;NA;NA;NA;0;NA;NA;0;0;NA;NA;NA;0;NA;NA;NA;NA;2;111;1;NA;NA;94
480656;31-01-2018;Match ends, Tottenham Hotspur 2, Manchester United 0.;90'+4';Tottenham Hotspur;Manchester United;2;0;0;1;0;0;0;NA;NA;NA;NA;NA;NA;NA;0;NA;NA;0;NA;0;0;NA;NA;NA;0;NA;NA;NA;0;NA;NA;0;NA;0;NA;NA;NA;0;NA;NA;0;0;NA;NA;NA;0;NA;NA;NA;NA;2;112;1;NA;NA;94
