480589;31-03-2018;Penalty Brighton and Hove Albion. José Izquierdo draws a foul in the penalty area.;76';Brighton & Hove Albion;Leicester City;0;0;0;0;0;0;0;NA;NA;NA;NA;NA;NA;NA;0;NA;NA;0;NA;0;0;NA;NA;NA;0;NA;NA;NA;0;NA;NA;0;NA;0;NA;NA;NA;0;NA;NA;0;0;NA;NA;NA;1;Brighton and Hove Albion;José Izquierdo;NA;NA;2;77;0;NA;NA;76
480589;31-03-2018;Penalty conceded by Harry Maguire (Leicester City) after a foul in the penalty area.;76';Brighton & Hove Albion;Leicester City;0;0;0;0;0;0;0;NA;NA;NA;NA;NA;NA;NA;0;NA;NA;0;NA;0;0;NA;NA;NA;0;NA;NA;NA;0;NA;NA;0;NA;0;NA;NA;NA;0;NA;NA;0;0;NA;NA;NA;1;Leicester City;NA;Harry Maguire;Leicester City;2;78;0;NA;NA;76
480589;31-03-2018;Penalty saved! Glenn Murray (Brighton and Hove Albion) fails to capitalise on this great opportunity,  right footed shot saved  in the bottom right corner.;77';Brighton & Hove Albion;Leicester City;0;0;0;0;0;1;1;saved;Glenn Murray;Brighton and Hove Albion;right;NA;NA;NA;0;NA;NA;0;NA;0;0;NA;NA;NA;0;NA;NA;NA;0;NA;NA;0;NA;0;NA;NA;NA;0;NA;NA;0;0;NA;NA;NA;1;NA;NA;NA;NA;2;79;0;NA;NA;77
480589;31-03-2018;Foul by Gaëtan Bong (Brighton and Hove Albion).;79';Brighton & Hove Albion;Leicester City;0;0;0;0;0;0;0;NA;NA;NA;NA;NA;NA;NA;1;Gaëtan Bong;Brighton and Hove Albion;0;NA;0;0;NA;NA;NA;0;NA;NA;NA;0;NA;NA;0;NA;0;NA;NA;NA;0;NA;NA;0;0;NA;NA;NA;0;NA;NA;NA;NA;2;80;0;NA;NA;79
480589;31-03-2018;Riyad Mahrez (Leicester City) wins a free kick on the right wing.;79';Brighton & Hove Albion;Leicester City;0;0;0;0;0;0;0;NA;NA;NA;NA;NA;NA;NA;0;NA;NA;0;NA;0;0;NA;NA;NA;0;NA;NA;NA;0;NA;NA;0;NA;1;Riyad Mahrez;Leicester City;NA;0;NA;NA;0;0;NA;NA;NA;0;NA;NA;NA;NA;2;81;0;NA;NA;79
480589;31-03-2018;Gaëtan Bong (Brighton and Hove Albion) is shown the yellow card for a bad foul.;79';Brighton & Hove Albion;Leicester City;0;0;0;0;0;0;0;NA;NA;NA;NA;NA;NA;NA;0;NA;NA;0;NA;0;0;NA;NA;NA;1;yellow;Gaëtan Bong;Brighton and Hove Albion;0;NA;NA;0;NA;0;NA;NA;NA;0;NA;NA;0;0;NA;NA;NA;0;NA;NA;NA;NA;2;82;0;NA;NA;79
480589;31-03-2018;Substitution, Leicester City. Demarai Gray replaces Marc Albrighton.;79';Brighton & Hove Albion;Leicester City;0;0;0;0;0;0;0;NA;NA;NA;NA;NA;NA;NA;0;NA;NA;0;NA;0;0;NA;NA;NA;0;NA;NA;NA;0;NA;NA;0;NA;0;NA;NA;NA;0;NA;NA;1;0;Leicester City;Demarai Gray;Marc Albrighton;0;NA;NA;NA;NA;2;83;0;NA;NA;79
480589;31-03-2018;Corner,  Leicester City. Conceded by Gaëtan Bong.;81';Brighton & Hove Albion;Leicester City;0;0;0;0;0;0;0;NA;NA;NA;NA;NA;NA;NA;0;NA;NA;0;NA;0;0;NA;NA;NA;0;NA;NA;NA;0;NA;NA;0;NA;0;NA;NA;NA;1;Leicester City;Gaëtan Bong;0;0;NA;NA;NA;0;NA;NA;NA;NA;2;84;0;NA;NA;81
480589;31-03-2018;Attempt missed. Wilfred Ndidi (Leicester City) right footed shot from outside the box is high and wide to the right following a corner.;81';Brighton & Hove Albion;Leicester City;0;0;0;0;0;1;0;missed;Wilfred Ndidi;Leicester City;right;outside the box;high and wide to the right;NA;0;NA;NA;0;NA;1;0;NA;NA;NA;0;NA;NA;NA;0;NA;NA;0;NA;0;NA;NA;NA;0;NA;NA;0;0;NA;NA;NA;0;NA;NA;NA;NA;2;85;0;NA;NA;81
480589;31-03-2018;Foul by Beram Kayal (Brighton and Hove Albion).;82';Brighton & Hove Albion;Leicester City;0;0;0;0;0;0;0;NA;NA;NA;NA;NA;NA;NA;1;Beram Kayal;Brighton and Hove Albion;0;NA;0;0;NA;NA;NA;0;NA;NA;NA;0;NA;NA;0;NA;0;NA;NA;NA;0;NA;NA;0;0;NA;NA;NA;0;NA;NA;NA;NA;2;86;0;NA;NA;82
480589;31-03-2018;Riyad Mahrez (Leicester City) wins a free kick in the attacking half.;82';Brighton & Hove Albion;Leicester City;0;0;0;0;0;0;0;NA;NA;NA;NA;NA;NA;NA;0;NA;NA;0;NA;0;0;NA;NA;NA;0;NA;NA;NA;0;NA;NA;0;NA;1;Riyad Mahrez;Leicester City;attacking half;0;NA;NA;0;0;NA;NA;NA;0;NA;NA;NA;NA;2;87;0;NA;NA;82
480589;31-03-2018;Goal!  Brighton and Hove Albion 0, Leicester City 1. Vicente Iborra (Leicester City) header from the centre of the box to the bottom right corner. Assisted by Ben Chilwell with a cross following a set piece situation.;83';Brighton & Hove Albion;Leicester City;0;1;0;0;0;1;0;goal;Vicente Iborra;Leicester City;header;the centre of the box;bottom right corner;Ben Chilwell;0;NA;NA;1;cross;0;0;NA;NA;NA;0;NA;NA;NA;0;NA;NA;0;NA;0;NA;NA;NA;0;NA;NA;0;0;NA;NA;NA;0;NA;NA;NA;NA;2;88;0;NA;NA;83
480589;31-03-2018;Substitution, Brighton and Hove Albion. Sam Baldock replaces Beram Kayal.;84';Brighton & Hove Albion;Leicester City;0;1;0;0;0;0;0;NA;NA;NA;NA;NA;NA;NA;0;NA;NA;0;NA;0;0;NA;NA;NA;0;NA;NA;NA;0;NA;NA;0;NA;0;NA;NA;NA;0;NA;NA;1;0;Brighton and Hove Albion;Sam Baldock;Beram Kayal;0;NA;NA;NA;NA;2;89;0;NA;NA;84
480589;31-03-2018;Substitution, Leicester City. Christian Fuchs replaces Riyad Mahrez.;85';Brighton & Hove Albion;Leicester City;0;1;0;0;0;0;0;NA;NA;NA;NA;NA;NA;NA;0;NA;NA;0;NA;0;0;NA;NA;NA;0;NA;NA;NA;0;NA;NA;0;NA;0;NA;NA;NA;0;NA;NA;1;0;Leicester City;Christian Fuchs;Riyad Mahrez;0;NA;NA;NA;NA;2;90;0;NA;NA;85
480589;31-03-2018;Foul by Wilfred Ndidi (Leicester City).;87';Brighton & Hove Albion;Leicester City;0;1;0;0;0;0;0;NA;NA;NA;NA;NA;NA;NA;1;Wilfred Ndidi;Leicester City;0;NA;0;0;NA;NA;NA;0;NA;NA;NA;0;NA;NA;0;NA;0;NA;NA;NA;0;NA;NA;0;0;NA;NA;NA;0;NA;NA;NA;NA;2;91;0;NA;NA;87
480589;31-03-2018;Shane Duffy (Brighton and Hove Albion) wins a free kick in the attacking half.;87';Brighton & Hove Albion;Leicester City;0;1;0;0;0;0;0;NA;NA;NA;NA;NA;NA;NA;0;NA;NA;0;NA;0;0;NA;NA;NA;0;NA;NA;NA;0;NA;NA;0;NA;1;Shane Duffy;Brighton and Hove Albion;attacking half;0;NA;NA;0;0;NA;NA;NA;0;NA;NA;NA;NA;2;92;0;NA;NA;87
480589;31-03-2018;Second yellow card to Wilfred Ndidi (Leicester City) for a bad foul.;87';Brighton & Hove Albion;Leicester City;0;1;0;0;0;0;0;NA;NA;NA;NA;NA;NA;NA;0;NA;NA;0;NA;0;0;NA;NA;NA;1;yellow;NA;Leicester City;0;NA;NA;0;NA;0;NA;NA;NA;0;NA;NA;0;0;NA;NA;NA;0;NA;NA;NA;NA;2;93;0;NA;NA;87
480589;31-03-2018;Attempt saved. Solly March (Brighton and Hove Albion) left footed shot from outside the box is saved in the top centre of the goal.;88';Brighton & Hove Albion;Leicester City;0;1;0;0;0;1;0;saved;Solly March;Brighton and Hove Albion;left;outside the box;the top centre of the goal;NA;0;NA;NA;0;NA;0;0;NA;NA;NA;0;NA;NA;NA;0;NA;NA;0;NA;0;NA;NA;NA;0;NA;NA;0;0;NA;NA;NA;0;NA;NA;NA;NA;2;94;0;NA;NA;88
480589;31-03-2018;Corner,  Brighton and Hove Albion. Conceded by Kasper Schmeichel.;88';Brighton & Hove Albion;Leicester City;0;1;0;0;0;0;0;NA;NA;NA;NA;NA;NA;NA;0;NA;NA;0;NA;0;0;NA;NA;NA;0;NA;NA;NA;0;NA;NA;0;NA;0;NA;NA;NA;1;Brighton and Hove Albion;Kasper Schmeichel;0;0;NA;NA;NA;0;NA;NA;NA;NA;2;95;0;NA;NA;88
480589;31-03-2018;Corner,  Brighton and Hove Albion. Conceded by Ben Chilwell.;89';Brighton & Hove Albion;Leicester City;0;1;0;0;0;0;0;NA;NA;NA;NA;NA;NA;NA;0;NA;NA;0;NA;0;0;NA;NA;NA;0;NA;NA;NA;0;NA;NA;0;NA;0;NA;NA;NA;1;Brighton and Hove Albion;Ben Chilwell;0;0;NA;NA;NA;0;NA;NA;NA;NA;2;96;0;NA;NA;89
480589;31-03-2018;Corner,  Brighton and Hove Albion. Conceded by Vicente Iborra.;90'+1';Brighton & Hove Albion;Leicester City;0;1;0;0;0;0;0;NA;NA;NA;NA;NA;NA;NA;0;NA;NA;0;NA;0;0;NA;NA;NA;0;NA;NA;NA;0;NA;NA;0;NA;0;NA;NA;NA;1;Brighton and Hove Albion;Vicente Iborra;0;0;NA;NA;NA;0;NA;NA;NA;NA;2;97;1;NA;NA;91
480589;31-03-2018;Attempt missed. Glenn Murray (Brighton and Hove Albion) header from the centre of the box misses to the left. Assisted by Pascal Groß with a cross.;90'+2';Brighton & Hove Albion;Leicester City;0;1;0;0;0;1;0;missed;Glenn Murray;Brighton and Hove Albion;header;the centre of the box;left;Pascal Groß;0;NA;NA;0;cross;0;0;NA;NA;NA;0;NA;NA;NA;0;NA;NA;0;NA;0;NA;NA;NA;0;NA;NA;0;0;NA;NA;NA;0;NA;NA;NA;NA;2;98;1;NA;NA;92
480589;31-03-2018;Corner,  Brighton and Hove Albion. Conceded by Christian Fuchs.;90'+3';Brighton & Hove Albion;Leicester City;0;1;0;0;0;0;0;NA;NA;NA;NA;NA;NA;NA;0;NA;NA;0;NA;0;0;NA;NA;NA;0;NA;NA;NA;0;NA;NA;0;NA;0;NA;NA;NA;1;Brighton and Hove Albion;Christian Fuchs;0;0;NA;NA;NA;0;NA;NA;NA;NA;2;99;1;NA;NA;93
480589;31-03-2018;Goal!  Brighton and Hove Albion 0, Leicester City 2. Jamie Vardy (Leicester City) left footed shot from very close range to the bottom left corner. Assisted by Demarai Gray following a fast break.;90'+6';Brighton & Hove Albion;Leicester City;0;2;0;0;0;1;0;goal;Jamie Vardy;Leicester City;left;left shot very close range;bottom left corner;Demarai Gray;0;NA;NA;0;NA;0;0;NA;NA;NA;0;NA;NA;NA;0;NA;NA;0;NA;0;NA;NA;NA;0;NA;NA;0;0;NA;NA;NA;0;NA;NA;NA;NA;2;100;1;NA;NA;96
480589;31-03-2018;Second Half ends, Brighton and Hove Albion 0, Leicester City 2.;90'+7';Brighton & Hove Albion;Leicester City;0;2;1;0;0;0;0;NA;NA;NA;NA;NA;NA;NA;0;NA;NA;0;NA;0;0;NA;NA;NA;0;NA;NA;NA;0;NA;NA;0;NA;0;NA;NA;NA;0;NA;NA;0;0;NA;NA;NA;0;NA;NA;NA;NA;2;101;1;NA;NA;97
480589;31-03-2018;Match ends, Brighton and Hove Albion 0, Leicester City 2.;90'+7';Brighton & Hove Albion;Leicester City;0;2;0;1;0;0;0;NA;NA;NA;NA;NA;NA;NA;0;NA;NA;0;NA;0;0;NA;NA;NA;0;NA;NA;NA;0;NA;NA;0;NA;0;NA;NA;NA;0;NA;NA;0;0;NA;NA;NA;0;NA;NA;NA;NA;2;102;1;NA;NA;97
