Game ID;Date;Commentary;Match Time;Team One;Team Two;Team One Score;Team Two Score;Half End;Match End;Half Begins;Shot Attempt;Penalty Shot;Shot Result;Shot by Player;Shot by Team;Shot with;Shot where;Net Location;Assist by Player;Foul;Foul by Player;Foul by Team;Followed by Set Piece;Assist Type;Followed by Corner;Offside;Offside Team;Offside Player;Offside followed by pass from;Shown Card;Card Type;Card Player;Card Team;Video Review;Video Review Event;Video Review Result;Delay in Match;Delay Team;Free Kick Won;Free Kick Player;Free Kick Team;Free Kick where;Corner;Corner Team;Corner conceded by;Substitution;Substitution Injury;Substitution Team;Substitution Player;Replaced Player;Penalty;Team drew Penalty;Player drew Penalty;Player conceded Penalty;Team conceded Penalty;Half;Comment ID;Stoppage Time;Team One Penalty Score;Team Two Penalty Score;Match Time Numeric
480656;31-01-2018;First Half begins.;-;Tottenham Hotspur;Manchester United;0;0;0;0;1;0;0;NA;NA;NA;NA;NA;NA;NA;0;NA;NA;0;NA;0;0;NA;NA;NA;0;NA;NA;NA;0;NA;NA;0;NA;0;NA;NA;NA;0;NA;NA;0;0;NA;NA;NA;0;NA;NA;NA;NA;1;1;0;NA;NA;NA
480656;31-01-2018;Lineups are announced and players are warming up.;-;Tottenham Hotspur;Manchester United;0;0;0;0;0;0;0;NA;NA;NA;NA;NA;NA;NA;0;NA;NA;0;NA;0;0;NA;NA;NA;0;NA;NA;NA;0;NA;NA;0;NA;0;NA;NA;NA;0;NA;NA;0;0;NA;NA;NA;0;NA;NA;NA;NA;1;2;0;NA;NA;NA
480656;31-01-2018;Goal!  Tottenham Hotspur 1, Manchester United 0. Christian Eriksen (Tottenham Hotspur) left footed shot from the centre of the box to the bottom left corner.;1';Tottenham Hotspur;Manchester United;1;0;0;0;0;1;0;goal;Christian Eriksen;Tottenham Hotspur;left;the centre of the box;bottom left corner;NA;0;NA;NA;0;NA;0;0;NA;NA;NA;0;NA;NA;NA;0;NA;NA;0;NA;0;NA;NA;NA;0;NA;NA;0;0;NA;NA;NA;0;NA;NA;NA;NA;1;3;0;NA;NA;1
480656;31-01-2018;Offside, Manchester United. Ashley Young tries a through ball, but Romelu Lukaku is caught offside.;3';Tottenham Hotspur;Manchester United;1;0;0;0;0;0;0;NA;NA;NA;NA;NA;NA;NA;0;NA;NA;0;NA;0;1;Manchester United;Romelu Lukaku;Ashley Young;0;NA;NA;NA;0;NA;NA;0;NA;0;NA;NA;NA;0;NA;NA;0;0;NA;NA;NA;0;NA;NA;NA;NA;1;4;0;NA;NA;3
480656;31-01-2018;Attempt saved. Jesse Lingard (Manchester United) right footed shot from the centre of the box is saved in the bottom right corner.;3';Tottenham Hotspur;Manchester United;1;0;0;0;0;1;0;saved;Jesse Lingard;Manchester United;right;the centre of the box;the bottom right corner;NA;0;NA;NA;0;NA;0;0;NA;NA;NA;0;NA;NA;NA;0;NA;NA;0;NA;0;NA;NA;NA;0;NA;NA;0;0;NA;NA;NA;0;NA;NA;NA;NA;1;5;0;NA;NA;3
480656;31-01-2018;Foul by Chris Smalling (Manchester United).;3';Tottenham Hotspur;Manchester United;1;0;0;0;0;0;0;NA;NA;NA;NA;NA;NA;NA;1;Chris Smalling;Manchester United;0;NA;0;0;NA;NA;NA;0;NA;NA;NA;0;NA;NA;0;NA;0;NA;NA;NA;0;NA;NA;0;0;NA;NA;NA;0;NA;NA;NA;NA;1;6;0;NA;NA;3
480656;31-01-2018;Harry Kane (Tottenham Hotspur) wins a free kick in the defensive half.;3';Tottenham Hotspur;Manchester United;1;0;0;0;0;0;0;NA;NA;NA;NA;NA;NA;NA;0;NA;NA;0;NA;0;0;NA;NA;NA;0;NA;NA;NA;0;NA;NA;0;NA;1;Harry Kane;Tottenham Hotspur;defensive half;0;NA;NA;0;0;NA;NA;NA;0;NA;NA;NA;NA;1;7;0;NA;NA;3
480656;31-01-2018;Foul by Mousa Dembélé (Tottenham Hotspur).;4';Tottenham Hotspur;Manchester United;1;0;0;0;0;0;0;NA;NA;NA;NA;NA;NA;NA;1;Mousa Dembélé;Tottenham Hotspur;0;NA;0;0;NA;NA;NA;0;NA;NA;NA;0;NA;NA;0;NA;0;NA;NA;NA;0;NA;NA;0;0;NA;NA;NA;0;NA;NA;NA;NA;1;8;0;NA;NA;4
480656;31-01-2018;Paul Pogba (Manchester United) wins a free kick in the defensive half.;4';Tottenham Hotspur;Manchester United;1;0;0;0;0;0;0;NA;NA;NA;NA;NA;NA;NA;0;NA;NA;0;NA;0;0;NA;NA;NA;0;NA;NA;NA;0;NA;NA;0;NA;1;Paul Pogba;Manchester United;defensive half;0;NA;NA;0;0;NA;NA;NA;0;NA;NA;NA;NA;1;9;0;NA;NA;4
480656;31-01-2018;Offside, Manchester United. David de Gea tries a through ball, but Alexis Sánchez is caught offside.;5';Tottenham Hotspur;Manchester United;1;0;0;0;0;0;0;NA;NA;NA;NA;NA;NA;NA;0;NA;NA;0;NA;0;1;Manchester United;Alexis Sánchez;David de Gea;0;NA;NA;NA;0;NA;NA;0;NA;0;NA;NA;NA;0;NA;NA;0;0;NA;NA;NA;0;NA;NA;NA;NA;1;10;0;NA;NA;5
480656;31-01-2018;Attempt blocked. Christian Eriksen (Tottenham Hotspur) right footed shot from outside the box is blocked. Assisted by Mousa Dembélé.;10';Tottenham Hotspur;Manchester United;1;0;0;0;0;1;0;blocked;Christian Eriksen;Tottenham Hotspur;right;outside the box;NA;Mousa Dembélé;0;NA;NA;0;NA;0;0;NA;NA;NA;0;NA;NA;NA;0;NA;NA;0;NA;0;NA;NA;NA;0;NA;NA;0;0;NA;NA;NA;0;NA;NA;NA;NA;1;11;0;NA;NA;10
480656;31-01-2018;Offside, Manchester United. Ashley Young tries a through ball, but Romelu Lukaku is caught offside.;10';Tottenham Hotspur;Manchester United;1;0;0;0;0;0;0;NA;NA;NA;NA;NA;NA;NA;0;NA;NA;0;NA;0;1;Manchester United;Romelu Lukaku;Ashley Young;0;NA;NA;NA;0;NA;NA;0;NA;0;NA;NA;NA;0;NA;NA;0;0;NA;NA;NA;0;NA;NA;NA;NA;1;12;0;NA;NA;10
480656;31-01-2018;Attempt blocked. Dele Alli (Tottenham Hotspur) right footed shot from the right side of the box is blocked.;12';Tottenham Hotspur;Manchester United;1;0;0;0;0;1;0;blocked;Dele Alli;Tottenham Hotspur;right;the right side of the box;NA;NA;0;NA;NA;0;NA;0;0;NA;NA;NA;0;NA;NA;NA;0;NA;NA;0;NA;0;NA;NA;NA;0;NA;NA;0;0;NA;NA;NA;0;NA;NA;NA;NA;1;13;0;NA;NA;12
480656;31-01-2018;Corner,  Tottenham Hotspur. Conceded by Phil Jones.;12';Tottenham Hotspur;Manchester United;1;0;0;0;0;0;0;NA;NA;NA;NA;NA;NA;NA;0;NA;NA;0;NA;0;0;NA;NA;NA;0;NA;NA;NA;0;NA;NA;0;NA;0;NA;NA;NA;1;Tottenham Hotspur;Phil Jones;0;0;NA;NA;NA;0;NA;NA;NA;NA;1;14;0;NA;NA;12
480656;31-01-2018;Foul by Mousa Dembélé (Tottenham Hotspur).;13';Tottenham Hotspur;Manchester United;1;0;0;0;0;0;0;NA;NA;NA;NA;NA;NA;NA;1;Mousa Dembélé;Tottenham Hotspur;0;NA;0;0;NA;NA;NA;0;NA;NA;NA;0;NA;NA;0;NA;0;NA;NA;NA;0;NA;NA;0;0;NA;NA;NA;0;NA;NA;NA;NA;1;15;0;NA;NA;13
480656;31-01-2018;Jesse Lingard (Manchester United) wins a free kick in the attacking half.;13';Tottenham Hotspur;Manchester United;1;0;0;0;0;0;0;NA;NA;NA;NA;NA;NA;NA;0;NA;NA;0;NA;0;0;NA;NA;NA;0;NA;NA;NA;0;NA;NA;0;NA;1;Jesse Lingard;Manchester United;attacking half;0;NA;NA;0;0;NA;NA;NA;0;NA;NA;NA;NA;1;16;0;NA;NA;13
480656;31-01-2018;Mousa Dembélé (Tottenham Hotspur) is shown the yellow card for a bad foul.;13';Tottenham Hotspur;Manchester United;1;0;0;0;0;0;0;NA;NA;NA;NA;NA;NA;NA;0;NA;NA;0;NA;0;0;NA;NA;NA;1;yellow;Mousa Dembélé;Tottenham Hotspur;0;NA;NA;0;NA;0;NA;NA;NA;0;NA;NA;0;0;NA;NA;NA;0;NA;NA;NA;NA;1;17;0;NA;NA;13
480656;31-01-2018;Corner,  Tottenham Hotspur. Conceded by Phil Jones.;14';Tottenham Hotspur;Manchester United;1;0;0;0;0;0;0;NA;NA;NA;NA;NA;NA;NA;0;NA;NA;0;NA;0;0;NA;NA;NA;0;NA;NA;NA;0;NA;NA;0;NA;0;NA;NA;NA;1;Tottenham Hotspur;Phil Jones;0;0;NA;NA;NA;0;NA;NA;NA;NA;1;18;0;NA;NA;14
480656;31-01-2018;Alexis Sánchez (Manchester United) wins a free kick in the attacking half.;15';Tottenham Hotspur;Manchester United;1;0;0;0;0;0;0;NA;NA;NA;NA;NA;NA;NA;0;NA;NA;0;NA;0;0;NA;NA;NA;0;NA;NA;NA;0;NA;NA;0;NA;1;Alexis Sánchez;Manchester United;attacking half;0;NA;NA;0;0;NA;NA;NA;0;NA;NA;NA;NA;1;19;0;NA;NA;15
480656;31-01-2018;Foul by Harry Kane (Tottenham Hotspur).;15';Tottenham Hotspur;Manchester United;1;0;0;0;0;0;0;NA;NA;NA;NA;NA;NA;NA;1;Harry Kane;Tottenham Hotspur;0;NA;0;0;NA;NA;NA;0;NA;NA;NA;0;NA;NA;0;NA;0;NA;NA;NA;0;NA;NA;0;0;NA;NA;NA;0;NA;NA;NA;NA;1;20;0;NA;NA;15
480656;31-01-2018;Alexis Sánchez (Manchester United) wins a free kick in the defensive half.;17';Tottenham Hotspur;Manchester United;1;0;0;0;0;0;0;NA;NA;NA;NA;NA;NA;NA;0;NA;NA;0;NA;0;0;NA;NA;NA;0;NA;NA;NA;0;NA;NA;0;NA;1;Alexis Sánchez;Manchester United;defensive half;0;NA;NA;0;0;NA;NA;NA;0;NA;NA;NA;NA;1;21;0;NA;NA;17
480656;31-01-2018;Foul by Harry Kane (Tottenham Hotspur).;17';Tottenham Hotspur;Manchester United;1;0;0;0;0;0;0;NA;NA;NA;NA;NA;NA;NA;1;Harry Kane;Tottenham Hotspur;0;NA;0;0;NA;NA;NA;0;NA;NA;NA;0;NA;NA;0;NA;0;NA;NA;NA;0;NA;NA;0;0;NA;NA;NA;0;NA;NA;NA;NA;1;22;0;NA;NA;17
480656;31-01-2018;Attempt missed. Anthony Martial (Manchester United) left footed shot from the right side of the box is high and wide to the left. Assisted by Antonio Valencia.;21';Tottenham Hotspur;Manchester United;1;0;0;0;0;1;0;missed;Anthony Martial;Manchester United;left;the right side of the box;high and wide to the left;Antonio Valencia;0;NA;NA;0;NA;0;0;NA;NA;NA;0;NA;NA;NA;0;NA;NA;0;NA;0;NA;NA;NA;0;NA;NA;0;0;NA;NA;NA;0;NA;NA;NA;NA;1;23;0;NA;NA;21
480656;31-01-2018;Dele Alli (Tottenham Hotspur) wins a free kick in the defensive half.;21';Tottenham Hotspur;Manchester United;1;0;0;0;0;0;0;NA;NA;NA;NA;NA;NA;NA;0;NA;NA;0;NA;0;0;NA;NA;NA;0;NA;NA;NA;0;NA;NA;0;NA;1;Dele Alli;Tottenham Hotspur;defensive half;0;NA;NA;0;0;NA;NA;NA;0;NA;NA;NA;NA;1;24;0;NA;NA;21
480656;31-01-2018;Foul by Chris Smalling (Manchester United).;21';Tottenham Hotspur;Manchester United;1;0;0;0;0;0;0;NA;NA;NA;NA;NA;NA;NA;1;Chris Smalling;Manchester United;0;NA;0;0;NA;NA;NA;0;NA;NA;NA;0;NA;NA;0;NA;0;NA;NA;NA;0;NA;NA;0;0;NA;NA;NA;0;NA;NA;NA;NA;1;25;0;NA;NA;21
480656;31-01-2018;Attempt missed. Dele Alli (Tottenham Hotspur) right footed shot from outside the box misses to the left. Assisted by Eric Dier.;22';Tottenham Hotspur;Manchester United;1;0;0;0;0;1;0;missed;Dele Alli;Tottenham Hotspur;right;outside the box;left;Eric Dier;0;NA;NA;0;NA;0;0;NA;NA;NA;0;NA;NA;NA;0;NA;NA;0;NA;0;NA;NA;NA;0;NA;NA;0;0;NA;NA;NA;0;NA;NA;NA;NA;1;26;0;NA;NA;22
480656;31-01-2018;Attempt saved. Harry Kane (Tottenham Hotspur) right footed shot from the centre of the box is saved in the bottom right corner. Assisted by Christian Eriksen.;24';Tottenham Hotspur;Manchester United;1;0;0;0;0;1;0;saved;Harry Kane;Tottenham Hotspur;right;the centre of the box;the bottom right corner;Christian Eriksen;0;NA;NA;0;NA;0;0;NA;NA;NA;0;NA;NA;NA;0;NA;NA;0;NA;0;NA;NA;NA;0;NA;NA;0;0;NA;NA;NA;0;NA;NA;NA;NA;1;27;0;NA;NA;24
480656;31-01-2018;Foul by Paul Pogba (Manchester United).;26';Tottenham Hotspur;Manchester United;1;0;0;0;0;0;0;NA;NA;NA;NA;NA;NA;NA;1;Paul Pogba;Manchester United;0;NA;0;0;NA;NA;NA;0;NA;NA;NA;0;NA;NA;0;NA;0;NA;NA;NA;0;NA;NA;0;0;NA;NA;NA;0;NA;NA;NA;NA;1;28;0;NA;NA;26
480656;31-01-2018;Mousa Dembélé (Tottenham Hotspur) wins a free kick in the attacking half.;26';Tottenham Hotspur;Manchester United;1;0;0;0;0;0;0;NA;NA;NA;NA;NA;NA;NA;0;NA;NA;0;NA;0;0;NA;NA;NA;0;NA;NA;NA;0;NA;NA;0;NA;1;Mousa Dembélé;Tottenham Hotspur;attacking half;0;NA;NA;0;0;NA;NA;NA;0;NA;NA;NA;NA;1;29;0;NA;NA;26
480656;31-01-2018;Attempt blocked. Harry Kane (Tottenham Hotspur) right footed shot from outside the box is blocked. Assisted by Mousa Dembélé.;27';Tottenham Hotspur;Manchester United;1;0;0;0;0;1;0;blocked;Harry Kane;Tottenham Hotspur;right;outside the box;NA;Mousa Dembélé;0;NA;NA;0;NA;0;0;NA;NA;NA;0;NA;NA;NA;0;NA;NA;0;NA;0;NA;NA;NA;0;NA;NA;0;0;NA;NA;NA;0;NA;NA;NA;NA;1;30;0;NA;NA;27
480656;31-01-2018;Offside, Manchester United. Anthony Martial tries a through ball, but Romelu Lukaku is caught offside.;27';Tottenham Hotspur;Manchester United;1;0;0;0;0;0;0;NA;NA;NA;NA;NA;NA;NA;0;NA;NA;0;NA;0;1;Manchester United;Romelu Lukaku;Anthony Martial;0;NA;NA;NA;0;NA;NA;0;NA;0;NA;NA;NA;0;NA;NA;0;0;NA;NA;NA;0;NA;NA;NA;NA;1;31;0;NA;NA;27
480656;31-01-2018;Own Goal by Phil Jones, Manchester United.  Tottenham Hotspur 2, Manchester United 0.;28';Tottenham Hotspur;Manchester United;2;0;0;0;0;0;0;own goal;Phil Jones;Manchester United;NA;NA;NA;NA;0;NA;NA;0;NA;0;0;NA;NA;NA;0;NA;NA;NA;0;NA;NA;0;NA;0;NA;NA;NA;0;NA;NA;0;0;NA;NA;NA;0;NA;NA;NA;NA;1;32;0;NA;NA;28
480656;31-01-2018;Attempt saved. Anthony Martial (Manchester United) right footed shot from the right side of the box is saved in the bottom right corner. Assisted by Antonio Valencia.;30';Tottenham Hotspur;Manchester United;2;0;0;0;0;1;0;saved;Anthony Martial;Manchester United;right;the right side of the box;the bottom right corner;Antonio Valencia;0;NA;NA;0;NA;0;0;NA;NA;NA;0;NA;NA;NA;0;NA;NA;0;NA;0;NA;NA;NA;0;NA;NA;0;0;NA;NA;NA;0;NA;NA;NA;NA;1;33;0;NA;NA;30
480656;31-01-2018;Corner,  Manchester United. Conceded by Hugo Lloris.;30';Tottenham Hotspur;Manchester United;2;0;0;0;0;0;0;NA;NA;NA;NA;NA;NA;NA;0;NA;NA;0;NA;0;0;NA;NA;NA;0;NA;NA;NA;0;NA;NA;0;NA;0;NA;NA;NA;1;Manchester United;Hugo Lloris;0;0;NA;NA;NA;0;NA;NA;NA;NA;1;34;0;NA;NA;30
480656;31-01-2018;Attempt missed. Paul Pogba (Manchester United) right footed shot from the right side of the six yard box is too high. Assisted by Chris Smalling with a headed pass following a corner.;31';Tottenham Hotspur;Manchester United;2;0;0;0;0;1;0;missed;Paul Pogba;Manchester United;right;the right side of the six yard box;too high;Chris Smalling;0;NA;NA;0;NA;1;0;NA;NA;NA;0;NA;NA;NA;0;NA;NA;0;NA;0;NA;NA;NA;0;NA;NA;0;0;NA;NA;NA;0;NA;NA;NA;NA;1;35;0;NA;NA;31
480656;31-01-2018;Foul by Dele Alli (Tottenham Hotspur).;33';Tottenham Hotspur;Manchester United;2;0;0;0;0;0;0;NA;NA;NA;NA;NA;NA;NA;1;Dele Alli;Tottenham Hotspur;0;NA;0;0;NA;NA;NA;0;NA;NA;NA;0;NA;NA;0;NA;0;NA;NA;NA;0;NA;NA;0;0;NA;NA;NA;0;NA;NA;NA;NA;1;36;0;NA;NA;33
480656;31-01-2018;Nemanja Matic (Manchester United) wins a free kick in the defensive half.;33';Tottenham Hotspur;Manchester United;2;0;0;0;0;0;0;NA;NA;NA;NA;NA;NA;NA;0;NA;NA;0;NA;0;0;NA;NA;NA;0;NA;NA;NA;0;NA;NA;0;NA;1;Nemanja Matic;Manchester United;defensive half;0;NA;NA;0;0;NA;NA;NA;0;NA;NA;NA;NA;1;37;0;NA;NA;33
480656;31-01-2018;Attempt missed. Son Heung-Min (Tottenham Hotspur) left footed shot from outside the box is too high. Assisted by Harry Kane.;33';Tottenham Hotspur;Manchester United;2;0;0;0;0;1;0;missed;Son Heung-Min;Tottenham Hotspur;left;outside the box;too high;Harry Kane;0;NA;NA;0;NA;0;0;NA;NA;NA;0;NA;NA;NA;0;NA;NA;0;NA;0;NA;NA;NA;0;NA;NA;0;0;NA;NA;NA;0;NA;NA;NA;NA;1;38;0;NA;NA;33
480656;31-01-2018;Foul by Jesse Lingard (Manchester United).;35';Tottenham Hotspur;Manchester United;2;0;0;0;0;0;0;NA;NA;NA;NA;NA;NA;NA;1;Jesse Lingard;Manchester United;0;NA;0;0;NA;NA;NA;0;NA;NA;NA;0;NA;NA;0;NA;0;NA;NA;NA;0;NA;NA;0;0;NA;NA;NA;0;NA;NA;NA;NA;1;39;0;NA;NA;35
480656;31-01-2018;Jan Vertonghen (Tottenham Hotspur) wins a free kick in the defensive half.;35';Tottenham Hotspur;Manchester United;2;0;0;0;0;0;0;NA;NA;NA;NA;NA;NA;NA;0;NA;NA;0;NA;0;0;NA;NA;NA;0;NA;NA;NA;0;NA;NA;0;NA;1;Jan Vertonghen;Tottenham Hotspur;defensive half;0;NA;NA;0;0;NA;NA;NA;0;NA;NA;NA;NA;1;40;0;NA;NA;35
480656;31-01-2018;Foul by Eric Dier (Tottenham Hotspur).;36';Tottenham Hotspur;Manchester United;2;0;0;0;0;0;0;NA;NA;NA;NA;NA;NA;NA;1;Eric Dier;Tottenham Hotspur;0;NA;0;0;NA;NA;NA;0;NA;NA;NA;0;NA;NA;0;NA;0;NA;NA;NA;0;NA;NA;0;0;NA;NA;NA;0;NA;NA;NA;NA;1;41;0;NA;NA;36
480656;31-01-2018;Paul Pogba (Manchester United) wins a free kick in the defensive half.;36';Tottenham Hotspur;Manchester United;2;0;0;0;0;0;0;NA;NA;NA;NA;NA;NA;NA;0;NA;NA;0;NA;0;0;NA;NA;NA;0;NA;NA;NA;0;NA;NA;0;NA;1;Paul Pogba;Manchester United;defensive half;0;NA;NA;0;0;NA;NA;NA;0;NA;NA;NA;NA;1;42;0;NA;NA;36
480656;31-01-2018;Foul by Phil Jones (Manchester United).;38';Tottenham Hotspur;Manchester United;2;0;0;0;0;0;0;NA;NA;NA;NA;NA;NA;NA;1;Phil Jones;Manchester United;0;NA;0;0;NA;NA;NA;0;NA;NA;NA;0;NA;NA;0;NA;0;NA;NA;NA;0;NA;NA;0;0;NA;NA;NA;0;NA;NA;NA;NA;1;43;0;NA;NA;38
480656;31-01-2018;Harry Kane (Tottenham Hotspur) wins a free kick in the defensive half.;38';Tottenham Hotspur;Manchester United;2;0;0;0;0;0;0;NA;NA;NA;NA;NA;NA;NA;0;NA;NA;0;NA;0;0;NA;NA;NA;0;NA;NA;NA;0;NA;NA;0;NA;1;Harry Kane;Tottenham Hotspur;defensive half;0;NA;NA;0;0;NA;NA;NA;0;NA;NA;NA;NA;1;44;0;NA;NA;38
480656;31-01-2018;Phil Jones (Manchester United) is shown the yellow card for a bad foul.;38';Tottenham Hotspur;Manchester United;2;0;0;0;0;0;0;NA;NA;NA;NA;NA;NA;NA;0;NA;NA;0;NA;0;0;NA;NA;NA;1;yellow;Phil Jones;Manchester United;0;NA;NA;0;NA;0;NA;NA;NA;0;NA;NA;0;0;NA;NA;NA;0;NA;NA;NA;NA;1;45;0;NA;NA;38
480656;31-01-2018;Christian Eriksen (Tottenham Hotspur) wins a free kick on the right wing.;39';Tottenham Hotspur;Manchester United;2;0;0;0;0;0;0;NA;NA;NA;NA;NA;NA;NA;0;NA;NA;0;NA;0;0;NA;NA;NA;0;NA;NA;NA;0;NA;NA;0;NA;1;Christian Eriksen;Tottenham Hotspur;NA;0;NA;NA;0;0;NA;NA;NA;0;NA;NA;NA;NA;1;46;0;NA;NA;39
480656;31-01-2018;Foul by Ashley Young (Manchester United).;39';Tottenham Hotspur;Manchester United;2;0;0;0;0;0;0;NA;NA;NA;NA;NA;NA;NA;1;Ashley Young;Manchester United;0;NA;0;0;NA;NA;NA;0;NA;NA;NA;0;NA;NA;0;NA;0;NA;NA;NA;0;NA;NA;0;0;NA;NA;NA;0;NA;NA;NA;NA;1;47;0;NA;NA;39
480656;31-01-2018;Attempt missed. Eric Dier (Tottenham Hotspur) header from the centre of the box is too high. Assisted by Christian Eriksen with a cross following a set piece situation.;40';Tottenham Hotspur;Manchester United;2;0;0;0;0;1;0;missed;Eric Dier;Tottenham Hotspur;header;the centre of the box;too high;Christian Eriksen;0;NA;NA;1;cross;0;0;NA;NA;NA;0;NA;NA;NA;0;NA;NA;0;NA;0;NA;NA;NA;0;NA;NA;0;0;NA;NA;NA;0;NA;NA;NA;NA;1;48;0;NA;NA;40
480656;31-01-2018;Foul by Chris Smalling (Manchester United).;41';Tottenham Hotspur;Manchester United;2;0;0;0;0;0;0;NA;NA;NA;NA;NA;NA;NA;1;Chris Smalling;Manchester United;0;NA;0;0;NA;NA;NA;0;NA;NA;NA;0;NA;NA;0;NA;0;NA;NA;NA;0;NA;NA;0;0;NA;NA;NA;0;NA;NA;NA;NA;1;49;0;NA;NA;41
480656;31-01-2018;Harry Kane (Tottenham Hotspur) wins a free kick on the left wing.;41';Tottenham Hotspur;Manchester United;2;0;0;0;0;0;0;NA;NA;NA;NA;NA;NA;NA;0;NA;NA;0;NA;0;0;NA;NA;NA;0;NA;NA;NA;0;NA;NA;0;NA;1;Harry Kane;Tottenham Hotspur;NA;0;NA;NA;0;0;NA;NA;NA;0;NA;NA;NA;NA;1;50;0;NA;NA;41
480656;31-01-2018;Foul by Antonio Valencia (Manchester United).;44';Tottenham Hotspur;Manchester United;2;0;0;0;0;0;0;NA;NA;NA;NA;NA;NA;NA;1;Antonio Valencia;Manchester United;0;NA;0;0;NA;NA;NA;0;NA;NA;NA;0;NA;NA;0;NA;0;NA;NA;NA;0;NA;NA;0;0;NA;NA;NA;0;NA;NA;NA;NA;1;51;0;NA;NA;44
480656;31-01-2018;Son Heung-Min (Tottenham Hotspur) wins a free kick in the defensive half.;44';Tottenham Hotspur;Manchester United;2;0;0;0;0;0;0;NA;NA;NA;NA;NA;NA;NA;0;NA;NA;0;NA;0;0;NA;NA;NA;0;NA;NA;NA;0;NA;NA;0;NA;1;Son Heung-Min;Tottenham Hotspur;defensive half;0;NA;NA;0;0;NA;NA;NA;0;NA;NA;NA;NA;1;52;0;NA;NA;44
480656;31-01-2018;Delay in match Son Heung-Min (Tottenham Hotspur) because of an injury.;45';Tottenham Hotspur;Manchester United;2;0;0;0;0;0;0;NA;NA;NA;NA;NA;NA;NA;0;NA;NA;0;NA;0;0;NA;NA;NA;0;NA;NA;NA;0;NA;NA;1;Tottenham Hotspur;0;NA;NA;NA;0;NA;NA;0;0;NA;NA;NA;0;NA;NA;NA;NA;1;53;0;NA;NA;45
480656;31-01-2018;Delay over. They are ready to continue.;45';Tottenham Hotspur;Manchester United;2;0;0;0;0;0;0;NA;NA;NA;NA;NA;NA;NA;0;NA;NA;0;NA;0;0;NA;NA;NA;0;NA;NA;NA;0;NA;NA;0;NA;0;NA;NA;NA;0;NA;NA;0;0;NA;NA;NA;0;NA;NA;NA;NA;1;54;0;NA;NA;45
480656;31-01-2018;Attempt saved. Harry Kane (Tottenham Hotspur) left footed shot from the centre of the box is saved in the bottom left corner. Assisted by Jan Vertonghen.;45'+1';Tottenham Hotspur;Manchester United;2;0;0;0;0;1;0;saved;Harry Kane;Tottenham Hotspur;left;the centre of the box;the bottom left corner;Jan Vertonghen;0;NA;NA;0;NA;0;0;NA;NA;NA;0;NA;NA;NA;0;NA;NA;0;NA;0;NA;NA;NA;0;NA;NA;0;0;NA;NA;NA;0;NA;NA;NA;NA;1;55;1;NA;NA;46
480656;31-01-2018;First Half ends, Tottenham Hotspur 2, Manchester United 0.;45'+3';Tottenham Hotspur;Manchester United;2;0;1;0;0;0;0;NA;NA;NA;NA;NA;NA;NA;0;NA;NA;0;NA;0;0;NA;NA;NA;0;NA;NA;NA;0;NA;NA;0;NA;0;NA;NA;NA;0;NA;NA;0;0;NA;NA;NA;0;NA;NA;NA;NA;1;56;1;NA;NA;48
480656;31-01-2018;Second Half begins Tottenham Hotspur 2, Manchester United 0.;45';Tottenham Hotspur;Manchester United;2;0;0;0;1;0;0;NA;NA;NA;NA;NA;NA;NA;0;NA;NA;0;NA;0;0;NA;NA;NA;0;NA;NA;NA;0;NA;NA;0;NA;0;NA;NA;NA;0;NA;NA;0;0;NA;NA;NA;0;NA;NA;NA;NA;2;57;0;NA;NA;45
480656;31-01-2018;Offside, Tottenham Hotspur. Son Heung-Min tries a through ball, but Harry Kane is caught offside.;46';Tottenham Hotspur;Manchester United;2;0;0;0;0;0;0;NA;NA;NA;NA;NA;NA;NA;0;NA;NA;0;NA;0;1;Tottenham Hotspur;Harry Kane;Son Heung-Min;0;NA;NA;NA;0;NA;NA;0;NA;0;NA;NA;NA;0;NA;NA;0;0;NA;NA;NA;0;NA;NA;NA;NA;2;58;0;NA;NA;46
480656;31-01-2018;Attempt blocked. Paul Pogba (Manchester United) left footed shot from outside the box is blocked. Assisted by Jesse Lingard.;47';Tottenham Hotspur;Manchester United;2;0;0;0;0;1;0;blocked;Paul Pogba;Manchester United;left;outside the box;NA;Jesse Lingard;0;NA;NA;0;NA;0;0;NA;NA;NA;0;NA;NA;NA;0;NA;NA;0;NA;0;NA;NA;NA;0;NA;NA;0;0;NA;NA;NA;0;NA;NA;NA;NA;2;59;0;NA;NA;47
480656;31-01-2018;Attempt missed. Son Heung-Min (Tottenham Hotspur) right footed shot from the centre of the box is close, but misses to the left. Assisted by Harry Kane.;49';Tottenham Hotspur;Manchester United;2;0;0;0;0;1;0;missed;Son Heung-Min;Tottenham Hotspur;right;the centre of the box;close, but left;Harry Kane;0;NA;NA;0;NA;0;0;NA;NA;NA;0;NA;NA;NA;0;NA;NA;0;NA;0;NA;NA;NA;0;NA;NA;0;0;NA;NA;NA;0;NA;NA;NA;NA;2;60;0;NA;NA;49
480656;31-01-2018;Alexis Sánchez (Manchester United) wins a free kick in the attacking half.;51';Tottenham Hotspur;Manchester United;2;0;0;0;0;0;0;NA;NA;NA;NA;NA;NA;NA;0;NA;NA;0;NA;0;0;NA;NA;NA;0;NA;NA;NA;0;NA;NA;0;NA;1;Alexis Sánchez;Manchester United;attacking half;0;NA;NA;0;0;NA;NA;NA;0;NA;NA;NA;NA;2;61;0;NA;NA;51
480656;31-01-2018;Foul by Christian Eriksen (Tottenham Hotspur).;51';Tottenham Hotspur;Manchester United;2;0;0;0;0;0;0;NA;NA;NA;NA;NA;NA;NA;1;Christian Eriksen;Tottenham Hotspur;0;NA;0;0;NA;NA;NA;0;NA;NA;NA;0;NA;NA;0;NA;0;NA;NA;NA;0;NA;NA;0;0;NA;NA;NA;0;NA;NA;NA;NA;2;62;0;NA;NA;51
480656;31-01-2018;Offside, Manchester United. Ashley Young tries a through ball, but Anthony Martial is caught offside.;51';Tottenham Hotspur;Manchester United;2;0;0;0;0;0;0;NA;NA;NA;NA;NA;NA;NA;0;NA;NA;0;NA;0;1;Manchester United;Anthony Martial;Ashley Young;0;NA;NA;NA;0;NA;NA;0;NA;0;NA;NA;NA;0;NA;NA;0;0;NA;NA;NA;0;NA;NA;NA;NA;2;63;0;NA;NA;51
480656;31-01-2018;Corner,  Manchester United. Conceded by Mousa Dembélé.;53';Tottenham Hotspur;Manchester United;2;0;0;0;0;0;0;NA;NA;NA;NA;NA;NA;NA;0;NA;NA;0;NA;0;0;NA;NA;NA;0;NA;NA;NA;0;NA;NA;0;NA;0;NA;NA;NA;1;Manchester United;Mousa Dembélé;0;0;NA;NA;NA;0;NA;NA;NA;NA;2;64;0;NA;NA;53
480656;31-01-2018;Offside, Manchester United. Phil Jones tries a through ball, but Anthony Martial is caught offside.;53';Tottenham Hotspur;Manchester United;2;0;0;0;0;0;0;NA;NA;NA;NA;NA;NA;NA;0;NA;NA;0;NA;0;1;Manchester United;Anthony Martial;Phil Jones;0;NA;NA;NA;0;NA;NA;0;NA;0;NA;NA;NA;0;NA;NA;0;0;NA;NA;NA;0;NA;NA;NA;NA;2;65;0;NA;NA;53
480656;31-01-2018;Attempt missed. Harry Kane (Tottenham Hotspur) right footed shot from the right side of the box misses to the left. Assisted by Dele Alli.;55';Tottenham Hotspur;Manchester United;2;0;0;0;0;1;0;missed;Harry Kane;Tottenham Hotspur;right;the right side of the box;left;Dele Alli;0;NA;NA;0;NA;0;0;NA;NA;NA;0;NA;NA;NA;0;NA;NA;0;NA;0;NA;NA;NA;0;NA;NA;0;0;NA;NA;NA;0;NA;NA;NA;NA;2;66;0;NA;NA;55
480656;31-01-2018;Attempt saved. Romelu Lukaku (Manchester United) left footed shot from a difficult angle on the left is saved in the top left corner.;56';Tottenham Hotspur;Manchester United;2;0;0;0;0;1;0;saved;Romelu Lukaku;Manchester United;left;NA;the top left corner;NA;0;NA;NA;0;NA;0;0;NA;NA;NA;0;NA;NA;NA;0;NA;NA;0;NA;0;NA;NA;NA;0;NA;NA;0;0;NA;NA;NA;0;NA;NA;NA;NA;2;67;0;NA;NA;56
480656;31-01-2018;Corner,  Manchester United. Conceded by Hugo Lloris.;56';Tottenham Hotspur;Manchester United;2;0;0;0;0;0;0;NA;NA;NA;NA;NA;NA;NA;0;NA;NA;0;NA;0;0;NA;NA;NA;0;NA;NA;NA;0;NA;NA;0;NA;0;NA;NA;NA;1;Manchester United;Hugo Lloris;0;0;NA;NA;NA;0;NA;NA;NA;NA;2;68;0;NA;NA;56
480656;31-01-2018;Offside, Manchester United. David de Gea tries a through ball, but Alexis Sánchez is caught offside.;59';Tottenham Hotspur;Manchester United;2;0;0;0;0;0;0;NA;NA;NA;NA;NA;NA;NA;0;NA;NA;0;NA;0;1;Manchester United;Alexis Sánchez;David de Gea;0;NA;NA;NA;0;NA;NA;0;NA;0;NA;NA;NA;0;NA;NA;0;0;NA;NA;NA;0;NA;NA;NA;NA;2;69;0;NA;NA;59
480656;31-01-2018;Attempt blocked. Dele Alli (Tottenham Hotspur) right footed shot from the left side of the box is blocked. Assisted by Harry Kane.;62';Tottenham Hotspur;Manchester United;2;0;0;0;0;1;0;blocked;Dele Alli;Tottenham Hotspur;right;the left side of the box;NA;Harry Kane;0;NA;NA;0;NA;0;0;NA;NA;NA;0;NA;NA;NA;0;NA;NA;0;NA;0;NA;NA;NA;0;NA;NA;0;0;NA;NA;NA;0;NA;NA;NA;NA;2;70;0;NA;NA;62
480656;31-01-2018;Foul by Harry Kane (Tottenham Hotspur).;62';Tottenham Hotspur;Manchester United;2;0;0;0;0;0;0;NA;NA;NA;NA;NA;NA;NA;1;Harry Kane;Tottenham Hotspur;0;NA;0;0;NA;NA;NA;0;NA;NA;NA;0;NA;NA;0;NA;0;NA;NA;NA;0;NA;NA;0;0;NA;NA;NA;0;NA;NA;NA;NA;2;71;0;NA;NA;62
480656;31-01-2018;Paul Pogba (Manchester United) wins a free kick in the defensive half.;62';Tottenham Hotspur;Manchester United;2;0;0;0;0;0;0;NA;NA;NA;NA;NA;NA;NA;0;NA;NA;0;NA;0;0;NA;NA;NA;0;NA;NA;NA;0;NA;NA;0;NA;1;Paul Pogba;Manchester United;defensive half;0;NA;NA;0;0;NA;NA;NA;0;NA;NA;NA;NA;2;72;0;NA;NA;62
480656;31-01-2018;Substitution, Manchester United. Marouane Fellaini replaces Jesse Lingard.;63';Tottenham Hotspur;Manchester United;2;0;0;0;0;0;0;NA;NA;NA;NA;NA;NA;NA;0;NA;NA;0;NA;0;0;NA;NA;NA;0;NA;NA;NA;0;NA;NA;0;NA;0;NA;NA;NA;0;NA;NA;1;0;Manchester United;Marouane Fellaini;Jesse Lingard;0;NA;NA;NA;NA;2;73;0;NA;NA;63
480656;31-01-2018;Substitution, Manchester United. Juan Mata replaces Paul Pogba.;63';Tottenham Hotspur;Manchester United;2;0;0;0;0;0;0;NA;NA;NA;NA;NA;NA;NA;0;NA;NA;0;NA;0;0;NA;NA;NA;0;NA;NA;NA;0;NA;NA;0;NA;0;NA;NA;NA;0;NA;NA;1;0;Manchester United;Juan Mata;Paul Pogba;0;NA;NA;NA;NA;2;74;0;NA;NA;63
480656;31-01-2018;Alexis Sánchez (Manchester United) wins a free kick in the defensive half.;65';Tottenham Hotspur;Manchester United;2;0;0;0;0;0;0;NA;NA;NA;NA;NA;NA;NA;0;NA;NA;0;NA;0;0;NA;NA;NA;0;NA;NA;NA;0;NA;NA;0;NA;1;Alexis Sánchez;Manchester United;defensive half;0;NA;NA;0;0;NA;NA;NA;0;NA;NA;NA;NA;2;75;0;NA;NA;65
480656;31-01-2018;Foul by Eric Dier (Tottenham Hotspur).;65';Tottenham Hotspur;Manchester United;2;0;0;0;0;0;0;NA;NA;NA;NA;NA;NA;NA;1;Eric Dier;Tottenham Hotspur;0;NA;0;0;NA;NA;NA;0;NA;NA;NA;0;NA;NA;0;NA;0;NA;NA;NA;0;NA;NA;0;0;NA;NA;NA;0;NA;NA;NA;NA;2;76;0;NA;NA;65
