480882;26-08-2017;First Half begins.;-;Huddersfield Town;Southampton;0;0;0;0;1;0;0;NA;NA;NA;NA;NA;NA;NA;0;NA;NA;0;NA;0;0;NA;NA;NA;0;NA;NA;NA;0;NA;NA;0;NA;0;NA;NA;NA;0;NA;NA;0;0;NA;NA;NA;0;NA;NA;NA;NA;1;1;0;NA;NA;NA
480882;26-08-2017;Lineups are announced and players are warming up.;-;Huddersfield Town;Southampton;0;0;0;0;0;0;0;NA;NA;NA;NA;NA;NA;NA;0;NA;NA;0;NA;0;0;NA;NA;NA;0;NA;NA;NA;0;NA;NA;0;NA;0;NA;NA;NA;0;NA;NA;0;0;NA;NA;NA;0;NA;NA;NA;NA;1;2;0;NA;NA;NA
480882;26-08-2017;Foul by Tommy Smith (Huddersfield Town).;2';Huddersfield Town;Southampton;0;0;0;0;0;0;0;NA;NA;NA;NA;NA;NA;NA;1;Tommy Smith;Huddersfield Town;0;NA;0;0;NA;NA;NA;0;NA;NA;NA;0;NA;NA;0;NA;0;NA;NA;NA;0;NA;NA;0;0;NA;NA;NA;0;NA;NA;NA;NA;1;3;0;NA;NA;2
480882;26-08-2017;Nathan Redmond (Southampton) wins a free kick in the defensive half.;2';Huddersfield Town;Southampton;0;0;0;0;0;0;0;NA;NA;NA;NA;NA;NA;NA;0;NA;NA;0;NA;0;0;NA;NA;NA;0;NA;NA;NA;0;NA;NA;0;NA;1;Nathan Redmond;Southampton;defensive half;0;NA;NA;0;0;NA;NA;NA;0;NA;NA;NA;NA;1;4;0;NA;NA;2
480882;26-08-2017;Foul by Christopher Schindler (Huddersfield Town).;2';Huddersfield Town;Southampton;0;0;0;0;0;0;0;NA;NA;NA;NA;NA;NA;NA;1;Christopher Schindler;Huddersfield Town;0;NA;0;0;NA;NA;NA;0;NA;NA;NA;0;NA;NA;0;NA;0;NA;NA;NA;0;NA;NA;0;0;NA;NA;NA;0;NA;NA;NA;NA;1;5;0;NA;NA;2
480882;26-08-2017;Steven Davis (Southampton) wins a free kick in the defensive half.;2';Huddersfield Town;Southampton;0;0;0;0;0;0;0;NA;NA;NA;NA;NA;NA;NA;0;NA;NA;0;NA;0;0;NA;NA;NA;0;NA;NA;NA;0;NA;NA;0;NA;1;Steven Davis;Southampton;defensive half;0;NA;NA;0;0;NA;NA;NA;0;NA;NA;NA;NA;1;6;0;NA;NA;2
480882;26-08-2017;Attempt blocked. Rajiv van La Parra (Huddersfield Town) right footed shot from outside the box is blocked. Assisted by Tom Ince.;3';Huddersfield Town;Southampton;0;0;0;0;0;1;0;blocked;NA;Huddersfield Town;right;outside the box;NA;Tom Ince;0;NA;NA;0;NA;0;0;NA;NA;NA;0;NA;NA;NA;0;NA;NA;0;NA;0;NA;NA;NA;0;NA;NA;0;0;NA;NA;NA;0;NA;NA;NA;NA;1;7;0;NA;NA;3
480882;26-08-2017;Corner,  Huddersfield Town. Conceded by Jack Stephens.;3';Huddersfield Town;Southampton;0;0;0;0;0;0;0;NA;NA;NA;NA;NA;NA;NA;0;NA;NA;0;NA;0;0;NA;NA;NA;0;NA;NA;NA;0;NA;NA;0;NA;0;NA;NA;NA;1;Huddersfield Town;Jack Stephens;0;0;NA;NA;NA;0;NA;NA;NA;NA;1;8;0;NA;NA;3
480882;26-08-2017;Foul by Steve Mounie (Huddersfield Town).;3';Huddersfield Town;Southampton;0;0;0;0;0;0;0;NA;NA;NA;NA;NA;NA;NA;1;Steve Mounie;Huddersfield Town;0;NA;0;0;NA;NA;NA;0;NA;NA;NA;0;NA;NA;0;NA;0;NA;NA;NA;0;NA;NA;0;0;NA;NA;NA;0;NA;NA;NA;NA;1;9;0;NA;NA;3
480882;26-08-2017;Maya Yoshida (Southampton) wins a free kick in the defensive half.;3';Huddersfield Town;Southampton;0;0;0;0;0;0;0;NA;NA;NA;NA;NA;NA;NA;0;NA;NA;0;NA;0;0;NA;NA;NA;0;NA;NA;NA;0;NA;NA;0;NA;1;Maya Yoshida;Southampton;defensive half;0;NA;NA;0;0;NA;NA;NA;0;NA;NA;NA;NA;1;10;0;NA;NA;3
480882;26-08-2017;Attempt missed. Nathan Redmond (Southampton) right footed shot from the left side of the box is close, but misses to the right. Assisted by Steven Davis with a through ball.;11';Huddersfield Town;Southampton;0;0;0;0;0;1;0;missed;Nathan Redmond;Southampton;right;the left side of the box;close, but right;Steven Davis;0;NA;NA;0;through;0;0;NA;NA;NA;0;NA;NA;NA;0;NA;NA;0;NA;0;NA;NA;NA;0;NA;NA;0;0;NA;NA;NA;0;NA;NA;NA;NA;1;11;0;NA;NA;11
480882;26-08-2017;Aaron Mooy (Huddersfield Town) wins a free kick on the right wing.;13';Huddersfield Town;Southampton;0;0;0;0;0;0;0;NA;NA;NA;NA;NA;NA;NA;0;NA;NA;0;NA;0;0;NA;NA;NA;0;NA;NA;NA;0;NA;NA;0;NA;1;Aaron Mooy;Huddersfield Town;NA;0;NA;NA;0;0;NA;NA;NA;0;NA;NA;NA;NA;1;12;0;NA;NA;13
480882;26-08-2017;Foul by Oriol Romeu (Southampton).;13';Huddersfield Town;Southampton;0;0;0;0;0;0;0;NA;NA;NA;NA;NA;NA;NA;1;Oriol Romeu;Southampton;0;NA;0;0;NA;NA;NA;0;NA;NA;NA;0;NA;NA;0;NA;0;NA;NA;NA;0;NA;NA;0;0;NA;NA;NA;0;NA;NA;NA;NA;1;13;0;NA;NA;13
480882;26-08-2017;Attempt saved. Zanka (Huddersfield Town) header from the centre of the box is saved in the centre of the goal. Assisted by Tommy Smith with a cross.;14';Huddersfield Town;Southampton;0;0;0;0;0;1;0;saved;Zanka;Huddersfield Town;header;the centre of the box;the centre of the goal;Tommy Smith;0;NA;NA;0;cross;0;0;NA;NA;NA;0;NA;NA;NA;0;NA;NA;0;NA;0;NA;NA;NA;0;NA;NA;0;0;NA;NA;NA;0;NA;NA;NA;NA;1;14;0;NA;NA;14
480882;26-08-2017;Elias Kachunga (Huddersfield Town) wins a free kick on the right wing.;14';Huddersfield Town;Southampton;0;0;0;0;0;0;0;NA;NA;NA;NA;NA;NA;NA;0;NA;NA;0;NA;0;0;NA;NA;NA;0;NA;NA;NA;0;NA;NA;0;NA;1;Elias Kachunga;Huddersfield Town;NA;0;NA;NA;0;0;NA;NA;NA;0;NA;NA;NA;NA;1;15;0;NA;NA;14
480882;26-08-2017;Foul by Ryan Bertrand (Southampton).;14';Huddersfield Town;Southampton;0;0;0;0;0;0;0;NA;NA;NA;NA;NA;NA;NA;1;Ryan Bertrand;Southampton;0;NA;0;0;NA;NA;NA;0;NA;NA;NA;0;NA;NA;0;NA;0;NA;NA;NA;0;NA;NA;0;0;NA;NA;NA;0;NA;NA;NA;NA;1;16;0;NA;NA;14
480882;26-08-2017;Foul by Elias Kachunga (Huddersfield Town).;16';Huddersfield Town;Southampton;0;0;0;0;0;0;0;NA;NA;NA;NA;NA;NA;NA;1;Elias Kachunga;Huddersfield Town;0;NA;0;0;NA;NA;NA;0;NA;NA;NA;0;NA;NA;0;NA;0;NA;NA;NA;0;NA;NA;0;0;NA;NA;NA;0;NA;NA;NA;NA;1;17;0;NA;NA;16
480882;26-08-2017;Ryan Bertrand (Southampton) wins a free kick in the defensive half.;16';Huddersfield Town;Southampton;0;0;0;0;0;0;0;NA;NA;NA;NA;NA;NA;NA;0;NA;NA;0;NA;0;0;NA;NA;NA;0;NA;NA;NA;0;NA;NA;0;NA;1;Ryan Bertrand;Southampton;defensive half;0;NA;NA;0;0;NA;NA;NA;0;NA;NA;NA;NA;1;18;0;NA;NA;16
480882;26-08-2017;Foul by Cédric Soares (Southampton).;18';Huddersfield Town;Southampton;0;0;0;0;0;0;0;NA;NA;NA;NA;NA;NA;NA;1;Cédric Soares;Southampton;0;NA;0;0;NA;NA;NA;0;NA;NA;NA;0;NA;NA;0;NA;0;NA;NA;NA;0;NA;NA;0;0;NA;NA;NA;0;NA;NA;NA;NA;1;19;0;NA;NA;18
480882;26-08-2017;Rajiv van La Parra (Huddersfield Town) wins a free kick on the left wing.;18';Huddersfield Town;Southampton;0;0;0;0;0;0;0;NA;NA;NA;NA;NA;NA;NA;0;NA;NA;0;NA;0;0;NA;NA;NA;0;NA;NA;NA;0;NA;NA;0;NA;1;NA;Huddersfield Town;NA;0;NA;NA;0;0;NA;NA;NA;0;NA;NA;NA;NA;1;20;0;NA;NA;18
480882;26-08-2017;Attempt blocked. Elias Kachunga (Huddersfield Town) right footed shot from the centre of the box is blocked. Assisted by Rajiv van La Parra with a cross.;19';Huddersfield Town;Southampton;0;0;0;0;0;1;0;blocked;Elias Kachunga;Huddersfield Town;right;the centre of the box;NA;Rajiv van La;0;NA;NA;0;cross;0;0;NA;NA;NA;0;NA;NA;NA;0;NA;NA;0;NA;0;NA;NA;NA;0;NA;NA;0;0;NA;NA;NA;0;NA;NA;NA;NA;1;21;0;NA;NA;19
480882;26-08-2017;Attempt saved. Steve Mounie (Huddersfield Town) right footed shot from the centre of the box is saved in the centre of the goal. Assisted by Philip Billing with a cross.;19';Huddersfield Town;Southampton;0;0;0;0;0;1;0;saved;Steve Mounie;Huddersfield Town;right;the centre of the box;the centre of the goal;Philip Billing;0;NA;NA;0;cross;0;0;NA;NA;NA;0;NA;NA;NA;0;NA;NA;0;NA;0;NA;NA;NA;0;NA;NA;0;0;NA;NA;NA;0;NA;NA;NA;NA;1;22;0;NA;NA;19
480882;26-08-2017;Corner,  Southampton. Conceded by Chris Löwe.;22';Huddersfield Town;Southampton;0;0;0;0;0;0;0;NA;NA;NA;NA;NA;NA;NA;0;NA;NA;0;NA;0;0;NA;NA;NA;0;NA;NA;NA;0;NA;NA;0;NA;0;NA;NA;NA;1;Southampton;Chris Löwe;0;0;NA;NA;NA;0;NA;NA;NA;NA;1;23;0;NA;NA;22
480882;26-08-2017;Attempt blocked. Rajiv van La Parra (Huddersfield Town) right footed shot from the centre of the box is blocked. Assisted by Elias Kachunga.;23';Huddersfield Town;Southampton;0;0;0;0;0;1;0;blocked;NA;Huddersfield Town;right;the centre of the box;NA;Elias Kachunga;0;NA;NA;0;NA;0;0;NA;NA;NA;0;NA;NA;NA;0;NA;NA;0;NA;0;NA;NA;NA;0;NA;NA;0;0;NA;NA;NA;0;NA;NA;NA;NA;1;24;0;NA;NA;23
480882;26-08-2017;Offside, Southampton. Steven Davis tries a through ball, but Manolo Gabbiadini is caught offside.;23';Huddersfield Town;Southampton;0;0;0;0;0;0;0;NA;NA;NA;NA;NA;NA;NA;0;NA;NA;0;NA;0;1;Southampton;Manolo Gabbiadini;Steven Davis;0;NA;NA;NA;0;NA;NA;0;NA;0;NA;NA;NA;0;NA;NA;0;0;NA;NA;NA;0;NA;NA;NA;NA;1;25;0;NA;NA;23
480882;26-08-2017;Attempt missed. Mario Lemina (Southampton) right footed shot from outside the box misses to the right. Assisted by Nathan Redmond.;28';Huddersfield Town;Southampton;0;0;0;0;0;1;0;missed;Mario Lemina;Southampton;right;outside the box;right;Nathan Redmond;0;NA;NA;0;NA;0;0;NA;NA;NA;0;NA;NA;NA;0;NA;NA;0;NA;0;NA;NA;NA;0;NA;NA;0;0;NA;NA;NA;0;NA;NA;NA;NA;1;26;0;NA;NA;28
480882;26-08-2017;Cédric Soares (Southampton) wins a free kick in the defensive half.;30';Huddersfield Town;Southampton;0;0;0;0;0;0;0;NA;NA;NA;NA;NA;NA;NA;0;NA;NA;0;NA;0;0;NA;NA;NA;0;NA;NA;NA;0;NA;NA;0;NA;1;Cédric Soares;Southampton;defensive half;0;NA;NA;0;0;NA;NA;NA;0;NA;NA;NA;NA;1;27;0;NA;NA;30
480882;26-08-2017;Foul by Rajiv van La Parra (Huddersfield Town).;30';Huddersfield Town;Southampton;0;0;0;0;0;0;0;NA;NA;NA;NA;NA;NA;NA;1;van La Parra;Huddersfield Town;0;NA;0;0;NA;NA;NA;0;NA;NA;NA;0;NA;NA;0;NA;0;NA;NA;NA;0;NA;NA;0;0;NA;NA;NA;0;NA;NA;NA;NA;1;28;0;NA;NA;30
480882;26-08-2017;Attempt missed. Steve Mounie (Huddersfield Town) right footed shot from the centre of the box is close, but misses to the left. Assisted by Tommy Smith with a cross.;31';Huddersfield Town;Southampton;0;0;0;0;0;1;0;missed;Steve Mounie;Huddersfield Town;right;the centre of the box;close, but left;Tommy Smith;0;NA;NA;0;cross;0;0;NA;NA;NA;0;NA;NA;NA;0;NA;NA;0;NA;0;NA;NA;NA;0;NA;NA;0;0;NA;NA;NA;0;NA;NA;NA;NA;1;29;0;NA;NA;31
480882;26-08-2017;Foul by Elias Kachunga (Huddersfield Town).;31';Huddersfield Town;Southampton;0;0;0;0;0;0;0;NA;NA;NA;NA;NA;NA;NA;1;Elias Kachunga;Huddersfield Town;0;NA;0;0;NA;NA;NA;0;NA;NA;NA;0;NA;NA;0;NA;0;NA;NA;NA;0;NA;NA;0;0;NA;NA;NA;0;NA;NA;NA;NA;1;30;0;NA;NA;31
480882;26-08-2017;Ryan Bertrand (Southampton) wins a free kick in the defensive half.;31';Huddersfield Town;Southampton;0;0;0;0;0;0;0;NA;NA;NA;NA;NA;NA;NA;0;NA;NA;0;NA;0;0;NA;NA;NA;0;NA;NA;NA;0;NA;NA;0;NA;1;Ryan Bertrand;Southampton;defensive half;0;NA;NA;0;0;NA;NA;NA;0;NA;NA;NA;NA;1;31;0;NA;NA;31
480882;26-08-2017;Aaron Mooy (Huddersfield Town) wins a free kick on the right wing.;33';Huddersfield Town;Southampton;0;0;0;0;0;0;0;NA;NA;NA;NA;NA;NA;NA;0;NA;NA;0;NA;0;0;NA;NA;NA;0;NA;NA;NA;0;NA;NA;0;NA;1;Aaron Mooy;Huddersfield Town;NA;0;NA;NA;0;0;NA;NA;NA;0;NA;NA;NA;NA;1;32;0;NA;NA;33
480882;26-08-2017;Foul by Oriol Romeu (Southampton).;33';Huddersfield Town;Southampton;0;0;0;0;0;0;0;NA;NA;NA;NA;NA;NA;NA;1;Oriol Romeu;Southampton;0;NA;0;0;NA;NA;NA;0;NA;NA;NA;0;NA;NA;0;NA;0;NA;NA;NA;0;NA;NA;0;0;NA;NA;NA;0;NA;NA;NA;NA;1;33;0;NA;NA;33
480882;26-08-2017;Corner,  Huddersfield Town. Conceded by Ryan Bertrand.;34';Huddersfield Town;Southampton;0;0;0;0;0;0;0;NA;NA;NA;NA;NA;NA;NA;0;NA;NA;0;NA;0;0;NA;NA;NA;0;NA;NA;NA;0;NA;NA;0;NA;0;NA;NA;NA;1;Huddersfield Town;Ryan Bertrand;0;0;NA;NA;NA;0;NA;NA;NA;NA;1;34;0;NA;NA;34
480882;26-08-2017;Attempt saved. Steve Mounie (Huddersfield Town) header from the centre of the box is saved in the centre of the goal. Assisted by Aaron Mooy with a cross.;35';Huddersfield Town;Southampton;0;0;0;0;0;1;0;saved;Steve Mounie;Huddersfield Town;header;the centre of the box;the centre of the goal;Aaron Mooy;0;NA;NA;0;cross;0;0;NA;NA;NA;0;NA;NA;NA;0;NA;NA;0;NA;0;NA;NA;NA;0;NA;NA;0;0;NA;NA;NA;0;NA;NA;NA;NA;1;35;0;NA;NA;35
480882;26-08-2017;Attempt saved. Tom Ince (Huddersfield Town) left footed shot from the right side of the box is saved in the bottom left corner. Assisted by Tommy Smith.;36';Huddersfield Town;Southampton;0;0;0;0;0;1;0;saved;Tom Ince;Huddersfield Town;left;the right side of the box;the bottom left corner;Tommy Smith;0;NA;NA;0;NA;0;0;NA;NA;NA;0;NA;NA;NA;0;NA;NA;0;NA;0;NA;NA;NA;0;NA;NA;0;0;NA;NA;NA;0;NA;NA;NA;NA;1;36;0;NA;NA;36
480882;26-08-2017;Corner,  Huddersfield Town. Conceded by Fraser Forster.;36';Huddersfield Town;Southampton;0;0;0;0;0;0;0;NA;NA;NA;NA;NA;NA;NA;0;NA;NA;0;NA;0;0;NA;NA;NA;0;NA;NA;NA;0;NA;NA;0;NA;0;NA;NA;NA;1;Huddersfield Town;Fraser Forster;0;0;NA;NA;NA;0;NA;NA;NA;NA;1;37;0;NA;NA;36
480882;26-08-2017;Attempt saved. Elias Kachunga (Huddersfield Town) left footed shot from the centre of the box is saved in the centre of the goal.;40';Huddersfield Town;Southampton;0;0;0;0;0;1;0;saved;Elias Kachunga;Huddersfield Town;left;the centre of the box;the centre of the goal;NA;0;NA;NA;0;NA;0;0;NA;NA;NA;0;NA;NA;NA;0;NA;NA;0;NA;0;NA;NA;NA;0;NA;NA;0;0;NA;NA;NA;0;NA;NA;NA;NA;1;38;0;NA;NA;40
480882;26-08-2017;Corner,  Huddersfield Town. Conceded by Fraser Forster.;40';Huddersfield Town;Southampton;0;0;0;0;0;0;0;NA;NA;NA;NA;NA;NA;NA;0;NA;NA;0;NA;0;0;NA;NA;NA;0;NA;NA;NA;0;NA;NA;0;NA;0;NA;NA;NA;1;Huddersfield Town;Fraser Forster;0;0;NA;NA;NA;0;NA;NA;NA;NA;1;39;0;NA;NA;40
480882;26-08-2017;Foul by Oriol Romeu (Southampton).;45'+1';Huddersfield Town;Southampton;0;0;0;0;0;0;0;NA;NA;NA;NA;NA;NA;NA;1;Oriol Romeu;Southampton;0;NA;0;0;NA;NA;NA;0;NA;NA;NA;0;NA;NA;0;NA;0;NA;NA;NA;0;NA;NA;0;0;NA;NA;NA;0;NA;NA;NA;NA;1;40;1;NA;NA;46
480882;26-08-2017;Steve Mounie (Huddersfield Town) wins a free kick on the right wing.;45'+1';Huddersfield Town;Southampton;0;0;0;0;0;0;0;NA;NA;NA;NA;NA;NA;NA;0;NA;NA;0;NA;0;0;NA;NA;NA;0;NA;NA;NA;0;NA;NA;0;NA;1;Steve Mounie;Huddersfield Town;NA;0;NA;NA;0;0;NA;NA;NA;0;NA;NA;NA;NA;1;41;1;NA;NA;46
480882;26-08-2017;Oriol Romeu (Southampton) is shown the yellow card for a bad foul.;45'+1';Huddersfield Town;Southampton;0;0;0;0;0;0;0;NA;NA;NA;NA;NA;NA;NA;0;NA;NA;0;NA;0;0;NA;NA;NA;1;yellow;Oriol Romeu;Southampton;0;NA;NA;0;NA;0;NA;NA;NA;0;NA;NA;0;0;NA;NA;NA;0;NA;NA;NA;NA;1;42;1;NA;NA;46
480882;26-08-2017;First Half ends, Huddersfield Town 0, Southampton 0.;45'+2';Huddersfield Town;Southampton;0;0;1;0;0;0;0;NA;NA;NA;NA;NA;NA;NA;0;NA;NA;0;NA;0;0;NA;NA;NA;0;NA;NA;NA;0;NA;NA;0;NA;0;NA;NA;NA;0;NA;NA;0;0;NA;NA;NA;0;NA;NA;NA;NA;1;43;1;NA;NA;47
480882;26-08-2017;Second Half begins Huddersfield Town 0, Southampton 0.;45';Huddersfield Town;Southampton;0;0;0;0;1;0;0;NA;NA;NA;NA;NA;NA;NA;0;NA;NA;0;NA;0;0;NA;NA;NA;0;NA;NA;NA;0;NA;NA;0;NA;0;NA;NA;NA;0;NA;NA;0;0;NA;NA;NA;0;NA;NA;NA;NA;2;44;0;NA;NA;45
480882;26-08-2017;Foul by Cédric Soares (Southampton).;48';Huddersfield Town;Southampton;0;0;0;0;0;0;0;NA;NA;NA;NA;NA;NA;NA;1;Cédric Soares;Southampton;0;NA;0;0;NA;NA;NA;0;NA;NA;NA;0;NA;NA;0;NA;0;NA;NA;NA;0;NA;NA;0;0;NA;NA;NA;0;NA;NA;NA;NA;2;45;0;NA;NA;48
480882;26-08-2017;Rajiv van La Parra (Huddersfield Town) wins a free kick on the left wing.;48';Huddersfield Town;Southampton;0;0;0;0;0;0;0;NA;NA;NA;NA;NA;NA;NA;0;NA;NA;0;NA;0;0;NA;NA;NA;0;NA;NA;NA;0;NA;NA;0;NA;1;NA;Huddersfield Town;NA;0;NA;NA;0;0;NA;NA;NA;0;NA;NA;NA;NA;2;46;0;NA;NA;48
480882;26-08-2017;Delay in match Rajiv van La Parra (Huddersfield Town) because of an injury.;48';Huddersfield Town;Southampton;0;0;0;0;0;0;0;NA;NA;NA;NA;NA;NA;NA;0;NA;NA;0;NA;0;0;NA;NA;NA;0;NA;NA;NA;0;NA;NA;1;Huddersfield Town;0;NA;NA;NA;0;NA;NA;0;0;NA;NA;NA;0;NA;NA;NA;NA;2;47;0;NA;NA;48
480882;26-08-2017;Delay over. They are ready to continue.;49';Huddersfield Town;Southampton;0;0;0;0;0;0;0;NA;NA;NA;NA;NA;NA;NA;0;NA;NA;0;NA;0;0;NA;NA;NA;0;NA;NA;NA;0;NA;NA;0;NA;0;NA;NA;NA;0;NA;NA;0;0;NA;NA;NA;0;NA;NA;NA;NA;2;48;0;NA;NA;49
480882;26-08-2017;Attempt saved. Manolo Gabbiadini (Southampton) left footed shot from outside the box is saved in the centre of the goal. Assisted by Mario Lemina.;51';Huddersfield Town;Southampton;0;0;0;0;0;1;0;saved;Manolo Gabbiadini;Southampton;left;outside the box;the centre of the goal;Mario Lemina;0;NA;NA;0;NA;0;0;NA;NA;NA;0;NA;NA;NA;0;NA;NA;0;NA;0;NA;NA;NA;0;NA;NA;0;0;NA;NA;NA;0;NA;NA;NA;NA;2;49;0;NA;NA;51
480882;26-08-2017;Corner,  Southampton. Conceded by Tom Ince.;53';Huddersfield Town;Southampton;0;0;0;0;0;0;0;NA;NA;NA;NA;NA;NA;NA;0;NA;NA;0;NA;0;0;NA;NA;NA;0;NA;NA;NA;0;NA;NA;0;NA;0;NA;NA;NA;1;Southampton;Tom Ince;0;0;NA;NA;NA;0;NA;NA;NA;NA;2;50;0;NA;NA;53
480882;26-08-2017;Substitution, Huddersfield Town. Kasey Palmer replaces Rajiv van La Parra because of an injury.;56';Huddersfield Town;Southampton;0;0;0;0;0;0;0;NA;NA;NA;NA;NA;NA;NA;0;NA;NA;0;NA;0;0;NA;NA;NA;0;NA;NA;NA;0;NA;NA;0;NA;0;NA;NA;NA;0;NA;NA;1;1;Huddersfield Town;Kasey Palmer;Rajiv van La;0;NA;NA;NA;NA;2;51;0;NA;NA;56
480882;26-08-2017;Attempt missed. Steve Mounie (Huddersfield Town) header from the centre of the box is too high. Assisted by Tommy Smith with a cross.;57';Huddersfield Town;Southampton;0;0;0;0;0;1;0;missed;Steve Mounie;Huddersfield Town;header;the centre of the box;too high;Tommy Smith;0;NA;NA;0;cross;0;0;NA;NA;NA;0;NA;NA;NA;0;NA;NA;0;NA;0;NA;NA;NA;0;NA;NA;0;0;NA;NA;NA;0;NA;NA;NA;NA;2;52;0;NA;NA;57
480882;26-08-2017;Foul by Jack Stephens (Southampton).;58';Huddersfield Town;Southampton;0;0;0;0;0;0;0;NA;NA;NA;NA;NA;NA;NA;1;Jack Stephens;Southampton;0;NA;0;0;NA;NA;NA;0;NA;NA;NA;0;NA;NA;0;NA;0;NA;NA;NA;0;NA;NA;0;0;NA;NA;NA;0;NA;NA;NA;NA;2;53;0;NA;NA;58
480882;26-08-2017;Kasey Palmer (Huddersfield Town) wins a free kick on the left wing.;58';Huddersfield Town;Southampton;0;0;0;0;0;0;0;NA;NA;NA;NA;NA;NA;NA;0;NA;NA;0;NA;0;0;NA;NA;NA;0;NA;NA;NA;0;NA;NA;0;NA;1;Kasey Palmer;Huddersfield Town;NA;0;NA;NA;0;0;NA;NA;NA;0;NA;NA;NA;NA;2;54;0;NA;NA;58
480882;26-08-2017;Substitution, Huddersfield Town. Danny Williams replaces Philip Billing.;61';Huddersfield Town;Southampton;0;0;0;0;0;0;0;NA;NA;NA;NA;NA;NA;NA;0;NA;NA;0;NA;0;0;NA;NA;NA;0;NA;NA;NA;0;NA;NA;0;NA;0;NA;NA;NA;0;NA;NA;1;0;Huddersfield Town;Danny Williams;Philip Billing;0;NA;NA;NA;NA;2;55;0;NA;NA;61
480882;26-08-2017;Dusan Tadic (Southampton) wins a free kick in the defensive half.;63';Huddersfield Town;Southampton;0;0;0;0;0;0;0;NA;NA;NA;NA;NA;NA;NA;0;NA;NA;0;NA;0;0;NA;NA;NA;0;NA;NA;NA;0;NA;NA;0;NA;1;Dusan Tadic;Southampton;defensive half;0;NA;NA;0;0;NA;NA;NA;0;NA;NA;NA;NA;2;56;0;NA;NA;63
480882;26-08-2017;Foul by Danny Williams (Huddersfield Town).;63';Huddersfield Town;Southampton;0;0;0;0;0;0;0;NA;NA;NA;NA;NA;NA;NA;1;Danny Williams;Huddersfield Town;0;NA;0;0;NA;NA;NA;0;NA;NA;NA;0;NA;NA;0;NA;0;NA;NA;NA;0;NA;NA;0;0;NA;NA;NA;0;NA;NA;NA;NA;2;57;0;NA;NA;63
480882;26-08-2017;Attempt missed. Nathan Redmond (Southampton) left footed shot from outside the box misses to the right. Assisted by Manolo Gabbiadini.;64';Huddersfield Town;Southampton;0;0;0;0;0;1;0;missed;Nathan Redmond;Southampton;left;outside the box;right;Manolo Gabbiadini;0;NA;NA;0;NA;0;0;NA;NA;NA;0;NA;NA;NA;0;NA;NA;0;NA;0;NA;NA;NA;0;NA;NA;0;0;NA;NA;NA;0;NA;NA;NA;NA;2;58;0;NA;NA;64
480882;26-08-2017;Substitution, Southampton. Shane Long replaces Mario Lemina.;64';Huddersfield Town;Southampton;0;0;0;0;0;0;0;NA;NA;NA;NA;NA;NA;NA;0;NA;NA;0;NA;0;0;NA;NA;NA;0;NA;NA;NA;0;NA;NA;0;NA;0;NA;NA;NA;0;NA;NA;1;0;Southampton;Shane Long;Mario Lemina;0;NA;NA;NA;NA;2;59;0;NA;NA;64
480882;26-08-2017;Corner,  Southampton. Conceded by Zanka.;66';Huddersfield Town;Southampton;0;0;0;0;0;0;0;NA;NA;NA;NA;NA;NA;NA;0;NA;NA;0;NA;0;0;NA;NA;NA;0;NA;NA;NA;0;NA;NA;0;NA;0;NA;NA;NA;1;Southampton;Zanka;0;0;NA;NA;NA;0;NA;NA;NA;NA;2;60;0;NA;NA;66
480882;26-08-2017;Corner,  Southampton. Conceded by Kasey Palmer.;66';Huddersfield Town;Southampton;0;0;0;0;0;0;0;NA;NA;NA;NA;NA;NA;NA;0;NA;NA;0;NA;0;0;NA;NA;NA;0;NA;NA;NA;0;NA;NA;0;NA;0;NA;NA;NA;1;Southampton;Kasey Palmer;0;0;NA;NA;NA;0;NA;NA;NA;NA;2;61;0;NA;NA;66
480882;26-08-2017;Foul by Christopher Schindler (Huddersfield Town).;67';Huddersfield Town;Southampton;0;0;0;0;0;0;0;NA;NA;NA;NA;NA;NA;NA;1;Christopher Schindler;Huddersfield Town;0;NA;0;0;NA;NA;NA;0;NA;NA;NA;0;NA;NA;0;NA;0;NA;NA;NA;0;NA;NA;0;0;NA;NA;NA;0;NA;NA;NA;NA;2;62;0;NA;NA;67
480882;26-08-2017;Shane Long (Southampton) wins a free kick in the defensive half.;67';Huddersfield Town;Southampton;0;0;0;0;0;0;0;NA;NA;NA;NA;NA;NA;NA;0;NA;NA;0;NA;0;0;NA;NA;NA;0;NA;NA;NA;0;NA;NA;0;NA;1;Shane Long;Southampton;defensive half;0;NA;NA;0;0;NA;NA;NA;0;NA;NA;NA;NA;2;63;0;NA;NA;67
480882;26-08-2017;Foul by Cédric Soares (Southampton).;68';Huddersfield Town;Southampton;0;0;0;0;0;0;0;NA;NA;NA;NA;NA;NA;NA;1;Cédric Soares;Southampton;0;NA;0;0;NA;NA;NA;0;NA;NA;NA;0;NA;NA;0;NA;0;NA;NA;NA;0;NA;NA;0;0;NA;NA;NA;0;NA;NA;NA;NA;2;64;0;NA;NA;68
480882;26-08-2017;Tom Ince (Huddersfield Town) wins a free kick in the defensive half.;68';Huddersfield Town;Southampton;0;0;0;0;0;0;0;NA;NA;NA;NA;NA;NA;NA;0;NA;NA;0;NA;0;0;NA;NA;NA;0;NA;NA;NA;0;NA;NA;0;NA;1;Tom Ince;Huddersfield Town;defensive half;0;NA;NA;0;0;NA;NA;NA;0;NA;NA;NA;NA;2;65;0;NA;NA;68
480882;26-08-2017;Attempt blocked. Tom Ince (Huddersfield Town) left footed shot from outside the box is blocked. Assisted by Elias Kachunga.;68';Huddersfield Town;Southampton;0;0;0;0;0;1;0;blocked;Tom Ince;Huddersfield Town;left;outside the box;NA;Elias Kachunga;0;NA;NA;0;NA;0;0;NA;NA;NA;0;NA;NA;NA;0;NA;NA;0;NA;0;NA;NA;NA;0;NA;NA;0;0;NA;NA;NA;0;NA;NA;NA;NA;2;66;0;NA;NA;68
480882;26-08-2017;Attempt blocked. Aaron Mooy (Huddersfield Town) right footed shot from the right side of the box is blocked.;68';Huddersfield Town;Southampton;0;0;0;0;0;1;0;blocked;Aaron Mooy;Huddersfield Town;right;the right side of the box;NA;NA;0;NA;NA;0;NA;0;0;NA;NA;NA;0;NA;NA;NA;0;NA;NA;0;NA;0;NA;NA;NA;0;NA;NA;0;0;NA;NA;NA;0;NA;NA;NA;NA;2;67;0;NA;NA;68
480882;26-08-2017;Christopher Schindler (Huddersfield Town) wins a free kick in the defensive half.;69';Huddersfield Town;Southampton;0;0;0;0;0;0;0;NA;NA;NA;NA;NA;NA;NA;0;NA;NA;0;NA;0;0;NA;NA;NA;0;NA;NA;NA;0;NA;NA;0;NA;1;Christopher Schindler;Huddersfield Town;defensive half;0;NA;NA;0;0;NA;NA;NA;0;NA;NA;NA;NA;2;68;0;NA;NA;69
480882;26-08-2017;Foul by Shane Long (Southampton).;69';Huddersfield Town;Southampton;0;0;0;0;0;0;0;NA;NA;NA;NA;NA;NA;NA;1;Shane Long;Southampton;0;NA;0;0;NA;NA;NA;0;NA;NA;NA;0;NA;NA;0;NA;0;NA;NA;NA;0;NA;NA;0;0;NA;NA;NA;0;NA;NA;NA;NA;2;69;0;NA;NA;69
480882;26-08-2017;Substitution, Southampton. James Ward-Prowse replaces Manolo Gabbiadini.;71';Huddersfield Town;Southampton;0;0;0;0;0;0;0;NA;NA;NA;NA;NA;NA;NA;0;NA;NA;0;NA;0;0;NA;NA;NA;0;NA;NA;NA;0;NA;NA;0;NA;0;NA;NA;NA;0;NA;NA;1;0;Southampton;James Ward-Prowse;Manolo Gabbiadini;0;NA;NA;NA;NA;2;70;0;NA;NA;71
480882;26-08-2017;Foul by Nathan Redmond (Southampton).;72';Huddersfield Town;Southampton;0;0;0;0;0;0;0;NA;NA;NA;NA;NA;NA;NA;1;Nathan Redmond;Southampton;0;NA;0;0;NA;NA;NA;0;NA;NA;NA;0;NA;NA;0;NA;0;NA;NA;NA;0;NA;NA;0;0;NA;NA;NA;0;NA;NA;NA;NA;2;71;0;NA;NA;72
480882;26-08-2017;Tommy Smith (Huddersfield Town) wins a free kick on the right wing.;72';Huddersfield Town;Southampton;0;0;0;0;0;0;0;NA;NA;NA;NA;NA;NA;NA;0;NA;NA;0;NA;0;0;NA;NA;NA;0;NA;NA;NA;0;NA;NA;0;NA;1;Tommy Smith;Huddersfield Town;NA;0;NA;NA;0;0;NA;NA;NA;0;NA;NA;NA;NA;2;72;0;NA;NA;72
480882;26-08-2017;Substitution, Southampton. Sam McQueen replaces Dusan Tadic.;74';Huddersfield Town;Southampton;0;0;0;0;0;0;0;NA;NA;NA;NA;NA;NA;NA;0;NA;NA;0;NA;0;0;NA;NA;NA;0;NA;NA;NA;0;NA;NA;0;NA;0;NA;NA;NA;0;NA;NA;1;0;Southampton;Sam McQueen;Dusan Tadic;0;NA;NA;NA;NA;2;73;0;NA;NA;74
480882;26-08-2017;Attempt saved. Tom Ince (Huddersfield Town) left footed shot from outside the box is saved in the centre of the goal. Assisted by Tommy Smith.;74';Huddersfield Town;Southampton;0;0;0;0;0;1;0;saved;Tom Ince;Huddersfield Town;left;outside the box;the centre of the goal;Tommy Smith;0;NA;NA;0;NA;0;0;NA;NA;NA;0;NA;NA;NA;0;NA;NA;0;NA;0;NA;NA;NA;0;NA;NA;0;0;NA;NA;NA;0;NA;NA;NA;NA;2;74;0;NA;NA;74
480882;26-08-2017;Attempt blocked. Kasey Palmer (Huddersfield Town) right footed shot from the right side of the box is blocked. Assisted by Tom Ince.;76';Huddersfield Town;Southampton;0;0;0;0;0;1;0;blocked;Kasey Palmer;Huddersfield Town;right;the right side of the box;NA;Tom Ince;0;NA;NA;0;NA;0;0;NA;NA;NA;0;NA;NA;NA;0;NA;NA;0;NA;0;NA;NA;NA;0;NA;NA;0;0;NA;NA;NA;0;NA;NA;NA;NA;2;75;0;NA;NA;76
480882;26-08-2017;Corner,  Huddersfield Town. Conceded by Jack Stephens.;76';Huddersfield Town;Southampton;0;0;0;0;0;0;0;NA;NA;NA;NA;NA;NA;NA;0;NA;NA;0;NA;0;0;NA;NA;NA;0;NA;NA;NA;0;NA;NA;0;NA;0;NA;NA;NA;1;Huddersfield Town;Jack Stephens;0;0;NA;NA;NA;0;NA;NA;NA;NA;2;76;0;NA;NA;76
480882;26-08-2017;Attempt missed. Danny Williams (Huddersfield Town) header from the centre of the box is too high. Assisted by Kasey Palmer with a cross following a corner.;76';Huddersfield Town;Southampton;0;0;0;0;0;1;0;missed;Danny Williams;Huddersfield Town;header;the centre of the box;too high;Kasey Palmer;0;NA;NA;0;cross;1;0;NA;NA;NA;0;NA;NA;NA;0;NA;NA;0;NA;0;NA;NA;NA;0;NA;NA;0;0;NA;NA;NA;0;NA;NA;NA;NA;2;77;0;NA;NA;76
480882;26-08-2017;Foul by Danny Williams (Huddersfield Town).;81';Huddersfield Town;Southampton;0;0;0;0;0;0;0;NA;NA;NA;NA;NA;NA;NA;1;Danny Williams;Huddersfield Town;0;NA;0;0;NA;NA;NA;0;NA;NA;NA;0;NA;NA;0;NA;0;NA;NA;NA;0;NA;NA;0;0;NA;NA;NA;0;NA;NA;NA;NA;2;78;0;NA;NA;81
480882;26-08-2017;Oriol Romeu (Southampton) wins a free kick in the defensive half.;81';Huddersfield Town;Southampton;0;0;0;0;0;0;0;NA;NA;NA;NA;NA;NA;NA;0;NA;NA;0;NA;0;0;NA;NA;NA;0;NA;NA;NA;0;NA;NA;0;NA;1;Oriol Romeu;Southampton;defensive half;0;NA;NA;0;0;NA;NA;NA;0;NA;NA;NA;NA;2;79;0;NA;NA;81
480882;26-08-2017;Attempt missed. Steve Mounie (Huddersfield Town) right footed shot from outside the box is high and wide to the right. Assisted by Tom Ince.;82';Huddersfield Town;Southampton;0;0;0;0;0;1;0;missed;Steve Mounie;Huddersfield Town;right;outside the box;high and wide to the right;Tom Ince;0;NA;NA;0;NA;0;0;NA;NA;NA;0;NA;NA;NA;0;NA;NA;0;NA;0;NA;NA;NA;0;NA;NA;0;0;NA;NA;NA;0;NA;NA;NA;NA;2;80;0;NA;NA;82
480882;26-08-2017;Attempt saved. Nathan Redmond (Southampton) right footed shot from the centre of the box is saved in the bottom right corner. Assisted by Shane Long.;85';Huddersfield Town;Southampton;0;0;0;0;0;1;0;saved;Nathan Redmond;Southampton;right;the centre of the box;the bottom right corner;Shane Long;0;NA;NA;0;NA;0;0;NA;NA;NA;0;NA;NA;NA;0;NA;NA;0;NA;0;NA;NA;NA;0;NA;NA;0;0;NA;NA;NA;0;NA;NA;NA;NA;2;81;0;NA;NA;85
480882;26-08-2017;Offside, Southampton. Nathan Redmond tries a through ball, but Sam McQueen is caught offside.;86';Huddersfield Town;Southampton;0;0;0;0;0;0;0;NA;NA;NA;NA;NA;NA;NA;0;NA;NA;0;NA;0;1;Southampton;Sam McQueen;Nathan Redmond;0;NA;NA;NA;0;NA;NA;0;NA;0;NA;NA;NA;0;NA;NA;0;0;NA;NA;NA;0;NA;NA;NA;NA;2;82;0;NA;NA;86
