480635;24-02-2018;First Half begins.;-;Liverpool;West Ham United;0;0;0;0;1;0;0;NA;NA;NA;NA;NA;NA;NA;0;NA;NA;0;NA;0;0;NA;NA;NA;0;NA;NA;NA;0;NA;NA;0;NA;0;NA;NA;NA;0;NA;NA;0;0;NA;NA;NA;0;NA;NA;NA;NA;1;1;0;NA;NA;NA
480635;24-02-2018;Lineups are announced and players are warming up.;-;Liverpool;West Ham United;0;0;0;0;0;0;0;NA;NA;NA;NA;NA;NA;NA;0;NA;NA;0;NA;0;0;NA;NA;NA;0;NA;NA;NA;0;NA;NA;0;NA;0;NA;NA;NA;0;NA;NA;0;0;NA;NA;NA;0;NA;NA;NA;NA;1;2;0;NA;NA;NA
480635;24-02-2018;Foul by Marko Arnautovic (West Ham United).;1';Liverpool;West Ham United;0;0;0;0;0;0;0;NA;NA;NA;NA;NA;NA;NA;1;Marko Arnautovic;West Ham United;0;NA;0;0;NA;NA;NA;0;NA;NA;NA;0;NA;NA;0;NA;0;NA;NA;NA;0;NA;NA;0;0;NA;NA;NA;0;NA;NA;NA;NA;1;3;0;NA;NA;1
480635;24-02-2018;Virgil van Dijk (Liverpool) wins a free kick in the defensive half.;1';Liverpool;West Ham United;0;0;0;0;0;0;0;NA;NA;NA;NA;NA;NA;NA;0;NA;NA;0;NA;0;0;NA;NA;NA;0;NA;NA;NA;0;NA;NA;0;NA;1;Virgil van Dijk;Liverpool;defensive half;0;NA;NA;0;0;NA;NA;NA;0;NA;NA;NA;NA;1;4;0;NA;NA;1
480635;24-02-2018;Attempt saved. Mohamed Salah (Liverpool) left footed shot from the centre of the box is saved in the bottom right corner. Assisted by Roberto Firmino.;3';Liverpool;West Ham United;0;0;0;0;0;1;0;saved;Mohamed Salah;Liverpool;left;the centre of the box;the bottom right corner;Roberto Firmino;0;NA;NA;0;NA;0;0;NA;NA;NA;0;NA;NA;NA;0;NA;NA;0;NA;0;NA;NA;NA;0;NA;NA;0;0;NA;NA;NA;0;NA;NA;NA;NA;1;5;0;NA;NA;3
480635;24-02-2018;Corner,  Liverpool. Conceded by Pablo Zabaleta.;3';Liverpool;West Ham United;0;0;0;0;0;0;0;NA;NA;NA;NA;NA;NA;NA;0;NA;NA;0;NA;0;0;NA;NA;NA;0;NA;NA;NA;0;NA;NA;0;NA;0;NA;NA;NA;1;Liverpool;Pablo Zabaleta;0;0;NA;NA;NA;0;NA;NA;NA;NA;1;6;0;NA;NA;3
480635;24-02-2018;Corner,  Liverpool. Conceded by James Collins.;7';Liverpool;West Ham United;0;0;0;0;0;0;0;NA;NA;NA;NA;NA;NA;NA;0;NA;NA;0;NA;0;0;NA;NA;NA;0;NA;NA;NA;0;NA;NA;0;NA;0;NA;NA;NA;1;Liverpool;James Collins;0;0;NA;NA;NA;0;NA;NA;NA;NA;1;7;0;NA;NA;7
480635;24-02-2018;Attempt saved. Virgil van Dijk (Liverpool) header from the centre of the box is saved in the centre of the goal. Assisted by James Milner with a cross.;7';Liverpool;West Ham United;0;0;0;0;0;1;0;saved;Virgil van Dijk;Liverpool;header;the centre of the box;the centre of the goal;James Milner;0;NA;NA;0;cross;0;0;NA;NA;NA;0;NA;NA;NA;0;NA;NA;0;NA;0;NA;NA;NA;0;NA;NA;0;0;NA;NA;NA;0;NA;NA;NA;NA;1;8;0;NA;NA;7
480635;24-02-2018;Corner,  Liverpool. Conceded by Pablo Zabaleta.;12';Liverpool;West Ham United;0;0;0;0;0;0;0;NA;NA;NA;NA;NA;NA;NA;0;NA;NA;0;NA;0;0;NA;NA;NA;0;NA;NA;NA;0;NA;NA;0;NA;0;NA;NA;NA;1;Liverpool;Pablo Zabaleta;0;0;NA;NA;NA;0;NA;NA;NA;NA;1;9;0;NA;NA;12
480635;24-02-2018;Cheikhou Kouyaté (West Ham United) wins a free kick in the defensive half.;13';Liverpool;West Ham United;0;0;0;0;0;0;0;NA;NA;NA;NA;NA;NA;NA;0;NA;NA;0;NA;0;0;NA;NA;NA;0;NA;NA;NA;0;NA;NA;0;NA;1;Cheikhou Kouyaté;West Ham United;defensive half;0;NA;NA;0;0;NA;NA;NA;0;NA;NA;NA;NA;1;10;0;NA;NA;13
480635;24-02-2018;Foul by James Milner (Liverpool).;13';Liverpool;West Ham United;0;0;0;0;0;0;0;NA;NA;NA;NA;NA;NA;NA;1;James Milner;Liverpool;0;NA;0;0;NA;NA;NA;0;NA;NA;NA;0;NA;NA;0;NA;0;NA;NA;NA;0;NA;NA;0;0;NA;NA;NA;0;NA;NA;NA;NA;1;11;0;NA;NA;13
480635;24-02-2018;Attempt saved. Marko Arnautovic (West Ham United) right footed shot from the right side of the box is saved in the top centre of the goal.;15';Liverpool;West Ham United;0;0;0;0;0;1;0;saved;Marko Arnautovic;West Ham United;right;the right side of the box;the top centre of the goal;NA;0;NA;NA;0;NA;0;0;NA;NA;NA;0;NA;NA;NA;0;NA;NA;0;NA;0;NA;NA;NA;0;NA;NA;0;0;NA;NA;NA;0;NA;NA;NA;NA;1;12;0;NA;NA;15
480635;24-02-2018;Attempt blocked. Marko Arnautovic (West Ham United) right footed shot from the left side of the box is blocked. Assisted by Manuel Lanzini.;16';Liverpool;West Ham United;0;0;0;0;0;1;0;blocked;Marko Arnautovic;West Ham United;right;the left side of the box;NA;Manuel Lanzini;0;NA;NA;0;NA;0;0;NA;NA;NA;0;NA;NA;NA;0;NA;NA;0;NA;0;NA;NA;NA;0;NA;NA;0;0;NA;NA;NA;0;NA;NA;NA;NA;1;13;0;NA;NA;16
480635;24-02-2018;Attempt missed. Pablo Zabaleta (West Ham United) right footed shot from the right side of the box misses to the left.;16';Liverpool;West Ham United;0;0;0;0;0;1;0;missed;Pablo Zabaleta;West Ham United;right;the right side of the box;left;NA;0;NA;NA;0;NA;0;0;NA;NA;NA;0;NA;NA;NA;0;NA;NA;0;NA;0;NA;NA;NA;0;NA;NA;0;0;NA;NA;NA;0;NA;NA;NA;NA;1;14;0;NA;NA;16
480635;24-02-2018;Offside, West Ham United. Manuel Lanzini tries a through ball, but Marko Arnautovic is caught offside.;18';Liverpool;West Ham United;0;0;0;0;0;0;0;NA;NA;NA;NA;NA;NA;NA;0;NA;NA;0;NA;0;1;West Ham United;Marko Arnautovic;Manuel Lanzini;0;NA;NA;NA;0;NA;NA;0;NA;0;NA;NA;NA;0;NA;NA;0;0;NA;NA;NA;0;NA;NA;NA;NA;1;15;0;NA;NA;18
480635;24-02-2018;Attempt missed. Sadio Mané (Liverpool) header from the centre of the box is too high. Assisted by Roberto Firmino with a cross.;19';Liverpool;West Ham United;0;0;0;0;0;1;0;missed;Sadio Mané;Liverpool;header;the centre of the box;too high;Roberto Firmino;0;NA;NA;0;cross;0;0;NA;NA;NA;0;NA;NA;NA;0;NA;NA;0;NA;0;NA;NA;NA;0;NA;NA;0;0;NA;NA;NA;0;NA;NA;NA;NA;1;16;0;NA;NA;19
480635;24-02-2018;Attempt blocked. James Milner (Liverpool) right footed shot from outside the box is blocked.;20';Liverpool;West Ham United;0;0;0;0;0;1;0;blocked;James Milner;Liverpool;right;outside the box;NA;NA;0;NA;NA;0;NA;0;0;NA;NA;NA;0;NA;NA;NA;0;NA;NA;0;NA;0;NA;NA;NA;0;NA;NA;0;0;NA;NA;NA;0;NA;NA;NA;NA;1;17;0;NA;NA;20
480635;24-02-2018;Delay in match James Milner (Liverpool) because of an injury.;21';Liverpool;West Ham United;0;0;0;0;0;0;0;NA;NA;NA;NA;NA;NA;NA;0;NA;NA;0;NA;0;0;NA;NA;NA;0;NA;NA;NA;0;NA;NA;1;Liverpool;0;NA;NA;NA;0;NA;NA;0;0;NA;NA;NA;0;NA;NA;NA;NA;1;18;0;NA;NA;21
480635;24-02-2018;Delay over. They are ready to continue.;21';Liverpool;West Ham United;0;0;0;0;0;0;0;NA;NA;NA;NA;NA;NA;NA;0;NA;NA;0;NA;0;0;NA;NA;NA;0;NA;NA;NA;0;NA;NA;0;NA;0;NA;NA;NA;0;NA;NA;0;0;NA;NA;NA;0;NA;NA;NA;NA;1;19;0;NA;NA;21
480635;24-02-2018;Foul by Aaron Cresswell (West Ham United).;24';Liverpool;West Ham United;0;0;0;0;0;0;0;NA;NA;NA;NA;NA;NA;NA;1;Aaron Cresswell;West Ham United;0;NA;0;0;NA;NA;NA;0;NA;NA;NA;0;NA;NA;0;NA;0;NA;NA;NA;0;NA;NA;0;0;NA;NA;NA;0;NA;NA;NA;NA;1;20;0;NA;NA;24
480635;24-02-2018;Mohamed Salah (Liverpool) wins a free kick in the attacking half.;24';Liverpool;West Ham United;0;0;0;0;0;0;0;NA;NA;NA;NA;NA;NA;NA;0;NA;NA;0;NA;0;0;NA;NA;NA;0;NA;NA;NA;0;NA;NA;0;NA;1;Mohamed Salah;Liverpool;attacking half;0;NA;NA;0;0;NA;NA;NA;0;NA;NA;NA;NA;1;21;0;NA;NA;24
480635;24-02-2018;Foul by Roberto Firmino (Liverpool).;26';Liverpool;West Ham United;0;0;0;0;0;0;0;NA;NA;NA;NA;NA;NA;NA;1;Roberto Firmino;Liverpool;0;NA;0;0;NA;NA;NA;0;NA;NA;NA;0;NA;NA;0;NA;0;NA;NA;NA;0;NA;NA;0;0;NA;NA;NA;0;NA;NA;NA;NA;1;22;0;NA;NA;26
480635;24-02-2018;Patrice Evra (West Ham United) wins a free kick on the left wing.;26';Liverpool;West Ham United;0;0;0;0;0;0;0;NA;NA;NA;NA;NA;NA;NA;0;NA;NA;0;NA;0;0;NA;NA;NA;0;NA;NA;NA;0;NA;NA;0;NA;1;Patrice Evra;West Ham United;NA;0;NA;NA;0;0;NA;NA;NA;0;NA;NA;NA;NA;1;23;0;NA;NA;26
480635;24-02-2018;Attempt saved. Manuel Lanzini (West Ham United) right footed shot from the left side of the box is saved in the bottom left corner.;27';Liverpool;West Ham United;0;0;0;0;0;1;0;saved;Manuel Lanzini;West Ham United;right;the left side of the box;the bottom left corner;NA;0;NA;NA;0;NA;0;0;NA;NA;NA;0;NA;NA;NA;0;NA;NA;0;NA;0;NA;NA;NA;0;NA;NA;0;0;NA;NA;NA;0;NA;NA;NA;NA;1;24;0;NA;NA;27
480635;24-02-2018;Corner,  Liverpool. Conceded by Mark Noble.;28';Liverpool;West Ham United;0;0;0;0;0;0;0;NA;NA;NA;NA;NA;NA;NA;0;NA;NA;0;NA;0;0;NA;NA;NA;0;NA;NA;NA;0;NA;NA;0;NA;0;NA;NA;NA;1;Liverpool;Mark Noble;0;0;NA;NA;NA;0;NA;NA;NA;NA;1;25;0;NA;NA;28
480635;24-02-2018;Corner,  Liverpool. Conceded by Adrián.;29';Liverpool;West Ham United;0;0;0;0;0;0;0;NA;NA;NA;NA;NA;NA;NA;0;NA;NA;0;NA;0;0;NA;NA;NA;0;NA;NA;NA;0;NA;NA;0;NA;0;NA;NA;NA;1;Liverpool;Adrián;0;0;NA;NA;NA;0;NA;NA;NA;NA;1;26;0;NA;NA;29
480635;24-02-2018;Corner,  Liverpool. Conceded by Adrián.;29';Liverpool;West Ham United;0;0;0;0;0;0;0;NA;NA;NA;NA;NA;NA;NA;0;NA;NA;0;NA;0;0;NA;NA;NA;0;NA;NA;NA;0;NA;NA;0;NA;0;NA;NA;NA;1;Liverpool;Adrián;0;0;NA;NA;NA;0;NA;NA;NA;NA;1;27;0;NA;NA;29
480635;24-02-2018;Goal!  Liverpool 1, West Ham United 0. Emre Can (Liverpool) header from very close range to the bottom left corner. Assisted by Mohamed Salah with a cross following a corner.;29';Liverpool;West Ham United;1;0;0;0;0;1;0;goal;Emre Can;Liverpool;header;very close range;bottom left corner;Mohamed Salah;0;NA;NA;0;cross;1;0;NA;NA;NA;0;NA;NA;NA;0;NA;NA;0;NA;0;NA;NA;NA;0;NA;NA;0;0;NA;NA;NA;0;NA;NA;NA;NA;1;28;0;NA;NA;29
480635;24-02-2018;Attempt missed. Emre Can (Liverpool) right footed shot from outside the box is close, but misses to the right. Assisted by Sadio Mané.;32';Liverpool;West Ham United;1;0;0;0;0;1;0;missed;Emre Can;Liverpool;right;outside the box;close, but right;Sadio Mané;0;NA;NA;0;NA;0;0;NA;NA;NA;0;NA;NA;NA;0;NA;NA;0;NA;0;NA;NA;NA;0;NA;NA;0;0;NA;NA;NA;0;NA;NA;NA;NA;1;29;0;NA;NA;32
480635;24-02-2018;Attempt missed. Mohamed Salah (Liverpool) header from the right side of the six yard box is just a bit too high. Assisted by Andrew Robertson with a cross.;32';Liverpool;West Ham United;1;0;0;0;0;1;0;missed;Mohamed Salah;Liverpool;header;the right side of the six yard box;just a bit too high;Andrew Robertson;0;NA;NA;0;cross;0;0;NA;NA;NA;0;NA;NA;NA;0;NA;NA;0;NA;0;NA;NA;NA;0;NA;NA;0;0;NA;NA;NA;0;NA;NA;NA;NA;1;30;0;NA;NA;32
480635;24-02-2018;Delay in match Emre Can (Liverpool) because of an injury.;34';Liverpool;West Ham United;1;0;0;0;0;0;0;NA;NA;NA;NA;NA;NA;NA;0;NA;NA;0;NA;0;0;NA;NA;NA;0;NA;NA;NA;0;NA;NA;1;Liverpool;0;NA;NA;NA;0;NA;NA;0;0;NA;NA;NA;0;NA;NA;NA;NA;1;31;0;NA;NA;34
480635;24-02-2018;Delay over. They are ready to continue.;34';Liverpool;West Ham United;1;0;0;0;0;0;0;NA;NA;NA;NA;NA;NA;NA;0;NA;NA;0;NA;0;0;NA;NA;NA;0;NA;NA;NA;0;NA;NA;0;NA;0;NA;NA;NA;0;NA;NA;0;0;NA;NA;NA;0;NA;NA;NA;NA;1;32;0;NA;NA;34
480635;24-02-2018;Offside, West Ham United. João Mário tries a through ball, but Patrice Evra is caught offside.;36';Liverpool;West Ham United;1;0;0;0;0;0;0;NA;NA;NA;NA;NA;NA;NA;0;NA;NA;0;NA;0;1;West Ham United;Patrice Evra;João Mário;0;NA;NA;NA;0;NA;NA;0;NA;0;NA;NA;NA;0;NA;NA;0;0;NA;NA;NA;0;NA;NA;NA;NA;1;33;0;NA;NA;36
480635;24-02-2018;Emre Can (Liverpool) wins a free kick in the defensive half.;38';Liverpool;West Ham United;1;0;0;0;0;0;0;NA;NA;NA;NA;NA;NA;NA;0;NA;NA;0;NA;0;0;NA;NA;NA;0;NA;NA;NA;0;NA;NA;0;NA;1;Emre Can;Liverpool;defensive half;0;NA;NA;0;0;NA;NA;NA;0;NA;NA;NA;NA;1;34;0;NA;NA;38
480635;24-02-2018;Foul by Cheikhou Kouyaté (West Ham United).;38';Liverpool;West Ham United;1;0;0;0;0;0;0;NA;NA;NA;NA;NA;NA;NA;1;Cheikhou Kouyaté;West Ham United;0;NA;0;0;NA;NA;NA;0;NA;NA;NA;0;NA;NA;0;NA;0;NA;NA;NA;0;NA;NA;0;0;NA;NA;NA;0;NA;NA;NA;NA;1;35;0;NA;NA;38
480635;24-02-2018;Foul by Emre Can (Liverpool).;40';Liverpool;West Ham United;1;0;0;0;0;0;0;NA;NA;NA;NA;NA;NA;NA;1;Emre Can;Liverpool;0;NA;0;0;NA;NA;NA;0;NA;NA;NA;0;NA;NA;0;NA;0;NA;NA;NA;0;NA;NA;0;0;NA;NA;NA;0;NA;NA;NA;NA;1;36;0;NA;NA;40
480635;24-02-2018;João Mário (West Ham United) wins a free kick in the defensive half.;40';Liverpool;West Ham United;1;0;0;0;0;0;0;NA;NA;NA;NA;NA;NA;NA;0;NA;NA;0;NA;0;0;NA;NA;NA;0;NA;NA;NA;0;NA;NA;0;NA;1;João Mário;West Ham United;defensive half;0;NA;NA;0;0;NA;NA;NA;0;NA;NA;NA;NA;1;37;0;NA;NA;40
480635;24-02-2018;Foul by Joel Matip (Liverpool).;41';Liverpool;West Ham United;1;0;0;0;0;0;0;NA;NA;NA;NA;NA;NA;NA;1;Joel Matip;Liverpool;0;NA;0;0;NA;NA;NA;0;NA;NA;NA;0;NA;NA;0;NA;0;NA;NA;NA;0;NA;NA;0;0;NA;NA;NA;0;NA;NA;NA;NA;1;38;0;NA;NA;41
480635;24-02-2018;Marko Arnautovic (West Ham United) wins a free kick in the defensive half.;41';Liverpool;West Ham United;1;0;0;0;0;0;0;NA;NA;NA;NA;NA;NA;NA;0;NA;NA;0;NA;0;0;NA;NA;NA;0;NA;NA;NA;0;NA;NA;0;NA;1;Marko Arnautovic;West Ham United;defensive half;0;NA;NA;0;0;NA;NA;NA;0;NA;NA;NA;NA;1;39;0;NA;NA;41
480635;24-02-2018;Attempt saved. Marko Arnautovic (West Ham United) right footed shot from outside the box is saved in the top centre of the goal. Assisted by Cheikhou Kouyaté.;42';Liverpool;West Ham United;1;0;0;0;0;1;0;saved;Marko Arnautovic;West Ham United;right;outside the box;the top centre of the goal;Cheikhou Kouyaté;0;NA;NA;0;NA;0;0;NA;NA;NA;0;NA;NA;NA;0;NA;NA;0;NA;0;NA;NA;NA;0;NA;NA;0;0;NA;NA;NA;0;NA;NA;NA;NA;1;40;0;NA;NA;42
480635;24-02-2018;Corner,  West Ham United. Conceded by Loris Karius.;42';Liverpool;West Ham United;1;0;0;0;0;0;0;NA;NA;NA;NA;NA;NA;NA;0;NA;NA;0;NA;0;0;NA;NA;NA;0;NA;NA;NA;0;NA;NA;0;NA;0;NA;NA;NA;1;West Ham United;Loris Karius;0;0;NA;NA;NA;0;NA;NA;NA;NA;1;41;0;NA;NA;42
480635;24-02-2018;Andrew Robertson (Liverpool) wins a free kick in the defensive half.;43';Liverpool;West Ham United;1;0;0;0;0;0;0;NA;NA;NA;NA;NA;NA;NA;0;NA;NA;0;NA;0;0;NA;NA;NA;0;NA;NA;NA;0;NA;NA;0;NA;1;Andrew Robertson;Liverpool;defensive half;0;NA;NA;0;0;NA;NA;NA;0;NA;NA;NA;NA;1;42;0;NA;NA;43
480635;24-02-2018;Foul by James Collins (West Ham United).;43';Liverpool;West Ham United;1;0;0;0;0;0;0;NA;NA;NA;NA;NA;NA;NA;1;James Collins;West Ham United;0;NA;0;0;NA;NA;NA;0;NA;NA;NA;0;NA;NA;0;NA;0;NA;NA;NA;0;NA;NA;0;0;NA;NA;NA;0;NA;NA;NA;NA;1;43;0;NA;NA;43
480635;24-02-2018;James Collins (West Ham United) is shown the yellow card for a bad foul.;43';Liverpool;West Ham United;1;0;0;0;0;0;0;NA;NA;NA;NA;NA;NA;NA;0;NA;NA;0;NA;0;0;NA;NA;NA;1;yellow;James Collins;West Ham United;0;NA;NA;0;NA;0;NA;NA;NA;0;NA;NA;0;0;NA;NA;NA;0;NA;NA;NA;NA;1;44;0;NA;NA;43
480635;24-02-2018;Foul by Pablo Zabaleta (West Ham United).;45';Liverpool;West Ham United;1;0;0;0;0;0;0;NA;NA;NA;NA;NA;NA;NA;1;Pablo Zabaleta;West Ham United;0;NA;0;0;NA;NA;NA;0;NA;NA;NA;0;NA;NA;0;NA;0;NA;NA;NA;0;NA;NA;0;0;NA;NA;NA;0;NA;NA;NA;NA;1;45;0;NA;NA;45
480635;24-02-2018;James Milner (Liverpool) wins a free kick in the attacking half.;45';Liverpool;West Ham United;1;0;0;0;0;0;0;NA;NA;NA;NA;NA;NA;NA;0;NA;NA;0;NA;0;0;NA;NA;NA;0;NA;NA;NA;0;NA;NA;0;NA;1;James Milner;Liverpool;attacking half;0;NA;NA;0;0;NA;NA;NA;0;NA;NA;NA;NA;1;46;0;NA;NA;45
480635;24-02-2018;Attempt blocked. Mohamed Salah (Liverpool) left footed shot from outside the box is blocked.;45'+1';Liverpool;West Ham United;1;0;0;0;0;1;0;blocked;Mohamed Salah;Liverpool;left;outside the box;NA;NA;0;NA;NA;0;NA;0;0;NA;NA;NA;0;NA;NA;NA;0;NA;NA;0;NA;0;NA;NA;NA;0;NA;NA;0;0;NA;NA;NA;0;NA;NA;NA;NA;1;47;1;NA;NA;46
480635;24-02-2018;First Half ends, Liverpool 1, West Ham United 0.;45'+3';Liverpool;West Ham United;1;0;1;0;0;0;0;NA;NA;NA;NA;NA;NA;NA;0;NA;NA;0;NA;0;0;NA;NA;NA;0;NA;NA;NA;0;NA;NA;0;NA;0;NA;NA;NA;0;NA;NA;0;0;NA;NA;NA;0;NA;NA;NA;NA;1;48;1;NA;NA;48
480635;24-02-2018;Second Half begins Liverpool 1, West Ham United 0.;45';Liverpool;West Ham United;1;0;0;0;1;0;0;NA;NA;NA;NA;NA;NA;NA;0;NA;NA;0;NA;0;0;NA;NA;NA;0;NA;NA;NA;0;NA;NA;0;NA;0;NA;NA;NA;0;NA;NA;0;0;NA;NA;NA;0;NA;NA;NA;NA;2;49;0;NA;NA;45
480635;24-02-2018;Foul by Cheikhou Kouyaté (West Ham United).;47';Liverpool;West Ham United;1;0;0;0;0;0;0;NA;NA;NA;NA;NA;NA;NA;1;Cheikhou Kouyaté;West Ham United;0;NA;0;0;NA;NA;NA;0;NA;NA;NA;0;NA;NA;0;NA;0;NA;NA;NA;0;NA;NA;0;0;NA;NA;NA;0;NA;NA;NA;NA;2;50;0;NA;NA;47
480635;24-02-2018;Virgil van Dijk (Liverpool) wins a free kick in the defensive half.;47';Liverpool;West Ham United;1;0;0;0;0;0;0;NA;NA;NA;NA;NA;NA;NA;0;NA;NA;0;NA;0;0;NA;NA;NA;0;NA;NA;NA;0;NA;NA;0;NA;1;Virgil van Dijk;Liverpool;defensive half;0;NA;NA;0;0;NA;NA;NA;0;NA;NA;NA;NA;2;51;0;NA;NA;47
480635;24-02-2018;Cheikhou Kouyaté (West Ham United) is shown the yellow card for a bad foul.;47';Liverpool;West Ham United;1;0;0;0;0;0;0;NA;NA;NA;NA;NA;NA;NA;0;NA;NA;0;NA;0;0;NA;NA;NA;1;yellow;Cheikhou Kouyaté;West Ham United;0;NA;NA;0;NA;0;NA;NA;NA;0;NA;NA;0;0;NA;NA;NA;0;NA;NA;NA;NA;2;52;0;NA;NA;47
480635;24-02-2018;Goal!  Liverpool 2, West Ham United 0. Mohamed Salah (Liverpool) left footed shot from the centre of the box to the bottom right corner. Assisted by Alex Oxlade-Chamberlain.;51';Liverpool;West Ham United;2;0;0;0;0;1;0;goal;Mohamed Salah;Liverpool;left;the centre of the box;bottom right corner;Alex Oxlade-Chamberlain;0;NA;NA;0;NA;0;0;NA;NA;NA;0;NA;NA;NA;0;NA;NA;0;NA;0;NA;NA;NA;0;NA;NA;0;0;NA;NA;NA;0;NA;NA;NA;NA;2;53;0;NA;NA;51
480635;24-02-2018;Foul by Roberto Firmino (Liverpool).;52';Liverpool;West Ham United;2;0;0;0;0;0;0;NA;NA;NA;NA;NA;NA;NA;1;Roberto Firmino;Liverpool;0;NA;0;0;NA;NA;NA;0;NA;NA;NA;0;NA;NA;0;NA;0;NA;NA;NA;0;NA;NA;0;0;NA;NA;NA;0;NA;NA;NA;NA;2;54;0;NA;NA;52
480635;24-02-2018;Pablo Zabaleta (West Ham United) wins a free kick in the attacking half.;52';Liverpool;West Ham United;2;0;0;0;0;0;0;NA;NA;NA;NA;NA;NA;NA;0;NA;NA;0;NA;0;0;NA;NA;NA;0;NA;NA;NA;0;NA;NA;0;NA;1;Pablo Zabaleta;West Ham United;attacking half;0;NA;NA;0;0;NA;NA;NA;0;NA;NA;NA;NA;2;55;0;NA;NA;52
480635;24-02-2018;Corner,  West Ham United. Conceded by Joel Matip.;53';Liverpool;West Ham United;2;0;0;0;0;0;0;NA;NA;NA;NA;NA;NA;NA;0;NA;NA;0;NA;0;0;NA;NA;NA;0;NA;NA;NA;0;NA;NA;0;NA;0;NA;NA;NA;1;West Ham United;Joel Matip;0;0;NA;NA;NA;0;NA;NA;NA;NA;2;56;0;NA;NA;53
480635;24-02-2018;Attempt missed. Alex Oxlade-Chamberlain (Liverpool) right footed shot from the right side of the box is close, but misses to the right. Assisted by Trent Alexander-Arnold.;54';Liverpool;West Ham United;2;0;0;0;0;1;0;missed;Alex Oxlade-Chamberlain;Liverpool;right;the right side of the box;close, but right;Trent Alexander-Arnold;0;NA;NA;0;NA;0;0;NA;NA;NA;0;NA;NA;NA;0;NA;NA;0;NA;0;NA;NA;NA;0;NA;NA;0;0;NA;NA;NA;0;NA;NA;NA;NA;2;57;0;NA;NA;54
480635;24-02-2018;Attempt saved. Sadio Mané (Liverpool) right footed shot from the centre of the box is saved in the centre of the goal. Assisted by Roberto Firmino with a through ball.;56';Liverpool;West Ham United;2;0;0;0;0;1;0;saved;Sadio Mané;Liverpool;right;the centre of the box;the centre of the goal;Roberto Firmino;0;NA;NA;0;through;0;0;NA;NA;NA;0;NA;NA;NA;0;NA;NA;0;NA;0;NA;NA;NA;0;NA;NA;0;0;NA;NA;NA;0;NA;NA;NA;NA;2;58;0;NA;NA;56
480635;24-02-2018;Goal!  Liverpool 3, West Ham United 0. Roberto Firmino (Liverpool) right footed shot from the centre of the box to the bottom right corner. Assisted by Emre Can with a through ball.;57';Liverpool;West Ham United;3;0;0;0;0;1;0;goal;Roberto Firmino;Liverpool;right;the centre of the box;bottom right corner;Emre Can;0;NA;NA;0;through;0;0;NA;NA;NA;0;NA;NA;NA;0;NA;NA;0;NA;0;NA;NA;NA;0;NA;NA;0;0;NA;NA;NA;0;NA;NA;NA;NA;2;59;0;NA;NA;57
480635;24-02-2018;Substitution, West Ham United. Michail Antonio replaces Manuel Lanzini.;58';Liverpool;West Ham United;3;0;0;0;0;0;0;NA;NA;NA;NA;NA;NA;NA;0;NA;NA;0;NA;0;0;NA;NA;NA;0;NA;NA;NA;0;NA;NA;0;NA;0;NA;NA;NA;0;NA;NA;1;0;West Ham United;Michail Antonio;Manuel Lanzini;0;NA;NA;NA;NA;2;60;0;NA;NA;58
480635;24-02-2018;Goal!  Liverpool 3, West Ham United 1. Michail Antonio (West Ham United) right footed shot from the right side of the box to the bottom left corner. Assisted by Cheikhou Kouyaté with a through ball following a fast break.;59';Liverpool;West Ham United;3;1;0;0;0;1;0;goal;Michail Antonio;West Ham United;right;the right side of the box;bottom left corner;Cheikhou Kouyaté;0;NA;NA;0;through;0;0;NA;NA;NA;0;NA;NA;NA;0;NA;NA;0;NA;0;NA;NA;NA;0;NA;NA;0;0;NA;NA;NA;0;NA;NA;NA;NA;2;61;0;NA;NA;59
480635;24-02-2018;Attempt saved. Mohamed Salah (Liverpool) left footed shot from the centre of the box is saved in the centre of the goal. Assisted by Alex Oxlade-Chamberlain.;61';Liverpool;West Ham United;3;1;0;0;0;1;0;saved;Mohamed Salah;Liverpool;left;the centre of the box;the centre of the goal;Alex Oxlade-Chamberlain;0;NA;NA;0;NA;0;0;NA;NA;NA;0;NA;NA;NA;0;NA;NA;0;NA;0;NA;NA;NA;0;NA;NA;0;0;NA;NA;NA;0;NA;NA;NA;NA;2;62;0;NA;NA;61
480635;24-02-2018;Attempt saved. Roberto Firmino (Liverpool) left footed shot from the centre of the box is saved in the centre of the goal. Assisted by Sadio Mané with a through ball.;62';Liverpool;West Ham United;3;1;0;0;0;1;0;saved;Roberto Firmino;Liverpool;left;the centre of the box;the centre of the goal;Sadio Mané;0;NA;NA;0;through;0;0;NA;NA;NA;0;NA;NA;NA;0;NA;NA;0;NA;0;NA;NA;NA;0;NA;NA;0;0;NA;NA;NA;0;NA;NA;NA;NA;2;63;0;NA;NA;62
480635;24-02-2018;Attempt saved. Sadio Mané (Liverpool) right footed shot from outside the box is saved in the top centre of the goal. Assisted by Alex Oxlade-Chamberlain.;62';Liverpool;West Ham United;3;1;0;0;0;1;0;saved;Sadio Mané;Liverpool;right;outside the box;the top centre of the goal;Alex Oxlade-Chamberlain;0;NA;NA;0;NA;0;0;NA;NA;NA;0;NA;NA;NA;0;NA;NA;0;NA;0;NA;NA;NA;0;NA;NA;0;0;NA;NA;NA;0;NA;NA;NA;NA;2;64;0;NA;NA;62
480635;24-02-2018;Foul by James Milner (Liverpool).;65';Liverpool;West Ham United;3;1;0;0;0;0;0;NA;NA;NA;NA;NA;NA;NA;1;James Milner;Liverpool;0;NA;0;0;NA;NA;NA;0;NA;NA;NA;0;NA;NA;0;NA;0;NA;NA;NA;0;NA;NA;0;0;NA;NA;NA;0;NA;NA;NA;NA;2;65;0;NA;NA;65
480635;24-02-2018;Patrice Evra (West Ham United) wins a free kick in the attacking half.;65';Liverpool;West Ham United;3;1;0;0;0;0;0;NA;NA;NA;NA;NA;NA;NA;0;NA;NA;0;NA;0;0;NA;NA;NA;0;NA;NA;NA;0;NA;NA;0;NA;1;Patrice Evra;West Ham United;attacking half;0;NA;NA;0;0;NA;NA;NA;0;NA;NA;NA;NA;2;66;0;NA;NA;65
480635;24-02-2018;Attempt missed. James Collins (West Ham United) header from the right side of the box is just a bit too high. Assisted by Aaron Cresswell following a set piece situation.;66';Liverpool;West Ham United;3;1;0;0;0;1;0;missed;James Collins;West Ham United;header;the right side of the box;just a bit too high;Aaron Cresswell;0;NA;NA;1;NA;0;0;NA;NA;NA;0;NA;NA;NA;0;NA;NA;0;NA;0;NA;NA;NA;0;NA;NA;0;0;NA;NA;NA;0;NA;NA;NA;NA;2;67;0;NA;NA;66
480635;24-02-2018;Attempt saved. Alex Oxlade-Chamberlain (Liverpool) right footed shot from outside the box is saved in the centre of the goal. Assisted by Emre Can.;68';Liverpool;West Ham United;3;1;0;0;0;1;0;saved;Alex Oxlade-Chamberlain;Liverpool;right;outside the box;the centre of the goal;Emre Can;0;NA;NA;0;NA;0;0;NA;NA;NA;0;NA;NA;NA;0;NA;NA;0;NA;0;NA;NA;NA;0;NA;NA;0;0;NA;NA;NA;0;NA;NA;NA;NA;2;68;0;NA;NA;68
480635;24-02-2018;Sadio Mané (Liverpool) hits the left post with a left footed shot from the centre of the box. Assisted by Alex Oxlade-Chamberlain with a through ball.;73';Liverpool;West Ham United;3;1;0;0;0;0;0;NA;NA;NA;NA;NA;NA;Alex Oxlade-Chamberlain;0;NA;NA;0;NA;0;0;NA;NA;NA;0;NA;NA;NA;0;NA;NA;0;NA;0;NA;NA;NA;0;NA;NA;0;0;NA;NA;NA;0;NA;NA;NA;NA;2;69;0;NA;NA;73
480635;24-02-2018;Goal!  Liverpool 4, West Ham United 1. Sadio Mané (Liverpool) right footed shot from very close range to the bottom left corner. Assisted by Andrew Robertson.;77';Liverpool;West Ham United;4;1;0;0;0;1;0;goal;Sadio Mané;Liverpool;right;right shot very close range;bottom left corner;Andrew Robertson;0;NA;NA;0;NA;0;0;NA;NA;NA;0;NA;NA;NA;0;NA;NA;0;NA;0;NA;NA;NA;0;NA;NA;0;0;NA;NA;NA;0;NA;NA;NA;NA;2;70;0;NA;NA;77
480635;24-02-2018;Corner,  Liverpool. Conceded by Aaron Cresswell.;78';Liverpool;West Ham United;4;1;0;0;0;0;0;NA;NA;NA;NA;NA;NA;NA;0;NA;NA;0;NA;0;0;NA;NA;NA;0;NA;NA;NA;0;NA;NA;0;NA;0;NA;NA;NA;1;Liverpool;Aaron Cresswell;0;0;NA;NA;NA;0;NA;NA;NA;NA;2;71;0;NA;NA;78
480635;24-02-2018;Attempt missed. Sadio Mané (Liverpool) left footed shot from outside the box is close, but misses to the right. Assisted by Andrew Robertson.;79';Liverpool;West Ham United;4;1;0;0;0;1;0;missed;Sadio Mané;Liverpool;left;outside the box;close, but right;Andrew Robertson;0;NA;NA;0;NA;0;0;NA;NA;NA;0;NA;NA;NA;0;NA;NA;0;NA;0;NA;NA;NA;0;NA;NA;0;0;NA;NA;NA;0;NA;NA;NA;NA;2;72;0;NA;NA;79
480635;24-02-2018;Cheikhou Kouyaté (West Ham United) wins a free kick in the defensive half.;81';Liverpool;West Ham United;4;1;0;0;0;0;0;NA;NA;NA;NA;NA;NA;NA;0;NA;NA;0;NA;0;0;NA;NA;NA;0;NA;NA;NA;0;NA;NA;0;NA;1;Cheikhou Kouyaté;West Ham United;defensive half;0;NA;NA;0;0;NA;NA;NA;0;NA;NA;NA;NA;2;73;0;NA;NA;81
480635;24-02-2018;Foul by Andrew Robertson (Liverpool).;81';Liverpool;West Ham United;4;1;0;0;0;0;0;NA;NA;NA;NA;NA;NA;NA;1;Andrew Robertson;Liverpool;0;NA;0;0;NA;NA;NA;0;NA;NA;NA;0;NA;NA;0;NA;0;NA;NA;NA;0;NA;NA;0;0;NA;NA;NA;0;NA;NA;NA;NA;2;74;0;NA;NA;81
480635;24-02-2018;Delay in match Cheikhou Kouyaté (West Ham United) because of an injury.;82';Liverpool;West Ham United;4;1;0;0;0;0;0;NA;NA;NA;NA;NA;NA;NA;0;NA;NA;0;NA;0;0;NA;NA;NA;0;NA;NA;NA;0;NA;NA;1;West Ham United;0;NA;NA;NA;0;NA;NA;0;0;NA;NA;NA;0;NA;NA;NA;NA;2;75;0;NA;NA;82
480635;24-02-2018;Substitution, Liverpool. Adam Lallana replaces Roberto Firmino.;82';Liverpool;West Ham United;4;1;0;0;0;0;0;NA;NA;NA;NA;NA;NA;NA;0;NA;NA;0;NA;0;0;NA;NA;NA;0;NA;NA;NA;0;NA;NA;0;NA;0;NA;NA;NA;0;NA;NA;1;0;Liverpool;Adam Lallana;Roberto Firmino;0;NA;NA;NA;NA;2;76;0;NA;NA;82
480635;24-02-2018;Delay over. They are ready to continue.;83';Liverpool;West Ham United;4;1;0;0;0;0;0;NA;NA;NA;NA;NA;NA;NA;0;NA;NA;0;NA;0;0;NA;NA;NA;0;NA;NA;NA;0;NA;NA;0;NA;0;NA;NA;NA;0;NA;NA;0;0;NA;NA;NA;0;NA;NA;NA;NA;2;77;0;NA;NA;83
480635;24-02-2018;Substitution, West Ham United. Chicharito replaces Marko Arnautovic.;83';Liverpool;West Ham United;4;1;0;0;0;0;0;NA;NA;NA;NA;NA;NA;NA;0;NA;NA;0;NA;0;0;NA;NA;NA;0;NA;NA;NA;0;NA;NA;0;NA;0;NA;NA;NA;0;NA;NA;1;0;West Ham United;Chicharito;Marko Arnautovic;0;NA;NA;NA;NA;2;78;0;NA;NA;83
480635;24-02-2018;Substitution, West Ham United. Declan Rice replaces João Mário.;83';Liverpool;West Ham United;4;1;0;0;0;0;0;NA;NA;NA;NA;NA;NA;NA;0;NA;NA;0;NA;0;0;NA;NA;NA;0;NA;NA;NA;0;NA;NA;0;NA;0;NA;NA;NA;0;NA;NA;1;0;West Ham United;Declan Rice;João Mário;0;NA;NA;NA;NA;2;79;0;NA;NA;83
480635;24-02-2018;Attempt missed. Adam Lallana (Liverpool) right footed shot from the right side of the box is too high. Assisted by Mohamed Salah.;86';Liverpool;West Ham United;4;1;0;0;0;1;0;missed;Adam Lallana;Liverpool;right;the right side of the box;too high;Mohamed Salah;0;NA;NA;0;NA;0;0;NA;NA;NA;0;NA;NA;NA;0;NA;NA;0;NA;0;NA;NA;NA;0;NA;NA;0;0;NA;NA;NA;0;NA;NA;NA;NA;2;80;0;NA;NA;86
