480737;13-12-2017;First Half begins.;-;Liverpool;West Bromwich Albion;0;0;0;0;1;0;0;NA;NA;NA;NA;NA;NA;NA;0;NA;NA;0;NA;0;0;NA;NA;NA;0;NA;NA;NA;0;NA;NA;0;NA;0;NA;NA;NA;0;NA;NA;0;0;NA;NA;NA;0;NA;NA;NA;NA;1;1;0;NA;NA;NA
480737;13-12-2017;Lineups are announced and players are warming up.;-;Liverpool;West Bromwich Albion;0;0;0;0;0;0;0;NA;NA;NA;NA;NA;NA;NA;0;NA;NA;0;NA;0;0;NA;NA;NA;0;NA;NA;NA;0;NA;NA;0;NA;0;NA;NA;NA;0;NA;NA;0;0;NA;NA;NA;0;NA;NA;NA;NA;1;2;0;NA;NA;NA
480737;13-12-2017;Offside, Liverpool. Georginio Wijnaldum tries a through ball, but Sadio Mané is caught offside.;4';Liverpool;West Bromwich Albion;0;0;0;0;0;0;0;NA;NA;NA;NA;NA;NA;NA;0;NA;NA;0;NA;0;1;Liverpool;Sadio Mané;Georginio Wijnaldum;0;NA;NA;NA;0;NA;NA;0;NA;0;NA;NA;NA;0;NA;NA;0;0;NA;NA;NA;0;NA;NA;NA;NA;1;3;0;NA;NA;4
480737;13-12-2017;Foul by Andrew Robertson (Liverpool).;7';Liverpool;West Bromwich Albion;0;0;0;0;0;0;0;NA;NA;NA;NA;NA;NA;NA;1;Andrew Robertson;Liverpool;0;NA;0;0;NA;NA;NA;0;NA;NA;NA;0;NA;NA;0;NA;0;NA;NA;NA;0;NA;NA;0;0;NA;NA;NA;0;NA;NA;NA;NA;1;4;0;NA;NA;7
480737;13-12-2017;Hal Robson-Kanu (West Bromwich Albion) wins a free kick in the defensive half.;7';Liverpool;West Bromwich Albion;0;0;0;0;0;0;0;NA;NA;NA;NA;NA;NA;NA;0;NA;NA;0;NA;0;0;NA;NA;NA;0;NA;NA;NA;0;NA;NA;0;NA;1;Hal Robson-Kanu;West Bromwich Albion;defensive half;0;NA;NA;0;0;NA;NA;NA;0;NA;NA;NA;NA;1;5;0;NA;NA;7
480737;13-12-2017;Claudio Yacob (West Bromwich Albion) wins a free kick in the defensive half.;10';Liverpool;West Bromwich Albion;0;0;0;0;0;0;0;NA;NA;NA;NA;NA;NA;NA;0;NA;NA;0;NA;0;0;NA;NA;NA;0;NA;NA;NA;0;NA;NA;0;NA;1;Claudio Yacob;West Bromwich Albion;defensive half;0;NA;NA;0;0;NA;NA;NA;0;NA;NA;NA;NA;1;6;0;NA;NA;10
480737;13-12-2017;Foul by Roberto Firmino (Liverpool).;10';Liverpool;West Bromwich Albion;0;0;0;0;0;0;0;NA;NA;NA;NA;NA;NA;NA;1;Roberto Firmino;Liverpool;0;NA;0;0;NA;NA;NA;0;NA;NA;NA;0;NA;NA;0;NA;0;NA;NA;NA;0;NA;NA;0;0;NA;NA;NA;0;NA;NA;NA;NA;1;7;0;NA;NA;10
480737;13-12-2017;Attempt blocked. Salomón Rondón (West Bromwich Albion) right footed shot from outside the box is blocked. Assisted by Ben Foster.;10';Liverpool;West Bromwich Albion;0;0;0;0;0;1;0;blocked;Salomón Rondón;West Bromwich Albion;right;outside the box;NA;Ben Foster;0;NA;NA;0;NA;0;0;NA;NA;NA;0;NA;NA;NA;0;NA;NA;0;NA;0;NA;NA;NA;0;NA;NA;0;0;NA;NA;NA;0;NA;NA;NA;NA;1;8;0;NA;NA;10
480737;13-12-2017;Attempt blocked. Emre Can (Liverpool) right footed shot from outside the box is blocked. Assisted by Philippe Coutinho.;12';Liverpool;West Bromwich Albion;0;0;0;0;0;1;0;blocked;Emre Can;Liverpool;right;outside the box;NA;Philippe Coutinho;0;NA;NA;0;NA;0;0;NA;NA;NA;0;NA;NA;NA;0;NA;NA;0;NA;0;NA;NA;NA;0;NA;NA;0;0;NA;NA;NA;0;NA;NA;NA;NA;1;9;0;NA;NA;12
480737;13-12-2017;Attempt missed. Roberto Firmino (Liverpool) left footed shot from the left side of the six yard box is close, but misses to the right. Assisted by Mohamed Salah with a through ball.;17';Liverpool;West Bromwich Albion;0;0;0;0;0;1;0;missed;Roberto Firmino;Liverpool;left;the left side of the six yard box;close, but right;Mohamed Salah;0;NA;NA;0;through;0;0;NA;NA;NA;0;NA;NA;NA;0;NA;NA;0;NA;0;NA;NA;NA;0;NA;NA;0;0;NA;NA;NA;0;NA;NA;NA;NA;1;10;0;NA;NA;17
480737;13-12-2017;Attempt blocked. Andrew Robertson (Liverpool) left footed shot from the left side of the box is blocked.;19';Liverpool;West Bromwich Albion;0;0;0;0;0;1;0;blocked;Andrew Robertson;Liverpool;left;the left side of the box;NA;NA;0;NA;NA;0;NA;0;0;NA;NA;NA;0;NA;NA;NA;0;NA;NA;0;NA;0;NA;NA;NA;0;NA;NA;0;0;NA;NA;NA;0;NA;NA;NA;NA;1;11;0;NA;NA;19
480737;13-12-2017;Corner,  Liverpool. Conceded by Jake Livermore.;19';Liverpool;West Bromwich Albion;0;0;0;0;0;0;0;NA;NA;NA;NA;NA;NA;NA;0;NA;NA;0;NA;0;0;NA;NA;NA;0;NA;NA;NA;0;NA;NA;0;NA;0;NA;NA;NA;1;Liverpool;Jake Livermore;0;0;NA;NA;NA;0;NA;NA;NA;NA;1;12;0;NA;NA;19
480737;13-12-2017;Foul by Ahmed Hegazi (West Bromwich Albion).;21';Liverpool;West Bromwich Albion;0;0;0;0;0;0;0;NA;NA;NA;NA;NA;NA;NA;1;Ahmed Hegazi;West Bromwich Albion;0;NA;0;0;NA;NA;NA;0;NA;NA;NA;0;NA;NA;0;NA;0;NA;NA;NA;0;NA;NA;0;0;NA;NA;NA;0;NA;NA;NA;NA;1;13;0;NA;NA;21
480737;13-12-2017;Mohamed Salah (Liverpool) wins a free kick on the left wing.;21';Liverpool;West Bromwich Albion;0;0;0;0;0;0;0;NA;NA;NA;NA;NA;NA;NA;0;NA;NA;0;NA;0;0;NA;NA;NA;0;NA;NA;NA;0;NA;NA;0;NA;1;Mohamed Salah;Liverpool;NA;0;NA;NA;0;0;NA;NA;NA;0;NA;NA;NA;NA;1;14;0;NA;NA;21
480737;13-12-2017;Claudio Yacob (West Bromwich Albion) wins a free kick on the right wing.;22';Liverpool;West Bromwich Albion;0;0;0;0;0;0;0;NA;NA;NA;NA;NA;NA;NA;0;NA;NA;0;NA;0;0;NA;NA;NA;0;NA;NA;NA;0;NA;NA;0;NA;1;Claudio Yacob;West Bromwich Albion;NA;0;NA;NA;0;0;NA;NA;NA;0;NA;NA;NA;NA;1;15;0;NA;NA;22
480737;13-12-2017;Dangerous play by Georginio Wijnaldum (Liverpool).;22';Liverpool;West Bromwich Albion;0;0;0;0;0;0;0;NA;NA;NA;NA;NA;NA;NA;0;NA;NA;0;NA;0;0;NA;NA;NA;0;NA;NA;NA;0;NA;NA;0;NA;0;NA;NA;NA;0;NA;NA;0;0;NA;NA;NA;0;NA;NA;NA;NA;1;16;0;NA;NA;22
480737;13-12-2017;Attempt missed. Claudio Yacob (West Bromwich Albion) header from the centre of the box is high and wide to the right. Assisted by Allan Nyom with a cross following a set piece situation.;22';Liverpool;West Bromwich Albion;0;0;0;0;0;1;0;missed;Claudio Yacob;West Bromwich Albion;header;the centre of the box;high and wide to the right;Allan Nyom;0;NA;NA;1;cross;0;0;NA;NA;NA;0;NA;NA;NA;0;NA;NA;0;NA;0;NA;NA;NA;0;NA;NA;0;0;NA;NA;NA;0;NA;NA;NA;NA;1;17;0;NA;NA;22
480737;13-12-2017;Attempt blocked. Trent Alexander-Arnold (Liverpool) right footed shot from outside the box is blocked.;24';Liverpool;West Bromwich Albion;0;0;0;0;0;1;0;blocked;Trent Alexander-Arnold;Liverpool;right;outside the box;NA;NA;0;NA;NA;0;NA;0;0;NA;NA;NA;0;NA;NA;NA;0;NA;NA;0;NA;0;NA;NA;NA;0;NA;NA;0;0;NA;NA;NA;0;NA;NA;NA;NA;1;18;0;NA;NA;24
480737;13-12-2017;Corner,  West Bromwich Albion. Conceded by Trent Alexander-Arnold.;25';Liverpool;West Bromwich Albion;0;0;0;0;0;0;0;NA;NA;NA;NA;NA;NA;NA;0;NA;NA;0;NA;0;0;NA;NA;NA;0;NA;NA;NA;0;NA;NA;0;NA;0;NA;NA;NA;1;West Bromwich Albion;Trent Alexander-Arnold;0;0;NA;NA;NA;0;NA;NA;NA;NA;1;19;0;NA;NA;25
480737;13-12-2017;Offside, West Bromwich Albion. Allan Nyom tries a through ball, but Hal Robson-Kanu is caught offside.;29';Liverpool;West Bromwich Albion;0;0;0;0;0;0;0;NA;NA;NA;NA;NA;NA;NA;0;NA;NA;0;NA;0;1;West Bromwich Albion;Hal Robson-Kanu;Allan Nyom;0;NA;NA;NA;0;NA;NA;0;NA;0;NA;NA;NA;0;NA;NA;0;0;NA;NA;NA;0;NA;NA;NA;NA;1;20;0;NA;NA;29
480737;13-12-2017;Foul by Roberto Firmino (Liverpool).;29';Liverpool;West Bromwich Albion;0;0;0;0;0;0;0;NA;NA;NA;NA;NA;NA;NA;1;Roberto Firmino;Liverpool;0;NA;0;0;NA;NA;NA;0;NA;NA;NA;0;NA;NA;0;NA;0;NA;NA;NA;0;NA;NA;0;0;NA;NA;NA;0;NA;NA;NA;NA;1;21;0;NA;NA;29
480737;13-12-2017;Hal Robson-Kanu (West Bromwich Albion) wins a free kick on the right wing.;29';Liverpool;West Bromwich Albion;0;0;0;0;0;0;0;NA;NA;NA;NA;NA;NA;NA;0;NA;NA;0;NA;0;0;NA;NA;NA;0;NA;NA;NA;0;NA;NA;0;NA;1;Hal Robson-Kanu;West Bromwich Albion;NA;0;NA;NA;0;0;NA;NA;NA;0;NA;NA;NA;NA;1;22;0;NA;NA;29
480737;13-12-2017;Hal Robson-Kanu (West Bromwich Albion) hits the bar with a right footed shot from outside the box. Assisted by Grzegorz Krychowiak.;30';Liverpool;West Bromwich Albion;0;0;0;0;0;0;0;NA;NA;NA;NA;NA;NA;Grzegorz Krychowiak;0;NA;NA;0;NA;0;0;NA;NA;NA;0;NA;NA;NA;0;NA;NA;0;NA;0;NA;NA;NA;0;NA;NA;0;0;NA;NA;NA;0;NA;NA;NA;NA;1;23;0;NA;NA;30
480737;13-12-2017;Attempt saved. Philippe Coutinho (Liverpool) right footed shot from outside the box is saved in the bottom left corner. Assisted by Emre Can.;31';Liverpool;West Bromwich Albion;0;0;0;0;0;1;0;saved;Philippe Coutinho;Liverpool;right;outside the box;the bottom left corner;Emre Can;0;NA;NA;0;NA;0;0;NA;NA;NA;0;NA;NA;NA;0;NA;NA;0;NA;0;NA;NA;NA;0;NA;NA;0;0;NA;NA;NA;0;NA;NA;NA;NA;1;24;0;NA;NA;31
480737;13-12-2017;Foul by Emre Can (Liverpool).;33';Liverpool;West Bromwich Albion;0;0;0;0;0;0;0;NA;NA;NA;NA;NA;NA;NA;1;Emre Can;Liverpool;0;NA;0;0;NA;NA;NA;0;NA;NA;NA;0;NA;NA;0;NA;0;NA;NA;NA;0;NA;NA;0;0;NA;NA;NA;0;NA;NA;NA;NA;1;25;0;NA;NA;33
480737;13-12-2017;Grzegorz Krychowiak (West Bromwich Albion) wins a free kick on the left wing.;33';Liverpool;West Bromwich Albion;0;0;0;0;0;0;0;NA;NA;NA;NA;NA;NA;NA;0;NA;NA;0;NA;0;0;NA;NA;NA;0;NA;NA;NA;0;NA;NA;0;NA;1;Grzegorz Krychowiak;West Bromwich Albion;NA;0;NA;NA;0;0;NA;NA;NA;0;NA;NA;NA;NA;1;26;0;NA;NA;33
480737;13-12-2017;Offside, West Bromwich Albion. Allan Nyom tries a through ball, but Ahmed Hegazi is caught offside.;34';Liverpool;West Bromwich Albion;0;0;0;0;0;0;0;NA;NA;NA;NA;NA;NA;NA;0;NA;NA;0;NA;0;1;West Bromwich Albion;Ahmed Hegazi;Allan Nyom;0;NA;NA;NA;0;NA;NA;0;NA;0;NA;NA;NA;0;NA;NA;0;0;NA;NA;NA;0;NA;NA;NA;NA;1;27;0;NA;NA;34
480737;13-12-2017;Corner,  West Bromwich Albion. Conceded by Georginio Wijnaldum.;40';Liverpool;West Bromwich Albion;0;0;0;0;0;0;0;NA;NA;NA;NA;NA;NA;NA;0;NA;NA;0;NA;0;0;NA;NA;NA;0;NA;NA;NA;0;NA;NA;0;NA;0;NA;NA;NA;1;West Bromwich Albion;Georginio Wijnaldum;0;0;NA;NA;NA;0;NA;NA;NA;NA;1;28;0;NA;NA;40
480737;13-12-2017;Claudio Yacob (West Bromwich Albion) wins a free kick in the defensive half.;40';Liverpool;West Bromwich Albion;0;0;0;0;0;0;0;NA;NA;NA;NA;NA;NA;NA;0;NA;NA;0;NA;0;0;NA;NA;NA;0;NA;NA;NA;0;NA;NA;0;NA;1;Claudio Yacob;West Bromwich Albion;defensive half;0;NA;NA;0;0;NA;NA;NA;0;NA;NA;NA;NA;1;29;0;NA;NA;40
480737;13-12-2017;Foul by Emre Can (Liverpool).;40';Liverpool;West Bromwich Albion;0;0;0;0;0;0;0;NA;NA;NA;NA;NA;NA;NA;1;Emre Can;Liverpool;0;NA;0;0;NA;NA;NA;0;NA;NA;NA;0;NA;NA;0;NA;0;NA;NA;NA;0;NA;NA;0;0;NA;NA;NA;0;NA;NA;NA;NA;1;30;0;NA;NA;40
480737;13-12-2017;Attempt blocked. Roberto Firmino (Liverpool) right footed shot from the left side of the box is blocked. Assisted by Dejan Lovren.;42';Liverpool;West Bromwich Albion;0;0;0;0;0;1;0;blocked;Roberto Firmino;Liverpool;right;the left side of the box;NA;Dejan Lovren;0;NA;NA;0;NA;0;0;NA;NA;NA;0;NA;NA;NA;0;NA;NA;0;NA;0;NA;NA;NA;0;NA;NA;0;0;NA;NA;NA;0;NA;NA;NA;NA;1;31;0;NA;NA;42
480737;13-12-2017;Attempt blocked. Mohamed Salah (Liverpool) left footed shot from the centre of the box is blocked.;42';Liverpool;West Bromwich Albion;0;0;0;0;0;1;0;blocked;Mohamed Salah;Liverpool;left;the centre of the box;NA;NA;0;NA;NA;0;NA;0;0;NA;NA;NA;0;NA;NA;NA;0;NA;NA;0;NA;0;NA;NA;NA;0;NA;NA;0;0;NA;NA;NA;0;NA;NA;NA;NA;1;32;0;NA;NA;42
480737;13-12-2017;Emre Can (Liverpool) wins a free kick in the attacking half.;43';Liverpool;West Bromwich Albion;0;0;0;0;0;0;0;NA;NA;NA;NA;NA;NA;NA;0;NA;NA;0;NA;0;0;NA;NA;NA;0;NA;NA;NA;0;NA;NA;0;NA;1;Emre Can;Liverpool;attacking half;0;NA;NA;0;0;NA;NA;NA;0;NA;NA;NA;NA;1;33;0;NA;NA;43
480737;13-12-2017;Foul by Salomón Rondón (West Bromwich Albion).;43';Liverpool;West Bromwich Albion;0;0;0;0;0;0;0;NA;NA;NA;NA;NA;NA;NA;1;Salomón Rondón;West Bromwich Albion;0;NA;0;0;NA;NA;NA;0;NA;NA;NA;0;NA;NA;0;NA;0;NA;NA;NA;0;NA;NA;0;0;NA;NA;NA;0;NA;NA;NA;NA;1;34;0;NA;NA;43
480737;13-12-2017;Corner,  Liverpool. Conceded by Allan Nyom.;43';Liverpool;West Bromwich Albion;0;0;0;0;0;0;0;NA;NA;NA;NA;NA;NA;NA;0;NA;NA;0;NA;0;0;NA;NA;NA;0;NA;NA;NA;0;NA;NA;0;NA;0;NA;NA;NA;1;Liverpool;Allan Nyom;0;0;NA;NA;NA;0;NA;NA;NA;NA;1;35;0;NA;NA;43
480737;13-12-2017;Foul by Sadio Mané (Liverpool).;45';Liverpool;West Bromwich Albion;0;0;0;0;0;0;0;NA;NA;NA;NA;NA;NA;NA;1;Sadio Mané;Liverpool;0;NA;0;0;NA;NA;NA;0;NA;NA;NA;0;NA;NA;0;NA;0;NA;NA;NA;0;NA;NA;0;0;NA;NA;NA;0;NA;NA;NA;NA;1;36;0;NA;NA;45
480737;13-12-2017;Jonny Evans (West Bromwich Albion) wins a free kick in the defensive half.;45';Liverpool;West Bromwich Albion;0;0;0;0;0;0;0;NA;NA;NA;NA;NA;NA;NA;0;NA;NA;0;NA;0;0;NA;NA;NA;0;NA;NA;NA;0;NA;NA;0;NA;1;Jonny Evans;West Bromwich Albion;defensive half;0;NA;NA;0;0;NA;NA;NA;0;NA;NA;NA;NA;1;37;0;NA;NA;45
480737;13-12-2017;Offside, West Bromwich Albion. Jonny Evans tries a through ball, but James McClean is caught offside.;45';Liverpool;West Bromwich Albion;0;0;0;0;0;0;0;NA;NA;NA;NA;NA;NA;NA;0;NA;NA;0;NA;0;1;West Bromwich Albion;James McClean;Jonny Evans;0;NA;NA;NA;0;NA;NA;0;NA;0;NA;NA;NA;0;NA;NA;0;0;NA;NA;NA;0;NA;NA;NA;NA;1;38;0;NA;NA;45
480737;13-12-2017;First Half ends, Liverpool 0, West Bromwich Albion 0.;45'+2';Liverpool;West Bromwich Albion;0;0;1;0;0;0;0;NA;NA;NA;NA;NA;NA;NA;0;NA;NA;0;NA;0;0;NA;NA;NA;0;NA;NA;NA;0;NA;NA;0;NA;0;NA;NA;NA;0;NA;NA;0;0;NA;NA;NA;0;NA;NA;NA;NA;1;39;1;NA;NA;47
480737;13-12-2017;Second Half begins Liverpool 0, West Bromwich Albion 0.;45';Liverpool;West Bromwich Albion;0;0;0;0;1;0;0;NA;NA;NA;NA;NA;NA;NA;0;NA;NA;0;NA;0;0;NA;NA;NA;0;NA;NA;NA;0;NA;NA;0;NA;0;NA;NA;NA;0;NA;NA;0;0;NA;NA;NA;0;NA;NA;NA;NA;2;40;0;NA;NA;45
480737;13-12-2017;Corner,  West Bromwich Albion. Conceded by Andrew Robertson.;47';Liverpool;West Bromwich Albion;0;0;0;0;0;0;0;NA;NA;NA;NA;NA;NA;NA;0;NA;NA;0;NA;0;0;NA;NA;NA;0;NA;NA;NA;0;NA;NA;0;NA;0;NA;NA;NA;1;West Bromwich Albion;Andrew Robertson;0;0;NA;NA;NA;0;NA;NA;NA;NA;2;41;0;NA;NA;47
480737;13-12-2017;Corner,  West Bromwich Albion. Conceded by Sadio Mané.;48';Liverpool;West Bromwich Albion;0;0;0;0;0;0;0;NA;NA;NA;NA;NA;NA;NA;0;NA;NA;0;NA;0;0;NA;NA;NA;0;NA;NA;NA;0;NA;NA;0;NA;0;NA;NA;NA;1;West Bromwich Albion;Sadio Mané;0;0;NA;NA;NA;0;NA;NA;NA;NA;2;42;0;NA;NA;48
480737;13-12-2017;Foul by Ragnar Klavan (Liverpool).;49';Liverpool;West Bromwich Albion;0;0;0;0;0;0;0;NA;NA;NA;NA;NA;NA;NA;1;Ragnar Klavan;Liverpool;0;NA;0;0;NA;NA;NA;0;NA;NA;NA;0;NA;NA;0;NA;0;NA;NA;NA;0;NA;NA;0;0;NA;NA;NA;0;NA;NA;NA;NA;2;43;0;NA;NA;49
480737;13-12-2017;Salomón Rondón (West Bromwich Albion) wins a free kick on the left wing.;49';Liverpool;West Bromwich Albion;0;0;0;0;0;0;0;NA;NA;NA;NA;NA;NA;NA;0;NA;NA;0;NA;0;0;NA;NA;NA;0;NA;NA;NA;0;NA;NA;0;NA;1;Salomón Rondón;West Bromwich Albion;NA;0;NA;NA;0;0;NA;NA;NA;0;NA;NA;NA;NA;2;44;0;NA;NA;49
480737;13-12-2017;Corner,  West Bromwich Albion. Conceded by Loris Karius.;50';Liverpool;West Bromwich Albion;0;0;0;0;0;0;0;NA;NA;NA;NA;NA;NA;NA;0;NA;NA;0;NA;0;0;NA;NA;NA;0;NA;NA;NA;0;NA;NA;0;NA;0;NA;NA;NA;1;West Bromwich Albion;Loris Karius;0;0;NA;NA;NA;0;NA;NA;NA;NA;2;45;0;NA;NA;50
480737;13-12-2017;Attempt saved. Claudio Yacob (West Bromwich Albion) header from the centre of the box is saved in the top centre of the goal. Assisted by Grzegorz Krychowiak with a cross.;51';Liverpool;West Bromwich Albion;0;0;0;0;0;1;0;saved;Claudio Yacob;West Bromwich Albion;header;the centre of the box;the top centre of the goal;Grzegorz Krychowiak;0;NA;NA;0;cross;0;0;NA;NA;NA;0;NA;NA;NA;0;NA;NA;0;NA;0;NA;NA;NA;0;NA;NA;0;0;NA;NA;NA;0;NA;NA;NA;NA;2;46;0;NA;NA;51
480737;13-12-2017;Corner,  West Bromwich Albion. Conceded by Loris Karius.;51';Liverpool;West Bromwich Albion;0;0;0;0;0;0;0;NA;NA;NA;NA;NA;NA;NA;0;NA;NA;0;NA;0;0;NA;NA;NA;0;NA;NA;NA;0;NA;NA;0;NA;0;NA;NA;NA;1;West Bromwich Albion;Loris Karius;0;0;NA;NA;NA;0;NA;NA;NA;NA;2;47;0;NA;NA;51
480737;13-12-2017;Attempt missed. Ahmed Hegazi (West Bromwich Albion) header from very close range is too high. Assisted by Grzegorz Krychowiak with a cross following a corner.;51';Liverpool;West Bromwich Albion;0;0;0;0;0;1;0;missed;Ahmed Hegazi;West Bromwich Albion;header;very close range;too high;Grzegorz Krychowiak;0;NA;NA;0;cross;1;0;NA;NA;NA;0;NA;NA;NA;0;NA;NA;0;NA;0;NA;NA;NA;0;NA;NA;0;0;NA;NA;NA;0;NA;NA;NA;NA;2;48;0;NA;NA;51
480737;13-12-2017;Emre Can (Liverpool) wins a free kick in the defensive half.;54';Liverpool;West Bromwich Albion;0;0;0;0;0;0;0;NA;NA;NA;NA;NA;NA;NA;0;NA;NA;0;NA;0;0;NA;NA;NA;0;NA;NA;NA;0;NA;NA;0;NA;1;Emre Can;Liverpool;defensive half;0;NA;NA;0;0;NA;NA;NA;0;NA;NA;NA;NA;2;49;0;NA;NA;54
480737;13-12-2017;Foul by Hal Robson-Kanu (West Bromwich Albion).;54';Liverpool;West Bromwich Albion;0;0;0;0;0;0;0;NA;NA;NA;NA;NA;NA;NA;1;Hal Robson-Kanu;West Bromwich Albion;0;NA;0;0;NA;NA;NA;0;NA;NA;NA;0;NA;NA;0;NA;0;NA;NA;NA;0;NA;NA;0;0;NA;NA;NA;0;NA;NA;NA;NA;2;50;0;NA;NA;54
480737;13-12-2017;Attempt missed. Sadio Mané (Liverpool) right footed shot from the centre of the box misses to the right. Assisted by Roberto Firmino.;56';Liverpool;West Bromwich Albion;0;0;0;0;0;1;0;missed;Sadio Mané;Liverpool;right;the centre of the box;right;Roberto Firmino;0;NA;NA;0;NA;0;0;NA;NA;NA;0;NA;NA;NA;0;NA;NA;0;NA;0;NA;NA;NA;0;NA;NA;0;0;NA;NA;NA;0;NA;NA;NA;NA;2;51;0;NA;NA;56
480737;13-12-2017;Attempt missed. Mohamed Salah (Liverpool) header from the centre of the box misses to the left.;57';Liverpool;West Bromwich Albion;0;0;0;0;0;1;0;missed;Mohamed Salah;Liverpool;header;the centre of the box;left;NA;0;NA;NA;0;NA;0;0;NA;NA;NA;0;NA;NA;NA;0;NA;NA;0;NA;0;NA;NA;NA;0;NA;NA;0;0;NA;NA;NA;0;NA;NA;NA;NA;2;52;0;NA;NA;57
480737;13-12-2017;Foul by Ahmed Hegazi (West Bromwich Albion).;63';Liverpool;West Bromwich Albion;0;0;0;0;0;0;0;NA;NA;NA;NA;NA;NA;NA;1;Ahmed Hegazi;West Bromwich Albion;0;NA;0;0;NA;NA;NA;0;NA;NA;NA;0;NA;NA;0;NA;0;NA;NA;NA;0;NA;NA;0;0;NA;NA;NA;0;NA;NA;NA;NA;2;53;0;NA;NA;63
480737;13-12-2017;Sadio Mané (Liverpool) wins a free kick in the attacking half.;63';Liverpool;West Bromwich Albion;0;0;0;0;0;0;0;NA;NA;NA;NA;NA;NA;NA;0;NA;NA;0;NA;0;0;NA;NA;NA;0;NA;NA;NA;0;NA;NA;0;NA;1;Sadio Mané;Liverpool;attacking half;0;NA;NA;0;0;NA;NA;NA;0;NA;NA;NA;NA;2;54;0;NA;NA;63
480737;13-12-2017;Attempt saved. Philippe Coutinho (Liverpool) right footed shot from outside the box is saved in the bottom left corner.;64';Liverpool;West Bromwich Albion;0;0;0;0;0;1;0;saved;Philippe Coutinho;Liverpool;right;outside the box;the bottom left corner;NA;0;NA;NA;0;NA;0;0;NA;NA;NA;0;NA;NA;NA;0;NA;NA;0;NA;0;NA;NA;NA;0;NA;NA;0;0;NA;NA;NA;0;NA;NA;NA;NA;2;55;0;NA;NA;64
480737;13-12-2017;Attempt blocked. Georginio Wijnaldum (Liverpool) right footed shot from very close range is blocked.;65';Liverpool;West Bromwich Albion;0;0;0;0;0;1;0;blocked;Georginio Wijnaldum;Liverpool;right;right shot very close range;NA;NA;0;NA;NA;0;NA;0;0;NA;NA;NA;0;NA;NA;NA;0;NA;NA;0;NA;0;NA;NA;NA;0;NA;NA;0;0;NA;NA;NA;0;NA;NA;NA;NA;2;56;0;NA;NA;65
480737;13-12-2017;Attempt blocked. Sadio Mané (Liverpool) right footed shot from the left side of the box is blocked. Assisted by Emre Can.;65';Liverpool;West Bromwich Albion;0;0;0;0;0;1;0;blocked;Sadio Mané;Liverpool;right;the left side of the box;NA;Emre Can;0;NA;NA;0;NA;0;0;NA;NA;NA;0;NA;NA;NA;0;NA;NA;0;NA;0;NA;NA;NA;0;NA;NA;0;0;NA;NA;NA;0;NA;NA;NA;NA;2;57;0;NA;NA;65
480737;13-12-2017;Corner,  Liverpool. Conceded by Allan Nyom.;65';Liverpool;West Bromwich Albion;0;0;0;0;0;0;0;NA;NA;NA;NA;NA;NA;NA;0;NA;NA;0;NA;0;0;NA;NA;NA;0;NA;NA;NA;0;NA;NA;0;NA;0;NA;NA;NA;1;Liverpool;Allan Nyom;0;0;NA;NA;NA;0;NA;NA;NA;NA;2;58;0;NA;NA;65
480737;13-12-2017;Foul by Dejan Lovren (Liverpool).;66';Liverpool;West Bromwich Albion;0;0;0;0;0;0;0;NA;NA;NA;NA;NA;NA;NA;1;Dejan Lovren;Liverpool;0;NA;0;0;NA;NA;NA;0;NA;NA;NA;0;NA;NA;0;NA;0;NA;NA;NA;0;NA;NA;0;0;NA;NA;NA;0;NA;NA;NA;NA;2;59;0;NA;NA;66
480737;13-12-2017;Salomón Rondón (West Bromwich Albion) wins a free kick on the left wing.;66';Liverpool;West Bromwich Albion;0;0;0;0;0;0;0;NA;NA;NA;NA;NA;NA;NA;0;NA;NA;0;NA;0;0;NA;NA;NA;0;NA;NA;NA;0;NA;NA;0;NA;1;Salomón Rondón;West Bromwich Albion;NA;0;NA;NA;0;0;NA;NA;NA;0;NA;NA;NA;NA;2;60;0;NA;NA;66
480737;13-12-2017;Foul by Emre Can (Liverpool).;68';Liverpool;West Bromwich Albion;0;0;0;0;0;0;0;NA;NA;NA;NA;NA;NA;NA;1;Emre Can;Liverpool;0;NA;0;0;NA;NA;NA;0;NA;NA;NA;0;NA;NA;0;NA;0;NA;NA;NA;0;NA;NA;0;0;NA;NA;NA;0;NA;NA;NA;NA;2;61;0;NA;NA;68
480737;13-12-2017;Hal Robson-Kanu (West Bromwich Albion) wins a free kick in the defensive half.;68';Liverpool;West Bromwich Albion;0;0;0;0;0;0;0;NA;NA;NA;NA;NA;NA;NA;0;NA;NA;0;NA;0;0;NA;NA;NA;0;NA;NA;NA;0;NA;NA;0;NA;1;Hal Robson-Kanu;West Bromwich Albion;defensive half;0;NA;NA;0;0;NA;NA;NA;0;NA;NA;NA;NA;2;62;0;NA;NA;68
480737;13-12-2017;Emre Can (Liverpool) is shown the yellow card.;68';Liverpool;West Bromwich Albion;0;0;0;0;0;0;0;NA;NA;NA;NA;NA;NA;NA;0;NA;NA;0;NA;0;0;NA;NA;NA;1;yellow;Emre Can;Liverpool;0;NA;NA;0;NA;0;NA;NA;NA;0;NA;NA;0;0;NA;NA;NA;0;NA;NA;NA;NA;2;63;0;NA;NA;68
480737;13-12-2017;Foul by Hal Robson-Kanu (West Bromwich Albion).;69';Liverpool;West Bromwich Albion;0;0;0;0;0;0;0;NA;NA;NA;NA;NA;NA;NA;1;Hal Robson-Kanu;West Bromwich Albion;0;NA;0;0;NA;NA;NA;0;NA;NA;NA;0;NA;NA;0;NA;0;NA;NA;NA;0;NA;NA;0;0;NA;NA;NA;0;NA;NA;NA;NA;2;64;0;NA;NA;69
480737;13-12-2017;Loris Karius (Liverpool) wins a free kick in the defensive half.;69';Liverpool;West Bromwich Albion;0;0;0;0;0;0;0;NA;NA;NA;NA;NA;NA;NA;0;NA;NA;0;NA;0;0;NA;NA;NA;0;NA;NA;NA;0;NA;NA;0;NA;1;Loris Karius;Liverpool;defensive half;0;NA;NA;0;0;NA;NA;NA;0;NA;NA;NA;NA;2;65;0;NA;NA;69
480737;13-12-2017;Corner,  West Bromwich Albion. Conceded by Ragnar Klavan.;71';Liverpool;West Bromwich Albion;0;0;0;0;0;0;0;NA;NA;NA;NA;NA;NA;NA;0;NA;NA;0;NA;0;0;NA;NA;NA;0;NA;NA;NA;0;NA;NA;0;NA;0;NA;NA;NA;1;West Bromwich Albion;Ragnar Klavan;0;0;NA;NA;NA;0;NA;NA;NA;NA;2;66;0;NA;NA;71
480737;13-12-2017;Substitution, West Bromwich Albion. Jay Rodriguez replaces Hal Robson-Kanu.;71';Liverpool;West Bromwich Albion;0;0;0;0;0;0;0;NA;NA;NA;NA;NA;NA;NA;0;NA;NA;0;NA;0;0;NA;NA;NA;0;NA;NA;NA;0;NA;NA;0;NA;0;NA;NA;NA;0;NA;NA;1;0;West Bromwich Albion;Jay Rodriguez;Hal Robson-Kanu;0;NA;NA;NA;NA;2;67;0;NA;NA;71
480737;13-12-2017;Foul by Jake Livermore (West Bromwich Albion).;71';Liverpool;West Bromwich Albion;0;0;0;0;0;0;0;NA;NA;NA;NA;NA;NA;NA;1;Jake Livermore;West Bromwich Albion;0;NA;0;0;NA;NA;NA;0;NA;NA;NA;0;NA;NA;0;NA;0;NA;NA;NA;0;NA;NA;0;0;NA;NA;NA;0;NA;NA;NA;NA;2;68;0;NA;NA;71
480737;13-12-2017;Mohamed Salah (Liverpool) wins a free kick in the defensive half.;71';Liverpool;West Bromwich Albion;0;0;0;0;0;0;0;NA;NA;NA;NA;NA;NA;NA;0;NA;NA;0;NA;0;0;NA;NA;NA;0;NA;NA;NA;0;NA;NA;0;NA;1;Mohamed Salah;Liverpool;defensive half;0;NA;NA;0;0;NA;NA;NA;0;NA;NA;NA;NA;2;69;0;NA;NA;71
480737;13-12-2017;Foul by Sadio Mané (Liverpool).;73';Liverpool;West Bromwich Albion;0;0;0;0;0;0;0;NA;NA;NA;NA;NA;NA;NA;1;Sadio Mané;Liverpool;0;NA;0;0;NA;NA;NA;0;NA;NA;NA;0;NA;NA;0;NA;0;NA;NA;NA;0;NA;NA;0;0;NA;NA;NA;0;NA;NA;NA;NA;2;70;0;NA;NA;73
480737;13-12-2017;Jake Livermore (West Bromwich Albion) wins a free kick in the defensive half.;73';Liverpool;West Bromwich Albion;0;0;0;0;0;0;0;NA;NA;NA;NA;NA;NA;NA;0;NA;NA;0;NA;0;0;NA;NA;NA;0;NA;NA;NA;0;NA;NA;0;NA;1;Jake Livermore;West Bromwich Albion;defensive half;0;NA;NA;0;0;NA;NA;NA;0;NA;NA;NA;NA;2;71;0;NA;NA;73
480737;13-12-2017;Substitution, Liverpool. Dominic Solanke replaces Sadio Mané.;76';Liverpool;West Bromwich Albion;0;0;0;0;0;0;0;NA;NA;NA;NA;NA;NA;NA;0;NA;NA;0;NA;0;0;NA;NA;NA;0;NA;NA;NA;0;NA;NA;0;NA;0;NA;NA;NA;0;NA;NA;1;0;Liverpool;Dominic Solanke;Sadio Mané;0;NA;NA;NA;NA;2;72;0;NA;NA;76
480737;13-12-2017;Substitution, Liverpool. Alex Oxlade-Chamberlain replaces Georginio Wijnaldum.;76';Liverpool;West Bromwich Albion;0;0;0;0;0;0;0;NA;NA;NA;NA;NA;NA;NA;0;NA;NA;0;NA;0;0;NA;NA;NA;0;NA;NA;NA;0;NA;NA;0;NA;0;NA;NA;NA;0;NA;NA;1;0;Liverpool;Alex Oxlade-Chamberlain;Georginio Wijnaldum;0;NA;NA;NA;NA;2;73;0;NA;NA;76
480737;13-12-2017;Dangerous play by Mohamed Salah (Liverpool).;78';Liverpool;West Bromwich Albion;0;0;0;0;0;0;0;NA;NA;NA;NA;NA;NA;NA;0;NA;NA;0;NA;0;0;NA;NA;NA;0;NA;NA;NA;0;NA;NA;0;NA;0;NA;NA;NA;0;NA;NA;0;0;NA;NA;NA;0;NA;NA;NA;NA;2;74;0;NA;NA;78
480737;13-12-2017;Jonny Evans (West Bromwich Albion) wins a free kick in the defensive half.;78';Liverpool;West Bromwich Albion;0;0;0;0;0;0;0;NA;NA;NA;NA;NA;NA;NA;0;NA;NA;0;NA;0;0;NA;NA;NA;0;NA;NA;NA;0;NA;NA;0;NA;1;Jonny Evans;West Bromwich Albion;defensive half;0;NA;NA;0;0;NA;NA;NA;0;NA;NA;NA;NA;2;75;0;NA;NA;78
480737;13-12-2017;Substitution, West Bromwich Albion. Chris Brunt replaces Grzegorz Krychowiak.;79';Liverpool;West Bromwich Albion;0;0;0;0;0;0;0;NA;NA;NA;NA;NA;NA;NA;0;NA;NA;0;NA;0;0;NA;NA;NA;0;NA;NA;NA;0;NA;NA;0;NA;0;NA;NA;NA;0;NA;NA;1;0;West Bromwich Albion;Chris Brunt;Grzegorz Krychowiak;0;NA;NA;NA;NA;2;76;0;NA;NA;79
480737;13-12-2017;Substitution, Liverpool. Joseph Gomez replaces Trent Alexander-Arnold.;80';Liverpool;West Bromwich Albion;0;0;0;0;0;0;0;NA;NA;NA;NA;NA;NA;NA;0;NA;NA;0;NA;0;0;NA;NA;NA;0;NA;NA;NA;0;NA;NA;0;NA;0;NA;NA;NA;0;NA;NA;1;0;Liverpool;Joseph Gomez;Trent Alexander-Arnold;0;NA;NA;NA;NA;2;77;0;NA;NA;80
480737;13-12-2017;Corner,  Liverpool. Conceded by Jay Rodriguez.;81';Liverpool;West Bromwich Albion;0;0;0;0;0;0;0;NA;NA;NA;NA;NA;NA;NA;0;NA;NA;0;NA;0;0;NA;NA;NA;0;NA;NA;NA;0;NA;NA;0;NA;0;NA;NA;NA;1;Liverpool;Jay Rodriguez;0;0;NA;NA;NA;0;NA;NA;NA;NA;2;78;0;NA;NA;81
480737;13-12-2017;Hand ball by Dominic Solanke (Liverpool).;82';Liverpool;West Bromwich Albion;0;0;0;0;0;0;0;NA;NA;NA;NA;NA;NA;NA;0;NA;NA;0;NA;0;0;NA;NA;NA;0;NA;NA;NA;0;NA;NA;0;NA;0;NA;NA;NA;0;NA;NA;0;0;NA;NA;NA;0;NA;NA;NA;NA;2;79;0;NA;NA;82
480737;13-12-2017;Attempt missed. Chris Brunt (West Bromwich Albion) left footed shot from outside the box is high and wide to the left. Assisted by Jake Livermore.;83';Liverpool;West Bromwich Albion;0;0;0;0;0;1;0;missed;Chris Brunt;West Bromwich Albion;left;outside the box;high and wide to the left;Jake Livermore;0;NA;NA;0;NA;0;0;NA;NA;NA;0;NA;NA;NA;0;NA;NA;0;NA;0;NA;NA;NA;0;NA;NA;0;0;NA;NA;NA;0;NA;NA;NA;NA;2;80;0;NA;NA;83
480737;13-12-2017;Attempt blocked. Dominic Solanke (Liverpool) right footed shot from the centre of the box is blocked.;84';Liverpool;West Bromwich Albion;0;0;0;0;0;1;0;blocked;Dominic Solanke;Liverpool;right;the centre of the box;NA;NA;0;NA;NA;0;NA;0;0;NA;NA;NA;0;NA;NA;NA;0;NA;NA;0;NA;0;NA;NA;NA;0;NA;NA;0;0;NA;NA;NA;0;NA;NA;NA;NA;2;81;0;NA;NA;84
480737;13-12-2017;Offside, West Bromwich Albion. Ben Foster tries a through ball, but James McClean is caught offside.;85';Liverpool;West Bromwich Albion;0;0;0;0;0;0;0;NA;NA;NA;NA;NA;NA;NA;0;NA;NA;0;NA;0;1;West Bromwich Albion;James McClean;Ben Foster;0;NA;NA;NA;0;NA;NA;0;NA;0;NA;NA;NA;0;NA;NA;0;0;NA;NA;NA;0;NA;NA;NA;NA;2;82;0;NA;NA;85
480737;13-12-2017;Attempt saved. Alex Oxlade-Chamberlain (Liverpool) right footed shot from the left side of the box is saved in the centre of the goal. Assisted by Dominic Solanke.;86';Liverpool;West Bromwich Albion;0;0;0;0;0;1;0;saved;Alex Oxlade-Chamberlain;Liverpool;right;the left side of the box;the centre of the goal;Dominic Solanke;0;NA;NA;0;NA;0;0;NA;NA;NA;0;NA;NA;NA;0;NA;NA;0;NA;0;NA;NA;NA;0;NA;NA;0;0;NA;NA;NA;0;NA;NA;NA;NA;2;83;0;NA;NA;86
