Game ID;Date;Commentary;Match Time;Team One;Team Two;Team One Score;Team Two Score;Half End;Match End;Half Begins;Shot Attempt;Penalty Shot;Shot Result;Shot by Player;Shot by Team;Shot with;Shot where;Net Location;Assist by Player;Foul;Foul by Player;Foul by Team;Followed by Set Piece;Assist Type;Followed by Corner;Offside;Offside Team;Offside Player;Offside followed by pass from;Shown Card;Card Type;Card Player;Card Team;Video Review;Video Review Event;Video Review Result;Delay in Match;Delay Team;Free Kick Won;Free Kick Player;Free Kick Team;Free Kick where;Corner;Corner Team;Corner conceded by;Substitution;Substitution Injury;Substitution Team;Substitution Player;Replaced Player;Penalty;Team drew Penalty;Player drew Penalty;Player conceded Penalty;Team conceded Penalty;Half;Comment ID;Stoppage Time;Team One Penalty Score;Team Two Penalty Score;Match Time Numeric
480589;31-03-2018;First Half begins.;-;Brighton & Hove Albion;Leicester City;0;0;0;0;1;0;0;NA;NA;NA;NA;NA;NA;NA;0;NA;NA;0;NA;0;0;NA;NA;NA;0;NA;NA;NA;0;NA;NA;0;NA;0;NA;NA;NA;0;NA;NA;0;0;NA;NA;NA;0;NA;NA;NA;NA;1;1;0;NA;NA;NA
480589;31-03-2018;Lineups are announced and players are warming up.;-;Brighton & Hove Albion;Leicester City;0;0;0;0;0;0;0;NA;NA;NA;NA;NA;NA;NA;0;NA;NA;0;NA;0;0;NA;NA;NA;0;NA;NA;NA;0;NA;NA;0;NA;0;NA;NA;NA;0;NA;NA;0;0;NA;NA;NA;0;NA;NA;NA;NA;1;2;0;NA;NA;NA
480589;31-03-2018;Foul by Vicente Iborra (Leicester City).;1';Brighton & Hove Albion;Leicester City;0;0;0;0;0;0;0;NA;NA;NA;NA;NA;NA;NA;1;Vicente Iborra;Leicester City;0;NA;0;0;NA;NA;NA;0;NA;NA;NA;0;NA;NA;0;NA;0;NA;NA;NA;0;NA;NA;0;0;NA;NA;NA;0;NA;NA;NA;NA;1;3;0;NA;NA;1
480589;31-03-2018;Jürgen Locadia (Brighton and Hove Albion) wins a free kick in the defensive half.;1';Brighton & Hove Albion;Leicester City;0;0;0;0;0;0;0;NA;NA;NA;NA;NA;NA;NA;0;NA;NA;0;NA;0;0;NA;NA;NA;0;NA;NA;NA;0;NA;NA;0;NA;1;Jürgen Locadia;Brighton and Hove Albion;defensive half;0;NA;NA;0;0;NA;NA;NA;0;NA;NA;NA;NA;1;4;0;NA;NA;1
480589;31-03-2018;Foul by Jürgen Locadia (Brighton and Hove Albion).;2';Brighton & Hove Albion;Leicester City;0;0;0;0;0;0;0;NA;NA;NA;NA;NA;NA;NA;1;Jürgen Locadia;Brighton and Hove Albion;0;NA;0;0;NA;NA;NA;0;NA;NA;NA;0;NA;NA;0;NA;0;NA;NA;NA;0;NA;NA;0;0;NA;NA;NA;0;NA;NA;NA;NA;1;5;0;NA;NA;2
480589;31-03-2018;Harry Maguire (Leicester City) wins a free kick in the defensive half.;2';Brighton & Hove Albion;Leicester City;0;0;0;0;0;0;0;NA;NA;NA;NA;NA;NA;NA;0;NA;NA;0;NA;0;0;NA;NA;NA;0;NA;NA;NA;0;NA;NA;0;NA;1;Harry Maguire;Leicester City;defensive half;0;NA;NA;0;0;NA;NA;NA;0;NA;NA;NA;NA;1;6;0;NA;NA;2
480589;31-03-2018;Offside, Brighton and Hove Albion. Mat Ryan tries a through ball, but Glenn Murray is caught offside.;4';Brighton & Hove Albion;Leicester City;0;0;0;0;0;0;0;NA;NA;NA;NA;NA;NA;NA;0;NA;NA;0;NA;0;1;Brighton and Hove Albion;Glenn Murray;Mat Ryan;0;NA;NA;NA;0;NA;NA;0;NA;0;NA;NA;NA;0;NA;NA;0;0;NA;NA;NA;0;NA;NA;NA;NA;1;7;0;NA;NA;4
480589;31-03-2018;Ezequiel Schelotto (Brighton and Hove Albion) wins a free kick in the defensive half.;5';Brighton & Hove Albion;Leicester City;0;0;0;0;0;0;0;NA;NA;NA;NA;NA;NA;NA;0;NA;NA;0;NA;0;0;NA;NA;NA;0;NA;NA;NA;0;NA;NA;0;NA;1;Ezequiel Schelotto;Brighton and Hove Albion;defensive half;0;NA;NA;0;0;NA;NA;NA;0;NA;NA;NA;NA;1;8;0;NA;NA;5
480589;31-03-2018;Foul by Shinji Okazaki (Leicester City).;5';Brighton & Hove Albion;Leicester City;0;0;0;0;0;0;0;NA;NA;NA;NA;NA;NA;NA;1;Shinji Okazaki;Leicester City;0;NA;0;0;NA;NA;NA;0;NA;NA;NA;0;NA;NA;0;NA;0;NA;NA;NA;0;NA;NA;0;0;NA;NA;NA;0;NA;NA;NA;NA;1;9;0;NA;NA;5
480589;31-03-2018;Attempt missed. Jürgen Locadia (Brighton and Hove Albion) left footed shot from the left side of the box is high and wide to the left. Assisted by Lewis Dunk.;7';Brighton & Hove Albion;Leicester City;0;0;0;0;0;1;0;missed;Jürgen Locadia;Brighton and Hove Albion;left;the left side of the box;high and wide to the left;Lewis Dunk;0;NA;NA;0;NA;0;0;NA;NA;NA;0;NA;NA;NA;0;NA;NA;0;NA;0;NA;NA;NA;0;NA;NA;0;0;NA;NA;NA;0;NA;NA;NA;NA;1;10;0;NA;NA;7
480589;31-03-2018;Foul by Wilfred Ndidi (Leicester City).;9';Brighton & Hove Albion;Leicester City;0;0;0;0;0;0;0;NA;NA;NA;NA;NA;NA;NA;1;Wilfred Ndidi;Leicester City;0;NA;0;0;NA;NA;NA;0;NA;NA;NA;0;NA;NA;0;NA;0;NA;NA;NA;0;NA;NA;0;0;NA;NA;NA;0;NA;NA;NA;NA;1;11;0;NA;NA;9
480589;31-03-2018;Jürgen Locadia (Brighton and Hove Albion) wins a free kick on the right wing.;9';Brighton & Hove Albion;Leicester City;0;0;0;0;0;0;0;NA;NA;NA;NA;NA;NA;NA;0;NA;NA;0;NA;0;0;NA;NA;NA;0;NA;NA;NA;0;NA;NA;0;NA;1;Jürgen Locadia;Brighton and Hove Albion;NA;0;NA;NA;0;0;NA;NA;NA;0;NA;NA;NA;NA;1;12;0;NA;NA;9
480589;31-03-2018;Attempt blocked. Jürgen Locadia (Brighton and Hove Albion) left footed shot from the left side of the box is blocked. Assisted by Beram Kayal.;11';Brighton & Hove Albion;Leicester City;0;0;0;0;0;1;0;blocked;Jürgen Locadia;Brighton and Hove Albion;left;the left side of the box;NA;Beram Kayal;0;NA;NA;0;NA;0;0;NA;NA;NA;0;NA;NA;NA;0;NA;NA;0;NA;0;NA;NA;NA;0;NA;NA;0;0;NA;NA;NA;0;NA;NA;NA;NA;1;13;0;NA;NA;11
480589;31-03-2018;Davy Pröpper (Brighton and Hove Albion) wins a free kick in the attacking half.;12';Brighton & Hove Albion;Leicester City;0;0;0;0;0;0;0;NA;NA;NA;NA;NA;NA;NA;0;NA;NA;0;NA;0;0;NA;NA;NA;0;NA;NA;NA;0;NA;NA;0;NA;1;Davy Pröpper;Brighton and Hove Albion;attacking half;0;NA;NA;0;0;NA;NA;NA;0;NA;NA;NA;NA;1;14;0;NA;NA;12
480589;31-03-2018;Foul by Wes Morgan (Leicester City).;12';Brighton & Hove Albion;Leicester City;0;0;0;0;0;0;0;NA;NA;NA;NA;NA;NA;NA;1;Wes Morgan;Leicester City;0;NA;0;0;NA;NA;NA;0;NA;NA;NA;0;NA;NA;0;NA;0;NA;NA;NA;0;NA;NA;0;0;NA;NA;NA;0;NA;NA;NA;NA;1;15;0;NA;NA;12
480589;31-03-2018;Wes Morgan (Leicester City) is shown the yellow card for a bad foul.;12';Brighton & Hove Albion;Leicester City;0;0;0;0;0;0;0;NA;NA;NA;NA;NA;NA;NA;0;NA;NA;0;NA;0;0;NA;NA;NA;1;yellow;Wes Morgan;Leicester City;0;NA;NA;0;NA;0;NA;NA;NA;0;NA;NA;0;0;NA;NA;NA;0;NA;NA;NA;NA;1;16;0;NA;NA;12
480589;31-03-2018;Attempt blocked. José Izquierdo (Brighton and Hove Albion) right footed shot from the left side of the box is blocked. Assisted by Glenn Murray.;13';Brighton & Hove Albion;Leicester City;0;0;0;0;0;1;0;blocked;José Izquierdo;Brighton and Hove Albion;right;the left side of the box;NA;Glenn Murray;0;NA;NA;0;NA;0;0;NA;NA;NA;0;NA;NA;NA;0;NA;NA;0;NA;0;NA;NA;NA;0;NA;NA;0;0;NA;NA;NA;0;NA;NA;NA;NA;1;17;0;NA;NA;13
480589;31-03-2018;Foul by Beram Kayal (Brighton and Hove Albion).;14';Brighton & Hove Albion;Leicester City;0;0;0;0;0;0;0;NA;NA;NA;NA;NA;NA;NA;1;Beram Kayal;Brighton and Hove Albion;0;NA;0;0;NA;NA;NA;0;NA;NA;NA;0;NA;NA;0;NA;0;NA;NA;NA;0;NA;NA;0;0;NA;NA;NA;0;NA;NA;NA;NA;1;18;0;NA;NA;14
480589;31-03-2018;Vicente Iborra (Leicester City) wins a free kick in the defensive half.;14';Brighton & Hove Albion;Leicester City;0;0;0;0;0;0;0;NA;NA;NA;NA;NA;NA;NA;0;NA;NA;0;NA;0;0;NA;NA;NA;0;NA;NA;NA;0;NA;NA;0;NA;1;Vicente Iborra;Leicester City;defensive half;0;NA;NA;0;0;NA;NA;NA;0;NA;NA;NA;NA;1;19;0;NA;NA;14
480589;31-03-2018;Foul by Davy Pröpper (Brighton and Hove Albion).;17';Brighton & Hove Albion;Leicester City;0;0;0;0;0;0;0;NA;NA;NA;NA;NA;NA;NA;1;Davy Pröpper;Brighton and Hove Albion;0;NA;0;0;NA;NA;NA;0;NA;NA;NA;0;NA;NA;0;NA;0;NA;NA;NA;0;NA;NA;0;0;NA;NA;NA;0;NA;NA;NA;NA;1;20;0;NA;NA;17
480589;31-03-2018;Riyad Mahrez (Leicester City) wins a free kick in the attacking half.;17';Brighton & Hove Albion;Leicester City;0;0;0;0;0;0;0;NA;NA;NA;NA;NA;NA;NA;0;NA;NA;0;NA;0;0;NA;NA;NA;0;NA;NA;NA;0;NA;NA;0;NA;1;Riyad Mahrez;Leicester City;attacking half;0;NA;NA;0;0;NA;NA;NA;0;NA;NA;NA;NA;1;21;0;NA;NA;17
480589;31-03-2018;Attempt saved. Vicente Iborra (Leicester City) header from the centre of the box is saved in the top centre of the goal. Assisted by Marc Albrighton.;18';Brighton & Hove Albion;Leicester City;0;0;0;0;0;1;0;saved;Vicente Iborra;Leicester City;header;the centre of the box;the top centre of the goal;Marc Albrighton;0;NA;NA;0;NA;0;0;NA;NA;NA;0;NA;NA;NA;0;NA;NA;0;NA;0;NA;NA;NA;0;NA;NA;0;0;NA;NA;NA;0;NA;NA;NA;NA;1;22;0;NA;NA;18
480589;31-03-2018;Foul by Gaëtan Bong (Brighton and Hove Albion).;19';Brighton & Hove Albion;Leicester City;0;0;0;0;0;0;0;NA;NA;NA;NA;NA;NA;NA;1;Gaëtan Bong;Brighton and Hove Albion;0;NA;0;0;NA;NA;NA;0;NA;NA;NA;0;NA;NA;0;NA;0;NA;NA;NA;0;NA;NA;0;0;NA;NA;NA;0;NA;NA;NA;NA;1;23;0;NA;NA;19
480589;31-03-2018;Shinji Okazaki (Leicester City) wins a free kick on the right wing.;19';Brighton & Hove Albion;Leicester City;0;0;0;0;0;0;0;NA;NA;NA;NA;NA;NA;NA;0;NA;NA;0;NA;0;0;NA;NA;NA;0;NA;NA;NA;0;NA;NA;0;NA;1;Shinji Okazaki;Leicester City;NA;0;NA;NA;0;0;NA;NA;NA;0;NA;NA;NA;NA;1;24;0;NA;NA;19
480589;31-03-2018;Beram Kayal (Brighton and Hove Albion) wins a free kick in the defensive half.;24';Brighton & Hove Albion;Leicester City;0;0;0;0;0;0;0;NA;NA;NA;NA;NA;NA;NA;0;NA;NA;0;NA;0;0;NA;NA;NA;0;NA;NA;NA;0;NA;NA;0;NA;1;Beram Kayal;Brighton and Hove Albion;defensive half;0;NA;NA;0;0;NA;NA;NA;0;NA;NA;NA;NA;1;25;0;NA;NA;24
480589;31-03-2018;Foul by Wilfred Ndidi (Leicester City).;24';Brighton & Hove Albion;Leicester City;0;0;0;0;0;0;0;NA;NA;NA;NA;NA;NA;NA;1;Wilfred Ndidi;Leicester City;0;NA;0;0;NA;NA;NA;0;NA;NA;NA;0;NA;NA;0;NA;0;NA;NA;NA;0;NA;NA;0;0;NA;NA;NA;0;NA;NA;NA;NA;1;26;0;NA;NA;24
480589;31-03-2018;Wilfred Ndidi (Leicester City) is shown the yellow card for a bad foul.;24';Brighton & Hove Albion;Leicester City;0;0;0;0;0;0;0;NA;NA;NA;NA;NA;NA;NA;0;NA;NA;0;NA;0;0;NA;NA;NA;1;yellow;Wilfred Ndidi;Leicester City;0;NA;NA;0;NA;0;NA;NA;NA;0;NA;NA;0;0;NA;NA;NA;0;NA;NA;NA;NA;1;27;0;NA;NA;24
480589;31-03-2018;Foul by Danny Simpson (Leicester City).;28';Brighton & Hove Albion;Leicester City;0;0;0;0;0;0;0;NA;NA;NA;NA;NA;NA;NA;1;Danny Simpson;Leicester City;0;NA;0;0;NA;NA;NA;0;NA;NA;NA;0;NA;NA;0;NA;0;NA;NA;NA;0;NA;NA;0;0;NA;NA;NA;0;NA;NA;NA;NA;1;28;0;NA;NA;28
480589;31-03-2018;Glenn Murray (Brighton and Hove Albion) wins a free kick on the left wing.;28';Brighton & Hove Albion;Leicester City;0;0;0;0;0;0;0;NA;NA;NA;NA;NA;NA;NA;0;NA;NA;0;NA;0;0;NA;NA;NA;0;NA;NA;NA;0;NA;NA;0;NA;1;Glenn Murray;Brighton and Hove Albion;NA;0;NA;NA;0;0;NA;NA;NA;0;NA;NA;NA;NA;1;29;0;NA;NA;28
480589;31-03-2018;Offside, Brighton and Hove Albion. Pascal Groß tries a through ball, but Jürgen Locadia is caught offside.;29';Brighton & Hove Albion;Leicester City;0;0;0;0;0;0;0;NA;NA;NA;NA;NA;NA;NA;0;NA;NA;0;NA;0;1;Brighton and Hove Albion;Jürgen Locadia;Pascal Groß;0;NA;NA;NA;0;NA;NA;0;NA;0;NA;NA;NA;0;NA;NA;0;0;NA;NA;NA;0;NA;NA;NA;NA;1;30;0;NA;NA;29
480589;31-03-2018;Offside, Brighton and Hove Albion. Lewis Dunk tries a through ball, but Jürgen Locadia is caught offside.;30';Brighton & Hove Albion;Leicester City;0;0;0;0;0;0;0;NA;NA;NA;NA;NA;NA;NA;0;NA;NA;0;NA;0;1;Brighton and Hove Albion;Jürgen Locadia;Lewis Dunk;0;NA;NA;NA;0;NA;NA;0;NA;0;NA;NA;NA;0;NA;NA;0;0;NA;NA;NA;0;NA;NA;NA;NA;1;31;0;NA;NA;30
480589;31-03-2018;Foul by Gaëtan Bong (Brighton and Hove Albion).;31';Brighton & Hove Albion;Leicester City;0;0;0;0;0;0;0;NA;NA;NA;NA;NA;NA;NA;1;Gaëtan Bong;Brighton and Hove Albion;0;NA;0;0;NA;NA;NA;0;NA;NA;NA;0;NA;NA;0;NA;0;NA;NA;NA;0;NA;NA;0;0;NA;NA;NA;0;NA;NA;NA;NA;1;32;0;NA;NA;31
480589;31-03-2018;Riyad Mahrez (Leicester City) wins a free kick in the defensive half.;31';Brighton & Hove Albion;Leicester City;0;0;0;0;0;0;0;NA;NA;NA;NA;NA;NA;NA;0;NA;NA;0;NA;0;0;NA;NA;NA;0;NA;NA;NA;0;NA;NA;0;NA;1;Riyad Mahrez;Leicester City;defensive half;0;NA;NA;0;0;NA;NA;NA;0;NA;NA;NA;NA;1;33;0;NA;NA;31
480589;31-03-2018;Attempt missed. Glenn Murray (Brighton and Hove Albion) right footed shot from the right side of the box is too high.;35';Brighton & Hove Albion;Leicester City;0;0;0;0;0;1;0;missed;Glenn Murray;Brighton and Hove Albion;right;the right side of the box;too high;NA;0;NA;NA;0;NA;0;0;NA;NA;NA;0;NA;NA;NA;0;NA;NA;0;NA;0;NA;NA;NA;0;NA;NA;0;0;NA;NA;NA;0;NA;NA;NA;NA;1;34;0;NA;NA;35
480589;31-03-2018;Attempt missed. Glenn Murray (Brighton and Hove Albion) right footed shot from the centre of the box is close, but misses to the right. Assisted by Pascal Groß with a through ball.;37';Brighton & Hove Albion;Leicester City;0;0;0;0;0;1;0;missed;Glenn Murray;Brighton and Hove Albion;right;the centre of the box;close, but right;Pascal Groß;0;NA;NA;0;through;0;0;NA;NA;NA;0;NA;NA;NA;0;NA;NA;0;NA;0;NA;NA;NA;0;NA;NA;0;0;NA;NA;NA;0;NA;NA;NA;NA;1;35;0;NA;NA;37
480589;31-03-2018;Attempt saved. Riyad Mahrez (Leicester City) left footed shot from the right side of the box is saved in the bottom right corner. Assisted by Wilfred Ndidi.;38';Brighton & Hove Albion;Leicester City;0;0;0;0;0;1;0;saved;Riyad Mahrez;Leicester City;left;the right side of the box;the bottom right corner;Wilfred Ndidi;0;NA;NA;0;NA;0;0;NA;NA;NA;0;NA;NA;NA;0;NA;NA;0;NA;0;NA;NA;NA;0;NA;NA;0;0;NA;NA;NA;0;NA;NA;NA;NA;1;36;0;NA;NA;38
480589;31-03-2018;Attempt blocked. José Izquierdo (Brighton and Hove Albion) right footed shot from outside the box is blocked. Assisted by Davy Pröpper.;41';Brighton & Hove Albion;Leicester City;0;0;0;0;0;1;0;blocked;José Izquierdo;Brighton and Hove Albion;right;outside the box;NA;Davy Pröpper;0;NA;NA;0;NA;0;0;NA;NA;NA;0;NA;NA;NA;0;NA;NA;0;NA;0;NA;NA;NA;0;NA;NA;0;0;NA;NA;NA;0;NA;NA;NA;NA;1;37;0;NA;NA;41
480589;31-03-2018;Offside, Brighton and Hove Albion. Pascal Groß tries a through ball, but Glenn Murray is caught offside.;41';Brighton & Hove Albion;Leicester City;0;0;0;0;0;0;0;NA;NA;NA;NA;NA;NA;NA;0;NA;NA;0;NA;0;1;Brighton and Hove Albion;Glenn Murray;Pascal Groß;0;NA;NA;NA;0;NA;NA;0;NA;0;NA;NA;NA;0;NA;NA;0;0;NA;NA;NA;0;NA;NA;NA;NA;1;38;0;NA;NA;41
480589;31-03-2018;Foul by Davy Pröpper (Brighton and Hove Albion).;44';Brighton & Hove Albion;Leicester City;0;0;0;0;0;0;0;NA;NA;NA;NA;NA;NA;NA;1;Davy Pröpper;Brighton and Hove Albion;0;NA;0;0;NA;NA;NA;0;NA;NA;NA;0;NA;NA;0;NA;0;NA;NA;NA;0;NA;NA;0;0;NA;NA;NA;0;NA;NA;NA;NA;1;39;0;NA;NA;44
480589;31-03-2018;Shinji Okazaki (Leicester City) wins a free kick in the attacking half.;44';Brighton & Hove Albion;Leicester City;0;0;0;0;0;0;0;NA;NA;NA;NA;NA;NA;NA;0;NA;NA;0;NA;0;0;NA;NA;NA;0;NA;NA;NA;0;NA;NA;0;NA;1;Shinji Okazaki;Leicester City;attacking half;0;NA;NA;0;0;NA;NA;NA;0;NA;NA;NA;NA;1;40;0;NA;NA;44
480589;31-03-2018;Offside, Leicester City. Riyad Mahrez tries a through ball, but Vicente Iborra is caught offside.;45';Brighton & Hove Albion;Leicester City;0;0;0;0;0;0;0;NA;NA;NA;NA;NA;NA;NA;0;NA;NA;0;NA;0;1;Leicester City;Vicente Iborra;Riyad Mahrez;0;NA;NA;NA;0;NA;NA;0;NA;0;NA;NA;NA;0;NA;NA;0;0;NA;NA;NA;0;NA;NA;NA;NA;1;41;0;NA;NA;45
480589;31-03-2018;Foul by José Izquierdo (Brighton and Hove Albion).;45'+1';Brighton & Hove Albion;Leicester City;0;0;0;0;0;0;0;NA;NA;NA;NA;NA;NA;NA;1;José Izquierdo;Brighton and Hove Albion;0;NA;0;0;NA;NA;NA;0;NA;NA;NA;0;NA;NA;0;NA;0;NA;NA;NA;0;NA;NA;0;0;NA;NA;NA;0;NA;NA;NA;NA;1;42;1;NA;NA;46
480589;31-03-2018;Riyad Mahrez (Leicester City) wins a free kick on the right wing.;45'+1';Brighton & Hove Albion;Leicester City;0;0;0;0;0;0;0;NA;NA;NA;NA;NA;NA;NA;0;NA;NA;0;NA;0;0;NA;NA;NA;0;NA;NA;NA;0;NA;NA;0;NA;1;Riyad Mahrez;Leicester City;NA;0;NA;NA;0;0;NA;NA;NA;0;NA;NA;NA;NA;1;43;1;NA;NA;46
480589;31-03-2018;First Half ends, Brighton and Hove Albion 0, Leicester City 0.;45'+2';Brighton & Hove Albion;Leicester City;0;0;1;0;0;0;0;NA;NA;NA;NA;NA;NA;NA;0;NA;NA;0;NA;0;0;NA;NA;NA;0;NA;NA;NA;0;NA;NA;0;NA;0;NA;NA;NA;0;NA;NA;0;0;NA;NA;NA;0;NA;NA;NA;NA;1;44;1;NA;NA;47
480589;31-03-2018;Second Half begins Brighton and Hove Albion 0, Leicester City 0.;45';Brighton & Hove Albion;Leicester City;0;0;0;0;1;0;0;NA;NA;NA;NA;NA;NA;NA;0;NA;NA;0;NA;0;0;NA;NA;NA;0;NA;NA;NA;0;NA;NA;0;NA;0;NA;NA;NA;0;NA;NA;0;0;NA;NA;NA;0;NA;NA;NA;NA;2;45;0;NA;NA;45
480589;31-03-2018;Foul by Jamie Vardy (Leicester City).;46';Brighton & Hove Albion;Leicester City;0;0;0;0;0;0;0;NA;NA;NA;NA;NA;NA;NA;1;Jamie Vardy;Leicester City;0;NA;0;0;NA;NA;NA;0;NA;NA;NA;0;NA;NA;0;NA;0;NA;NA;NA;0;NA;NA;0;0;NA;NA;NA;0;NA;NA;NA;NA;2;46;0;NA;NA;46
480589;31-03-2018;Shane Duffy (Brighton and Hove Albion) wins a free kick in the defensive half.;46';Brighton & Hove Albion;Leicester City;0;0;0;0;0;0;0;NA;NA;NA;NA;NA;NA;NA;0;NA;NA;0;NA;0;0;NA;NA;NA;0;NA;NA;NA;0;NA;NA;0;NA;1;Shane Duffy;Brighton and Hove Albion;defensive half;0;NA;NA;0;0;NA;NA;NA;0;NA;NA;NA;NA;2;47;0;NA;NA;46
480589;31-03-2018;Attempt saved. Pascal Groß (Brighton and Hove Albion) right footed shot from outside the box is saved in the top centre of the goal.;47';Brighton & Hove Albion;Leicester City;0;0;0;0;0;1;0;saved;Pascal Groß;Brighton and Hove Albion;right;outside the box;the top centre of the goal;NA;0;NA;NA;0;NA;0;0;NA;NA;NA;0;NA;NA;NA;0;NA;NA;0;NA;0;NA;NA;NA;0;NA;NA;0;0;NA;NA;NA;0;NA;NA;NA;NA;2;48;0;NA;NA;47
480589;31-03-2018;Corner,  Brighton and Hove Albion. Conceded by Kasper Schmeichel.;47';Brighton & Hove Albion;Leicester City;0;0;0;0;0;0;0;NA;NA;NA;NA;NA;NA;NA;0;NA;NA;0;NA;0;0;NA;NA;NA;0;NA;NA;NA;0;NA;NA;0;NA;0;NA;NA;NA;1;Brighton and Hove Albion;Kasper Schmeichel;0;0;NA;NA;NA;0;NA;NA;NA;NA;2;49;0;NA;NA;47
480589;31-03-2018;Foul by Pascal Groß (Brighton and Hove Albion).;48';Brighton & Hove Albion;Leicester City;0;0;0;0;0;0;0;NA;NA;NA;NA;NA;NA;NA;1;Pascal Groß;Brighton and Hove Albion;0;NA;0;0;NA;NA;NA;0;NA;NA;NA;0;NA;NA;0;NA;0;NA;NA;NA;0;NA;NA;0;0;NA;NA;NA;0;NA;NA;NA;NA;2;50;0;NA;NA;48
480589;31-03-2018;Wes Morgan (Leicester City) wins a free kick on the right wing.;48';Brighton & Hove Albion;Leicester City;0;0;0;0;0;0;0;NA;NA;NA;NA;NA;NA;NA;0;NA;NA;0;NA;0;0;NA;NA;NA;0;NA;NA;NA;0;NA;NA;0;NA;1;Wes Morgan;Leicester City;NA;0;NA;NA;0;0;NA;NA;NA;0;NA;NA;NA;NA;2;51;0;NA;NA;48
480589;31-03-2018;Attempt blocked. Ezequiel Schelotto (Brighton and Hove Albion) left footed shot from outside the box is blocked. Assisted by José Izquierdo.;49';Brighton & Hove Albion;Leicester City;0;0;0;0;0;1;0;blocked;Ezequiel Schelotto;Brighton and Hove Albion;left;outside the box;NA;José Izquierdo;0;NA;NA;0;NA;0;0;NA;NA;NA;0;NA;NA;NA;0;NA;NA;0;NA;0;NA;NA;NA;0;NA;NA;0;0;NA;NA;NA;0;NA;NA;NA;NA;2;52;0;NA;NA;49
480589;31-03-2018;Attempt missed. Gaëtan Bong (Brighton and Hove Albion) left footed shot from outside the box is high and wide to the right.;49';Brighton & Hove Albion;Leicester City;0;0;0;0;0;1;0;missed;Gaëtan Bong;Brighton and Hove Albion;left;outside the box;high and wide to the right;NA;0;NA;NA;0;NA;0;0;NA;NA;NA;0;NA;NA;NA;0;NA;NA;0;NA;0;NA;NA;NA;0;NA;NA;0;0;NA;NA;NA;0;NA;NA;NA;NA;2;53;0;NA;NA;49
480589;31-03-2018;Offside, Brighton and Hove Albion. Gaëtan Bong tries a through ball, but Glenn Murray is caught offside.;53';Brighton & Hove Albion;Leicester City;0;0;0;0;0;0;0;NA;NA;NA;NA;NA;NA;NA;0;NA;NA;0;NA;0;1;Brighton and Hove Albion;Glenn Murray;Gaëtan Bong;0;NA;NA;NA;0;NA;NA;0;NA;0;NA;NA;NA;0;NA;NA;0;0;NA;NA;NA;0;NA;NA;NA;NA;2;54;0;NA;NA;53
480589;31-03-2018;Attempt blocked. José Izquierdo (Brighton and Hove Albion) right footed shot from the centre of the box is blocked. Assisted by Gaëtan Bong.;54';Brighton & Hove Albion;Leicester City;0;0;0;0;0;1;0;blocked;José Izquierdo;Brighton and Hove Albion;right;the centre of the box;NA;Gaëtan Bong;0;NA;NA;0;NA;0;0;NA;NA;NA;0;NA;NA;NA;0;NA;NA;0;NA;0;NA;NA;NA;0;NA;NA;0;0;NA;NA;NA;0;NA;NA;NA;NA;2;55;0;NA;NA;54
480589;31-03-2018;Corner,  Brighton and Hove Albion. Conceded by Harry Maguire.;55';Brighton & Hove Albion;Leicester City;0;0;0;0;0;0;0;NA;NA;NA;NA;NA;NA;NA;0;NA;NA;0;NA;0;0;NA;NA;NA;0;NA;NA;NA;0;NA;NA;0;NA;0;NA;NA;NA;1;Brighton and Hove Albion;Harry Maguire;0;0;NA;NA;NA;0;NA;NA;NA;NA;2;56;0;NA;NA;55
480589;31-03-2018;Attempt missed. Beram Kayal (Brighton and Hove Albion) right footed shot from outside the box misses to the left. Assisted by Lewis Dunk following a corner.;55';Brighton & Hove Albion;Leicester City;0;0;0;0;0;1;0;missed;Beram Kayal;Brighton and Hove Albion;right;outside the box;left;Lewis Dunk;0;NA;NA;0;NA;1;0;NA;NA;NA;0;NA;NA;NA;0;NA;NA;0;NA;0;NA;NA;NA;0;NA;NA;0;0;NA;NA;NA;0;NA;NA;NA;NA;2;57;0;NA;NA;55
480589;31-03-2018;Substitution, Leicester City. Fousseni Diabaté replaces Shinji Okazaki.;56';Brighton & Hove Albion;Leicester City;0;0;0;0;0;0;0;NA;NA;NA;NA;NA;NA;NA;0;NA;NA;0;NA;0;0;NA;NA;NA;0;NA;NA;NA;0;NA;NA;0;NA;0;NA;NA;NA;0;NA;NA;1;0;Leicester City;Fousseni Diabaté;Shinji Okazaki;0;NA;NA;NA;NA;2;58;0;NA;NA;56
480589;31-03-2018;Offside, Brighton and Hove Albion. Beram Kayal tries a through ball, but José Izquierdo is caught offside.;60';Brighton & Hove Albion;Leicester City;0;0;0;0;0;0;0;NA;NA;NA;NA;NA;NA;NA;0;NA;NA;0;NA;0;1;Brighton and Hove Albion;José Izquierdo;Beram Kayal;0;NA;NA;NA;0;NA;NA;0;NA;0;NA;NA;NA;0;NA;NA;0;0;NA;NA;NA;0;NA;NA;NA;NA;2;59;0;NA;NA;60
480589;31-03-2018;Foul by Vicente Iborra (Leicester City).;61';Brighton & Hove Albion;Leicester City;0;0;0;0;0;0;0;NA;NA;NA;NA;NA;NA;NA;1;Vicente Iborra;Leicester City;0;NA;0;0;NA;NA;NA;0;NA;NA;NA;0;NA;NA;0;NA;0;NA;NA;NA;0;NA;NA;0;0;NA;NA;NA;0;NA;NA;NA;NA;2;60;0;NA;NA;61
480589;31-03-2018;Pascal Groß (Brighton and Hove Albion) wins a free kick in the defensive half.;61';Brighton & Hove Albion;Leicester City;0;0;0;0;0;0;0;NA;NA;NA;NA;NA;NA;NA;0;NA;NA;0;NA;0;0;NA;NA;NA;0;NA;NA;NA;0;NA;NA;0;NA;1;Pascal Groß;Brighton and Hove Albion;defensive half;0;NA;NA;0;0;NA;NA;NA;0;NA;NA;NA;NA;2;61;0;NA;NA;61
480589;31-03-2018;Ezequiel Schelotto (Brighton and Hove Albion) wins a free kick in the defensive half.;63';Brighton & Hove Albion;Leicester City;0;0;0;0;0;0;0;NA;NA;NA;NA;NA;NA;NA;0;NA;NA;0;NA;0;0;NA;NA;NA;0;NA;NA;NA;0;NA;NA;0;NA;1;Ezequiel Schelotto;Brighton and Hove Albion;defensive half;0;NA;NA;0;0;NA;NA;NA;0;NA;NA;NA;NA;2;62;0;NA;NA;63
480589;31-03-2018;Foul by Ben Chilwell (Leicester City).;63';Brighton & Hove Albion;Leicester City;0;0;0;0;0;0;0;NA;NA;NA;NA;NA;NA;NA;1;Ben Chilwell;Leicester City;0;NA;0;0;NA;NA;NA;0;NA;NA;NA;0;NA;NA;0;NA;0;NA;NA;NA;0;NA;NA;0;0;NA;NA;NA;0;NA;NA;NA;NA;2;63;0;NA;NA;63
480589;31-03-2018;Ben Chilwell (Leicester City) is shown the yellow card for a bad foul.;63';Brighton & Hove Albion;Leicester City;0;0;0;0;0;0;0;NA;NA;NA;NA;NA;NA;NA;0;NA;NA;0;NA;0;0;NA;NA;NA;1;yellow;Ben Chilwell;Leicester City;0;NA;NA;0;NA;0;NA;NA;NA;0;NA;NA;0;0;NA;NA;NA;0;NA;NA;NA;NA;2;64;0;NA;NA;63
480589;31-03-2018;Foul by Danny Simpson (Leicester City).;63';Brighton & Hove Albion;Leicester City;0;0;0;0;0;0;0;NA;NA;NA;NA;NA;NA;NA;1;Danny Simpson;Leicester City;0;NA;0;0;NA;NA;NA;0;NA;NA;NA;0;NA;NA;0;NA;0;NA;NA;NA;0;NA;NA;0;0;NA;NA;NA;0;NA;NA;NA;NA;2;65;0;NA;NA;63
480589;31-03-2018;José Izquierdo (Brighton and Hove Albion) wins a free kick on the left wing.;63';Brighton & Hove Albion;Leicester City;0;0;0;0;0;0;0;NA;NA;NA;NA;NA;NA;NA;0;NA;NA;0;NA;0;0;NA;NA;NA;0;NA;NA;NA;0;NA;NA;0;NA;1;José Izquierdo;Brighton and Hove Albion;NA;0;NA;NA;0;0;NA;NA;NA;0;NA;NA;NA;NA;2;66;0;NA;NA;63
480589;31-03-2018;Danny Simpson (Leicester City) is shown the yellow card for a bad foul.;64';Brighton & Hove Albion;Leicester City;0;0;0;0;0;0;0;NA;NA;NA;NA;NA;NA;NA;0;NA;NA;0;NA;0;0;NA;NA;NA;1;yellow;Danny Simpson;Leicester City;0;NA;NA;0;NA;0;NA;NA;NA;0;NA;NA;0;0;NA;NA;NA;0;NA;NA;NA;NA;2;67;0;NA;NA;64
480589;31-03-2018;Foul by Beram Kayal (Brighton and Hove Albion).;65';Brighton & Hove Albion;Leicester City;0;0;0;0;0;0;0;NA;NA;NA;NA;NA;NA;NA;1;Beram Kayal;Brighton and Hove Albion;0;NA;0;0;NA;NA;NA;0;NA;NA;NA;0;NA;NA;0;NA;0;NA;NA;NA;0;NA;NA;0;0;NA;NA;NA;0;NA;NA;NA;NA;2;68;0;NA;NA;65
480589;31-03-2018;Fousseni Diabaté (Leicester City) wins a free kick in the attacking half.;65';Brighton & Hove Albion;Leicester City;0;0;0;0;0;0;0;NA;NA;NA;NA;NA;NA;NA;0;NA;NA;0;NA;0;0;NA;NA;NA;0;NA;NA;NA;0;NA;NA;0;NA;1;Fousseni Diabaté;Leicester City;attacking half;0;NA;NA;0;0;NA;NA;NA;0;NA;NA;NA;NA;2;69;0;NA;NA;65
480589;31-03-2018;Beram Kayal (Brighton and Hove Albion) is shown the yellow card for a bad foul.;66';Brighton & Hove Albion;Leicester City;0;0;0;0;0;0;0;NA;NA;NA;NA;NA;NA;NA;0;NA;NA;0;NA;0;0;NA;NA;NA;1;yellow;Beram Kayal;Brighton and Hove Albion;0;NA;NA;0;NA;0;NA;NA;NA;0;NA;NA;0;0;NA;NA;NA;0;NA;NA;NA;NA;2;70;0;NA;NA;66
480589;31-03-2018;Ezequiel Schelotto (Brighton and Hove Albion) wins a free kick on the right wing.;68';Brighton & Hove Albion;Leicester City;0;0;0;0;0;0;0;NA;NA;NA;NA;NA;NA;NA;0;NA;NA;0;NA;0;0;NA;NA;NA;0;NA;NA;NA;0;NA;NA;0;NA;1;Ezequiel Schelotto;Brighton and Hove Albion;NA;0;NA;NA;0;0;NA;NA;NA;0;NA;NA;NA;NA;2;71;0;NA;NA;68
480589;31-03-2018;Foul by Harry Maguire (Leicester City).;68';Brighton & Hove Albion;Leicester City;0;0;0;0;0;0;0;NA;NA;NA;NA;NA;NA;NA;1;Harry Maguire;Leicester City;0;NA;0;0;NA;NA;NA;0;NA;NA;NA;0;NA;NA;0;NA;0;NA;NA;NA;0;NA;NA;0;0;NA;NA;NA;0;NA;NA;NA;NA;2;72;0;NA;NA;68
480589;31-03-2018;Harry Maguire (Leicester City) is shown the yellow card for a bad foul.;68';Brighton & Hove Albion;Leicester City;0;0;0;0;0;0;0;NA;NA;NA;NA;NA;NA;NA;0;NA;NA;0;NA;0;0;NA;NA;NA;1;yellow;Harry Maguire;Leicester City;0;NA;NA;0;NA;0;NA;NA;NA;0;NA;NA;0;0;NA;NA;NA;0;NA;NA;NA;NA;2;73;0;NA;NA;68
480589;31-03-2018;Attempt missed. Lewis Dunk (Brighton and Hove Albion) header from the centre of the box is too high. Assisted by Pascal Groß with a cross following a set piece situation.;69';Brighton & Hove Albion;Leicester City;0;0;0;0;0;1;0;missed;Lewis Dunk;Brighton and Hove Albion;header;the centre of the box;too high;Pascal Groß;0;NA;NA;1;cross;0;0;NA;NA;NA;0;NA;NA;NA;0;NA;NA;0;NA;0;NA;NA;NA;0;NA;NA;0;0;NA;NA;NA;0;NA;NA;NA;NA;2;74;0;NA;NA;69
480589;31-03-2018;Attempt missed. Jamie Vardy (Leicester City) left footed shot from the centre of the box misses to the right. Assisted by Ben Chilwell with a cross.;72';Brighton & Hove Albion;Leicester City;0;0;0;0;0;1;0;missed;Jamie Vardy;Leicester City;left;the centre of the box;right;Ben Chilwell;0;NA;NA;0;cross;0;0;NA;NA;NA;0;NA;NA;NA;0;NA;NA;0;NA;0;NA;NA;NA;0;NA;NA;0;0;NA;NA;NA;0;NA;NA;NA;NA;2;75;0;NA;NA;72
480589;31-03-2018;Substitution, Brighton and Hove Albion. Solly March replaces Jürgen Locadia.;75';Brighton & Hove Albion;Leicester City;0;0;0;0;0;0;0;NA;NA;NA;NA;NA;NA;NA;0;NA;NA;0;NA;0;0;NA;NA;NA;0;NA;NA;NA;0;NA;NA;0;NA;0;NA;NA;NA;0;NA;NA;1;0;Brighton and Hove Albion;Solly March;Jürgen Locadia;0;NA;NA;NA;NA;2;76;0;NA;NA;75
