480635;24-02-2018;Substitution, Liverpool. Alberto Moreno replaces Sadio Mané.;87';Liverpool;West Ham United;4;1;0;0;0;0;0;NA;NA;NA;NA;NA;NA;NA;0;NA;NA;0;NA;0;0;NA;NA;NA;0;NA;NA;NA;0;NA;NA;0;NA;0;NA;NA;NA;0;NA;NA;1;0;Liverpool;Alberto Moreno;Sadio Mané;0;NA;NA;NA;NA;2;81;0;NA;NA;87
480635;24-02-2018;Substitution, Liverpool. Dominic Solanke replaces Mohamed Salah.;87';Liverpool;West Ham United;4;1;0;0;0;0;0;NA;NA;NA;NA;NA;NA;NA;0;NA;NA;0;NA;0;0;NA;NA;NA;0;NA;NA;NA;0;NA;NA;0;NA;0;NA;NA;NA;0;NA;NA;1;0;Liverpool;Dominic Solanke;Mohamed Salah;0;NA;NA;NA;NA;2;82;0;NA;NA;87
480635;24-02-2018;Corner,  Liverpool. Conceded by James Collins.;88';Liverpool;West Ham United;4;1;0;0;0;0;0;NA;NA;NA;NA;NA;NA;NA;0;NA;NA;0;NA;0;0;NA;NA;NA;0;NA;NA;NA;0;NA;NA;0;NA;0;NA;NA;NA;1;Liverpool;James Collins;0;0;NA;NA;NA;0;NA;NA;NA;NA;2;83;0;NA;NA;88
480635;24-02-2018;Attempt saved. Alex Oxlade-Chamberlain (Liverpool) right footed shot from outside the box is saved in the centre of the goal. Assisted by Trent Alexander-Arnold.;90'+3';Liverpool;West Ham United;4;1;0;0;0;1;0;saved;Alex Oxlade-Chamberlain;Liverpool;right;outside the box;the centre of the goal;Trent Alexander-Arnold;0;NA;NA;0;NA;0;0;NA;NA;NA;0;NA;NA;NA;0;NA;NA;0;NA;0;NA;NA;NA;0;NA;NA;0;0;NA;NA;NA;0;NA;NA;NA;NA;2;84;1;NA;NA;93
480635;24-02-2018;Foul by Michail Antonio (West Ham United).;90'+3';Liverpool;West Ham United;4;1;0;0;0;0;0;NA;NA;NA;NA;NA;NA;NA;1;Michail Antonio;West Ham United;0;NA;0;0;NA;NA;NA;0;NA;NA;NA;0;NA;NA;0;NA;0;NA;NA;NA;0;NA;NA;0;0;NA;NA;NA;0;NA;NA;NA;NA;2;85;1;NA;NA;93
480635;24-02-2018;Virgil van Dijk (Liverpool) wins a free kick in the defensive half.;90'+3';Liverpool;West Ham United;4;1;0;0;0;0;0;NA;NA;NA;NA;NA;NA;NA;0;NA;NA;0;NA;0;0;NA;NA;NA;0;NA;NA;NA;0;NA;NA;0;NA;1;Virgil van Dijk;Liverpool;defensive half;0;NA;NA;0;0;NA;NA;NA;0;NA;NA;NA;NA;2;86;1;NA;NA;93
480635;24-02-2018;Offside, Liverpool. Dominic Solanke tries a through ball, but Andrew Robertson is caught offside.;90'+3';Liverpool;West Ham United;4;1;0;0;0;0;0;NA;NA;NA;NA;NA;NA;NA;0;NA;NA;0;NA;0;1;Liverpool;Andrew Robertson;Dominic Solanke;0;NA;NA;NA;0;NA;NA;0;NA;0;NA;NA;NA;0;NA;NA;0;0;NA;NA;NA;0;NA;NA;NA;NA;2;87;1;NA;NA;93
480635;24-02-2018;Second Half ends, Liverpool 4, West Ham United 1.;90'+4';Liverpool;West Ham United;4;1;1;0;0;0;0;NA;NA;NA;NA;NA;NA;NA;0;NA;NA;0;NA;0;0;NA;NA;NA;0;NA;NA;NA;0;NA;NA;0;NA;0;NA;NA;NA;0;NA;NA;0;0;NA;NA;NA;0;NA;NA;NA;NA;2;88;1;NA;NA;94
480635;24-02-2018;Match ends, Liverpool 4, West Ham United 1.;90'+4';Liverpool;West Ham United;4;1;0;1;0;0;0;NA;NA;NA;NA;NA;NA;NA;0;NA;NA;0;NA;0;0;NA;NA;NA;0;NA;NA;NA;0;NA;NA;0;NA;0;NA;NA;NA;0;NA;NA;0;0;NA;NA;NA;0;NA;NA;NA;NA;2;89;1;NA;NA;94
