480812;28-10-2017;First Half begins.;-;Watford;Stoke City;0;0;0;0;1;0;0;NA;NA;NA;NA;NA;NA;NA;0;NA;NA;0;NA;0;0;NA;NA;NA;0;NA;NA;NA;0;NA;NA;0;NA;0;NA;NA;NA;0;NA;NA;0;0;NA;NA;NA;0;NA;NA;NA;NA;1;1;0;NA;NA;NA
480812;28-10-2017;Lineups are announced and players are warming up.;-;Watford;Stoke City;0;0;0;0;0;0;0;NA;NA;NA;NA;NA;NA;NA;0;NA;NA;0;NA;0;0;NA;NA;NA;0;NA;NA;NA;0;NA;NA;0;NA;0;NA;NA;NA;0;NA;NA;0;0;NA;NA;NA;0;NA;NA;NA;NA;1;2;0;NA;NA;NA
480812;28-10-2017;Foul by Ramadan Sobhi (Stoke City).;4';Watford;Stoke City;0;0;0;0;0;0;0;NA;NA;NA;NA;NA;NA;NA;1;Ramadan Sobhi;Stoke City;0;NA;0;0;NA;NA;NA;0;NA;NA;NA;0;NA;NA;0;NA;0;NA;NA;NA;0;NA;NA;0;0;NA;NA;NA;0;NA;NA;NA;NA;1;3;0;NA;NA;4
480812;28-10-2017;Kiko Femenía (Watford) wins a free kick on the right wing.;4';Watford;Stoke City;0;0;0;0;0;0;0;NA;NA;NA;NA;NA;NA;NA;0;NA;NA;0;NA;0;0;NA;NA;NA;0;NA;NA;NA;0;NA;NA;0;NA;1;Kiko Femenía;Watford;NA;0;NA;NA;0;0;NA;NA;NA;0;NA;NA;NA;NA;1;4;0;NA;NA;4
480812;28-10-2017;Offside, Stoke City. Mame Biram Diouf tries a through ball, but Eric Maxim Choupo-Moting is caught offside.;5';Watford;Stoke City;0;0;0;0;0;0;0;NA;NA;NA;NA;NA;NA;NA;0;NA;NA;0;NA;0;1;Stoke City;NA;Mame Biram Diouf;0;NA;NA;NA;0;NA;NA;0;NA;0;NA;NA;NA;0;NA;NA;0;0;NA;NA;NA;0;NA;NA;NA;NA;1;5;0;NA;NA;5
480812;28-10-2017;Foul by André Carrillo (Watford).;8';Watford;Stoke City;0;0;0;0;0;0;0;NA;NA;NA;NA;NA;NA;NA;1;André Carrillo;Watford;0;NA;0;0;NA;NA;NA;0;NA;NA;NA;0;NA;NA;0;NA;0;NA;NA;NA;0;NA;NA;0;0;NA;NA;NA;0;NA;NA;NA;NA;1;6;0;NA;NA;8
480812;28-10-2017;Joe Allen (Stoke City) wins a free kick in the defensive half.;8';Watford;Stoke City;0;0;0;0;0;0;0;NA;NA;NA;NA;NA;NA;NA;0;NA;NA;0;NA;0;0;NA;NA;NA;0;NA;NA;NA;0;NA;NA;0;NA;1;Joe Allen;Stoke City;defensive half;0;NA;NA;0;0;NA;NA;NA;0;NA;NA;NA;NA;1;7;0;NA;NA;8
480812;28-10-2017;Foul by Richarlison (Watford).;10';Watford;Stoke City;0;0;0;0;0;0;0;NA;NA;NA;NA;NA;NA;NA;1;Richarlison;Watford;0;NA;0;0;NA;NA;NA;0;NA;NA;NA;0;NA;NA;0;NA;0;NA;NA;NA;0;NA;NA;0;0;NA;NA;NA;0;NA;NA;NA;NA;1;8;0;NA;NA;10
480812;28-10-2017;Mame Biram Diouf (Stoke City) wins a free kick in the defensive half.;10';Watford;Stoke City;0;0;0;0;0;0;0;NA;NA;NA;NA;NA;NA;NA;0;NA;NA;0;NA;0;0;NA;NA;NA;0;NA;NA;NA;0;NA;NA;0;NA;1;Mame Biram Diouf;Stoke City;defensive half;0;NA;NA;0;0;NA;NA;NA;0;NA;NA;NA;NA;1;9;0;NA;NA;10
480812;28-10-2017;Foul by Mame Biram Diouf (Stoke City).;13';Watford;Stoke City;0;0;0;0;0;0;0;NA;NA;NA;NA;NA;NA;NA;1;Mame Biram Diouf;Stoke City;0;NA;0;0;NA;NA;NA;0;NA;NA;NA;0;NA;NA;0;NA;0;NA;NA;NA;0;NA;NA;0;0;NA;NA;NA;0;NA;NA;NA;NA;1;10;0;NA;NA;13
480812;28-10-2017;Richarlison (Watford) wins a free kick in the defensive half.;13';Watford;Stoke City;0;0;0;0;0;0;0;NA;NA;NA;NA;NA;NA;NA;0;NA;NA;0;NA;0;0;NA;NA;NA;0;NA;NA;NA;0;NA;NA;0;NA;1;Richarlison;Watford;defensive half;0;NA;NA;0;0;NA;NA;NA;0;NA;NA;NA;NA;1;11;0;NA;NA;13
480812;28-10-2017;Foul by Troy Deeney (Watford).;14';Watford;Stoke City;0;0;0;0;0;0;0;NA;NA;NA;NA;NA;NA;NA;1;Troy Deeney;Watford;0;NA;0;0;NA;NA;NA;0;NA;NA;NA;0;NA;NA;0;NA;0;NA;NA;NA;0;NA;NA;0;0;NA;NA;NA;0;NA;NA;NA;NA;1;12;0;NA;NA;14
480812;28-10-2017;Ramadan Sobhi (Stoke City) wins a free kick on the left wing.;14';Watford;Stoke City;0;0;0;0;0;0;0;NA;NA;NA;NA;NA;NA;NA;0;NA;NA;0;NA;0;0;NA;NA;NA;0;NA;NA;NA;0;NA;NA;0;NA;1;Ramadan Sobhi;Stoke City;NA;0;NA;NA;0;0;NA;NA;NA;0;NA;NA;NA;NA;1;13;0;NA;NA;14
480812;28-10-2017;Corner,  Stoke City. Conceded by Etienne Capoue.;15';Watford;Stoke City;0;0;0;0;0;0;0;NA;NA;NA;NA;NA;NA;NA;0;NA;NA;0;NA;0;0;NA;NA;NA;0;NA;NA;NA;0;NA;NA;0;NA;0;NA;NA;NA;1;Stoke City;Etienne Capoue;0;0;NA;NA;NA;0;NA;NA;NA;NA;1;14;0;NA;NA;15
480812;28-10-2017;Goal!  Watford 0, Stoke City 1. Darren Fletcher (Stoke City) right footed shot from outside the box to the bottom right corner. Assisted by Xherdan Shaqiri following a corner.;16';Watford;Stoke City;0;1;0;0;0;1;0;goal;Darren Fletcher;Stoke City;right;outside the box;bottom right corner;Xherdan Shaqiri;0;NA;NA;0;NA;1;0;NA;NA;NA;0;NA;NA;NA;0;NA;NA;0;NA;0;NA;NA;NA;0;NA;NA;0;0;NA;NA;NA;0;NA;NA;NA;NA;1;15;0;NA;NA;16
480812;28-10-2017;Corner,  Watford. Conceded by Erik Pieters.;17';Watford;Stoke City;0;1;0;0;0;0;0;NA;NA;NA;NA;NA;NA;NA;0;NA;NA;0;NA;0;0;NA;NA;NA;0;NA;NA;NA;0;NA;NA;0;NA;0;NA;NA;NA;1;Watford;Erik Pieters;0;0;NA;NA;NA;0;NA;NA;NA;NA;1;16;0;NA;NA;17
480812;28-10-2017;Offside, Watford. José Holebas tries a through ball, but Troy Deeney is caught offside.;25';Watford;Stoke City;0;1;0;0;0;0;0;NA;NA;NA;NA;NA;NA;NA;0;NA;NA;0;NA;0;1;Watford;Troy Deeney;José Holebas;0;NA;NA;NA;0;NA;NA;0;NA;0;NA;NA;NA;0;NA;NA;0;0;NA;NA;NA;0;NA;NA;NA;NA;1;17;0;NA;NA;25
480812;28-10-2017;Delay in match José Holebas (Watford) because of an injury.;29';Watford;Stoke City;0;1;0;0;0;0;0;NA;NA;NA;NA;NA;NA;NA;0;NA;NA;0;NA;0;0;NA;NA;NA;0;NA;NA;NA;0;NA;NA;1;Watford;0;NA;NA;NA;0;NA;NA;0;0;NA;NA;NA;0;NA;NA;NA;NA;1;18;0;NA;NA;29
480812;28-10-2017;Delay in match Mame Biram Diouf (Stoke City) because of an injury.;29';Watford;Stoke City;0;1;0;0;0;0;0;NA;NA;NA;NA;NA;NA;NA;0;NA;NA;0;NA;0;0;NA;NA;NA;0;NA;NA;NA;0;NA;NA;1;Stoke City;0;NA;NA;NA;0;NA;NA;0;0;NA;NA;NA;0;NA;NA;NA;NA;1;19;0;NA;NA;29
480812;28-10-2017;Delay over. They are ready to continue.;31';Watford;Stoke City;0;1;0;0;0;0;0;NA;NA;NA;NA;NA;NA;NA;0;NA;NA;0;NA;0;0;NA;NA;NA;0;NA;NA;NA;0;NA;NA;0;NA;0;NA;NA;NA;0;NA;NA;0;0;NA;NA;NA;0;NA;NA;NA;NA;1;20;0;NA;NA;31
480812;28-10-2017;Corner,  Watford. Conceded by Kurt Zouma.;32';Watford;Stoke City;0;1;0;0;0;0;0;NA;NA;NA;NA;NA;NA;NA;0;NA;NA;0;NA;0;0;NA;NA;NA;0;NA;NA;NA;0;NA;NA;0;NA;0;NA;NA;NA;1;Watford;Kurt Zouma;0;0;NA;NA;NA;0;NA;NA;NA;NA;1;21;0;NA;NA;32
480812;28-10-2017;Foul by Mame Biram Diouf (Stoke City).;33';Watford;Stoke City;0;1;0;0;0;0;0;NA;NA;NA;NA;NA;NA;NA;1;Mame Biram Diouf;Stoke City;0;NA;0;0;NA;NA;NA;0;NA;NA;NA;0;NA;NA;0;NA;0;NA;NA;NA;0;NA;NA;0;0;NA;NA;NA;0;NA;NA;NA;NA;1;22;0;NA;NA;33
480812;28-10-2017;José Holebas (Watford) wins a free kick in the defensive half.;33';Watford;Stoke City;0;1;0;0;0;0;0;NA;NA;NA;NA;NA;NA;NA;0;NA;NA;0;NA;0;0;NA;NA;NA;0;NA;NA;NA;0;NA;NA;0;NA;1;José Holebas;Watford;defensive half;0;NA;NA;0;0;NA;NA;NA;0;NA;NA;NA;NA;1;23;0;NA;NA;33
480812;28-10-2017;Abdoulaye Doucouré (Watford) wins a free kick in the defensive half.;35';Watford;Stoke City;0;1;0;0;0;0;0;NA;NA;NA;NA;NA;NA;NA;0;NA;NA;0;NA;0;0;NA;NA;NA;0;NA;NA;NA;0;NA;NA;0;NA;1;Abdoulaye Doucouré;Watford;defensive half;0;NA;NA;0;0;NA;NA;NA;0;NA;NA;NA;NA;1;24;0;NA;NA;35
480812;28-10-2017;Foul by Eric Maxim Choupo-Moting (Stoke City).;35';Watford;Stoke City;0;1;0;0;0;0;0;NA;NA;NA;NA;NA;NA;NA;1;Maxim Choupo-Moting;Stoke City;0;NA;0;0;NA;NA;NA;0;NA;NA;NA;0;NA;NA;0;NA;0;NA;NA;NA;0;NA;NA;0;0;NA;NA;NA;0;NA;NA;NA;NA;1;25;0;NA;NA;35
480812;28-10-2017;Corner,  Watford. Conceded by Kurt Zouma.;37';Watford;Stoke City;0;1;0;0;0;0;0;NA;NA;NA;NA;NA;NA;NA;0;NA;NA;0;NA;0;0;NA;NA;NA;0;NA;NA;NA;0;NA;NA;0;NA;0;NA;NA;NA;1;Watford;Kurt Zouma;0;0;NA;NA;NA;0;NA;NA;NA;NA;1;26;0;NA;NA;37
480812;28-10-2017;Attempt missed. Miguel Britos (Watford) header from the centre of the box misses to the right. Assisted by José Holebas with a cross following a corner.;37';Watford;Stoke City;0;1;0;0;0;1;0;missed;Miguel Britos;Watford;header;the centre of the box;right;José Holebas;0;NA;NA;0;cross;1;0;NA;NA;NA;0;NA;NA;NA;0;NA;NA;0;NA;0;NA;NA;NA;0;NA;NA;0;0;NA;NA;NA;0;NA;NA;NA;NA;1;27;0;NA;NA;37
480812;28-10-2017;Offside, Watford. Miguel Britos tries a through ball, but Etienne Capoue is caught offside.;37';Watford;Stoke City;0;1;0;0;0;0;0;NA;NA;NA;NA;NA;NA;NA;0;NA;NA;0;NA;0;1;Watford;Etienne Capoue;Miguel Britos;0;NA;NA;NA;0;NA;NA;0;NA;0;NA;NA;NA;0;NA;NA;0;0;NA;NA;NA;0;NA;NA;NA;NA;1;28;0;NA;NA;37
480812;28-10-2017;Attempt blocked. Eric Maxim Choupo-Moting (Stoke City) right footed shot from the centre of the box is blocked. Assisted by Mame Biram Diouf with a cross.;39';Watford;Stoke City;0;1;0;0;0;1;0;blocked;NA;Stoke City;right;the centre of the box;NA;Mame Biram Diouf;0;NA;NA;0;cross;0;0;NA;NA;NA;0;NA;NA;NA;0;NA;NA;0;NA;0;NA;NA;NA;0;NA;NA;0;0;NA;NA;NA;0;NA;NA;NA;NA;1;29;0;NA;NA;39
480812;28-10-2017;Offside, Watford. Tom Cleverley tries a through ball, but Troy Deeney is caught offside.;39';Watford;Stoke City;0;1;0;0;0;0;0;NA;NA;NA;NA;NA;NA;NA;0;NA;NA;0;NA;0;1;Watford;Troy Deeney;Tom Cleverley;0;NA;NA;NA;0;NA;NA;0;NA;0;NA;NA;NA;0;NA;NA;0;0;NA;NA;NA;0;NA;NA;NA;NA;1;30;0;NA;NA;39
480812;28-10-2017;Foul by Etienne Capoue (Watford).;43';Watford;Stoke City;0;1;0;0;0;0;0;NA;NA;NA;NA;NA;NA;NA;1;Etienne Capoue;Watford;0;NA;0;0;NA;NA;NA;0;NA;NA;NA;0;NA;NA;0;NA;0;NA;NA;NA;0;NA;NA;0;0;NA;NA;NA;0;NA;NA;NA;NA;1;31;0;NA;NA;43
480812;28-10-2017;Xherdan Shaqiri (Stoke City) wins a free kick on the right wing.;43';Watford;Stoke City;0;1;0;0;0;0;0;NA;NA;NA;NA;NA;NA;NA;0;NA;NA;0;NA;0;0;NA;NA;NA;0;NA;NA;NA;0;NA;NA;0;NA;1;Xherdan Shaqiri;Stoke City;NA;0;NA;NA;0;0;NA;NA;NA;0;NA;NA;NA;NA;1;32;0;NA;NA;43
480812;28-10-2017;Abdoulaye Doucouré (Watford) wins a free kick in the attacking half.;45'+1';Watford;Stoke City;0;1;0;0;0;0;0;NA;NA;NA;NA;NA;NA;NA;0;NA;NA;0;NA;0;0;NA;NA;NA;0;NA;NA;NA;0;NA;NA;0;NA;1;Abdoulaye Doucouré;Watford;attacking half;0;NA;NA;0;0;NA;NA;NA;0;NA;NA;NA;NA;1;33;1;NA;NA;46
480812;28-10-2017;Foul by Eric Maxim Choupo-Moting (Stoke City).;45'+1';Watford;Stoke City;0;1;0;0;0;0;0;NA;NA;NA;NA;NA;NA;NA;1;Maxim Choupo-Moting;Stoke City;0;NA;0;0;NA;NA;NA;0;NA;NA;NA;0;NA;NA;0;NA;0;NA;NA;NA;0;NA;NA;0;0;NA;NA;NA;0;NA;NA;NA;NA;1;34;1;NA;NA;46
480812;28-10-2017;Foul by Troy Deeney (Watford).;45'+1';Watford;Stoke City;0;1;0;0;0;0;0;NA;NA;NA;NA;NA;NA;NA;1;Troy Deeney;Watford;0;NA;0;0;NA;NA;NA;0;NA;NA;NA;0;NA;NA;0;NA;0;NA;NA;NA;0;NA;NA;0;0;NA;NA;NA;0;NA;NA;NA;NA;1;35;1;NA;NA;46
480812;28-10-2017;Ryan Shawcross (Stoke City) wins a free kick in the defensive half.;45'+1';Watford;Stoke City;0;1;0;0;0;0;0;NA;NA;NA;NA;NA;NA;NA;0;NA;NA;0;NA;0;0;NA;NA;NA;0;NA;NA;NA;0;NA;NA;0;NA;1;Ryan Shawcross;Stoke City;defensive half;0;NA;NA;0;0;NA;NA;NA;0;NA;NA;NA;NA;1;36;1;NA;NA;46
480812;28-10-2017;First Half ends, Watford 0, Stoke City 1.;45'+3';Watford;Stoke City;0;1;1;0;0;0;0;NA;NA;NA;NA;NA;NA;NA;0;NA;NA;0;NA;0;0;NA;NA;NA;0;NA;NA;NA;0;NA;NA;0;NA;0;NA;NA;NA;0;NA;NA;0;0;NA;NA;NA;0;NA;NA;NA;NA;1;37;1;NA;NA;48
480812;28-10-2017;Second Half begins Watford 0, Stoke City 1.;45';Watford;Stoke City;0;1;0;0;1;0;0;NA;NA;NA;NA;NA;NA;NA;0;NA;NA;0;NA;0;0;NA;NA;NA;0;NA;NA;NA;0;NA;NA;0;NA;0;NA;NA;NA;0;NA;NA;0;0;NA;NA;NA;0;NA;NA;NA;NA;2;38;0;NA;NA;45
480812;28-10-2017;Foul by Eric Maxim Choupo-Moting (Stoke City).;46';Watford;Stoke City;0;1;0;0;0;0;0;NA;NA;NA;NA;NA;NA;NA;1;Maxim Choupo-Moting;Stoke City;0;NA;0;0;NA;NA;NA;0;NA;NA;NA;0;NA;NA;0;NA;0;NA;NA;NA;0;NA;NA;0;0;NA;NA;NA;0;NA;NA;NA;NA;2;39;0;NA;NA;46
480812;28-10-2017;José Holebas (Watford) wins a free kick on the left wing.;46';Watford;Stoke City;0;1;0;0;0;0;0;NA;NA;NA;NA;NA;NA;NA;0;NA;NA;0;NA;0;0;NA;NA;NA;0;NA;NA;NA;0;NA;NA;0;NA;1;José Holebas;Watford;NA;0;NA;NA;0;0;NA;NA;NA;0;NA;NA;NA;NA;2;40;0;NA;NA;46
480812;28-10-2017;Attempt blocked. Troy Deeney (Watford) right footed shot from the right side of the six yard box is blocked. Assisted by Kiko Femenía.;48';Watford;Stoke City;0;1;0;0;0;1;0;blocked;Troy Deeney;Watford;right;the right side of the six yard box;NA;Kiko Femenía;0;NA;NA;0;NA;0;0;NA;NA;NA;0;NA;NA;NA;0;NA;NA;0;NA;0;NA;NA;NA;0;NA;NA;0;0;NA;NA;NA;0;NA;NA;NA;NA;2;41;0;NA;NA;48
480812;28-10-2017;Corner,  Watford. Conceded by Ryan Shawcross.;48';Watford;Stoke City;0;1;0;0;0;0;0;NA;NA;NA;NA;NA;NA;NA;0;NA;NA;0;NA;0;0;NA;NA;NA;0;NA;NA;NA;0;NA;NA;0;NA;0;NA;NA;NA;1;Watford;Ryan Shawcross;0;0;NA;NA;NA;0;NA;NA;NA;NA;2;42;0;NA;NA;48
480812;28-10-2017;Corner,  Watford. Conceded by Erik Pieters.;49';Watford;Stoke City;0;1;0;0;0;0;0;NA;NA;NA;NA;NA;NA;NA;0;NA;NA;0;NA;0;0;NA;NA;NA;0;NA;NA;NA;0;NA;NA;0;NA;0;NA;NA;NA;1;Watford;Erik Pieters;0;0;NA;NA;NA;0;NA;NA;NA;NA;2;43;0;NA;NA;49
480812;28-10-2017;Attempt missed. André Carrillo (Watford) header from the right side of the six yard box misses to the left. Assisted by José Holebas.;56';Watford;Stoke City;0;1;0;0;0;1;0;missed;André Carrillo;Watford;header;the right side of the six yard box;left;José Holebas;0;NA;NA;0;NA;0;0;NA;NA;NA;0;NA;NA;NA;0;NA;NA;0;NA;0;NA;NA;NA;0;NA;NA;0;0;NA;NA;NA;0;NA;NA;NA;NA;2;44;0;NA;NA;56
480812;28-10-2017;Attempt missed. Richarlison (Watford) left footed shot from a difficult angle on the left is close, but misses to the left. Assisted by André Carrillo.;56';Watford;Stoke City;0;1;0;0;0;1;0;missed;Richarlison;Watford;left;NA;NA;André Carrillo;0;NA;NA;0;NA;0;0;NA;NA;NA;0;NA;NA;NA;0;NA;NA;0;NA;0;NA;NA;NA;0;NA;NA;0;0;NA;NA;NA;0;NA;NA;NA;NA;2;45;0;NA;NA;56
480812;28-10-2017;Attempt blocked. André Carrillo (Watford) left footed shot from outside the box is blocked. Assisted by Etienne Capoue.;57';Watford;Stoke City;0;1;0;0;0;1;0;blocked;André Carrillo;Watford;left;outside the box;NA;Etienne Capoue;0;NA;NA;0;NA;0;0;NA;NA;NA;0;NA;NA;NA;0;NA;NA;0;NA;0;NA;NA;NA;0;NA;NA;0;0;NA;NA;NA;0;NA;NA;NA;NA;2;46;0;NA;NA;57
480812;28-10-2017;Kiko Femenía (Watford) is shown the yellow card for a bad foul.;57';Watford;Stoke City;0;1;0;0;0;0;0;NA;NA;NA;NA;NA;NA;NA;0;NA;NA;0;NA;0;0;NA;NA;NA;1;yellow;Kiko Femenía;Watford;0;NA;NA;0;NA;0;NA;NA;NA;0;NA;NA;0;0;NA;NA;NA;0;NA;NA;NA;NA;2;47;0;NA;NA;57
480812;28-10-2017;Substitution, Watford. Andre Gray replaces Etienne Capoue.;58';Watford;Stoke City;0;1;0;0;0;0;0;NA;NA;NA;NA;NA;NA;NA;0;NA;NA;0;NA;0;0;NA;NA;NA;0;NA;NA;NA;0;NA;NA;0;NA;0;NA;NA;NA;0;NA;NA;1;0;Watford;Andre Gray;Etienne Capoue;0;NA;NA;NA;NA;2;48;0;NA;NA;58
480812;28-10-2017;Attempt missed. Joe Allen (Stoke City) left footed shot from the centre of the box is close, but misses to the right. Assisted by Ramadan Sobhi.;61';Watford;Stoke City;0;1;0;0;0;1;0;missed;Joe Allen;Stoke City;left;the centre of the box;close, but right;Ramadan Sobhi;0;NA;NA;0;NA;0;0;NA;NA;NA;0;NA;NA;NA;0;NA;NA;0;NA;0;NA;NA;NA;0;NA;NA;0;0;NA;NA;NA;0;NA;NA;NA;NA;2;49;0;NA;NA;61
480812;28-10-2017;Foul by Eric Maxim Choupo-Moting (Stoke City).;62';Watford;Stoke City;0;1;0;0;0;0;0;NA;NA;NA;NA;NA;NA;NA;1;Maxim Choupo-Moting;Stoke City;0;NA;0;0;NA;NA;NA;0;NA;NA;NA;0;NA;NA;0;NA;0;NA;NA;NA;0;NA;NA;0;0;NA;NA;NA;0;NA;NA;NA;NA;2;50;0;NA;NA;62
480812;28-10-2017;Tom Cleverley (Watford) wins a free kick in the attacking half.;62';Watford;Stoke City;0;1;0;0;0;0;0;NA;NA;NA;NA;NA;NA;NA;0;NA;NA;0;NA;0;0;NA;NA;NA;0;NA;NA;NA;0;NA;NA;0;NA;1;Tom Cleverley;Watford;attacking half;0;NA;NA;0;0;NA;NA;NA;0;NA;NA;NA;NA;2;51;0;NA;NA;62
480812;28-10-2017;Eric Maxim Choupo-Moting (Stoke City) is shown the yellow card.;62';Watford;Stoke City;0;1;0;0;0;0;0;NA;NA;NA;NA;NA;NA;NA;0;NA;NA;0;NA;0;0;NA;NA;NA;1;yellow;NA;Stoke City;0;NA;NA;0;NA;0;NA;NA;NA;0;NA;NA;0;0;NA;NA;NA;0;NA;NA;NA;NA;2;52;0;NA;NA;62
480812;28-10-2017;Foul by Ramadan Sobhi (Stoke City).;65';Watford;Stoke City;0;1;0;0;0;0;0;NA;NA;NA;NA;NA;NA;NA;1;Ramadan Sobhi;Stoke City;0;NA;0;0;NA;NA;NA;0;NA;NA;NA;0;NA;NA;0;NA;0;NA;NA;NA;0;NA;NA;0;0;NA;NA;NA;0;NA;NA;NA;NA;2;53;0;NA;NA;65
480812;28-10-2017;Miguel Britos (Watford) wins a free kick in the defensive half.;65';Watford;Stoke City;0;1;0;0;0;0;0;NA;NA;NA;NA;NA;NA;NA;0;NA;NA;0;NA;0;0;NA;NA;NA;0;NA;NA;NA;0;NA;NA;0;NA;1;Miguel Britos;Watford;defensive half;0;NA;NA;0;0;NA;NA;NA;0;NA;NA;NA;NA;2;54;0;NA;NA;65
480812;28-10-2017;Foul by Mame Biram Diouf (Stoke City).;65';Watford;Stoke City;0;1;0;0;0;0;0;NA;NA;NA;NA;NA;NA;NA;1;Mame Biram Diouf;Stoke City;0;NA;0;0;NA;NA;NA;0;NA;NA;NA;0;NA;NA;0;NA;0;NA;NA;NA;0;NA;NA;0;0;NA;NA;NA;0;NA;NA;NA;NA;2;55;0;NA;NA;65
480812;28-10-2017;José Holebas (Watford) wins a free kick on the left wing.;65';Watford;Stoke City;0;1;0;0;0;0;0;NA;NA;NA;NA;NA;NA;NA;0;NA;NA;0;NA;0;0;NA;NA;NA;0;NA;NA;NA;0;NA;NA;0;NA;1;José Holebas;Watford;NA;0;NA;NA;0;0;NA;NA;NA;0;NA;NA;NA;NA;2;56;0;NA;NA;65
480812;28-10-2017;Attempt missed. Richarlison (Watford) header from the centre of the box is close, but misses to the left. Assisted by Miguel Britos following a set piece situation.;66';Watford;Stoke City;0;1;0;0;0;1;0;missed;Richarlison;Watford;header;the centre of the box;close, but left;Miguel Britos;0;NA;NA;1;NA;0;0;NA;NA;NA;0;NA;NA;NA;0;NA;NA;0;NA;0;NA;NA;NA;0;NA;NA;0;0;NA;NA;NA;0;NA;NA;NA;NA;2;57;0;NA;NA;66
480812;28-10-2017;Attempt missed. Andre Gray (Watford) right footed shot from the centre of the box misses to the right.;67';Watford;Stoke City;0;1;0;0;0;1;0;missed;Andre Gray;Watford;right;the centre of the box;right;NA;0;NA;NA;0;NA;0;0;NA;NA;NA;0;NA;NA;NA;0;NA;NA;0;NA;0;NA;NA;NA;0;NA;NA;0;0;NA;NA;NA;0;NA;NA;NA;NA;2;58;0;NA;NA;67
480812;28-10-2017;Foul by José Holebas (Watford).;68';Watford;Stoke City;0;1;0;0;0;0;0;NA;NA;NA;NA;NA;NA;NA;1;José Holebas;Watford;0;NA;0;0;NA;NA;NA;0;NA;NA;NA;0;NA;NA;0;NA;0;NA;NA;NA;0;NA;NA;0;0;NA;NA;NA;0;NA;NA;NA;NA;2;59;0;NA;NA;68
480812;28-10-2017;Mame Biram Diouf (Stoke City) wins a free kick in the defensive half.;68';Watford;Stoke City;0;1;0;0;0;0;0;NA;NA;NA;NA;NA;NA;NA;0;NA;NA;0;NA;0;0;NA;NA;NA;0;NA;NA;NA;0;NA;NA;0;NA;1;Mame Biram Diouf;Stoke City;defensive half;0;NA;NA;0;0;NA;NA;NA;0;NA;NA;NA;NA;2;60;0;NA;NA;68
480812;28-10-2017;Foul by Andre Gray (Watford).;69';Watford;Stoke City;0;1;0;0;0;0;0;NA;NA;NA;NA;NA;NA;NA;1;Andre Gray;Watford;0;NA;0;0;NA;NA;NA;0;NA;NA;NA;0;NA;NA;0;NA;0;NA;NA;NA;0;NA;NA;0;0;NA;NA;NA;0;NA;NA;NA;NA;2;61;0;NA;NA;69
480812;28-10-2017;Ryan Shawcross (Stoke City) wins a free kick in the defensive half.;69';Watford;Stoke City;0;1;0;0;0;0;0;NA;NA;NA;NA;NA;NA;NA;0;NA;NA;0;NA;0;0;NA;NA;NA;0;NA;NA;NA;0;NA;NA;0;NA;1;Ryan Shawcross;Stoke City;defensive half;0;NA;NA;0;0;NA;NA;NA;0;NA;NA;NA;NA;2;62;0;NA;NA;69
480812;28-10-2017;Attempt blocked. Richarlison (Watford) right footed shot from the left side of the box is blocked. Assisted by José Holebas.;71';Watford;Stoke City;0;1;0;0;0;1;0;blocked;Richarlison;Watford;right;the left side of the box;NA;José Holebas;0;NA;NA;0;NA;0;0;NA;NA;NA;0;NA;NA;NA;0;NA;NA;0;NA;0;NA;NA;NA;0;NA;NA;0;0;NA;NA;NA;0;NA;NA;NA;NA;2;63;0;NA;NA;71
480812;28-10-2017;Attempt blocked. André Carrillo (Watford) right footed shot from outside the box is blocked. Assisted by Tom Cleverley.;73';Watford;Stoke City;0;1;0;0;0;1;0;blocked;André Carrillo;Watford;right;outside the box;NA;Tom Cleverley;0;NA;NA;0;NA;0;0;NA;NA;NA;0;NA;NA;NA;0;NA;NA;0;NA;0;NA;NA;NA;0;NA;NA;0;0;NA;NA;NA;0;NA;NA;NA;NA;2;64;0;NA;NA;73
480812;28-10-2017;Foul by Richarlison (Watford).;76';Watford;Stoke City;0;1;0;0;0;0;0;NA;NA;NA;NA;NA;NA;NA;1;Richarlison;Watford;0;NA;0;0;NA;NA;NA;0;NA;NA;NA;0;NA;NA;0;NA;0;NA;NA;NA;0;NA;NA;0;0;NA;NA;NA;0;NA;NA;NA;NA;2;65;0;NA;NA;76
480812;28-10-2017;Mame Biram Diouf (Stoke City) wins a free kick in the defensive half.;76';Watford;Stoke City;0;1;0;0;0;0;0;NA;NA;NA;NA;NA;NA;NA;0;NA;NA;0;NA;0;0;NA;NA;NA;0;NA;NA;NA;0;NA;NA;0;NA;1;Mame Biram Diouf;Stoke City;defensive half;0;NA;NA;0;0;NA;NA;NA;0;NA;NA;NA;NA;2;66;0;NA;NA;76
480812;28-10-2017;Richarlison (Watford) is shown the yellow card for a bad foul.;76';Watford;Stoke City;0;1;0;0;0;0;0;NA;NA;NA;NA;NA;NA;NA;0;NA;NA;0;NA;0;0;NA;NA;NA;1;yellow;Richarlison;Watford;0;NA;NA;0;NA;0;NA;NA;NA;0;NA;NA;0;0;NA;NA;NA;0;NA;NA;NA;NA;2;67;0;NA;NA;76
480812;28-10-2017;Erik Pieters (Stoke City) wins a free kick in the attacking half.;77';Watford;Stoke City;0;1;0;0;0;0;0;NA;NA;NA;NA;NA;NA;NA;0;NA;NA;0;NA;0;0;NA;NA;NA;0;NA;NA;NA;0;NA;NA;0;NA;1;Erik Pieters;Stoke City;attacking half;0;NA;NA;0;0;NA;NA;NA;0;NA;NA;NA;NA;2;68;0;NA;NA;77
480812;28-10-2017;Foul by André Carrillo (Watford).;77';Watford;Stoke City;0;1;0;0;0;0;0;NA;NA;NA;NA;NA;NA;NA;1;André Carrillo;Watford;0;NA;0;0;NA;NA;NA;0;NA;NA;NA;0;NA;NA;0;NA;0;NA;NA;NA;0;NA;NA;0;0;NA;NA;NA;0;NA;NA;NA;NA;2;69;0;NA;NA;77
480812;28-10-2017;Substitution, Stoke City. Saido Berahino replaces Ramadan Sobhi.;78';Watford;Stoke City;0;1;0;0;0;0;0;NA;NA;NA;NA;NA;NA;NA;0;NA;NA;0;NA;0;0;NA;NA;NA;0;NA;NA;NA;0;NA;NA;0;NA;0;NA;NA;NA;0;NA;NA;1;0;Stoke City;Saido Berahino;Ramadan Sobhi;0;NA;NA;NA;NA;2;70;0;NA;NA;78
480812;28-10-2017;Corner,  Watford. Conceded by Mame Biram Diouf.;79';Watford;Stoke City;0;1;0;0;0;0;0;NA;NA;NA;NA;NA;NA;NA;0;NA;NA;0;NA;0;0;NA;NA;NA;0;NA;NA;NA;0;NA;NA;0;NA;0;NA;NA;NA;1;Watford;Mame Biram Diouf;0;0;NA;NA;NA;0;NA;NA;NA;NA;2;71;0;NA;NA;79
480812;28-10-2017;Attempt blocked. Abdoulaye Doucouré (Watford) left footed shot from outside the box is blocked.;79';Watford;Stoke City;0;1;0;0;0;1;0;blocked;Abdoulaye Doucouré;Watford;left;outside the box;NA;NA;0;NA;NA;0;NA;0;0;NA;NA;NA;0;NA;NA;NA;0;NA;NA;0;NA;0;NA;NA;NA;0;NA;NA;0;0;NA;NA;NA;0;NA;NA;NA;NA;2;72;0;NA;NA;79
480812;28-10-2017;Corner,  Watford. Conceded by Ryan Shawcross.;79';Watford;Stoke City;0;1;0;0;0;0;0;NA;NA;NA;NA;NA;NA;NA;0;NA;NA;0;NA;0;0;NA;NA;NA;0;NA;NA;NA;0;NA;NA;0;NA;0;NA;NA;NA;1;Watford;Ryan Shawcross;0;0;NA;NA;NA;0;NA;NA;NA;NA;2;73;0;NA;NA;79
480812;28-10-2017;Substitution, Watford. Will Hughes replaces André Carrillo.;80';Watford;Stoke City;0;1;0;0;0;0;0;NA;NA;NA;NA;NA;NA;NA;0;NA;NA;0;NA;0;0;NA;NA;NA;0;NA;NA;NA;0;NA;NA;0;NA;0;NA;NA;NA;0;NA;NA;1;0;Watford;Will Hughes;André Carrillo;0;NA;NA;NA;NA;2;74;0;NA;NA;80
480812;28-10-2017;Attempt saved. Eric Maxim Choupo-Moting (Stoke City) right footed shot from outside the box is saved in the centre of the goal.;81';Watford;Stoke City;0;1;0;0;0;1;0;saved;NA;Stoke City;right;outside the box;the centre of the goal;NA;0;NA;NA;0;NA;0;0;NA;NA;NA;0;NA;NA;NA;0;NA;NA;0;NA;0;NA;NA;NA;0;NA;NA;0;0;NA;NA;NA;0;NA;NA;NA;NA;2;75;0;NA;NA;81
480812;28-10-2017;Attempt blocked. José Holebas (Watford) right footed shot from outside the box is blocked. Assisted by Richarlison.;81';Watford;Stoke City;0;1;0;0;0;1;0;blocked;José Holebas;Watford;right;outside the box;NA;Richarlison;0;NA;NA;0;NA;0;0;NA;NA;NA;0;NA;NA;NA;0;NA;NA;0;NA;0;NA;NA;NA;0;NA;NA;0;0;NA;NA;NA;0;NA;NA;NA;NA;2;76;0;NA;NA;81
480812;28-10-2017;Attempt missed. Andre Gray (Watford) header from the centre of the box misses to the left. Assisted by Abdoulaye Doucouré.;83';Watford;Stoke City;0;1;0;0;0;1;0;missed;Andre Gray;Watford;header;the centre of the box;left;Abdoulaye Doucouré;0;NA;NA;0;NA;0;0;NA;NA;NA;0;NA;NA;NA;0;NA;NA;0;NA;0;NA;NA;NA;0;NA;NA;0;0;NA;NA;NA;0;NA;NA;NA;NA;2;77;0;NA;NA;83
480812;28-10-2017;Attempt missed. Saido Berahino (Stoke City) right footed shot from outside the box is close, but misses to the right. Assisted by Xherdan Shaqiri with a through ball.;84';Watford;Stoke City;0;1;0;0;0;1;0;missed;Saido Berahino;Stoke City;right;outside the box;close, but right;Xherdan Shaqiri;0;NA;NA;0;through;0;0;NA;NA;NA;0;NA;NA;NA;0;NA;NA;0;NA;0;NA;NA;NA;0;NA;NA;0;0;NA;NA;NA;0;NA;NA;NA;NA;2;78;0;NA;NA;84
480812;28-10-2017;Xherdan Shaqiri (Stoke City) is shown the yellow card.;85';Watford;Stoke City;0;1;0;0;0;0;0;NA;NA;NA;NA;NA;NA;NA;0;NA;NA;0;NA;0;0;NA;NA;NA;1;yellow;Xherdan Shaqiri;Stoke City;0;NA;NA;0;NA;0;NA;NA;NA;0;NA;NA;0;0;NA;NA;NA;0;NA;NA;NA;NA;2;79;0;NA;NA;85
480812;28-10-2017;Attempt missed. Andre Gray (Watford) header from the centre of the box is too high. Assisted by Tom Cleverley with a cross.;85';Watford;Stoke City;0;1;0;0;0;1;0;missed;Andre Gray;Watford;header;the centre of the box;too high;Tom Cleverley;0;NA;NA;0;cross;0;0;NA;NA;NA;0;NA;NA;NA;0;NA;NA;0;NA;0;NA;NA;NA;0;NA;NA;0;0;NA;NA;NA;0;NA;NA;NA;NA;2;80;0;NA;NA;85
480812;28-10-2017;Dangerous play by Abdoulaye Doucouré (Watford).;86';Watford;Stoke City;0;1;0;0;0;0;0;NA;NA;NA;NA;NA;NA;NA;0;NA;NA;0;NA;0;0;NA;NA;NA;0;NA;NA;NA;0;NA;NA;0;NA;0;NA;NA;NA;0;NA;NA;0;0;NA;NA;NA;0;NA;NA;NA;NA;2;81;0;NA;NA;86
480812;28-10-2017;Mame Biram Diouf (Stoke City) wins a free kick on the right wing.;86';Watford;Stoke City;0;1;0;0;0;0;0;NA;NA;NA;NA;NA;NA;NA;0;NA;NA;0;NA;0;0;NA;NA;NA;0;NA;NA;NA;0;NA;NA;0;NA;1;Mame Biram Diouf;Stoke City;NA;0;NA;NA;0;0;NA;NA;NA;0;NA;NA;NA;NA;2;82;0;NA;NA;86
480812;28-10-2017;Mame Biram Diouf (Stoke City) is shown the yellow card.;87';Watford;Stoke City;0;1;0;0;0;0;0;NA;NA;NA;NA;NA;NA;NA;0;NA;NA;0;NA;0;0;NA;NA;NA;1;yellow;Mame Biram Diouf;Stoke City;0;NA;NA;0;NA;0;NA;NA;NA;0;NA;NA;0;0;NA;NA;NA;0;NA;NA;NA;NA;2;83;0;NA;NA;87
480812;28-10-2017;Abdoulaye Doucouré (Watford) is shown the yellow card.;87';Watford;Stoke City;0;1;0;0;0;0;0;NA;NA;NA;NA;NA;NA;NA;0;NA;NA;0;NA;0;0;NA;NA;NA;1;yellow;Abdoulaye Doucouré;Watford;0;NA;NA;0;NA;0;NA;NA;NA;0;NA;NA;0;0;NA;NA;NA;0;NA;NA;NA;NA;2;84;0;NA;NA;87
480812;28-10-2017;Substitution, Stoke City. Charlie Adam replaces Xherdan Shaqiri.;88';Watford;Stoke City;0;1;0;0;0;0;0;NA;NA;NA;NA;NA;NA;NA;0;NA;NA;0;NA;0;0;NA;NA;NA;0;NA;NA;NA;0;NA;NA;0;NA;0;NA;NA;NA;0;NA;NA;1;0;Stoke City;Charlie Adam;Xherdan Shaqiri;0;NA;NA;NA;NA;2;85;0;NA;NA;88
480812;28-10-2017;Offside, Watford. Tom Cleverley tries a through ball, but Troy Deeney is caught offside.;89';Watford;Stoke City;0;1;0;0;0;0;0;NA;NA;NA;NA;NA;NA;NA;0;NA;NA;0;NA;0;1;Watford;Troy Deeney;Tom Cleverley;0;NA;NA;NA;0;NA;NA;0;NA;0;NA;NA;NA;0;NA;NA;0;0;NA;NA;NA;0;NA;NA;NA;NA;2;86;0;NA;NA;89
480812;28-10-2017;Offside, Stoke City. Eric Maxim Choupo-Moting tries a through ball, but Saido Berahino is caught offside.;90';Watford;Stoke City;0;1;0;0;0;0;0;NA;NA;NA;NA;NA;NA;NA;0;NA;NA;0;NA;0;1;Stoke City;Saido Berahino;NA;0;NA;NA;NA;0;NA;NA;0;NA;0;NA;NA;NA;0;NA;NA;0;0;NA;NA;NA;0;NA;NA;NA;NA;2;87;0;NA;NA;90
480812;28-10-2017;Joe Allen (Stoke City) is shown the yellow card.;90'+5';Watford;Stoke City;0;1;0;0;0;0;0;NA;NA;NA;NA;NA;NA;NA;0;NA;NA;0;NA;0;0;NA;NA;NA;1;yellow;Joe Allen;Stoke City;0;NA;NA;0;NA;0;NA;NA;NA;0;NA;NA;0;0;NA;NA;NA;0;NA;NA;NA;NA;2;88;1;NA;NA;95
480812;28-10-2017;Troy Deeney (Watford) is shown the yellow card.;90'+5';Watford;Stoke City;0;1;0;0;0;0;0;NA;NA;NA;NA;NA;NA;NA;0;NA;NA;0;NA;0;0;NA;NA;NA;1;yellow;Troy Deeney;Watford;0;NA;NA;0;NA;0;NA;NA;NA;0;NA;NA;0;0;NA;NA;NA;0;NA;NA;NA;NA;2;89;1;NA;NA;95
480812;28-10-2017;Attempt blocked. Andre Gray (Watford) right footed shot from the centre of the box is blocked. Assisted by Will Hughes.;90'+5';Watford;Stoke City;0;1;0;0;0;1;0;blocked;Andre Gray;Watford;right;the centre of the box;NA;Will Hughes;0;NA;NA;0;NA;0;0;NA;NA;NA;0;NA;NA;NA;0;NA;NA;0;NA;0;NA;NA;NA;0;NA;NA;0;0;NA;NA;NA;0;NA;NA;NA;NA;2;90;1;NA;NA;95
