480644;10-02-2018;First Half begins.;-;West Ham United;Watford;0;0;0;0;1;0;0;NA;NA;NA;NA;NA;NA;NA;0;NA;NA;0;NA;0;0;NA;NA;NA;0;NA;NA;NA;0;NA;NA;0;NA;0;NA;NA;NA;0;NA;NA;0;0;NA;NA;NA;0;NA;NA;NA;NA;1;1;0;NA;NA;NA
480644;10-02-2018;Lineups are announced and players are warming up.;-;West Ham United;Watford;0;0;0;0;0;0;0;NA;NA;NA;NA;NA;NA;NA;0;NA;NA;0;NA;0;0;NA;NA;NA;0;NA;NA;NA;0;NA;NA;0;NA;0;NA;NA;NA;0;NA;NA;0;0;NA;NA;NA;0;NA;NA;NA;NA;1;2;0;NA;NA;NA
480644;10-02-2018;Attempt blocked. Etienne Capoue (Watford) right footed shot from outside the box is blocked. Assisted by Abdoulaye Doucouré.;7';West Ham United;Watford;0;0;0;0;0;1;0;blocked;Etienne Capoue;Watford;right;outside the box;NA;Abdoulaye Doucouré;0;NA;NA;0;NA;0;0;NA;NA;NA;0;NA;NA;NA;0;NA;NA;0;NA;0;NA;NA;NA;0;NA;NA;0;0;NA;NA;NA;0;NA;NA;NA;NA;1;3;0;NA;NA;7
480644;10-02-2018;Corner,  Watford. Conceded by Angelo Ogbonna.;7';West Ham United;Watford;0;0;0;0;0;0;0;NA;NA;NA;NA;NA;NA;NA;0;NA;NA;0;NA;0;0;NA;NA;NA;0;NA;NA;NA;0;NA;NA;0;NA;0;NA;NA;NA;1;Watford;Angelo Ogbonna;0;0;NA;NA;NA;0;NA;NA;NA;NA;1;4;0;NA;NA;7
480644;10-02-2018;Attempt saved. Adrian Mariappa (Watford) header from the centre of the box is saved in the bottom left corner. Assisted by José Holebas with a cross.;7';West Ham United;Watford;0;0;0;0;0;1;0;saved;Adrian Mariappa;Watford;header;the centre of the box;the bottom left corner;José Holebas;0;NA;NA;0;cross;0;0;NA;NA;NA;0;NA;NA;NA;0;NA;NA;0;NA;0;NA;NA;NA;0;NA;NA;0;0;NA;NA;NA;0;NA;NA;NA;NA;1;5;0;NA;NA;7
480644;10-02-2018;Attempt saved. João Mário (West Ham United) left footed shot from the left side of the box is saved in the centre of the goal. Assisted by Marko Arnautovic.;11';West Ham United;Watford;0;0;0;0;0;1;0;saved;João Mário;West Ham United;left;the left side of the box;the centre of the goal;Marko Arnautovic;0;NA;NA;0;NA;0;0;NA;NA;NA;0;NA;NA;NA;0;NA;NA;0;NA;0;NA;NA;NA;0;NA;NA;0;0;NA;NA;NA;0;NA;NA;NA;NA;1;6;0;NA;NA;11
480644;10-02-2018;Corner,  West Ham United. Conceded by Orestis Karnezis.;11';West Ham United;Watford;0;0;0;0;0;0;0;NA;NA;NA;NA;NA;NA;NA;0;NA;NA;0;NA;0;0;NA;NA;NA;0;NA;NA;NA;0;NA;NA;0;NA;0;NA;NA;NA;1;West Ham United;Orestis Karnezis;0;0;NA;NA;NA;0;NA;NA;NA;NA;1;7;0;NA;NA;11
480644;10-02-2018;Corner,  West Ham United. Conceded by Abdoulaye Doucouré.;12';West Ham United;Watford;0;0;0;0;0;0;0;NA;NA;NA;NA;NA;NA;NA;0;NA;NA;0;NA;0;0;NA;NA;NA;0;NA;NA;NA;0;NA;NA;0;NA;0;NA;NA;NA;1;West Ham United;Abdoulaye Doucouré;0;0;NA;NA;NA;0;NA;NA;NA;NA;1;8;0;NA;NA;12
480644;10-02-2018;Corner,  West Ham United. Conceded by José Holebas.;15';West Ham United;Watford;0;0;0;0;0;0;0;NA;NA;NA;NA;NA;NA;NA;0;NA;NA;0;NA;0;0;NA;NA;NA;0;NA;NA;NA;0;NA;NA;0;NA;0;NA;NA;NA;1;West Ham United;José Holebas;0;0;NA;NA;NA;0;NA;NA;NA;NA;1;9;0;NA;NA;15
480644;10-02-2018;Adrian Mariappa (Watford) wins a free kick in the defensive half.;16';West Ham United;Watford;0;0;0;0;0;0;0;NA;NA;NA;NA;NA;NA;NA;0;NA;NA;0;NA;0;0;NA;NA;NA;0;NA;NA;NA;0;NA;NA;0;NA;1;Adrian Mariappa;Watford;defensive half;0;NA;NA;0;0;NA;NA;NA;0;NA;NA;NA;NA;1;10;0;NA;NA;16
480644;10-02-2018;Foul by James Collins (West Ham United).;16';West Ham United;Watford;0;0;0;0;0;0;0;NA;NA;NA;NA;NA;NA;NA;1;James Collins;West Ham United;0;NA;0;0;NA;NA;NA;0;NA;NA;NA;0;NA;NA;0;NA;0;NA;NA;NA;0;NA;NA;0;0;NA;NA;NA;0;NA;NA;NA;NA;1;11;0;NA;NA;16
480644;10-02-2018;Corner,  Watford. Conceded by James Collins.;17';West Ham United;Watford;0;0;0;0;0;0;0;NA;NA;NA;NA;NA;NA;NA;0;NA;NA;0;NA;0;0;NA;NA;NA;0;NA;NA;NA;0;NA;NA;0;NA;0;NA;NA;NA;1;Watford;James Collins;0;0;NA;NA;NA;0;NA;NA;NA;NA;1;12;0;NA;NA;17
480644;10-02-2018;Attempt blocked. Abdoulaye Doucouré (Watford) header from the centre of the box is blocked. Assisted by José Holebas with a cross.;18';West Ham United;Watford;0;0;0;0;0;1;0;blocked;Abdoulaye Doucouré;Watford;header;the centre of the box;NA;José Holebas;0;NA;NA;0;cross;0;0;NA;NA;NA;0;NA;NA;NA;0;NA;NA;0;NA;0;NA;NA;NA;0;NA;NA;0;0;NA;NA;NA;0;NA;NA;NA;NA;1;13;0;NA;NA;18
480644;10-02-2018;Abdoulaye Doucouré (Watford) wins a free kick in the defensive half.;21';West Ham United;Watford;0;0;0;0;0;0;0;NA;NA;NA;NA;NA;NA;NA;0;NA;NA;0;NA;0;0;NA;NA;NA;0;NA;NA;NA;0;NA;NA;0;NA;1;Abdoulaye Doucouré;Watford;defensive half;0;NA;NA;0;0;NA;NA;NA;0;NA;NA;NA;NA;1;14;0;NA;NA;21
480644;10-02-2018;Foul by Michail Antonio (West Ham United).;21';West Ham United;Watford;0;0;0;0;0;0;0;NA;NA;NA;NA;NA;NA;NA;1;Michail Antonio;West Ham United;0;NA;0;0;NA;NA;NA;0;NA;NA;NA;0;NA;NA;0;NA;0;NA;NA;NA;0;NA;NA;0;0;NA;NA;NA;0;NA;NA;NA;NA;1;15;0;NA;NA;21
480644;10-02-2018;Foul by Chicharito (West Ham United).;23';West Ham United;Watford;0;0;0;0;0;0;0;NA;NA;NA;NA;NA;NA;NA;1;Chicharito;West Ham United;0;NA;0;0;NA;NA;NA;0;NA;NA;NA;0;NA;NA;0;NA;0;NA;NA;NA;0;NA;NA;0;0;NA;NA;NA;0;NA;NA;NA;NA;1;16;0;NA;NA;23
480644;10-02-2018;Sebastian Prödl (Watford) wins a free kick in the defensive half.;23';West Ham United;Watford;0;0;0;0;0;0;0;NA;NA;NA;NA;NA;NA;NA;0;NA;NA;0;NA;0;0;NA;NA;NA;0;NA;NA;NA;0;NA;NA;0;NA;1;Sebastian Prödl;Watford;defensive half;0;NA;NA;0;0;NA;NA;NA;0;NA;NA;NA;NA;1;17;0;NA;NA;23
480644;10-02-2018;Attempt blocked. Michail Antonio (West Ham United) right footed shot from outside the box is blocked. Assisted by Mark Noble.;25';West Ham United;Watford;0;0;0;0;0;1;0;blocked;Michail Antonio;West Ham United;right;outside the box;NA;Mark Noble;0;NA;NA;0;NA;0;0;NA;NA;NA;0;NA;NA;NA;0;NA;NA;0;NA;0;NA;NA;NA;0;NA;NA;0;0;NA;NA;NA;0;NA;NA;NA;NA;1;18;0;NA;NA;25
480644;10-02-2018;Corner,  West Ham United. Conceded by José Holebas.;25';West Ham United;Watford;0;0;0;0;0;0;0;NA;NA;NA;NA;NA;NA;NA;0;NA;NA;0;NA;0;0;NA;NA;NA;0;NA;NA;NA;0;NA;NA;0;NA;0;NA;NA;NA;1;West Ham United;José Holebas;0;0;NA;NA;NA;0;NA;NA;NA;NA;1;19;0;NA;NA;25
480644;10-02-2018;Foul by Gerard Deulofeu (Watford).;26';West Ham United;Watford;0;0;0;0;0;0;0;NA;NA;NA;NA;NA;NA;NA;1;Gerard Deulofeu;Watford;0;NA;0;0;NA;NA;NA;0;NA;NA;NA;0;NA;NA;0;NA;0;NA;NA;NA;0;NA;NA;0;0;NA;NA;NA;0;NA;NA;NA;NA;1;20;0;NA;NA;26
480644;10-02-2018;Mark Noble (West Ham United) wins a free kick in the attacking half.;26';West Ham United;Watford;0;0;0;0;0;0;0;NA;NA;NA;NA;NA;NA;NA;0;NA;NA;0;NA;0;0;NA;NA;NA;0;NA;NA;NA;0;NA;NA;0;NA;1;Mark Noble;West Ham United;attacking half;0;NA;NA;0;0;NA;NA;NA;0;NA;NA;NA;NA;1;21;0;NA;NA;26
480644;10-02-2018;Offside, West Ham United. Pablo Zabaleta tries a through ball, but Chicharito is caught offside.;27';West Ham United;Watford;0;0;0;0;0;0;0;NA;NA;NA;NA;NA;NA;NA;0;NA;NA;0;NA;0;1;West Ham United;Chicharito;Pablo Zabaleta;0;NA;NA;NA;0;NA;NA;0;NA;0;NA;NA;NA;0;NA;NA;0;0;NA;NA;NA;0;NA;NA;NA;NA;1;22;0;NA;NA;27
480644;10-02-2018;Chicharito (West Ham United) wins a free kick on the right wing.;27';West Ham United;Watford;0;0;0;0;0;0;0;NA;NA;NA;NA;NA;NA;NA;0;NA;NA;0;NA;0;0;NA;NA;NA;0;NA;NA;NA;0;NA;NA;0;NA;1;Chicharito;West Ham United;NA;0;NA;NA;0;0;NA;NA;NA;0;NA;NA;NA;NA;1;23;0;NA;NA;27
480644;10-02-2018;Foul by Marvin Zeegelaar (Watford).;27';West Ham United;Watford;0;0;0;0;0;0;0;NA;NA;NA;NA;NA;NA;NA;1;Marvin Zeegelaar;Watford;0;NA;0;0;NA;NA;NA;0;NA;NA;NA;0;NA;NA;0;NA;0;NA;NA;NA;0;NA;NA;0;0;NA;NA;NA;0;NA;NA;NA;NA;1;24;0;NA;NA;27
480644;10-02-2018;Foul by Cheikhou Kouyaté (West Ham United).;28';West Ham United;Watford;0;0;0;0;0;0;0;NA;NA;NA;NA;NA;NA;NA;1;Cheikhou Kouyaté;West Ham United;0;NA;0;0;NA;NA;NA;0;NA;NA;NA;0;NA;NA;0;NA;0;NA;NA;NA;0;NA;NA;0;0;NA;NA;NA;0;NA;NA;NA;NA;1;25;0;NA;NA;28
480644;10-02-2018;Marvin Zeegelaar (Watford) wins a free kick in the defensive half.;28';West Ham United;Watford;0;0;0;0;0;0;0;NA;NA;NA;NA;NA;NA;NA;0;NA;NA;0;NA;0;0;NA;NA;NA;0;NA;NA;NA;0;NA;NA;0;NA;1;Marvin Zeegelaar;Watford;defensive half;0;NA;NA;0;0;NA;NA;NA;0;NA;NA;NA;NA;1;26;0;NA;NA;28
480644;10-02-2018;Foul by José Holebas (Watford).;30';West Ham United;Watford;0;0;0;0;0;0;0;NA;NA;NA;NA;NA;NA;NA;1;José Holebas;Watford;0;NA;0;0;NA;NA;NA;0;NA;NA;NA;0;NA;NA;0;NA;0;NA;NA;NA;0;NA;NA;0;0;NA;NA;NA;0;NA;NA;NA;NA;1;27;0;NA;NA;30
480644;10-02-2018;João Mário (West Ham United) wins a free kick on the right wing.;30';West Ham United;Watford;0;0;0;0;0;0;0;NA;NA;NA;NA;NA;NA;NA;0;NA;NA;0;NA;0;0;NA;NA;NA;0;NA;NA;NA;0;NA;NA;0;NA;1;João Mário;West Ham United;NA;0;NA;NA;0;0;NA;NA;NA;0;NA;NA;NA;NA;1;28;0;NA;NA;30
480644;10-02-2018;Offside, West Ham United. João Mário tries a through ball, but Chicharito is caught offside.;31';West Ham United;Watford;0;0;0;0;0;0;0;NA;NA;NA;NA;NA;NA;NA;0;NA;NA;0;NA;0;1;West Ham United;Chicharito;João Mário;0;NA;NA;NA;0;NA;NA;0;NA;0;NA;NA;NA;0;NA;NA;0;0;NA;NA;NA;0;NA;NA;NA;NA;1;29;0;NA;NA;31
480644;10-02-2018;Attempt saved. Etienne Capoue (Watford) right footed shot from outside the box is saved in the centre of the goal. Assisted by Gerard Deulofeu.;32';West Ham United;Watford;0;0;0;0;0;1;0;saved;Etienne Capoue;Watford;right;outside the box;the centre of the goal;Gerard Deulofeu;0;NA;NA;0;NA;0;0;NA;NA;NA;0;NA;NA;NA;0;NA;NA;0;NA;0;NA;NA;NA;0;NA;NA;0;0;NA;NA;NA;0;NA;NA;NA;NA;1;30;0;NA;NA;32
480644;10-02-2018;Foul by João Mário (West Ham United).;35';West Ham United;Watford;0;0;0;0;0;0;0;NA;NA;NA;NA;NA;NA;NA;1;João Mário;West Ham United;0;NA;0;0;NA;NA;NA;0;NA;NA;NA;0;NA;NA;0;NA;0;NA;NA;NA;0;NA;NA;0;0;NA;NA;NA;0;NA;NA;NA;NA;1;31;0;NA;NA;35
480644;10-02-2018;Marvin Zeegelaar (Watford) wins a free kick on the left wing.;35';West Ham United;Watford;0;0;0;0;0;0;0;NA;NA;NA;NA;NA;NA;NA;0;NA;NA;0;NA;0;0;NA;NA;NA;0;NA;NA;NA;0;NA;NA;0;NA;1;Marvin Zeegelaar;Watford;NA;0;NA;NA;0;0;NA;NA;NA;0;NA;NA;NA;NA;1;32;0;NA;NA;35
480644;10-02-2018;Foul by Marvin Zeegelaar (Watford).;36';West Ham United;Watford;0;0;0;0;0;0;0;NA;NA;NA;NA;NA;NA;NA;1;Marvin Zeegelaar;Watford;0;NA;0;0;NA;NA;NA;0;NA;NA;NA;0;NA;NA;0;NA;0;NA;NA;NA;0;NA;NA;0;0;NA;NA;NA;0;NA;NA;NA;NA;1;33;0;NA;NA;36
480644;10-02-2018;Marko Arnautovic (West Ham United) wins a free kick in the attacking half.;36';West Ham United;Watford;0;0;0;0;0;0;0;NA;NA;NA;NA;NA;NA;NA;0;NA;NA;0;NA;0;0;NA;NA;NA;0;NA;NA;NA;0;NA;NA;0;NA;1;Marko Arnautovic;West Ham United;attacking half;0;NA;NA;0;0;NA;NA;NA;0;NA;NA;NA;NA;1;34;0;NA;NA;36
480644;10-02-2018;Attempt saved. Marko Arnautovic (West Ham United) right footed shot from the centre of the box is saved in the centre of the goal. Assisted by James Collins with a headed pass.;37';West Ham United;Watford;0;0;0;0;0;1;0;saved;Marko Arnautovic;West Ham United;right;the centre of the box;the centre of the goal;James Collins;0;NA;NA;0;NA;0;0;NA;NA;NA;0;NA;NA;NA;0;NA;NA;0;NA;0;NA;NA;NA;0;NA;NA;0;0;NA;NA;NA;0;NA;NA;NA;NA;1;35;0;NA;NA;37
480644;10-02-2018;Foul by Abdoulaye Doucouré (Watford).;37';West Ham United;Watford;0;0;0;0;0;0;0;NA;NA;NA;NA;NA;NA;NA;1;Abdoulaye Doucouré;Watford;0;NA;0;0;NA;NA;NA;0;NA;NA;NA;0;NA;NA;0;NA;0;NA;NA;NA;0;NA;NA;0;0;NA;NA;NA;0;NA;NA;NA;NA;1;36;0;NA;NA;37
480644;10-02-2018;Mark Noble (West Ham United) wins a free kick in the defensive half.;37';West Ham United;Watford;0;0;0;0;0;0;0;NA;NA;NA;NA;NA;NA;NA;0;NA;NA;0;NA;0;0;NA;NA;NA;0;NA;NA;NA;0;NA;NA;0;NA;1;Mark Noble;West Ham United;defensive half;0;NA;NA;0;0;NA;NA;NA;0;NA;NA;NA;NA;1;37;0;NA;NA;37
480644;10-02-2018;Goal!  West Ham United 1, Watford 0. Chicharito (West Ham United) header from the centre of the box to the bottom right corner. Assisted by Michail Antonio with a cross.;38';West Ham United;Watford;1;0;0;0;0;1;0;goal;Chicharito;West Ham United;header;the centre of the box;bottom right corner;Michail Antonio;0;NA;NA;0;cross;0;0;NA;NA;NA;0;NA;NA;NA;0;NA;NA;0;NA;0;NA;NA;NA;0;NA;NA;0;0;NA;NA;NA;0;NA;NA;NA;NA;1;38;0;NA;NA;38
480644;10-02-2018;Foul by Cheikhou Kouyaté (West Ham United).;42';West Ham United;Watford;1;0;0;0;0;0;0;NA;NA;NA;NA;NA;NA;NA;1;Cheikhou Kouyaté;West Ham United;0;NA;0;0;NA;NA;NA;0;NA;NA;NA;0;NA;NA;0;NA;0;NA;NA;NA;0;NA;NA;0;0;NA;NA;NA;0;NA;NA;NA;NA;1;39;0;NA;NA;42
480644;10-02-2018;Marvin Zeegelaar (Watford) wins a free kick on the left wing.;42';West Ham United;Watford;1;0;0;0;0;0;0;NA;NA;NA;NA;NA;NA;NA;0;NA;NA;0;NA;0;0;NA;NA;NA;0;NA;NA;NA;0;NA;NA;0;NA;1;Marvin Zeegelaar;Watford;NA;0;NA;NA;0;0;NA;NA;NA;0;NA;NA;NA;NA;1;40;0;NA;NA;42
480644;10-02-2018;Attempt blocked. Michail Antonio (West Ham United) right footed shot from outside the box is blocked. Assisted by Marko Arnautovic.;43';West Ham United;Watford;1;0;0;0;0;1;0;blocked;Michail Antonio;West Ham United;right;outside the box;NA;Marko Arnautovic;0;NA;NA;0;NA;0;0;NA;NA;NA;0;NA;NA;NA;0;NA;NA;0;NA;0;NA;NA;NA;0;NA;NA;0;0;NA;NA;NA;0;NA;NA;NA;NA;1;41;0;NA;NA;43
480644;10-02-2018;Foul by Pablo Zabaleta (West Ham United).;44';West Ham United;Watford;1;0;0;0;0;0;0;NA;NA;NA;NA;NA;NA;NA;1;Pablo Zabaleta;West Ham United;0;NA;0;0;NA;NA;NA;0;NA;NA;NA;0;NA;NA;0;NA;0;NA;NA;NA;0;NA;NA;0;0;NA;NA;NA;0;NA;NA;NA;NA;1;42;0;NA;NA;44
480644;10-02-2018;Richarlison (Watford) wins a free kick in the defensive half.;44';West Ham United;Watford;1;0;0;0;0;0;0;NA;NA;NA;NA;NA;NA;NA;0;NA;NA;0;NA;0;0;NA;NA;NA;0;NA;NA;NA;0;NA;NA;0;NA;1;Richarlison;Watford;defensive half;0;NA;NA;0;0;NA;NA;NA;0;NA;NA;NA;NA;1;43;0;NA;NA;44
480644;10-02-2018;Pablo Zabaleta (West Ham United) is shown the yellow card for a bad foul.;44';West Ham United;Watford;1;0;0;0;0;0;0;NA;NA;NA;NA;NA;NA;NA;0;NA;NA;0;NA;0;0;NA;NA;NA;1;yellow;Pablo Zabaleta;West Ham United;0;NA;NA;0;NA;0;NA;NA;NA;0;NA;NA;0;0;NA;NA;NA;0;NA;NA;NA;NA;1;44;0;NA;NA;44
480644;10-02-2018;Chicharito (West Ham United) wins a free kick in the defensive half.;45'+1';West Ham United;Watford;1;0;0;0;0;0;0;NA;NA;NA;NA;NA;NA;NA;0;NA;NA;0;NA;0;0;NA;NA;NA;0;NA;NA;NA;0;NA;NA;0;NA;1;Chicharito;West Ham United;defensive half;0;NA;NA;0;0;NA;NA;NA;0;NA;NA;NA;NA;1;45;1;NA;NA;46
480644;10-02-2018;Foul by Daryl Janmaat (Watford).;45'+1';West Ham United;Watford;1;0;0;0;0;0;0;NA;NA;NA;NA;NA;NA;NA;1;Daryl Janmaat;Watford;0;NA;0;0;NA;NA;NA;0;NA;NA;NA;0;NA;NA;0;NA;0;NA;NA;NA;0;NA;NA;0;0;NA;NA;NA;0;NA;NA;NA;NA;1;46;1;NA;NA;46
480644;10-02-2018;First Half ends, West Ham United 1, Watford 0.;45'+2';West Ham United;Watford;1;0;1;0;0;0;0;NA;NA;NA;NA;NA;NA;NA;0;NA;NA;0;NA;0;0;NA;NA;NA;0;NA;NA;NA;0;NA;NA;0;NA;0;NA;NA;NA;0;NA;NA;0;0;NA;NA;NA;0;NA;NA;NA;NA;1;47;1;NA;NA;47
480644;10-02-2018;Second Half begins West Ham United 1, Watford 0.;45';West Ham United;Watford;1;0;0;0;1;0;0;NA;NA;NA;NA;NA;NA;NA;0;NA;NA;0;NA;0;0;NA;NA;NA;0;NA;NA;NA;0;NA;NA;0;NA;0;NA;NA;NA;0;NA;NA;0;0;NA;NA;NA;0;NA;NA;NA;NA;2;48;0;NA;NA;45
480644;10-02-2018;Foul by Mark Noble (West Ham United).;48';West Ham United;Watford;1;0;0;0;0;0;0;NA;NA;NA;NA;NA;NA;NA;1;Mark Noble;West Ham United;0;NA;0;0;NA;NA;NA;0;NA;NA;NA;0;NA;NA;0;NA;0;NA;NA;NA;0;NA;NA;0;0;NA;NA;NA;0;NA;NA;NA;NA;2;49;0;NA;NA;48
480644;10-02-2018;Troy Deeney (Watford) wins a free kick in the attacking half.;48';West Ham United;Watford;1;0;0;0;0;0;0;NA;NA;NA;NA;NA;NA;NA;0;NA;NA;0;NA;0;0;NA;NA;NA;0;NA;NA;NA;0;NA;NA;0;NA;1;Troy Deeney;Watford;attacking half;0;NA;NA;0;0;NA;NA;NA;0;NA;NA;NA;NA;2;50;0;NA;NA;48
480644;10-02-2018;Corner,  Watford. Conceded by Aaron Cresswell.;51';West Ham United;Watford;1;0;0;0;0;0;0;NA;NA;NA;NA;NA;NA;NA;0;NA;NA;0;NA;0;0;NA;NA;NA;0;NA;NA;NA;0;NA;NA;0;NA;0;NA;NA;NA;1;Watford;Aaron Cresswell;0;0;NA;NA;NA;0;NA;NA;NA;NA;2;51;0;NA;NA;51
480644;10-02-2018;Attempt missed. Cheikhou Kouyaté (West Ham United) right footed shot from outside the box misses to the left.;52';West Ham United;Watford;1;0;0;0;0;1;0;missed;Cheikhou Kouyaté;West Ham United;right;outside the box;left;NA;0;NA;NA;0;NA;0;0;NA;NA;NA;0;NA;NA;NA;0;NA;NA;0;NA;0;NA;NA;NA;0;NA;NA;0;0;NA;NA;NA;0;NA;NA;NA;NA;2;52;0;NA;NA;52
480644;10-02-2018;Corner,  West Ham United. Conceded by Adrian Mariappa.;53';West Ham United;Watford;1;0;0;0;0;0;0;NA;NA;NA;NA;NA;NA;NA;0;NA;NA;0;NA;0;0;NA;NA;NA;0;NA;NA;NA;0;NA;NA;0;NA;0;NA;NA;NA;1;West Ham United;Adrian Mariappa;0;0;NA;NA;NA;0;NA;NA;NA;NA;2;53;0;NA;NA;53
480644;10-02-2018;Attempt missed. Cheikhou Kouyaté (West Ham United) header from very close range is close, but misses to the left. Assisted by João Mário with a cross following a corner.;54';West Ham United;Watford;1;0;0;0;0;1;0;missed;Cheikhou Kouyaté;West Ham United;header;very close range;close, but left;João Mário;0;NA;NA;0;cross;1;0;NA;NA;NA;0;NA;NA;NA;0;NA;NA;0;NA;0;NA;NA;NA;0;NA;NA;0;0;NA;NA;NA;0;NA;NA;NA;NA;2;54;0;NA;NA;54
480644;10-02-2018;Corner,  West Ham United. Conceded by Sebastian Prödl.;54';West Ham United;Watford;1;0;0;0;0;0;0;NA;NA;NA;NA;NA;NA;NA;0;NA;NA;0;NA;0;0;NA;NA;NA;0;NA;NA;NA;0;NA;NA;0;NA;0;NA;NA;NA;1;West Ham United;Sebastian Prödl;0;0;NA;NA;NA;0;NA;NA;NA;NA;2;55;0;NA;NA;54
480644;10-02-2018;Foul by Cheikhou Kouyaté (West Ham United).;55';West Ham United;Watford;1;0;0;0;0;0;0;NA;NA;NA;NA;NA;NA;NA;1;Cheikhou Kouyaté;West Ham United;0;NA;0;0;NA;NA;NA;0;NA;NA;NA;0;NA;NA;0;NA;0;NA;NA;NA;0;NA;NA;0;0;NA;NA;NA;0;NA;NA;NA;NA;2;56;0;NA;NA;55
480644;10-02-2018;Gerard Deulofeu (Watford) wins a free kick in the attacking half.;55';West Ham United;Watford;1;0;0;0;0;0;0;NA;NA;NA;NA;NA;NA;NA;0;NA;NA;0;NA;0;0;NA;NA;NA;0;NA;NA;NA;0;NA;NA;0;NA;1;Gerard Deulofeu;Watford;attacking half;0;NA;NA;0;0;NA;NA;NA;0;NA;NA;NA;NA;2;57;0;NA;NA;55
480644;10-02-2018;Substitution, Watford. Roberto Pereyra replaces Marvin Zeegelaar.;56';West Ham United;Watford;1;0;0;0;0;0;0;NA;NA;NA;NA;NA;NA;NA;0;NA;NA;0;NA;0;0;NA;NA;NA;0;NA;NA;NA;0;NA;NA;0;NA;0;NA;NA;NA;0;NA;NA;1;0;Watford;Roberto Pereyra;Marvin Zeegelaar;0;NA;NA;NA;NA;2;58;0;NA;NA;56
480644;10-02-2018;Attempt saved. Gerard Deulofeu (Watford) right footed shot from outside the box is saved in the bottom left corner.;57';West Ham United;Watford;1;0;0;0;0;1;0;saved;Gerard Deulofeu;Watford;right;outside the box;the bottom left corner;NA;0;NA;NA;0;NA;0;0;NA;NA;NA;0;NA;NA;NA;0;NA;NA;0;NA;0;NA;NA;NA;0;NA;NA;0;0;NA;NA;NA;0;NA;NA;NA;NA;2;59;0;NA;NA;57
480644;10-02-2018;Corner,  Watford. Conceded by Angelo Ogbonna.;59';West Ham United;Watford;1;0;0;0;0;0;0;NA;NA;NA;NA;NA;NA;NA;0;NA;NA;0;NA;0;0;NA;NA;NA;0;NA;NA;NA;0;NA;NA;0;NA;0;NA;NA;NA;1;Watford;Angelo Ogbonna;0;0;NA;NA;NA;0;NA;NA;NA;NA;2;60;0;NA;NA;59
480644;10-02-2018;Offside, Watford. José Holebas tries a through ball, but Troy Deeney is caught offside.;63';West Ham United;Watford;1;0;0;0;0;0;0;NA;NA;NA;NA;NA;NA;NA;0;NA;NA;0;NA;0;1;Watford;Troy Deeney;José Holebas;0;NA;NA;NA;0;NA;NA;0;NA;0;NA;NA;NA;0;NA;NA;0;0;NA;NA;NA;0;NA;NA;NA;NA;2;61;0;NA;NA;63
480644;10-02-2018;Attempt missed. Etienne Capoue (Watford) right footed shot from more than 35 yards misses to the right. Assisted by Abdoulaye Doucouré.;66';West Ham United;Watford;1;0;0;0;0;1;0;missed;Etienne Capoue;Watford;right;NA;NA;Abdoulaye Doucouré;0;NA;NA;0;NA;0;0;NA;NA;NA;0;NA;NA;NA;0;NA;NA;0;NA;0;NA;NA;NA;0;NA;NA;0;0;NA;NA;NA;0;NA;NA;NA;NA;2;62;0;NA;NA;66
480644;10-02-2018;Corner,  West Ham United. Conceded by Daryl Janmaat.;72';West Ham United;Watford;1;0;0;0;0;0;0;NA;NA;NA;NA;NA;NA;NA;0;NA;NA;0;NA;0;0;NA;NA;NA;0;NA;NA;NA;0;NA;NA;0;NA;0;NA;NA;NA;1;West Ham United;Daryl Janmaat;0;0;NA;NA;NA;0;NA;NA;NA;NA;2;63;0;NA;NA;72
480644;10-02-2018;Substitution, Watford. Dodi Lukebakio replaces Gerard Deulofeu.;75';West Ham United;Watford;1;0;0;0;0;0;0;NA;NA;NA;NA;NA;NA;NA;0;NA;NA;0;NA;0;0;NA;NA;NA;0;NA;NA;NA;0;NA;NA;0;NA;0;NA;NA;NA;0;NA;NA;1;0;Watford;Dodi Lukebakio;Gerard Deulofeu;0;NA;NA;NA;NA;2;64;0;NA;NA;75
480644;10-02-2018;Corner,  Watford. Conceded by Cheikhou Kouyaté.;75';West Ham United;Watford;1;0;0;0;0;0;0;NA;NA;NA;NA;NA;NA;NA;0;NA;NA;0;NA;0;0;NA;NA;NA;0;NA;NA;NA;0;NA;NA;0;NA;0;NA;NA;NA;1;Watford;Cheikhou Kouyaté;0;0;NA;NA;NA;0;NA;NA;NA;NA;2;65;0;NA;NA;75
480644;10-02-2018;Attempt missed. Sebastian Prödl (Watford) header from very close range is too high. Assisted by José Holebas with a cross following a corner.;76';West Ham United;Watford;1;0;0;0;0;1;0;missed;Sebastian Prödl;Watford;header;very close range;too high;José Holebas;0;NA;NA;0;cross;1;0;NA;NA;NA;0;NA;NA;NA;0;NA;NA;0;NA;0;NA;NA;NA;0;NA;NA;0;0;NA;NA;NA;0;NA;NA;NA;NA;2;66;0;NA;NA;76
480644;10-02-2018;Substitution, West Ham United. Sam Byram replaces João Mário.;77';West Ham United;Watford;1;0;0;0;0;0;0;NA;NA;NA;NA;NA;NA;NA;0;NA;NA;0;NA;0;0;NA;NA;NA;0;NA;NA;NA;0;NA;NA;0;NA;0;NA;NA;NA;0;NA;NA;1;0;West Ham United;Sam Byram;João Mário;0;NA;NA;NA;NA;2;67;0;NA;NA;77
480644;10-02-2018;Corner,  West Ham United. Conceded by José Holebas.;77';West Ham United;Watford;1;0;0;0;0;0;0;NA;NA;NA;NA;NA;NA;NA;0;NA;NA;0;NA;0;0;NA;NA;NA;0;NA;NA;NA;0;NA;NA;0;NA;0;NA;NA;NA;1;West Ham United;José Holebas;0;0;NA;NA;NA;0;NA;NA;NA;NA;2;68;0;NA;NA;77
480644;10-02-2018;Goal!  West Ham United 2, Watford 0. Marko Arnautovic (West Ham United) left footed shot from the left side of the six yard box to the bottom left corner. Assisted by Aaron Cresswell following a corner.;78';West Ham United;Watford;2;0;0;0;0;1;0;goal;Marko Arnautovic;West Ham United;left;the left side of the six yard box;bottom left corner;Aaron Cresswell;0;NA;NA;0;NA;1;0;NA;NA;NA;0;NA;NA;NA;0;NA;NA;0;NA;0;NA;NA;NA;0;NA;NA;0;0;NA;NA;NA;0;NA;NA;NA;NA;2;69;0;NA;NA;78
480644;10-02-2018;Adrian Mariappa (Watford) wins a free kick in the defensive half.;80';West Ham United;Watford;2;0;0;0;0;0;0;NA;NA;NA;NA;NA;NA;NA;0;NA;NA;0;NA;0;0;NA;NA;NA;0;NA;NA;NA;0;NA;NA;0;NA;1;Adrian Mariappa;Watford;defensive half;0;NA;NA;0;0;NA;NA;NA;0;NA;NA;NA;NA;2;70;0;NA;NA;80
480644;10-02-2018;Foul by Marko Arnautovic (West Ham United).;80';West Ham United;Watford;2;0;0;0;0;0;0;NA;NA;NA;NA;NA;NA;NA;1;Marko Arnautovic;West Ham United;0;NA;0;0;NA;NA;NA;0;NA;NA;NA;0;NA;NA;0;NA;0;NA;NA;NA;0;NA;NA;0;0;NA;NA;NA;0;NA;NA;NA;NA;2;71;0;NA;NA;80
480644;10-02-2018;Attempt saved. Richarlison (Watford) left footed shot from outside the box is saved in the centre of the goal. Assisted by Dodi Lukebakio.;81';West Ham United;Watford;2;0;0;0;0;1;0;saved;Richarlison;Watford;left;outside the box;the centre of the goal;Dodi Lukebakio;0;NA;NA;0;NA;0;0;NA;NA;NA;0;NA;NA;NA;0;NA;NA;0;NA;0;NA;NA;NA;0;NA;NA;0;0;NA;NA;NA;0;NA;NA;NA;NA;2;72;0;NA;NA;81
480644;10-02-2018;Attempt missed. Dodi Lukebakio (Watford) left footed shot from outside the box is too high. Assisted by Abdoulaye Doucouré.;82';West Ham United;Watford;2;0;0;0;0;1;0;missed;Dodi Lukebakio;Watford;left;outside the box;too high;Abdoulaye Doucouré;0;NA;NA;0;NA;0;0;NA;NA;NA;0;NA;NA;NA;0;NA;NA;0;NA;0;NA;NA;NA;0;NA;NA;0;0;NA;NA;NA;0;NA;NA;NA;NA;2;73;0;NA;NA;82
480644;10-02-2018;Substitution, Watford. Andre Gray replaces Richarlison.;82';West Ham United;Watford;2;0;0;0;0;0;0;NA;NA;NA;NA;NA;NA;NA;0;NA;NA;0;NA;0;0;NA;NA;NA;0;NA;NA;NA;0;NA;NA;0;NA;0;NA;NA;NA;0;NA;NA;1;0;Watford;Andre Gray;Richarlison;0;NA;NA;NA;NA;2;74;0;NA;NA;82
480644;10-02-2018;Substitution, West Ham United. Declan Rice replaces Marko Arnautovic.;84';West Ham United;Watford;2;0;0;0;0;0;0;NA;NA;NA;NA;NA;NA;NA;0;NA;NA;0;NA;0;0;NA;NA;NA;0;NA;NA;NA;0;NA;NA;0;NA;0;NA;NA;NA;0;NA;NA;1;0;West Ham United;Declan Rice;Marko Arnautovic;0;NA;NA;NA;NA;2;75;0;NA;NA;84
480644;10-02-2018;Corner,  Watford. Conceded by Declan Rice.;86';West Ham United;Watford;2;0;0;0;0;0;0;NA;NA;NA;NA;NA;NA;NA;0;NA;NA;0;NA;0;0;NA;NA;NA;0;NA;NA;NA;0;NA;NA;0;NA;0;NA;NA;NA;1;Watford;Declan Rice;0;0;NA;NA;NA;0;NA;NA;NA;NA;2;76;0;NA;NA;86
480644;10-02-2018;Attempt blocked. Adrian Mariappa (Watford) right footed shot from the centre of the box is blocked. Assisted by Dodi Lukebakio with a cross.;86';West Ham United;Watford;2;0;0;0;0;1;0;blocked;Adrian Mariappa;Watford;right;the centre of the box;NA;Dodi Lukebakio;0;NA;NA;0;cross;0;0;NA;NA;NA;0;NA;NA;NA;0;NA;NA;0;NA;0;NA;NA;NA;0;NA;NA;0;0;NA;NA;NA;0;NA;NA;NA;NA;2;77;0;NA;NA;86
480644;10-02-2018;Corner,  Watford. Conceded by Sam Byram.;86';West Ham United;Watford;2;0;0;0;0;0;0;NA;NA;NA;NA;NA;NA;NA;0;NA;NA;0;NA;0;0;NA;NA;NA;0;NA;NA;NA;0;NA;NA;0;NA;0;NA;NA;NA;1;Watford;Sam Byram;0;0;NA;NA;NA;0;NA;NA;NA;NA;2;78;0;NA;NA;86
480644;10-02-2018;Substitution, West Ham United. Jordan Hugill replaces Chicharito.;88';West Ham United;Watford;2;0;0;0;0;0;0;NA;NA;NA;NA;NA;NA;NA;0;NA;NA;0;NA;0;0;NA;NA;NA;0;NA;NA;NA;0;NA;NA;0;NA;0;NA;NA;NA;0;NA;NA;1;0;West Ham United;Jordan Hugill;Chicharito;0;NA;NA;NA;NA;2;79;0;NA;NA;88
480644;10-02-2018;Adrian Mariappa (Watford) wins a free kick in the defensive half.;88';West Ham United;Watford;2;0;0;0;0;0;0;NA;NA;NA;NA;NA;NA;NA;0;NA;NA;0;NA;0;0;NA;NA;NA;0;NA;NA;NA;0;NA;NA;0;NA;1;Adrian Mariappa;Watford;defensive half;0;NA;NA;0;0;NA;NA;NA;0;NA;NA;NA;NA;2;80;0;NA;NA;88
480644;10-02-2018;Foul by Jordan Hugill (West Ham United).;88';West Ham United;Watford;2;0;0;0;0;0;0;NA;NA;NA;NA;NA;NA;NA;1;Jordan Hugill;West Ham United;0;NA;0;0;NA;NA;NA;0;NA;NA;NA;0;NA;NA;0;NA;0;NA;NA;NA;0;NA;NA;0;0;NA;NA;NA;0;NA;NA;NA;NA;2;81;0;NA;NA;88
480644;10-02-2018;Attempt blocked. Adrian Mariappa (Watford) header from the centre of the box is blocked. Assisted by José Holebas with a cross.;89';West Ham United;Watford;2;0;0;0;0;1;0;blocked;Adrian Mariappa;Watford;header;the centre of the box;NA;José Holebas;0;NA;NA;0;cross;0;0;NA;NA;NA;0;NA;NA;NA;0;NA;NA;0;NA;0;NA;NA;NA;0;NA;NA;0;0;NA;NA;NA;0;NA;NA;NA;NA;2;82;0;NA;NA;89
480644;10-02-2018;Foul by Sebastian Prödl (Watford).;90';West Ham United;Watford;2;0;0;0;0;0;0;NA;NA;NA;NA;NA;NA;NA;1;Sebastian Prödl;Watford;0;NA;0;0;NA;NA;NA;0;NA;NA;NA;0;NA;NA;0;NA;0;NA;NA;NA;0;NA;NA;0;0;NA;NA;NA;0;NA;NA;NA;NA;2;83;0;NA;NA;90
480644;10-02-2018;Jordan Hugill (West Ham United) wins a free kick in the defensive half.;90';West Ham United;Watford;2;0;0;0;0;0;0;NA;NA;NA;NA;NA;NA;NA;0;NA;NA;0;NA;0;0;NA;NA;NA;0;NA;NA;NA;0;NA;NA;0;NA;1;Jordan Hugill;West Ham United;defensive half;0;NA;NA;0;0;NA;NA;NA;0;NA;NA;NA;NA;2;84;0;NA;NA;90
480644;10-02-2018;Sebastian Prödl (Watford) is shown the yellow card for a bad foul.;90';West Ham United;Watford;2;0;0;0;0;0;0;NA;NA;NA;NA;NA;NA;NA;0;NA;NA;0;NA;0;0;NA;NA;NA;1;yellow;Sebastian Prödl;Watford;0;NA;NA;0;NA;0;NA;NA;NA;0;NA;NA;0;0;NA;NA;NA;0;NA;NA;NA;NA;2;85;0;NA;NA;90
480644;10-02-2018;Offside, West Ham United. Pablo Zabaleta tries a through ball, but Sam Byram is caught offside.;90'+1';West Ham United;Watford;2;0;0;0;0;0;0;NA;NA;NA;NA;NA;NA;NA;0;NA;NA;0;NA;0;1;West Ham United;Sam Byram;Pablo Zabaleta;0;NA;NA;NA;0;NA;NA;0;NA;0;NA;NA;NA;0;NA;NA;0;0;NA;NA;NA;0;NA;NA;NA;NA;2;86;1;NA;NA;91
