480625;03-03-2018;Foul by Jordan Ayew (Swansea City).;84';Swansea City;West Ham United;4;1;0;0;0;0;0;NA;NA;NA;NA;NA;NA;NA;1;Jordan Ayew;Swansea City;0;NA;0;0;NA;NA;NA;0;NA;NA;NA;0;NA;NA;0;NA;0;NA;NA;NA;0;NA;NA;0;0;NA;NA;NA;0;NA;NA;NA;NA;2;86;0;NA;NA;84
480625;03-03-2018;Michail Antonio (West Ham United) wins a free kick in the defensive half.;84';Swansea City;West Ham United;4;1;0;0;0;0;0;NA;NA;NA;NA;NA;NA;NA;0;NA;NA;0;NA;0;0;NA;NA;NA;0;NA;NA;NA;0;NA;NA;0;NA;1;Michail Antonio;West Ham United;defensive half;0;NA;NA;0;0;NA;NA;NA;0;NA;NA;NA;NA;2;87;0;NA;NA;84
480625;03-03-2018;Attempt blocked. Manuel Lanzini (West Ham United) left footed shot from outside the box is blocked.;85';Swansea City;West Ham United;4;1;0;0;0;1;0;blocked;Manuel Lanzini;West Ham United;left;outside the box;NA;NA;0;NA;NA;0;NA;0;0;NA;NA;NA;0;NA;NA;NA;0;NA;NA;0;NA;0;NA;NA;NA;0;NA;NA;0;0;NA;NA;NA;0;NA;NA;NA;NA;2;88;0;NA;NA;85
480625;03-03-2018;Attempt blocked. Michail Antonio (West Ham United) left footed shot from outside the box is blocked. Assisted by Chicharito.;86';Swansea City;West Ham United;4;1;0;0;0;1;0;blocked;Michail Antonio;West Ham United;left;outside the box;NA;Chicharito;0;NA;NA;0;NA;0;0;NA;NA;NA;0;NA;NA;NA;0;NA;NA;0;NA;0;NA;NA;NA;0;NA;NA;0;0;NA;NA;NA;0;NA;NA;NA;NA;2;89;0;NA;NA;86
480625;03-03-2018;Offside, West Ham United. Mark Noble tries a through ball, but Michail Antonio is caught offside.;86';Swansea City;West Ham United;4;1;0;0;0;0;0;NA;NA;NA;NA;NA;NA;NA;0;NA;NA;0;NA;0;1;West Ham United;Michail Antonio;Mark Noble;0;NA;NA;NA;0;NA;NA;0;NA;0;NA;NA;NA;0;NA;NA;0;0;NA;NA;NA;0;NA;NA;NA;NA;2;90;0;NA;NA;86
480625;03-03-2018;Chicharito (West Ham United) wins a free kick in the defensive half.;90';Swansea City;West Ham United;4;1;0;0;0;0;0;NA;NA;NA;NA;NA;NA;NA;0;NA;NA;0;NA;0;0;NA;NA;NA;0;NA;NA;NA;0;NA;NA;0;NA;1;Chicharito;West Ham United;defensive half;0;NA;NA;0;0;NA;NA;NA;0;NA;NA;NA;NA;2;91;0;NA;NA;90
480625;03-03-2018;Foul by Alfie Mawson (Swansea City).;90';Swansea City;West Ham United;4;1;0;0;0;0;0;NA;NA;NA;NA;NA;NA;NA;1;Alfie Mawson;Swansea City;0;NA;0;0;NA;NA;NA;0;NA;NA;NA;0;NA;NA;0;NA;0;NA;NA;NA;0;NA;NA;0;0;NA;NA;NA;0;NA;NA;NA;NA;2;92;0;NA;NA;90
480625;03-03-2018;Substitution, Swansea City. Tammy Abraham replaces Sam Clucas.;90';Swansea City;West Ham United;4;1;0;0;0;0;0;NA;NA;NA;NA;NA;NA;NA;0;NA;NA;0;NA;0;0;NA;NA;NA;0;NA;NA;NA;0;NA;NA;0;NA;0;NA;NA;NA;0;NA;NA;1;0;Swansea City;Tammy Abraham;Sam Clucas;0;NA;NA;NA;NA;2;93;0;NA;NA;90
480625;03-03-2018;Second Half ends, Swansea City 4, West Ham United 1.;90'+4';Swansea City;West Ham United;4;1;1;0;0;0;0;NA;NA;NA;NA;NA;NA;NA;0;NA;NA;0;NA;0;0;NA;NA;NA;0;NA;NA;NA;0;NA;NA;0;NA;0;NA;NA;NA;0;NA;NA;0;0;NA;NA;NA;0;NA;NA;NA;NA;2;94;1;NA;NA;94
480625;03-03-2018;Match ends, Swansea City 4, West Ham United 1.;90'+4';Swansea City;West Ham United;4;1;0;1;0;0;0;NA;NA;NA;NA;NA;NA;NA;0;NA;NA;0;NA;0;0;NA;NA;NA;0;NA;NA;NA;0;NA;NA;0;NA;0;NA;NA;NA;0;NA;NA;0;0;NA;NA;NA;0;NA;NA;NA;NA;2;95;1;NA;NA;94
