480625;03-03-2018;First Half begins.;-;Swansea City;West Ham United;0;0;0;0;1;0;0;NA;NA;NA;NA;NA;NA;NA;0;NA;NA;0;NA;0;0;NA;NA;NA;0;NA;NA;NA;0;NA;NA;0;NA;0;NA;NA;NA;0;NA;NA;0;0;NA;NA;NA;0;NA;NA;NA;NA;1;1;0;NA;NA;NA
480625;03-03-2018;Lineups are announced and players are warming up.;-;Swansea City;West Ham United;0;0;0;0;0;0;0;NA;NA;NA;NA;NA;NA;NA;0;NA;NA;0;NA;0;0;NA;NA;NA;0;NA;NA;NA;0;NA;NA;0;NA;0;NA;NA;NA;0;NA;NA;0;0;NA;NA;NA;0;NA;NA;NA;NA;1;2;0;NA;NA;NA
480625;03-03-2018;Corner,  West Ham United. Conceded by Alfie Mawson.;6';Swansea City;West Ham United;0;0;0;0;0;0;0;NA;NA;NA;NA;NA;NA;NA;0;NA;NA;0;NA;0;0;NA;NA;NA;0;NA;NA;NA;0;NA;NA;0;NA;0;NA;NA;NA;1;West Ham United;Alfie Mawson;0;0;NA;NA;NA;0;NA;NA;NA;NA;1;3;0;NA;NA;6
480625;03-03-2018;Attempt missed. Winston Reid (West Ham United) header from the centre of the box misses to the left following a corner.;6';Swansea City;West Ham United;0;0;0;0;0;1;0;missed;Winston Reid;West Ham United;header;the centre of the box;left;NA;0;NA;NA;0;NA;1;0;NA;NA;NA;0;NA;NA;NA;0;NA;NA;0;NA;0;NA;NA;NA;0;NA;NA;0;0;NA;NA;NA;0;NA;NA;NA;NA;1;4;0;NA;NA;6
480625;03-03-2018;Offside, West Ham United. Winston Reid tries a through ball, but Chicharito is caught offside.;6';Swansea City;West Ham United;0;0;0;0;0;0;0;NA;NA;NA;NA;NA;NA;NA;0;NA;NA;0;NA;0;1;West Ham United;Chicharito;Winston Reid;0;NA;NA;NA;0;NA;NA;0;NA;0;NA;NA;NA;0;NA;NA;0;0;NA;NA;NA;0;NA;NA;NA;NA;1;5;0;NA;NA;6
480625;03-03-2018;Goal!  Swansea City 1, West Ham United 0. Ki Sung-yueng (Swansea City) left footed shot from outside the box to the bottom right corner. Assisted by André Ayew.;8';Swansea City;West Ham United;1;0;0;0;0;1;0;goal;Ki Sung-yueng;Swansea City;left;outside the box;bottom right corner;André Ayew;0;NA;NA;0;NA;0;0;NA;NA;NA;0;NA;NA;NA;0;NA;NA;0;NA;0;NA;NA;NA;0;NA;NA;0;0;NA;NA;NA;0;NA;NA;NA;NA;1;6;0;NA;NA;8
480625;03-03-2018;Corner,  West Ham United. Conceded by Martin Olsson.;11';Swansea City;West Ham United;1;0;0;0;0;0;0;NA;NA;NA;NA;NA;NA;NA;0;NA;NA;0;NA;0;0;NA;NA;NA;0;NA;NA;NA;0;NA;NA;0;NA;0;NA;NA;NA;1;West Ham United;Martin Olsson;0;0;NA;NA;NA;0;NA;NA;NA;NA;1;7;0;NA;NA;11
480625;03-03-2018;Foul by Winston Reid (West Ham United).;13';Swansea City;West Ham United;1;0;0;0;0;0;0;NA;NA;NA;NA;NA;NA;NA;1;Winston Reid;West Ham United;0;NA;0;0;NA;NA;NA;0;NA;NA;NA;0;NA;NA;0;NA;0;NA;NA;NA;0;NA;NA;0;0;NA;NA;NA;0;NA;NA;NA;NA;1;8;0;NA;NA;13
480625;03-03-2018;Sam Clucas (Swansea City) wins a free kick in the defensive half.;13';Swansea City;West Ham United;1;0;0;0;0;0;0;NA;NA;NA;NA;NA;NA;NA;0;NA;NA;0;NA;0;0;NA;NA;NA;0;NA;NA;NA;0;NA;NA;0;NA;1;Sam Clucas;Swansea City;defensive half;0;NA;NA;0;0;NA;NA;NA;0;NA;NA;NA;NA;1;9;0;NA;NA;13
480625;03-03-2018;Foul by Mark Noble (West Ham United).;15';Swansea City;West Ham United;1;0;0;0;0;0;0;NA;NA;NA;NA;NA;NA;NA;1;Mark Noble;West Ham United;0;NA;0;0;NA;NA;NA;0;NA;NA;NA;0;NA;NA;0;NA;0;NA;NA;NA;0;NA;NA;0;0;NA;NA;NA;0;NA;NA;NA;NA;1;10;0;NA;NA;15
480625;03-03-2018;Ki Sung-yueng (Swansea City) wins a free kick in the attacking half.;15';Swansea City;West Ham United;1;0;0;0;0;0;0;NA;NA;NA;NA;NA;NA;NA;0;NA;NA;0;NA;0;0;NA;NA;NA;0;NA;NA;NA;0;NA;NA;0;NA;1;Ki Sung-yueng;Swansea City;attacking half;0;NA;NA;0;0;NA;NA;NA;0;NA;NA;NA;NA;1;11;0;NA;NA;15
480625;03-03-2018;Corner,  Swansea City. Conceded by Adrián.;16';Swansea City;West Ham United;1;0;0;0;0;0;0;NA;NA;NA;NA;NA;NA;NA;0;NA;NA;0;NA;0;0;NA;NA;NA;0;NA;NA;NA;0;NA;NA;0;NA;0;NA;NA;NA;1;Swansea City;Adrián;0;0;NA;NA;NA;0;NA;NA;NA;NA;1;12;0;NA;NA;16
480625;03-03-2018;Attempt blocked. Federico Fernández (Swansea City) right footed shot from the left side of the six yard box is blocked. Assisted by Mike van der Hoorn.;17';Swansea City;West Ham United;1;0;0;0;0;1;0;blocked;Federico Fernández;Swansea City;right;the left side of the six yard box;NA;Mike van der;0;NA;NA;0;NA;0;0;NA;NA;NA;0;NA;NA;NA;0;NA;NA;0;NA;0;NA;NA;NA;0;NA;NA;0;0;NA;NA;NA;0;NA;NA;NA;NA;1;13;0;NA;NA;17
480625;03-03-2018;Corner,  Swansea City. Conceded by Pablo Zabaleta.;19';Swansea City;West Ham United;1;0;0;0;0;0;0;NA;NA;NA;NA;NA;NA;NA;0;NA;NA;0;NA;0;0;NA;NA;NA;0;NA;NA;NA;0;NA;NA;0;NA;0;NA;NA;NA;1;Swansea City;Pablo Zabaleta;0;0;NA;NA;NA;0;NA;NA;NA;NA;1;14;0;NA;NA;19
480625;03-03-2018;Delay in match Winston Reid (West Ham United) because of an injury.;18';Swansea City;West Ham United;1;0;0;0;0;0;0;NA;NA;NA;NA;NA;NA;NA;0;NA;NA;0;NA;0;0;NA;NA;NA;0;NA;NA;NA;0;NA;NA;1;West Ham United;0;NA;NA;NA;0;NA;NA;0;0;NA;NA;NA;0;NA;NA;NA;NA;1;15;0;NA;NA;18
480625;03-03-2018;Delay over. They are ready to continue.;26';Swansea City;West Ham United;1;0;0;0;0;0;0;NA;NA;NA;NA;NA;NA;NA;0;NA;NA;0;NA;0;0;NA;NA;NA;0;NA;NA;NA;0;NA;NA;0;NA;0;NA;NA;NA;0;NA;NA;0;0;NA;NA;NA;0;NA;NA;NA;NA;1;16;0;NA;NA;26
480625;03-03-2018;Substitution, West Ham United. Sam Byram replaces Winston Reid because of an injury.;27';Swansea City;West Ham United;1;0;0;0;0;0;0;NA;NA;NA;NA;NA;NA;NA;0;NA;NA;0;NA;0;0;NA;NA;NA;0;NA;NA;NA;0;NA;NA;0;NA;0;NA;NA;NA;0;NA;NA;1;1;West Ham United;Sam Byram;Winston Reid;0;NA;NA;NA;NA;1;17;0;NA;NA;27
480625;03-03-2018;Offside, West Ham United. Chicharito tries a through ball, but Marko Arnautovic is caught offside.;27';Swansea City;West Ham United;1;0;0;0;0;0;0;NA;NA;NA;NA;NA;NA;NA;0;NA;NA;0;NA;0;1;West Ham United;Marko Arnautovic;Chicharito;0;NA;NA;NA;0;NA;NA;0;NA;0;NA;NA;NA;0;NA;NA;0;0;NA;NA;NA;0;NA;NA;NA;NA;1;18;0;NA;NA;27
480625;03-03-2018;Foul by Mark Noble (West Ham United).;30';Swansea City;West Ham United;1;0;0;0;0;0;0;NA;NA;NA;NA;NA;NA;NA;1;Mark Noble;West Ham United;0;NA;0;0;NA;NA;NA;0;NA;NA;NA;0;NA;NA;0;NA;0;NA;NA;NA;0;NA;NA;0;0;NA;NA;NA;0;NA;NA;NA;NA;1;19;0;NA;NA;30
480625;03-03-2018;Jordan Ayew (Swansea City) wins a free kick in the attacking half.;30';Swansea City;West Ham United;1;0;0;0;0;0;0;NA;NA;NA;NA;NA;NA;NA;0;NA;NA;0;NA;0;0;NA;NA;NA;0;NA;NA;NA;0;NA;NA;0;NA;1;Jordan Ayew;Swansea City;attacking half;0;NA;NA;0;0;NA;NA;NA;0;NA;NA;NA;NA;1;20;0;NA;NA;30
480625;03-03-2018;Attempt saved. André Ayew (Swansea City) left footed shot from the right side of the box is saved in the centre of the goal. Assisted by Jordan Ayew.;31';Swansea City;West Ham United;1;0;0;0;0;1;0;saved;André Ayew;Swansea City;left;the right side of the box;the centre of the goal;Jordan Ayew;0;NA;NA;0;NA;0;0;NA;NA;NA;0;NA;NA;NA;0;NA;NA;0;NA;0;NA;NA;NA;0;NA;NA;0;0;NA;NA;NA;0;NA;NA;NA;NA;1;21;0;NA;NA;31
480625;03-03-2018;Corner,  Swansea City. Conceded by Declan Rice.;31';Swansea City;West Ham United;1;0;0;0;0;0;0;NA;NA;NA;NA;NA;NA;NA;0;NA;NA;0;NA;0;0;NA;NA;NA;0;NA;NA;NA;0;NA;NA;0;NA;0;NA;NA;NA;1;Swansea City;Declan Rice;0;0;NA;NA;NA;0;NA;NA;NA;NA;1;22;0;NA;NA;31
480625;03-03-2018;Goal!  Swansea City 2, West Ham United 0. Mike van der Hoorn (Swansea City) header from the centre of the box to the centre of the goal. Assisted by Ki Sung-yueng with a cross following a corner.;32';Swansea City;West Ham United;2;0;0;0;0;1;0;goal;NA;Swansea City;header;the centre of the box;centre of the goal;Ki Sung-yueng;0;NA;NA;0;cross;1;0;NA;NA;NA;0;NA;NA;NA;0;NA;NA;0;NA;0;NA;NA;NA;0;NA;NA;0;0;NA;NA;NA;0;NA;NA;NA;NA;1;23;0;NA;NA;32
480625;03-03-2018;Federico Fernández (Swansea City) wins a free kick in the defensive half.;33';Swansea City;West Ham United;2;0;0;0;0;0;0;NA;NA;NA;NA;NA;NA;NA;0;NA;NA;0;NA;0;0;NA;NA;NA;0;NA;NA;NA;0;NA;NA;0;NA;1;Federico Fernández;Swansea City;defensive half;0;NA;NA;0;0;NA;NA;NA;0;NA;NA;NA;NA;1;24;0;NA;NA;33
480625;03-03-2018;Foul by Marko Arnautovic (West Ham United).;33';Swansea City;West Ham United;2;0;0;0;0;0;0;NA;NA;NA;NA;NA;NA;NA;1;Marko Arnautovic;West Ham United;0;NA;0;0;NA;NA;NA;0;NA;NA;NA;0;NA;NA;0;NA;0;NA;NA;NA;0;NA;NA;0;0;NA;NA;NA;0;NA;NA;NA;NA;1;25;0;NA;NA;33
480625;03-03-2018;Aaron Cresswell (West Ham United) wins a free kick in the defensive half.;34';Swansea City;West Ham United;2;0;0;0;0;0;0;NA;NA;NA;NA;NA;NA;NA;0;NA;NA;0;NA;0;0;NA;NA;NA;0;NA;NA;NA;0;NA;NA;0;NA;1;Aaron Cresswell;West Ham United;defensive half;0;NA;NA;0;0;NA;NA;NA;0;NA;NA;NA;NA;1;26;0;NA;NA;34
480625;03-03-2018;Foul by André Ayew (Swansea City).;34';Swansea City;West Ham United;2;0;0;0;0;0;0;NA;NA;NA;NA;NA;NA;NA;1;André Ayew;Swansea City;0;NA;0;0;NA;NA;NA;0;NA;NA;NA;0;NA;NA;0;NA;0;NA;NA;NA;0;NA;NA;0;0;NA;NA;NA;0;NA;NA;NA;NA;1;27;0;NA;NA;34
480625;03-03-2018;Foul by Jordan Ayew (Swansea City).;38';Swansea City;West Ham United;2;0;0;0;0;0;0;NA;NA;NA;NA;NA;NA;NA;1;Jordan Ayew;Swansea City;0;NA;0;0;NA;NA;NA;0;NA;NA;NA;0;NA;NA;0;NA;0;NA;NA;NA;0;NA;NA;0;0;NA;NA;NA;0;NA;NA;NA;NA;1;28;0;NA;NA;38
480625;03-03-2018;Sam Byram (West Ham United) wins a free kick in the defensive half.;38';Swansea City;West Ham United;2;0;0;0;0;0;0;NA;NA;NA;NA;NA;NA;NA;0;NA;NA;0;NA;0;0;NA;NA;NA;0;NA;NA;NA;0;NA;NA;0;NA;1;Sam Byram;West Ham United;defensive half;0;NA;NA;0;0;NA;NA;NA;0;NA;NA;NA;NA;1;29;0;NA;NA;38
480625;03-03-2018;Foul by André Ayew (Swansea City).;39';Swansea City;West Ham United;2;0;0;0;0;0;0;NA;NA;NA;NA;NA;NA;NA;1;André Ayew;Swansea City;0;NA;0;0;NA;NA;NA;0;NA;NA;NA;0;NA;NA;0;NA;0;NA;NA;NA;0;NA;NA;0;0;NA;NA;NA;0;NA;NA;NA;NA;1;30;0;NA;NA;39
480625;03-03-2018;Manuel Lanzini (West Ham United) wins a free kick in the defensive half.;39';Swansea City;West Ham United;2;0;0;0;0;0;0;NA;NA;NA;NA;NA;NA;NA;0;NA;NA;0;NA;0;0;NA;NA;NA;0;NA;NA;NA;0;NA;NA;0;NA;1;Manuel Lanzini;West Ham United;defensive half;0;NA;NA;0;0;NA;NA;NA;0;NA;NA;NA;NA;1;31;0;NA;NA;39
480625;03-03-2018;Aaron Cresswell (West Ham United) wins a free kick in the defensive half.;41';Swansea City;West Ham United;2;0;0;0;0;0;0;NA;NA;NA;NA;NA;NA;NA;0;NA;NA;0;NA;0;0;NA;NA;NA;0;NA;NA;NA;0;NA;NA;0;NA;1;Aaron Cresswell;West Ham United;defensive half;0;NA;NA;0;0;NA;NA;NA;0;NA;NA;NA;NA;1;32;0;NA;NA;41
480625;03-03-2018;Dangerous play by André Ayew (Swansea City).;41';Swansea City;West Ham United;2;0;0;0;0;0;0;NA;NA;NA;NA;NA;NA;NA;0;NA;NA;0;NA;0;0;NA;NA;NA;0;NA;NA;NA;0;NA;NA;0;NA;0;NA;NA;NA;0;NA;NA;0;0;NA;NA;NA;0;NA;NA;NA;NA;1;33;0;NA;NA;41
480625;03-03-2018;Andy King (Swansea City) wins a free kick in the defensive half.;41';Swansea City;West Ham United;2;0;0;0;0;0;0;NA;NA;NA;NA;NA;NA;NA;0;NA;NA;0;NA;0;0;NA;NA;NA;0;NA;NA;NA;0;NA;NA;0;NA;1;Andy King;Swansea City;defensive half;0;NA;NA;0;0;NA;NA;NA;0;NA;NA;NA;NA;1;34;0;NA;NA;41
480625;03-03-2018;Foul by Mark Noble (West Ham United).;41';Swansea City;West Ham United;2;0;0;0;0;0;0;NA;NA;NA;NA;NA;NA;NA;1;Mark Noble;West Ham United;0;NA;0;0;NA;NA;NA;0;NA;NA;NA;0;NA;NA;0;NA;0;NA;NA;NA;0;NA;NA;0;0;NA;NA;NA;0;NA;NA;NA;NA;1;35;0;NA;NA;41
480625;03-03-2018;Mark Noble (West Ham United) is shown the yellow card for a bad foul.;41';Swansea City;West Ham United;2;0;0;0;0;0;0;NA;NA;NA;NA;NA;NA;NA;0;NA;NA;0;NA;0;0;NA;NA;NA;1;yellow;Mark Noble;West Ham United;0;NA;NA;0;NA;0;NA;NA;NA;0;NA;NA;0;0;NA;NA;NA;0;NA;NA;NA;NA;1;36;0;NA;NA;41
480625;03-03-2018;Alfie Mawson (Swansea City) wins a free kick in the defensive half.;44';Swansea City;West Ham United;2;0;0;0;0;0;0;NA;NA;NA;NA;NA;NA;NA;0;NA;NA;0;NA;0;0;NA;NA;NA;0;NA;NA;NA;0;NA;NA;0;NA;1;Alfie Mawson;Swansea City;defensive half;0;NA;NA;0;0;NA;NA;NA;0;NA;NA;NA;NA;1;37;0;NA;NA;44
480625;03-03-2018;Foul by Cheikhou Kouyaté (West Ham United).;44';Swansea City;West Ham United;2;0;0;0;0;0;0;NA;NA;NA;NA;NA;NA;NA;1;Cheikhou Kouyaté;West Ham United;0;NA;0;0;NA;NA;NA;0;NA;NA;NA;0;NA;NA;0;NA;0;NA;NA;NA;0;NA;NA;0;0;NA;NA;NA;0;NA;NA;NA;NA;1;38;0;NA;NA;44
480625;03-03-2018;Attempt missed. Ki Sung-yueng (Swansea City) right footed shot from outside the box is too high. Assisted by Andy King.;45'+2';Swansea City;West Ham United;2;0;0;0;0;1;0;missed;Ki Sung-yueng;Swansea City;right;outside the box;too high;Andy King;0;NA;NA;0;NA;0;0;NA;NA;NA;0;NA;NA;NA;0;NA;NA;0;NA;0;NA;NA;NA;0;NA;NA;0;0;NA;NA;NA;0;NA;NA;NA;NA;1;39;1;NA;NA;47
480625;03-03-2018;Foul by Marko Arnautovic (West Ham United).;45'+4';Swansea City;West Ham United;2;0;0;0;0;0;0;NA;NA;NA;NA;NA;NA;NA;1;Marko Arnautovic;West Ham United;0;NA;0;0;NA;NA;NA;0;NA;NA;NA;0;NA;NA;0;NA;0;NA;NA;NA;0;NA;NA;0;0;NA;NA;NA;0;NA;NA;NA;NA;1;40;1;NA;NA;49
480625;03-03-2018;Martin Olsson (Swansea City) wins a free kick on the left wing.;45'+4';Swansea City;West Ham United;2;0;0;0;0;0;0;NA;NA;NA;NA;NA;NA;NA;0;NA;NA;0;NA;0;0;NA;NA;NA;0;NA;NA;NA;0;NA;NA;0;NA;1;Martin Olsson;Swansea City;NA;0;NA;NA;0;0;NA;NA;NA;0;NA;NA;NA;NA;1;41;1;NA;NA;49
480625;03-03-2018;Corner,  West Ham United. Conceded by Kyle Naughton.;45'+7';Swansea City;West Ham United;2;0;0;0;0;0;0;NA;NA;NA;NA;NA;NA;NA;0;NA;NA;0;NA;0;0;NA;NA;NA;0;NA;NA;NA;0;NA;NA;0;NA;0;NA;NA;NA;1;West Ham United;Kyle Naughton;0;0;NA;NA;NA;0;NA;NA;NA;NA;1;42;1;NA;NA;52
480625;03-03-2018;André Ayew (Swansea City) wins a free kick on the right wing.;45'+10';Swansea City;West Ham United;2;0;0;0;0;0;0;NA;NA;NA;NA;NA;NA;NA;0;NA;NA;0;NA;0;0;NA;NA;NA;0;NA;NA;NA;0;NA;NA;0;NA;1;André Ayew;Swansea City;NA;0;NA;NA;0;0;NA;NA;NA;0;NA;NA;NA;NA;1;43;1;NA;NA;55
480625;03-03-2018;Foul by Aaron Cresswell (West Ham United).;45'+10';Swansea City;West Ham United;2;0;0;0;0;0;0;NA;NA;NA;NA;NA;NA;NA;1;Aaron Cresswell;West Ham United;0;NA;0;0;NA;NA;NA;0;NA;NA;NA;0;NA;NA;0;NA;0;NA;NA;NA;0;NA;NA;0;0;NA;NA;NA;0;NA;NA;NA;NA;1;44;1;NA;NA;55
480625;03-03-2018;First Half ends, Swansea City 2, West Ham United 0.;45'+11';Swansea City;West Ham United;2;0;1;0;0;0;0;NA;NA;NA;NA;NA;NA;NA;0;NA;NA;0;NA;0;0;NA;NA;NA;0;NA;NA;NA;0;NA;NA;0;NA;0;NA;NA;NA;0;NA;NA;0;0;NA;NA;NA;0;NA;NA;NA;NA;1;45;1;NA;NA;56
480625;03-03-2018;Second Half begins Swansea City 2, West Ham United 0.;45';Swansea City;West Ham United;2;0;0;0;1;0;0;NA;NA;NA;NA;NA;NA;NA;0;NA;NA;0;NA;0;0;NA;NA;NA;0;NA;NA;NA;0;NA;NA;0;NA;0;NA;NA;NA;0;NA;NA;0;0;NA;NA;NA;0;NA;NA;NA;NA;2;46;0;NA;NA;45
480625;03-03-2018;Substitution, West Ham United. Michail Antonio replaces Patrice Evra.;45';Swansea City;West Ham United;2;0;0;0;0;0;0;NA;NA;NA;NA;NA;NA;NA;0;NA;NA;0;NA;0;0;NA;NA;NA;0;NA;NA;NA;0;NA;NA;0;NA;0;NA;NA;NA;0;NA;NA;1;0;West Ham United;Michail Antonio;Patrice Evra;0;NA;NA;NA;NA;2;47;0;NA;NA;45
480625;03-03-2018;Offside, West Ham United. Chicharito tries a through ball, but Marko Arnautovic is caught offside.;46';Swansea City;West Ham United;2;0;0;0;0;0;0;NA;NA;NA;NA;NA;NA;NA;0;NA;NA;0;NA;0;1;West Ham United;Marko Arnautovic;Chicharito;0;NA;NA;NA;0;NA;NA;0;NA;0;NA;NA;NA;0;NA;NA;0;0;NA;NA;NA;0;NA;NA;NA;NA;2;48;0;NA;NA;46
480625;03-03-2018;Corner,  Swansea City. Conceded by Aaron Cresswell.;47';Swansea City;West Ham United;2;0;0;0;0;0;0;NA;NA;NA;NA;NA;NA;NA;0;NA;NA;0;NA;0;0;NA;NA;NA;0;NA;NA;NA;0;NA;NA;0;NA;0;NA;NA;NA;1;Swansea City;Aaron Cresswell;0;0;NA;NA;NA;0;NA;NA;NA;NA;2;49;0;NA;NA;47
480625;03-03-2018;Attempt saved. André Ayew (Swansea City) header from very close range is saved in the bottom right corner. Assisted by Sam Clucas with a cross.;48';Swansea City;West Ham United;2;0;0;0;0;1;0;saved;André Ayew;Swansea City;header;very close range;the bottom right corner;Sam Clucas;0;NA;NA;0;cross;0;0;NA;NA;NA;0;NA;NA;NA;0;NA;NA;0;NA;0;NA;NA;NA;0;NA;NA;0;0;NA;NA;NA;0;NA;NA;NA;NA;2;50;0;NA;NA;48
480625;03-03-2018;Goal!  Swansea City 3, West Ham United 0. Andy King (Swansea City) right footed shot from very close range to the centre of the goal following a corner.;48';Swansea City;West Ham United;3;0;0;0;0;1;0;goal;Andy King;Swansea City;right;right shot very close range;centre of the goal following a corner;NA;0;NA;NA;0;NA;1;0;NA;NA;NA;0;NA;NA;NA;0;NA;NA;0;NA;0;NA;NA;NA;0;NA;NA;0;0;NA;NA;NA;0;NA;NA;NA;NA;2;51;0;NA;NA;48
480625;03-03-2018;Alfie Mawson (Swansea City) wins a free kick in the defensive half.;51';Swansea City;West Ham United;3;0;0;0;0;0;0;NA;NA;NA;NA;NA;NA;NA;0;NA;NA;0;NA;0;0;NA;NA;NA;0;NA;NA;NA;0;NA;NA;0;NA;1;Alfie Mawson;Swansea City;defensive half;0;NA;NA;0;0;NA;NA;NA;0;NA;NA;NA;NA;2;52;0;NA;NA;51
480625;03-03-2018;Foul by Chicharito (West Ham United).;51';Swansea City;West Ham United;3;0;0;0;0;0;0;NA;NA;NA;NA;NA;NA;NA;1;Chicharito;West Ham United;0;NA;0;0;NA;NA;NA;0;NA;NA;NA;0;NA;NA;0;NA;0;NA;NA;NA;0;NA;NA;0;0;NA;NA;NA;0;NA;NA;NA;NA;2;53;0;NA;NA;51
480625;03-03-2018;Corner,  West Ham United. Conceded by Federico Fernández.;54';Swansea City;West Ham United;3;0;0;0;0;0;0;NA;NA;NA;NA;NA;NA;NA;0;NA;NA;0;NA;0;0;NA;NA;NA;0;NA;NA;NA;0;NA;NA;0;NA;0;NA;NA;NA;1;West Ham United;Federico Fernández;0;0;NA;NA;NA;0;NA;NA;NA;NA;2;54;0;NA;NA;54
480625;03-03-2018;Corner,  West Ham United. Conceded by Mike van der Hoorn.;54';Swansea City;West Ham United;3;0;0;0;0;0;0;NA;NA;NA;NA;NA;NA;NA;0;NA;NA;0;NA;0;0;NA;NA;NA;0;NA;NA;NA;0;NA;NA;0;NA;0;NA;NA;NA;1;West Ham United;Mike van der;0;0;NA;NA;NA;0;NA;NA;NA;NA;2;55;0;NA;NA;54
480625;03-03-2018;Attempt saved. Marko Arnautovic (West Ham United) right footed shot from the centre of the box is saved in the top right corner. Assisted by Manuel Lanzini.;57';Swansea City;West Ham United;3;0;0;0;0;1;0;saved;Marko Arnautovic;West Ham United;right;the centre of the box;the top right corner;Manuel Lanzini;0;NA;NA;0;NA;0;0;NA;NA;NA;0;NA;NA;NA;0;NA;NA;0;NA;0;NA;NA;NA;0;NA;NA;0;0;NA;NA;NA;0;NA;NA;NA;NA;2;56;0;NA;NA;57
480625;03-03-2018;Foul by Jordan Ayew (Swansea City).;58';Swansea City;West Ham United;3;0;0;0;0;0;0;NA;NA;NA;NA;NA;NA;NA;1;Jordan Ayew;Swansea City;0;NA;0;0;NA;NA;NA;0;NA;NA;NA;0;NA;NA;0;NA;0;NA;NA;NA;0;NA;NA;0;0;NA;NA;NA;0;NA;NA;NA;NA;2;57;0;NA;NA;58
480625;03-03-2018;Michail Antonio (West Ham United) wins a free kick in the defensive half.;58';Swansea City;West Ham United;3;0;0;0;0;0;0;NA;NA;NA;NA;NA;NA;NA;0;NA;NA;0;NA;0;0;NA;NA;NA;0;NA;NA;NA;0;NA;NA;0;NA;1;Michail Antonio;West Ham United;defensive half;0;NA;NA;0;0;NA;NA;NA;0;NA;NA;NA;NA;2;58;0;NA;NA;58
480625;03-03-2018;Penalty Swansea City. André Ayew draws a foul in the penalty area.;62';Swansea City;West Ham United;3;0;0;0;0;0;0;NA;NA;NA;NA;NA;NA;NA;0;NA;NA;0;NA;0;0;NA;NA;NA;0;NA;NA;NA;0;NA;NA;0;NA;0;NA;NA;NA;0;NA;NA;0;0;NA;NA;NA;1;Swansea City;André Ayew;NA;NA;2;59;0;NA;NA;62
480625;03-03-2018;Penalty conceded by Cheikhou Kouyaté (West Ham United) after a foul in the penalty area.;62';Swansea City;West Ham United;3;0;0;0;0;0;0;NA;NA;NA;NA;NA;NA;NA;0;NA;NA;0;NA;0;0;NA;NA;NA;0;NA;NA;NA;0;NA;NA;0;NA;0;NA;NA;NA;0;NA;NA;0;0;NA;NA;NA;1;West Ham United;NA;Cheikhou Kouyaté;West Ham United;2;60;0;NA;NA;62
480625;03-03-2018;Goal!  Swansea City 4, West Ham United 0. Jordan Ayew (Swansea City) converts the penalty with a right footed shot to the bottom left corner.;63';Swansea City;West Ham United;4;0;0;0;0;1;0;goal;Jordan Ayew;Swansea City;right;NA;bottom left corner;NA;0;NA;NA;0;NA;0;0;NA;NA;NA;0;NA;NA;NA;0;NA;NA;0;NA;0;NA;NA;NA;0;NA;NA;0;0;NA;NA;NA;0;NA;NA;NA;NA;2;61;0;NA;NA;63
480625;03-03-2018;Foul by Cheikhou Kouyaté (West Ham United).;65';Swansea City;West Ham United;4;0;0;0;0;0;0;NA;NA;NA;NA;NA;NA;NA;1;Cheikhou Kouyaté;West Ham United;0;NA;0;0;NA;NA;NA;0;NA;NA;NA;0;NA;NA;0;NA;0;NA;NA;NA;0;NA;NA;0;0;NA;NA;NA;0;NA;NA;NA;NA;2;62;0;NA;NA;65
480625;03-03-2018;Jordan Ayew (Swansea City) wins a free kick in the attacking half.;65';Swansea City;West Ham United;4;0;0;0;0;0;0;NA;NA;NA;NA;NA;NA;NA;0;NA;NA;0;NA;0;0;NA;NA;NA;0;NA;NA;NA;0;NA;NA;0;NA;1;Jordan Ayew;Swansea City;attacking half;0;NA;NA;0;0;NA;NA;NA;0;NA;NA;NA;NA;2;63;0;NA;NA;65
480625;03-03-2018;André Ayew (Swansea City) wins a free kick in the attacking half.;65';Swansea City;West Ham United;4;0;0;0;0;0;0;NA;NA;NA;NA;NA;NA;NA;0;NA;NA;0;NA;0;0;NA;NA;NA;0;NA;NA;NA;0;NA;NA;0;NA;1;André Ayew;Swansea City;attacking half;0;NA;NA;0;0;NA;NA;NA;0;NA;NA;NA;NA;2;64;0;NA;NA;65
480625;03-03-2018;Foul by Cheikhou Kouyaté (West Ham United).;65';Swansea City;West Ham United;4;0;0;0;0;0;0;NA;NA;NA;NA;NA;NA;NA;1;Cheikhou Kouyaté;West Ham United;0;NA;0;0;NA;NA;NA;0;NA;NA;NA;0;NA;NA;0;NA;0;NA;NA;NA;0;NA;NA;0;0;NA;NA;NA;0;NA;NA;NA;NA;2;65;0;NA;NA;65
480625;03-03-2018;Cheikhou Kouyaté (West Ham United) is shown the yellow card for a bad foul.;66';Swansea City;West Ham United;4;0;0;0;0;0;0;NA;NA;NA;NA;NA;NA;NA;0;NA;NA;0;NA;0;0;NA;NA;NA;1;yellow;Cheikhou Kouyaté;West Ham United;0;NA;NA;0;NA;0;NA;NA;NA;0;NA;NA;0;0;NA;NA;NA;0;NA;NA;NA;NA;2;66;0;NA;NA;66
480625;03-03-2018;Foul by Marko Arnautovic (West Ham United).;66';Swansea City;West Ham United;4;0;0;0;0;0;0;NA;NA;NA;NA;NA;NA;NA;1;Marko Arnautovic;West Ham United;0;NA;0;0;NA;NA;NA;0;NA;NA;NA;0;NA;NA;0;NA;0;NA;NA;NA;0;NA;NA;0;0;NA;NA;NA;0;NA;NA;NA;NA;2;67;0;NA;NA;66
480625;03-03-2018;Kyle Naughton (Swansea City) wins a free kick in the defensive half.;66';Swansea City;West Ham United;4;0;0;0;0;0;0;NA;NA;NA;NA;NA;NA;NA;0;NA;NA;0;NA;0;0;NA;NA;NA;0;NA;NA;NA;0;NA;NA;0;NA;1;Kyle Naughton;Swansea City;defensive half;0;NA;NA;0;0;NA;NA;NA;0;NA;NA;NA;NA;2;68;0;NA;NA;66
480625;03-03-2018;Marko Arnautovic (West Ham United) is shown the yellow card for a bad foul.;66';Swansea City;West Ham United;4;0;0;0;0;0;0;NA;NA;NA;NA;NA;NA;NA;0;NA;NA;0;NA;0;0;NA;NA;NA;1;yellow;Marko Arnautovic;West Ham United;0;NA;NA;0;NA;0;NA;NA;NA;0;NA;NA;0;0;NA;NA;NA;0;NA;NA;NA;NA;2;69;0;NA;NA;66
480625;03-03-2018;Attempt saved. Jordan Ayew (Swansea City) right footed shot from outside the box is saved in the centre of the goal. Assisted by André Ayew.;68';Swansea City;West Ham United;4;0;0;0;0;1;0;saved;Jordan Ayew;Swansea City;right;outside the box;the centre of the goal;André Ayew;0;NA;NA;0;NA;0;0;NA;NA;NA;0;NA;NA;NA;0;NA;NA;0;NA;0;NA;NA;NA;0;NA;NA;0;0;NA;NA;NA;0;NA;NA;NA;NA;2;70;0;NA;NA;68
480625;03-03-2018;André Ayew (Swansea City) wins a free kick in the attacking half.;71';Swansea City;West Ham United;4;0;0;0;0;0;0;NA;NA;NA;NA;NA;NA;NA;0;NA;NA;0;NA;0;0;NA;NA;NA;0;NA;NA;NA;0;NA;NA;0;NA;1;André Ayew;Swansea City;attacking half;0;NA;NA;0;0;NA;NA;NA;0;NA;NA;NA;NA;2;71;0;NA;NA;71
480625;03-03-2018;Foul by Mark Noble (West Ham United).;71';Swansea City;West Ham United;4;0;0;0;0;0;0;NA;NA;NA;NA;NA;NA;NA;1;Mark Noble;West Ham United;0;NA;0;0;NA;NA;NA;0;NA;NA;NA;0;NA;NA;0;NA;0;NA;NA;NA;0;NA;NA;0;0;NA;NA;NA;0;NA;NA;NA;NA;2;72;0;NA;NA;71
480625;03-03-2018;Delay in match Alfie Mawson (Swansea City) because of an injury.;76';Swansea City;West Ham United;4;0;0;0;0;0;0;NA;NA;NA;NA;NA;NA;NA;0;NA;NA;0;NA;0;0;NA;NA;NA;0;NA;NA;NA;0;NA;NA;1;Swansea City;0;NA;NA;NA;0;NA;NA;0;0;NA;NA;NA;0;NA;NA;NA;NA;2;73;0;NA;NA;76
480625;03-03-2018;Delay in match Michail Antonio (West Ham United) because of an injury.;76';Swansea City;West Ham United;4;0;0;0;0;0;0;NA;NA;NA;NA;NA;NA;NA;0;NA;NA;0;NA;0;0;NA;NA;NA;0;NA;NA;NA;0;NA;NA;1;West Ham United;0;NA;NA;NA;0;NA;NA;0;0;NA;NA;NA;0;NA;NA;NA;NA;2;74;0;NA;NA;76
480625;03-03-2018;Delay over. They are ready to continue.;77';Swansea City;West Ham United;4;0;0;0;0;0;0;NA;NA;NA;NA;NA;NA;NA;0;NA;NA;0;NA;0;0;NA;NA;NA;0;NA;NA;NA;0;NA;NA;0;NA;0;NA;NA;NA;0;NA;NA;0;0;NA;NA;NA;0;NA;NA;NA;NA;2;75;0;NA;NA;77
480625;03-03-2018;Foul by Kyle Naughton (Swansea City).;78';Swansea City;West Ham United;4;0;0;0;0;0;0;NA;NA;NA;NA;NA;NA;NA;1;Kyle Naughton;Swansea City;0;NA;0;0;NA;NA;NA;0;NA;NA;NA;0;NA;NA;0;NA;0;NA;NA;NA;0;NA;NA;0;0;NA;NA;NA;0;NA;NA;NA;NA;2;76;0;NA;NA;78
480625;03-03-2018;Michail Antonio (West Ham United) wins a free kick on the left wing.;78';Swansea City;West Ham United;4;0;0;0;0;0;0;NA;NA;NA;NA;NA;NA;NA;0;NA;NA;0;NA;0;0;NA;NA;NA;0;NA;NA;NA;0;NA;NA;0;NA;1;Michail Antonio;West Ham United;NA;0;NA;NA;0;0;NA;NA;NA;0;NA;NA;NA;NA;2;77;0;NA;NA;78
480625;03-03-2018;Substitution, Swansea City. Nathan Dyer replaces André Ayew.;78';Swansea City;West Ham United;4;0;0;0;0;0;0;NA;NA;NA;NA;NA;NA;NA;0;NA;NA;0;NA;0;0;NA;NA;NA;0;NA;NA;NA;0;NA;NA;0;NA;0;NA;NA;NA;0;NA;NA;1;0;Swansea City;Nathan Dyer;André Ayew;0;NA;NA;NA;NA;2;78;0;NA;NA;78
480625;03-03-2018;Goal!  Swansea City 4, West Ham United 1. Michail Antonio (West Ham United) right footed shot from the centre of the box to the bottom left corner. Assisted by Aaron Cresswell following a set piece situation.;78';Swansea City;West Ham United;4;1;0;0;0;1;0;goal;Michail Antonio;West Ham United;right;the centre of the box;bottom left corner;Aaron Cresswell;0;NA;NA;1;NA;0;0;NA;NA;NA;0;NA;NA;NA;0;NA;NA;0;NA;0;NA;NA;NA;0;NA;NA;0;0;NA;NA;NA;0;NA;NA;NA;NA;2;79;0;NA;NA;78
480625;03-03-2018;Foul by Sam Clucas (Swansea City).;80';Swansea City;West Ham United;4;1;0;0;0;0;0;NA;NA;NA;NA;NA;NA;NA;1;Sam Clucas;Swansea City;0;NA;0;0;NA;NA;NA;0;NA;NA;NA;0;NA;NA;0;NA;0;NA;NA;NA;0;NA;NA;0;0;NA;NA;NA;0;NA;NA;NA;NA;2;80;0;NA;NA;80
480625;03-03-2018;Manuel Lanzini (West Ham United) wins a free kick in the defensive half.;80';Swansea City;West Ham United;4;1;0;0;0;0;0;NA;NA;NA;NA;NA;NA;NA;0;NA;NA;0;NA;0;0;NA;NA;NA;0;NA;NA;NA;0;NA;NA;0;NA;1;Manuel Lanzini;West Ham United;defensive half;0;NA;NA;0;0;NA;NA;NA;0;NA;NA;NA;NA;2;81;0;NA;NA;80
480625;03-03-2018;Attempt blocked. Cheikhou Kouyaté (West Ham United) right footed shot from outside the box is blocked.;80';Swansea City;West Ham United;4;1;0;0;0;1;0;blocked;Cheikhou Kouyaté;West Ham United;right;outside the box;NA;NA;0;NA;NA;0;NA;0;0;NA;NA;NA;0;NA;NA;NA;0;NA;NA;0;NA;0;NA;NA;NA;0;NA;NA;0;0;NA;NA;NA;0;NA;NA;NA;NA;2;82;0;NA;NA;80
480625;03-03-2018;Substitution, Swansea City. Tom Carroll replaces Andy King.;81';Swansea City;West Ham United;4;1;0;0;0;0;0;NA;NA;NA;NA;NA;NA;NA;0;NA;NA;0;NA;0;0;NA;NA;NA;0;NA;NA;NA;0;NA;NA;0;NA;0;NA;NA;NA;0;NA;NA;1;0;Swansea City;Tom Carroll;Andy King;0;NA;NA;NA;NA;2;83;0;NA;NA;81
480625;03-03-2018;Attempt blocked. Sam Byram (West Ham United) right footed shot from outside the box is blocked.;82';Swansea City;West Ham United;4;1;0;0;0;1;0;blocked;Sam Byram;West Ham United;right;outside the box;NA;NA;0;NA;NA;0;NA;0;0;NA;NA;NA;0;NA;NA;NA;0;NA;NA;0;NA;0;NA;NA;NA;0;NA;NA;0;0;NA;NA;NA;0;NA;NA;NA;NA;2;84;0;NA;NA;82
480625;03-03-2018;Offside, West Ham United. Michail Antonio tries a through ball, but Marko Arnautovic is caught offside.;83';Swansea City;West Ham United;4;1;0;0;0;0;0;NA;NA;NA;NA;NA;NA;NA;0;NA;NA;0;NA;0;1;West Ham United;Marko Arnautovic;Michail Antonio;0;NA;NA;NA;0;NA;NA;0;NA;0;NA;NA;NA;0;NA;NA;0;0;NA;NA;NA;0;NA;NA;NA;NA;2;85;0;NA;NA;83
