480781;24-11-2017;Foul by Islam Slimani (Leicester City).;90'+2';West Ham United;Leicester City;1;1;0;0;0;0;0;NA;NA;NA;NA;NA;NA;NA;1;Islam Slimani;Leicester City;0;NA;0;0;NA;NA;NA;0;NA;NA;NA;0;NA;NA;0;NA;0;NA;NA;NA;0;NA;NA;0;0;NA;NA;NA;0;NA;NA;NA;NA;2;83;1;NA;NA;92
480781;24-11-2017;Attempt blocked. André Ayew (West Ham United) left footed shot from the right side of the box is blocked. Assisted by Manuel Lanzini.;90'+3';West Ham United;Leicester City;1;1;0;0;0;1;0;blocked;André Ayew;West Ham United;left;the right side of the box;NA;Manuel Lanzini;0;NA;NA;0;NA;0;0;NA;NA;NA;0;NA;NA;NA;0;NA;NA;0;NA;0;NA;NA;NA;0;NA;NA;0;0;NA;NA;NA;0;NA;NA;NA;NA;2;84;1;NA;NA;93
480781;24-11-2017;Substitution, West Ham United. Diafra Sakho replaces Arthur Masuaku.;90'+4';West Ham United;Leicester City;1;1;0;0;0;0;0;NA;NA;NA;NA;NA;NA;NA;0;NA;NA;0;NA;0;0;NA;NA;NA;0;NA;NA;NA;0;NA;NA;0;NA;0;NA;NA;NA;0;NA;NA;1;0;West Ham United;Diafra Sakho;Arthur Masuaku;0;NA;NA;NA;NA;2;85;1;NA;NA;94
480781;24-11-2017;Foul by Islam Slimani (Leicester City).;90'+4';West Ham United;Leicester City;1;1;0;0;0;0;0;NA;NA;NA;NA;NA;NA;NA;1;Islam Slimani;Leicester City;0;NA;0;0;NA;NA;NA;0;NA;NA;NA;0;NA;NA;0;NA;0;NA;NA;NA;0;NA;NA;0;0;NA;NA;NA;0;NA;NA;NA;NA;2;86;1;NA;NA;94
480781;24-11-2017;Pedro Obiang (West Ham United) wins a free kick on the right wing.;90'+4';West Ham United;Leicester City;1;1;0;0;0;0;0;NA;NA;NA;NA;NA;NA;NA;0;NA;NA;0;NA;0;0;NA;NA;NA;0;NA;NA;NA;0;NA;NA;0;NA;1;Pedro Obiang;West Ham United;NA;0;NA;NA;0;0;NA;NA;NA;0;NA;NA;NA;NA;2;87;1;NA;NA;94
480781;24-11-2017;Foul by Manuel Lanzini (West Ham United).;90'+5';West Ham United;Leicester City;1;1;0;0;0;0;0;NA;NA;NA;NA;NA;NA;NA;1;Manuel Lanzini;West Ham United;0;NA;0;0;NA;NA;NA;0;NA;NA;NA;0;NA;NA;0;NA;0;NA;NA;NA;0;NA;NA;0;0;NA;NA;NA;0;NA;NA;NA;NA;2;88;1;NA;NA;95
480781;24-11-2017;Marc Albrighton (Leicester City) wins a free kick in the defensive half.;90'+5';West Ham United;Leicester City;1;1;0;0;0;0;0;NA;NA;NA;NA;NA;NA;NA;0;NA;NA;0;NA;0;0;NA;NA;NA;0;NA;NA;NA;0;NA;NA;0;NA;1;Marc Albrighton;Leicester City;defensive half;0;NA;NA;0;0;NA;NA;NA;0;NA;NA;NA;NA;2;89;1;NA;NA;95
480781;24-11-2017;Foul by Ben Chilwell (Leicester City).;90'+6';West Ham United;Leicester City;1;1;0;0;0;0;0;NA;NA;NA;NA;NA;NA;NA;1;Ben Chilwell;Leicester City;0;NA;0;0;NA;NA;NA;0;NA;NA;NA;0;NA;NA;0;NA;0;NA;NA;NA;0;NA;NA;0;0;NA;NA;NA;0;NA;NA;NA;NA;2;90;1;NA;NA;96
480781;24-11-2017;Pablo Zabaleta (West Ham United) wins a free kick in the defensive half.;90'+6';West Ham United;Leicester City;1;1;0;0;0;0;0;NA;NA;NA;NA;NA;NA;NA;0;NA;NA;0;NA;0;0;NA;NA;NA;0;NA;NA;NA;0;NA;NA;0;NA;1;Pablo Zabaleta;West Ham United;defensive half;0;NA;NA;0;0;NA;NA;NA;0;NA;NA;NA;NA;2;91;1;NA;NA;96
480781;24-11-2017;Second Half ends, West Ham United 1, Leicester City 1.;90'+7';West Ham United;Leicester City;1;1;1;0;0;0;0;NA;NA;NA;NA;NA;NA;NA;0;NA;NA;0;NA;0;0;NA;NA;NA;0;NA;NA;NA;0;NA;NA;0;NA;0;NA;NA;NA;0;NA;NA;0;0;NA;NA;NA;0;NA;NA;NA;NA;2;92;1;NA;NA;97
480781;24-11-2017;Match ends, West Ham United 1, Leicester City 1.;90'+7';West Ham United;Leicester City;1;1;0;1;0;0;0;NA;NA;NA;NA;NA;NA;NA;0;NA;NA;0;NA;0;0;NA;NA;NA;0;NA;NA;NA;0;NA;NA;0;NA;0;NA;NA;NA;0;NA;NA;0;0;NA;NA;NA;0;NA;NA;NA;NA;2;93;1;NA;NA;97
