480882;26-08-2017;Substitution, Huddersfield Town. Collin Quaner replaces Elias Kachunga.;88';Huddersfield Town;Southampton;0;0;0;0;0;0;0;NA;NA;NA;NA;NA;NA;NA;0;NA;NA;0;NA;0;0;NA;NA;NA;0;NA;NA;NA;0;NA;NA;0;NA;0;NA;NA;NA;0;NA;NA;1;0;Huddersfield Town;Collin Quaner;Elias Kachunga;0;NA;NA;NA;NA;2;83;0;NA;NA;88
480882;26-08-2017;Attempt blocked. Ryan Bertrand (Southampton) header from the left side of the six yard box is blocked. Assisted by Shane Long with a cross.;90'+1';Huddersfield Town;Southampton;0;0;0;0;0;1;0;blocked;Ryan Bertrand;Southampton;header;the left side of the six yard box;NA;Shane Long;0;NA;NA;0;cross;0;0;NA;NA;NA;0;NA;NA;NA;0;NA;NA;0;NA;0;NA;NA;NA;0;NA;NA;0;0;NA;NA;NA;0;NA;NA;NA;NA;2;84;1;NA;NA;91
480882;26-08-2017;Foul by Collin Quaner (Huddersfield Town).;90'+3';Huddersfield Town;Southampton;0;0;0;0;0;0;0;NA;NA;NA;NA;NA;NA;NA;1;Collin Quaner;Huddersfield Town;0;NA;0;0;NA;NA;NA;0;NA;NA;NA;0;NA;NA;0;NA;0;NA;NA;NA;0;NA;NA;0;0;NA;NA;NA;0;NA;NA;NA;NA;2;85;1;NA;NA;93
480882;26-08-2017;Nathan Redmond (Southampton) wins a free kick on the right wing.;90'+3';Huddersfield Town;Southampton;0;0;0;0;0;0;0;NA;NA;NA;NA;NA;NA;NA;0;NA;NA;0;NA;0;0;NA;NA;NA;0;NA;NA;NA;0;NA;NA;0;NA;1;Nathan Redmond;Southampton;NA;0;NA;NA;0;0;NA;NA;NA;0;NA;NA;NA;NA;2;86;1;NA;NA;93
480882;26-08-2017;Offside, Southampton. James Ward-Prowse tries a through ball, but Oriol Romeu is caught offside.;90'+4';Huddersfield Town;Southampton;0;0;0;0;0;0;0;NA;NA;NA;NA;NA;NA;NA;0;NA;NA;0;NA;0;1;Southampton;Oriol Romeu;James Ward-Prowse;0;NA;NA;NA;0;NA;NA;0;NA;0;NA;NA;NA;0;NA;NA;0;0;NA;NA;NA;0;NA;NA;NA;NA;2;87;1;NA;NA;94
480882;26-08-2017;Second Half ends, Huddersfield Town 0, Southampton 0.;90'+4';Huddersfield Town;Southampton;0;0;1;0;0;0;0;NA;NA;NA;NA;NA;NA;NA;0;NA;NA;0;NA;0;0;NA;NA;NA;0;NA;NA;NA;0;NA;NA;0;NA;0;NA;NA;NA;0;NA;NA;0;0;NA;NA;NA;0;NA;NA;NA;NA;2;88;1;NA;NA;94
480882;26-08-2017;Match ends, Huddersfield Town 0, Southampton 0.;90'+4';Huddersfield Town;Southampton;0;0;0;1;0;0;0;NA;NA;NA;NA;NA;NA;NA;0;NA;NA;0;NA;0;0;NA;NA;NA;0;NA;NA;NA;0;NA;NA;0;NA;0;NA;NA;NA;0;NA;NA;0;0;NA;NA;NA;0;NA;NA;NA;NA;2;89;1;NA;NA;94
